	AverageSellingUnitWeight	ContentsMeasureType	ContentsQuantity	IsNew	IsSpecialOffer	PromotionDescription	UnitOfSale	UnitQuantity	description	image	name	price	tpnb	unitprice
22	0.335	G	300.0		True	Any 2 for £3.00	1	100G	[Digestive biscuit crumb topped with cheesecake filling and lemon compote, Digestive biscuit crumb topped with cheesecake filling and lemon compote]	http://img.tesco.com/Groceries/pi/610/5052910902610/IDShot_90x90.jpg	Tesco Lemon Cheesecake 3X100g	1.6	73603794	0.533
23	1.0	SNGL	5.0				2	EACH	[Oat and honey biscuits, A crunchy finger shaped cookie full of oats sweetened with honey & golden syrup.]	http://img.tesco.com/Groceries/pi/000/0287250000000/IDShot_90x90.jpg	Oaty Dunkers 5 Pack	0.7	78971568	0.14
24	0.056	G	42.0				1	100G	[Crunchy cereal bars made with whole grain rolled oats and Canadian maple syrup.]	http://img.tesco.com/Groceries/pi/642/0016000502642/IDShot_90x90.jpg	Nature Valley Canadian Maple Syrup Bar 42G	0.6	66981678	1.43
25	0.258	ML	330.0		True	Any 2 for £3.00	1	100ML	[Cream Flavour Ice Cream with Crushed Chocolate Flavour Biscuit Pieces with Vanilla Flavour Filling, Coated in Crushed Chocolate Flavour Biscuit with a Vanilla Flavour Filling 29%.]	http://img.tesco.com/Groceries/pi/599/4007993021599/IDShot_90x90.jpg	Mondelez Oreo Stick 3X110ml	2.5	80728037	0.758
26	0.165	G	126.0				1	100G	[Milk chocolate with soft caramel (30%) and crispy biscuit centre (5%)., Learn more: http://www.nestle.co.uk/brands, Good to remember: Enjoying chocolate as part of a varied, balanced diet and a healthy lifestyle, is one of life's little pleasures., Cocoa Plan:, Supporting farmers for better chocolate. Working with UTZ to support cocoa farmers. Find out more at www.nestlecocoaplan.com.]	http://img.tesco.com/Groceries/pi/818/7613034494818/IDShot_90x90.jpg	Munchies Chocolate Pouch 126G	1.5	57018889	1.2
27	0.068	G	200.0		True	Buy 1 SIDE + 1 MAIN + 1 DESSERT + 1 DRINK FOR £10	1	100G	[Baked Madagascan vanilla cheesecake on a digestive biscuit base., Made with creamy soft cheese and vanilla seeds so they're wonderfully rich.]	http://img.tesco.com/Groceries/pi/129/5053526189129/IDShot_90x90.jpg	Tesco Finest Madagascan Vanilla Cheesecake Slices 200G	2.75	75077445	1.38
28	0.213	G	150.0	True			1	100G	[Gluten Free Oaty Biscuits Topped with Milk Chocolate, www.123healthybalance.com]	http://img.tesco.com/Groceries/pi/162/5000168195162/IDShot_90x90.jpg	Mc Vities Gluten Free Chocolate Hobnobs 150G	2.19	81542102	1.46
29	0.031	G	25.0				1	100G	[Mini Oat Biscuits made with wholegrain oats, flax & chia seeds, and protein]	http://img.tesco.com/Groceries/pi/706/5060121671706/IDShot_90x90.jpg	Little Dish Go Gos Vanilla 25G	0.6	80307236	2.4
30	8.23	G	125.0	False			1	KG	[Gluten and wheat free biscuits with vanilla cream., Europe's no 1* gluten free, *www.schaer.com/no1, Facebook/ScharglutenfreeUK, Instagram/ScharglutenfreeUK, Pinterest/ScharUK, Twitter/ScharUK]	http://img.tesco.com/Groceries/pi/083/8008698013083/IDShot_90x90.jpg	Schar Custard Creams 125G	1.4	73633551	11.2
31	0.128	G	108.0		True	Save 50p Was £1.50 Now £1.00	1	100G	[Milk chocolates with caramel (28%) and biscuit (1%) filling.]	http://img.tesco.com/Groceries/pi/001/7622210445001/IDShot_90x90.jpg	Cadbury Boost Bites Pouch 108G	1.0	79809219	0.926
32	0.208	G	190.0	False			1	100G	[Chocolates with Candied Plum (37%) in Cocoa Cream]	http://img.tesco.com/Groceries/pi/466/5900189002466/IDShot_90x90.jpg	Solidarnosc Plums In Chocolate Naleczowska 190G	1.99	81575532	1.05
33	0.382	G	275.0	False	True	Half Price Was £2.79 Now £1.39	1	100G	[Milk chocolate (35%) covered caramel (32%) and biscuit (26%)]	http://img.tesco.com/Groceries/pi/057/5000159473057/IDShot_90x90.jpg	Twix Funsize 275G	1.39	55028840	0.506
34	0.408	G	375.0	False			1	100G	[Baked cheesecake on a digestive biscuit base, topped with a swirl of lemon sauce., Lemon Swirl Cheesecake]	http://img.tesco.com/Groceries/pi/639/5054402767639/IDShot_90x90.jpg	Tesco Lemon Swirl Cheesecake 375G	1.0	78550669	0.267
35	0.446	ML	720.0				1	100ML	[8 Individually wrapped strawberry, vanilla and chocolate flavoured ice creams in biscuit wafers, dipped in a chocolate flavour coating, 8 Neapolitan Choc Sandwich]	http://img.tesco.com/Groceries/pi/828/5052320337828/IDShot_90x90.jpg	Tesco Neapolitan Chocolate Sandwich 8X90ml	2.0	67440413	0.278
36	0.418	G	380.0	False			1	100G	[Milk chocolate covered creamy marshmallow.]	http://img.tesco.com/Groceries/pi/408/5901588057408/IDShot_90x90.jpg	E.Wedel Milk Chocolate Covered Creamy Marshmallows 380G	3.49	77964573	0.918
37	0.043	G	36.0	False			1	100G	[Crispy grains of toasted rice cereal and milk chocolate chunks with a chocolate flavour coating.]	http://img.tesco.com/Groceries/pi/031/5050083449031/IDShot_90x90.jpg	Kelloggs Rice Krispie Squares Chocolatley 36G	0.6	63887566	1.67
38	0.025	G	20.0				1	100G		http://img.tesco.com/Groceries/pi/019/5000127780019/IDShot_90x90.jpg	Kelloggs Coco Pops Cereal Bar 20G	0.6	54287044	3.0
39	0.368	ML	440.0				1	100ML	[Peach & strawberry and cream ice creams in a biscuit cone coated with chocolate flavour coating, rippled and topped with peach sauce and sugar balls, 4 Knickerbocker Glory Cones]	http://img.tesco.com/Groceries/pi/779/5054269765779/IDShot_90x90.jpg	T.Knickerbocker Glory Cone 4X110ml	1.0	79720409	0.227
40	0.308	G	280.0	False			1	100G	[Filled (12%) jellies.]	http://img.tesco.com/Groceries/pi/737/5900102017737/IDShot_90x90.jpg	Wawel Fresh And Fruity Filled Jellies 280G	1.69	81574441	0.604
41	0.174	G	160.0		True	Save 50p Was £1.50 Now £1.00	1	100G	[Milk chocolate with caramel (26 %) and biscuit (3 %) filling.]	http://img.tesco.com/Groceries/pi/154/7622210989154/IDShot_90x90.jpg	Cadbury Dairy Milk Boost Chocolate Barsx4 160G	1.0	80965274	0.625
42	175.0	G	125.0				1	100G	[Very Berry Fruit & Oat Bites with freeze dried Strawberries, Raspberries and other dried fruits., Find us on facebook and twitter]	http://img.tesco.com/Groceries/pi/565/5060145254565/IDShot_90x90.jpg	Harvest Chewee Fruit&Oat Bites Very Berry 125G	1.69	79996088	1.36
43	0.137	G	120.0				1	100G	[Milk Chocolate Coated Biscuit Balls, www.123healthybalance.com]	http://img.tesco.com/Groceries/pi/607/5000168191607/IDShot_90x90.jpg	Mcvities Digestive Nibbles Milk Chocolate 120G	1.5	80808974	1.25
44	0.132	SNGL	15.0	False	True	Any 2 for £3.00	1	EACH	[15 Bites of milk chocolate covered crisped rice, currants, marshmallows and biscuit pieces.]	http://img.tesco.com/Groceries/pi/102/5052320611102/IDShot_90x90.jpg	Tesco Rocky Road Cluster	1.6	67601984	0.107
45	0.05	G	50.0		True	Any 3 for £1.20	1	100G	[Milk chocolate (35%) covered caramel (32%) and biscuit (26%), www.betreatwise.org.uk]	http://img.tesco.com/Groceries/pi/228/5000159459228/IDShot_90x90.jpg	Twix Twin 50G	0.6	50083798	1.2
46	0.294	SNGL	5.0	False	True	Any 2 for £3.00	1	EACH	[5 Gingerbread biscuits with a sachet each of milk chocolate beans and jelly drops and a yellow coloured icing tube., 5 Decorate your own gingerbread men]	http://img.tesco.com/Groceries/pi/775/5051622985775/IDShot_90x90.jpg	Tesco Decorate Your Own Gingerbread Men 5 Pack	1.6	72306998	0.32
47	0.229	G	185.0				1	100G	[Cheddar cheese biscuits, To find out how exercise and a balanced diet can help a healthy lifestyle, visit www.123healthybalance.com]	http://img.tesco.com/Groceries/pi/705/5000168156705/IDShot_90x90.jpg	Jacobs Cheddars 185G Carton	1.29	67996694	0.697
48	0.579	G	500.0				1	100G	[Shredded whole grain wheat biscuits with golden syrup filling., Shredded whole grain wheat biscuits with golden syrup filling]	http://img.tesco.com/Groceries/pi/204/5053947885204/IDShot_90x90.jpg	Tesco Golden Syrup Wheat Cereal 500G	1.79	74849006	0.358
49	0.142	G	137.0		True	Any 2 for £1.80	1	100G	[Cheesecake batter and sea salted butterscotch sauce on a digestive biscuit crumb base, with a sprinkling of coated toffee pieces., Cheesecake batter and sea salted butterscotch sauce on a digestive biscuit crumb base, with a sprinkling of coated toffee pieces.]	http://img.tesco.com/Groceries/pi/509/5054269766509/IDShot_90x90.jpg	Tesco Salted Butterscotch Cheesecake 137G	1.0	79731310	0.73
50	0.933	ML	865.0				1	100ML	[3 Chocolate flavoured ice cream lollies in a chocolate flavoured coating with biscuit crumb and a chocolate flavoured core; 3 Strawberry and chocolate flavour ice cream lollies with a chocolate flavoured coating and sugar balls; 3 Mint flavour ice cream lollies in a chocolate flavoured coating with biscuit crumb and a chocolate flavoured core; 5 Strawberry and vanilla flavour ice lollies with a chocolate flavoured coating and sugar strands, A selection of your favourite ice lollies for the family to enjoy]	http://img.tesco.com/Groceries/pi/467/5053526922467/IDShot_90x90.jpg	Tesco 14 Family Favourites Lollies 865Ml	3.0	67250062	0.347
51	0.173	G	114.0	True			1	KG	[Ginger Cookies Containing Crystallised Stem Ginger and Lemon Peel, Visit us:, weightwatchersfoods.co.uk, weloveweightwatchersfoods.co.uk, For great free recipe ideas, money off coupons and information about new products in our range., weightwatchers.co.uk, Our food range is just part of what we have to offer. We also run thousand of friendly meetings across the UK each week, or you can follow our plan step by step completely online., For more information, call 03456092462.]	http://img.tesco.com/Groceries/pi/400/0039047153400/IDShot_90x90.jpg	Weight Watchers Ginger And Lemon Cookies 10X114g	0.85	73318544	7.46
52	0.335	G	300.0		True	Any 2 for £3.00	1	100G	[Digestive biscuit crumb topped with cheesecake filling and toffee sauce, Digestive biscuit crumb topped with cheesecake filling and toffee sauce]	http://img.tesco.com/Groceries/pi/634/5052910902634/IDShot_90x90.jpg	Tesco Toffee Cheesecake 3X100g	1.6	73603817	0.533
53	0.298	G	300.0				1	KG	[Fresh free range egg pasta parcels filled with pumpkin and amaretti biscuits]	http://img.tesco.com/Groceries/pi/822/5053947674822/IDShot_90x90.jpg	Tesco Finest Pumpkin And Amaretti Ravioli 300G	3.0	59370283	10.0
54	0.461	G	405.0		True	Save 44p Was £1.44 Now £1.00	1	KG	[Skimmed Sweetened Condensed Milk, Looking for a guilt free dessert to share with your friends? Try making our gorgeous Light Key Lime Pie   It's sharp, sweet and delicious. All you need is:, 405g Carnation Light Condensed Milk, 55g low fat spread, 140g light digestive biscuits, 3 eggs, 3 limes, 85g caster sugar, For this plus more great recipe ideas and inspiration, visit www.carnation.co.uk]	http://img.tesco.com/Groceries/pi/737/8715000934737/IDShot_90x90.jpg	Carnation Light Condensed Milk 405G	1.0	50031751	2.47
55	0.55	KG	0.5				1	100G	[A baked cheesecake topped with strawberries in strawberry sauce on a digestive biscuit base.]	http://img.tesco.com/Groceries/pi/034/5052320299034/IDShot_90x90.jpg	Tesco Strawberry Cheesecake 500G	1.5	67392256	0.3
56	0.05	G	45.0	False			1	100G	[Pocky Biscuit Stick Coated with Strawberry Flavour]	http://img.tesco.com/Groceries/pi/144/8851019010144/IDShot_90x90.jpg	Glico Pocky Biscuit Sticks Strawberry Flavoured 45G	1.1	78551121	2.45
57	0.154	G	150.0				1	100G	[Salted savoury biscuits, A light and salted savoury snack, tasty on it's own or with a topping]	http://img.tesco.com/Groceries/pi/020/5000358494020/IDShot_90x90.jpg	Tesco Crak'n'snak 150G	1.0	51148796	0.667
58	0.495	G	445.0				1	100G	[Tangy raspberry sauce into a deep layer of cheesecake on a crunchy biscuit base]	http://img.tesco.com/Groceries/pi/205/4008577088205/IDShot_90x90.jpg	Coppenrath & Wiese Raspberry Swirl Cheesecake 445G	1.5	71955599	0.337
59	0.033	G	30.0				1	100G	[Assorted Flavours Candy]	http://img.tesco.com/Groceries/pi/325/0071567987325/IDShot_90x90.jpg	Jelly Belly Jelly Beans Assorted Flavours 30G	0.6	75369411	2.0
60	0.185	G	125.0				1	100G	[Salt & Vinegar Flavour Assorted Mini Biscuit Shapes, To find out how exercise and a balanced diet can help a healthy lifestyle, visit www.123healthybalance.com]	http://img.tesco.com/Groceries/pi/358/5000168174358/IDShot_90x90.jpg	Jacobs Oddities Salt And Vinegar 5 Pack 125G	1.59	73142135	1.28
61	1.0	KG	1.0				1	KG	[Light brown muscovado cane sugar., Ideal for cakes, biscuits and puddings]	http://img.tesco.com/Groceries/pi/976/5000119693976/IDShot_90x90.jpg	Tesco Light Muscovado Sugar 1Kg Bag	2.4	51026946	2.4
62	0.35	G	200.0		True	Any 12 for £6.00	1	KG	[Apple & banana in orange juice with biscuit crumb]	http://img.tesco.com/Groceries/pi/983/8591119002983/IDShot_90x90.jpg	Cow And Gate Fruity Crumble Jar 200G 7 Mth+	0.8	62935280	4.0
63	0.137	G	120.0				1	100G	[Milk Chocolate Coated Biscuit Balls with Caramel Flavour Cream, www.123healthybalance.com]	http://img.tesco.com/Groceries/pi/799/5000168191799/IDShot_90x90.jpg	Mcvities Digestive Nibbles Caramel 120G	1.5	80809005	1.25
64	0.11	G	80.0				1	100G	[Savoury Biscuits with Gouda Cheese., Mini cheese savoury bites with Gouda cheese]	http://img.tesco.com/Groceries/pi/267/5052109885267/IDShot_90x90.jpg	Tesco Cheese Bites 80G	0.9	73384960	1.13
65	0.046	G	41.0		True	Any 3 for £1.20	1	100G	[Milk chocolate with a vanilla flavour filling (34%) and biscuit pieces (17%).]	http://img.tesco.com/Groceries/pi/006/7622210437006/IDShot_90x90.jpg	Cadbury Dairy Milk Oreo 41G	0.6	77405677	1.47
66	0.45	G	450.0				1	100G	[Baked cheesecake on a digestive biscuit base, topped with salted caramel sauce chocolate sauce, sprinkled with salted caramel pieces and dark chocolate coated crisped rice.]	http://img.tesco.com/Groceries/pi/529/5054402765529/IDShot_90x90.jpg	Tesco Salted Caramel Cheesecake 450G	2.0	78527018	0.444
67	0.104	G	93.0				1	100G	[Milk chocolate with chocolate flavoured creme (46 %), shortcake biscuit pieces (4.5 %), chocolate chips (4.5 %), and fudge pieces (2 %).]	http://img.tesco.com/Groceries/pi/345/7622210497345/IDShot_90x90.jpg	Cadbury Dairy Milk Caramel Fudge Medley 93G	1.5	80929796	1.62
68	0.494	G	540.0				1	100G	[Lemon cheesecake with lemon sauce on a digestive biscuit base., Delicious digestive biscuit base, with a thick and creamy cheesecake, and a zingy lemon sauce]	http://img.tesco.com/Groceries/pi/861/5054269765861/IDShot_90x90.jpg	Tesco Lemon Cheesecake 540G	3.0	57481771	0.556
69	0.058	G	52.0		True	Any 3 for £1.20	1	100G	[Milk chocolate with soft caramel (30%) and crisp biscuit centre (5%)., Learn more: http;//www.nestle.co.uk/brands, Good to remember: Enjoying chocolate as part of a varied, balanced diet and a healthy lifestyle, is one of life's little pleasures., Cocoa Plan:, Supporting farmers for better chocolate. Working with UTZ to support cocoa farmers., Find out more at www.nestlecocoaplan.com.]	http://img.tesco.com/Groceries/pi/473/0000050249473/IDShot_90x90.jpg	Munchies Tube 52G	0.6	51578298	1.16
70	0.19	G	150.0	False	True	Save 99p Was £1.99 Now £1.00	1	100G	[Smoky Barbecue Flavour Crisp Snack Biscuits, To find out how exercise and a balanced diet can help a healthy lifestyle, visit www.123healthybalance.com]	http://img.tesco.com/Groceries/pi/922/5000168193922/IDShot_90x90.jpg	Jacobs Cracker Crisp Smokey Bbq 150G	1.0	81158462	0.667
71	0.144	G	125.0	False			1	100G	[Pickled Onion Flavour Mini Baked Snack Biscuits]	http://img.tesco.com/Groceries/pi/539/0072417154539/IDShot_90x90.jpg	Burtons Fish & Chips Pickled Onion Snack 125G	1.59	79550253	1.28
72	0.142	G	130.0		True	Any 2 for £1.80	1	100G	[Dark chocolate mousse, vanilla mousse, digestive biscuit crumb and toffee flavour custard with white chocolate coated shortcake pieces., Dark chocolate mousse, vanilla mousse, digestive biscuit crumb and toffee flavour custard with white chocolate coated shortcake pieces.]	http://img.tesco.com/Groceries/pi/902/5054268074902/IDShot_90x90.jpg	Tesco Millionaires Shortcake Sundae 130G	1.0	76358630	0.769
73	0.68	G	540.0				1	100G	[Digestive biscuit base, topped with a Madagascan vanilla cheesecake batter, finished with a soured cream topping., With Madagascan vanilla and a soured cream topping]	http://img.tesco.com/Groceries/pi/908/5054269765908/IDShot_90x90.jpg	Tesco Finest Madagascan Vanilla Cheesecake 540G	4.0	65610776	0.741
74	0.131	G	96.0	True	True	Any 2 for £3.00	1	100G	[High fibre mixed cereal bar with coconut and a chocolate drizzle, dipped in a smooth dark chocolate layer.]	http://img.tesco.com/Groceries/pi/589/5053827161589/IDShot_90x90.jpg	Kelloggs Special K Chocolate Delight Coconut 4X24g	1.99	81544143	2.08
75	0.494	G	540.0		True	Save £1.00 Was £3.00 Now £2.00	1	100G	[Chocolate flavoured cheesecake with chocolate sauce on a chocolate flavoured digestive biscuit base, Delicious chocolate digestive biscuit base, topped with thick and creamy chocolate cheesecake, with an indulgent chocolate sauce]	http://img.tesco.com/Groceries/pi/885/5054269765885/IDShot_90x90.jpg	Tesco Chocolate Cheesecake 540G	2.0	50930067	0.37
76	0.058	G	53.0				1	100G	[Milk chocolate with raisins and biscuits]	http://img.tesco.com/Groceries/pi/915/5034660003915/IDShot_90x90.jpg	Cadbury Dairy Milk Tiffin 53G	1.0	71012385	1.89
77	0.448	ML	500.0				1	100ML	[Biscuit cone with chocolate and vanilla flavour ice creams rippled and toppled with chocolate sauce and a chocolate coated wafer finger.]	http://img.tesco.com/Groceries/pi/118/5010238014118/IDShot_90x90.jpg	Nestle Kit Kat Ice Cream Cones 4 X 125Ml	2.99	76170678	0.598
78	0.142	G	125.0	False	True	Any 2 for £1.80	1	100G	[Cheesecake batter and lime flavour curd sauce on a digestive biscuit crumb base, with a sprinkling of dark chocolate curls., Cheesecake batter and lime flavour curd sauce on a digestive biscuit crumb base, with a sprinkling of dark chocolate curls.]	http://img.tesco.com/Groceries/pi/486/5054269766486/IDShot_90x90.jpg	Tesco Zingy Lime Cheesecake 137G	1.0	79731293	0.8
79	0.393	G	340.0				2	100G	[4 x Toffee flavour dairy desserts with milk chocolate coated digestive biscuit balls (17%)]	http://img.tesco.com/Groceries/pi/761/4025500189761/IDShot_90x90.jpg	Muller Corner Pud. Toffee Digestive 4X85g	2.0	78760173	0.588
80	0.137	G	120.0				1	100G	[Dark Chocolate Coated Biscuit Balls, www.123healthybalance.com]	http://img.tesco.com/Groceries/pi/584/5000168191584/IDShot_90x90.jpg	Mcvities Digestive Nibbles Dark Chocolate 120G	1.5	80808980	1.25
81	0.482	G	540.0				1	100G	[Vanilla flavoured cheesecake with raspberry sauce on a digestive biscuit base, Delicious digestive biscuit base, with a thick and creamy vanilla cheesecake, and a juicy raspberry sauce]	http://img.tesco.com/Groceries/pi/532/5054269746532/IDShot_90x90.jpg	Tesco Raspberry Cheesecake 540G	3.0	57746430	0.556
82	0.175	G	125.0				1	100G	[Cheese Flavour Assorted Mini Biscuit Shapes, To find out how exercise and a balanced diet can help a healthy lifestyle, visit www.123healthybalance.com]	http://img.tesco.com/Groceries/pi/085/5000168160085/IDShot_90x90.jpg	Jacobs Oddities Cheese Multipack 5X25g	1.59	71274523	1.28
83	0.334	G	474.0				1	100G	[A vanilla flavoured cheesecake on a sweet digestive biscuit base, Vanilla flavoured cheesecake on a sweet digestive biscuit base. Tasted and approved by customers.]	http://img.tesco.com/Groceries/pi/904/5050179987904/IDShot_90x90.jpg	Tesco Everyday Value Vanilla Cheesecake 474G	1.75	55997285	0.369
84	0.44	G	400.0	False			1	100G	[Ladyfingers biscuits]	http://img.tesco.com/Groceries/pi/023/8001100016023/IDShot_90x90.jpg	Balocco Savoiardi 400G	2.8	77688750	0.7
85	0.533	KG	0.5		True	Any 3 for 2 Cheapest Product Free	1	100G	[A digestive biscuit base topped with banana cream mousse and decorated with cream mousse swirls, toffee sauce and caramel flavour curls]	http://img.tesco.com/Groceries/pi/845/5052319334845/IDShot_90x90.jpg	Tesco Banoffee Pie 500G	2.0	66570600	0.4
86	0.425	G	425.0				1	100G	[Baked cheesecake on a chocolate flavoured biscuit base, topped with chocolate sauce and chocolate cream mousse, sprinked with a mix of milk and white chocolate curls]	http://img.tesco.com/Groceries/pi/505/5054402765505/IDShot_90x90.jpg	Tesco Chocolate Cheesecake 425G	1.5	78526993	0.353
87	0.585	ML	900.0		True	Half Price Was £3.49 Now £1.74	1	100ML	[Biscuit flavour ice cream with biscuit pieces (2.5%), lemon fruit ice swirled with lemon sauce (14%) and topped with meringue pieces (1.5%)., www.icecreamjoy.com, Find us on Facebook]	http://img.tesco.com/Groceries/pi/417/8712100876417/IDShot_90x90.jpg	Carte D'or Lemon Meringue Ice Cream 900Ml	1.74	80777911	0.193
88	0.204	G	185.0		True	Any 2 for £3.00	1	100G	[Milk chocolate with a vanilla flavour filling (32%) and biscuit pieces (12%).]	http://img.tesco.com/Groceries/pi/045/7622210357045/IDShot_90x90.jpg	Cadbury Dairy Milk Oreo 185G	2.0	79809260	1.09
89	0.3	G	259.0				1	KG	[Ready to Mix Cheesecake with a Biscuit Crumb Base, Hints & Tips, For recipe ideas, and baking inspiration, visit our website: greenscakes.co.uk]	http://img.tesco.com/Groceries/pi/281/5000318107281/IDShot_90x90.jpg	Greens Original Cheesecake Mix 259G	0.88	59790246	3.4
90	0.167	SNGL	16.0		True	Any 2 for £3.00	1	EACH	[16 Bites of dark chocolate brownie with fudge pieces, topped with biscuit pieces., 16 Biscuit fudge brownie bites]	http://img.tesco.com/Groceries/pi/450/5054269691450/IDShot_90x90.jpg	Cookie Brownie Bites 16 Pack	2.0	79605345	0.125
91	0.23	G	200.0				1	100G	[A Selection of Savoury Biscuits, To find out how exercise and a balanced diet can help a healthy lifestyle, visit www.123healthybalance.com]	http://img.tesco.com/Groceries/pi/099/5000168158099/IDShot_90x90.jpg	Jacobs Savoury Favourites 200G	1.5	66519375	0.75
92	0.136	G	120.0				1	100G	[Yogurt on a layer of caramel sauce (13%) with chewy chocolate pieces coated in milk chocolate and chocolate coated biscuit pieces (8%).]	http://img.tesco.com/Groceries/pi/178/5060360501178/IDShot_90x90.jpg	Twix Split Pot Dessert 120G	0.99	79720346	0.825
93	0.84	G	840.0				1	100G	[Baked lemon flavoured cheesecake with a digestive biscuit base, topped with meringue swirls.]	http://img.tesco.com/Groceries/pi/504/5054402689504/IDShot_90x90.jpg	Tesco Lemon Meringue Cheesecake 840G	3.0	78457498	0.357
94	0.247	G	180.0				1	100G	[Chocolate flavoured digestive biscuit crumb, Belgian chocolate cheesecake topping with pockets of Belgian choclate sauce. Finished with a feathered effect chocolate glaze and white chocolate ganache, with a chocolate biscuit crumb base, and smooth pockets of Belgian chocolate sauce, topped with rich chocolate ganache]	http://img.tesco.com/Groceries/pi/960/5054269765960/IDShot_90x90.jpg	Tesco Finest Belgian Chocolate Cheesecake Slices 180G	2.75	61440025	1.53
95	0.4	G	200.0		True	Save 79p Was £2.79 Now £2.00	1	100G	[Savoury Biscuit Selection, www.123healthybalance.com]	http://img.tesco.com/Groceries/pi/829/5000168162829/IDShot_90x90.jpg	Carrs Selection Carton 200G	2.0	67576137	1.0
96	0.483	G	478.0				1	100G	[Meringue encrusted with amaretti biscuit crumb, filled with British whipping cream, raspberry sauce, whole raspberries and raspberry pieces., Our frozen finest raspberry roulade is a crisp shelled meringue studded with amaretti biscuit crumb filled with whipped British dairy cream, raspberry compote and tangy raspberries. For an extra treat why not serve it up with a scoop of our finest Madagascan vanilla ice cream.]	http://img.tesco.com/Groceries/pi/485/5053947691485/IDShot_90x90.jpg	Tesco Finest Raspberry Roulade 478G	4.0	54338077	0.837
97	0.41	G	200.0	False			1	100G	[Chocolate caramel flavoured spread with biscuit pieces.]	http://img.tesco.com/Groceries/pi/928/5060402901928/IDShot_90x90.jpg	Twix Chocolate Caramel Spread 200G	2.0	81220699	1.0
98	0.212	G	140.0		True	Any 2 for £2.50	1	100G	[Cheesecake batter with Senga strawberry sauce on a base of shortcake biscuit crumb and white chocolate chips., A layered dessert of cheesecake and Senga strawberry sauce on a base of shortcake biscuit crumb and white chocolate chips.]	http://img.tesco.com/Groceries/pi/360/5054269051360/IDShot_90x90.jpg	Tesco Finest Strawberry And White Chocolate Cheesecake 140G	1.6	74255236	1.15
99	23.0	G	138.0		True	Any 2 for £2.50	1	100G	[Toffee mousse, Belgian plain chocolate topping, biscuit crumb and sea salted toffee sauce, topped with gold coloured milk chocolate coated honeycomb pieces., A layered dessert of toffee mousse and rich Belgian plain chocolate topping on a base of biscuit crumb and sea salted toffee sauce, topped with gold coloured milk chocolate coated honeycomb pieces.]	http://img.tesco.com/Groceries/pi/285/5054269051285/IDShot_90x90.jpg	Tesco Fin Belgian Chocolate Salted Caramel Millionaires 138G	1.6	78775184	1.16
0	0.248	G	225.0	False			1	100G	[Gingerbread biscuit mix]	http://img.tesco.com/Groceries/pi/875/5054269711875/IDShot_90x90.jpg	Tesco Gingerbread Mix 225G	0.99	79649742	0.44
1	75.0	G	300.0		True	Any 2 for £3.00	1	100G	[Digestive biscuit crumb topped with cheesecake filling and a set raspberry compote, Digestive biscuit crumb topped with cheesecake filling and raspberry compote]	http://img.tesco.com/Groceries/pi/267/5054269765267/IDShot_90x90.jpg	Tesco Raspberry Jelly Cheesecake 3 X 100G	1.6	79719683	0.533
2	0.2	G	180.0		True	Any 2 for £3.00	1	100G	[Milk chocolate with marshmallow (7%), strawberry flavour jellies (5%), and shortcake biscuit (5%).]	http://img.tesco.com/Groceries/pi/491/7622210464491/IDShot_90x90.jpg	Cadbury Marvellous Creations Smashables Rocky Road 180G	2.0	79809473	1.12
3	0.088	G	85.0				1	100G	[Milk chocolate (35%) covered caramel (32%) and biscuit (26%), www.betreatwise.org.uk]	http://img.tesco.com/Groceries/pi/502/5900951028502/IDShot_90x90.jpg	Twix Kingsize Bar 85G	0.8	51778568	0.941
4	0.592	G	180.0				1	100G	[Digestive biscuit base, topped with a Madagascan vanilla cheesecake batter, finished with a soured cream topping., A sweet creamy Madagascan vanilla cheesecake topped with deliciously soured cream, for an indlugent taste of New York.]	http://img.tesco.com/Groceries/pi/953/5054269765953/IDShot_90x90.jpg	Tesco Finest Vanilla Cheesecake Slices 180G	2.75	66448585	1.53
5	0.183	G	150.0	True	True	Special Purchase 95p	1	100G	[Chicken Flavour Mini Baked Snack Biscuits]	http://img.tesco.com/Groceries/pi/289/0072417163289/IDShot_90x90.jpg	Burton's Chicken 'N' Chips 6X25g	0.95	81595174	0.633
