	AverageSellingUnitWeight	ContentsMeasureType	ContentsQuantity	IsNew	IsSpecialOffer	PromotionDescription	UnitOfSale	UnitQuantity	description	image	name	price	tpnb	unitprice
68	0.226	G	200.0				1	100G	[Traditional Puff Pastry Biscuits Sandwiched with a Light Flavoured Cream Filling]	http://img.tesco.com/Groceries/pi/010/5011021106010/IDShot_90x90.jpg	Mcvities Lemon Puff 200G	1.69	55100092	0.845
69	2.025	KG	2.0				1	KG	[Complete Pet Food for Adult Cats.]	http://img.tesco.com/Groceries/pi/002/3065891259002/IDShot_90x90.jpg	Whiskas 1+ Dry Cat Food Biscuits Chicken & Veg 2kg	4.5	57506980	2.25
70	0.186	G	160.0				1	100G	[Scottish All Butter Chocolate Chip Shortbread]	http://img.tesco.com/Groceries/pi/255/5000462131255/IDShot_90x90.jpg	Tesco Scottish All Butter Chocolate Chip Shortbread 160G	0.89	57928808	0.556
71	0.088	G	400.0				1	KG	[Dog Biscuit Meaty Chip Bitesize]	http://img.tesco.com/Groceries/pi/166/7613033684166/IDShot_90x90.jpg	Bonio Meaty Chip Biscuits Bitesize 400G	1.65	71169965	4.13
72	0.014	G	160.0				1	100G	[Gluten free biscuit breaks chocolate chip, If you are concerned about safely including oats in your gluten free diet, visit the 'pure oats' pages in the gluten free section of our website., Our product contains sustainable palm oil. For more information please visit our website., Come and find out more about us, our gluten free products, the benefits of oats, and some tasty gluten free recipes., www.nairns oatcakes.com/gluten free, Find us on Facebook and Twitter]	http://img.tesco.com/Groceries/pi/087/0612322030087/IDShot_90x90.jpg	Nairns Chocolate Chip Biscuits 160G	1.8	75844764	1.13
73	0.178	G	110.0		True	Any 2 for £3.00	1	100G	[Mixed cereal bar with raspberry fruit pieces and dipped in a smooth chocolate layer.]	http://img.tesco.com/Groceries/pi/345/5050083519345/IDShot_90x90.jpg	Kelloggs Special K Raspberry/Choc Bars 5 X 22G	1.99	59100926	1.81
74	0.765	G	650.0				1	KG	[Dog Biscuit The Original]	http://img.tesco.com/Groceries/pi/911/5000161004911/IDShot_90x90.jpg	Bonio The Original 650G	1.65	50096028	2.54
75	0.168	G	154.0	False	True	Half Price Was £1.08 Now 54p	1	100G	[Cocoa Flavoured Sandwich Biscuits with a Strawberry and Cheesecake Flavour Filling (28.8%).]	http://img.tesco.com/Groceries/pi/105/7622210635105/IDShot_90x90.jpg	Oreo Strawberry Cheesecake 154G	0.54	81829158	0.351
76	0.034	G	54.0				1	100G	[Organic baby biscuits containing wheat flour, banana juice, grape juice and added vitamin B1., Join in at organix.com, If you've got a question, need some help or want to chat, join us and lots other parents online., See you there, Facebook/organixfood, Twitter@organixbrands, And at www.organix.com or call us on 0800 39 35 11 (UK) or 1800 40 92 78 (ROI)]	http://img.tesco.com/Groceries/pi/210/5024121639210/IDShot_90x90.jpg	Organix Banana Baby Biscuits 54G	1.39	79661260	2.58
77	0.343	G	250.0		True	Save 50p Was £1.99 Now £1.49	1	100G	[Biscuit Almond Apricot (Kernels), Find us on facebook.com/Doriauk]	http://img.tesco.com/Groceries/pi/376/8000605010376/IDShot_90x90.jpg	Doria Amaretti 250G	1.49	51435934	0.596
78	0.435	G	250.0				1	100G	[Vanilla flavoured cookies with chocolate chips., Chocolate Chip Cookies]	http://img.tesco.com/Groceries/pi/468/5051790788468/IDShot_90x90.jpg	Tesco Everyday Value Chocolate Chip Cookie 250G	0.4	63031535	0.16
79	178.833	G	125.0		True	Any 2 for £3.00	1	100G	[Cherry flavoured filling in a cocoa biscuit topped with a vanilla flavour drizzle.]	http://img.tesco.com/Groceries/pi/464/5053827149464/IDShot_90x90.jpg	Special K Biscuit Moment Cherry 5 X 25G	1.99	80165760	1.6
80	0.334	G	300.0				1	100G	[An Assortment of Biscuits Covered with Milk Chocolate.]	http://img.tesco.com/Groceries/pi/884/0072417153884/IDShot_90x90.jpg	Cadburysignature Selection Box 300G	3.79	71981498	1.27
81	0.146	G	120.0				1	KG	[Cocoa Loco flavour raw fruit, oat & nut bars, Join the Wholefood Revolution at eatnakd.com. Replace over processed foods with nourishing wholefoods and get ready to be happy. Simply Yummy, We'd love you to join us and discover the delightful world of wholefood alternatives:, Eatnakd.com, Find us on Facebook, Twitter @nakd]	http://img.tesco.com/Groceries/pi/744/5060088701744/IDShot_90x90.jpg	Nakd Cocoa Loco Bar Frt, Oat And Nut Multi Pk120g	2.49	70627684	20.75
82	0.495	G	300.0		True	Save £1.00 Was £4.00 Now £3.00	1	100G	[An Indulgent Biscuit Selection with Milk, Dark and White Chocolate., www.123healthybalance.com]	http://img.tesco.com/Groceries/pi/282/5000168183282/IDShot_90x90.jpg	Mcvities Victoria 300G	3.0	65684486	1.0
83	0.242	G	126.0		True	Any 2 for £2.00	1	100G	[Oat cereal bars with strawberry pieces., Strawberry  Cereal bars]	http://img.tesco.com/Groceries/pi/177/5051008815177/IDShot_90x90.jpg	Tesco Goodness Cereal Bar Strawberry 6X21g	1.19	57603868	0.944
84	0.195	G	218.0		True	Any 2 for £2.00	1	100G	[Crispy biscuits with a cranberry fruit filling.  Five individually wrapped packs of 3 biscuits., Crispy biscuits with a cranberry fruit filling.  Five individually wrapped packs of 3 biscuits.]	http://img.tesco.com/Groceries/pi/341/5051622418341/IDShot_90x90.jpg	Tesco Standard Cranberry Crispy Slices 218G	1.19	61960158	0.546
85	0.133	SNGL	5.0				1	EACH	[Milk chocolate coated biscuit bars with a chocolate flavoured filling.]	http://img.tesco.com/Groceries/pi/726/5010035065726/IDShot_90x90.jpg	Fox's Chocolatey Double Chocolate Biscuit Bars 5 Pack	1.79	80067467	0.358
86	0.31	G	252.0		True	Any 2 for £2.00	1	100G	[6 Individually wrapped packs containing 2 oats and honey crunchy bars., Twin packs of oats and honey Granola Bars]	http://img.tesco.com/Groceries/pi/156/5052320238156/IDShot_90x90.jpg	Tesco 6 Honey And Oaty Granola Bars 6 Pack 252G	1.19	67337628	0.472
87	1.561	SNGL	72.0				1	EACH	[Whole Wheat Cereal with Added Vitamins & Iron.]	http://img.tesco.com/Groceries/pi/856/5010029000856/IDShot_90x90.jpg	Weetabix 72Pk	5.69	51982660	0.079
88	0.825	G	750.0				1	100G		http://img.tesco.com/Groceries/pi/537/5000168108537/IDShot_90x90.jpg	Mcvities Digestive/Hobnob /Richtea 750G	2.5	57179006	0.333
89	0.11	G	75.0				1	100G	[Almond Thins, Connect, Twitter@DestrooperJules, www.facebook.com/Julesdestrooper, www.youtube.com/Julesdestrooper1886]	http://img.tesco.com/Groceries/pi/000/5410471127000/IDShot_90x90.jpg	Jules Destrooper Almond Thins 75 G	1.19	67609405	1.59
90	0.163	G	135.0				1	100G	[3 bars of peanuts, coconut and honey with chocolate chunks and soya crispies.]	http://img.tesco.com/Groceries/pi/982/5013803991982/IDShot_90x90.jpg	Eat Natural Protein Bar 3 X 45G	1.99	76982380	1.48
91	0.131	SNGL	5.0				1	EACH	[Dark Chocolate coated biscuit bars with a raspberry flavoured filling.]	http://img.tesco.com/Groceries/pi/696/5010035065696/IDShot_90x90.jpg	Fox's Chocolatey Dark Chocolate And Raspberry Biscuit Bars 5 Pack	1.79	80067542	0.358
92	1.16	KG	1.2				1	KG	[A complementary pet food for dogs, Crunchy biscuit bones which can assist in keeping teeth clean. Vitamin & Mineral enriched. Oven baked wheatmeal biscuits. No artificial flavours or colours]	http://img.tesco.com/Groceries/pi/730/5031021312730/IDShot_90x90.jpg	Tesco Large Bite Biscuit Bone Selection 1.2Kg	2.0	52801309	1.67
93	0.254	G	145.0		True	Save 99p Was £1.99 Now £1.00	1	100G	[Mixed cereal bars with apple and strawberry, dipped and drizzled with a yogurt flavour coating.]	http://img.tesco.com/Groceries/pi/061/5010029211061/IDShot_90x90.jpg	Alpen Strawberry With Yoghurt Cereal Bar 5X29g	1.0	56810217	0.69
94	0.333	G	170.0	False			1	100G	[Sweet almond biscuit]	http://img.tesco.com/Groceries/pi/731/5054268676731/IDShot_90x90.jpg	Tesco Finest Cantuccini Biscuits 170G	2.0	77092244	1.18
95	0.2	G	180.0		True	Save 98p Was £1.98 Now £1.00	1	100G	[Orange Flavoured Cookies Baked with Milk and Dark Chocolate Chunks., Vinnie's Quality Guarantee, A large part of my job making biscwits, is tasting biscwits. So I can personally guarantee that these biscwits are not just delicious, but have more yum per crumb in every bite. Got something to say on the matter, contact me at TalktoVinnie@foxs biscuits.co.uk]	http://img.tesco.com/Groceries/pi/825/5010035065825/IDShot_90x90.jpg	Fox's Chunkie Orange Biscuits 180G	1.0	81067811	0.556
96	0.132	G	95.0	False	True	Save 99p Was £1.99 Now £1.00	1	100G	[Mixed cereal bar with toffee, sweetened banana and a plain chocolate drizzle.]	http://img.tesco.com/Groceries/pi/070/5010029220070/IDShot_90x90.jpg	Alpen Light Banoffee Bar 5 Pack 95G	1.0	78663766	1.06
97	0.107	G	90.0				1	100G	[Crispy wafers filled with hazelnuts cream (75% cream filling).]	http://img.tesco.com/Groceries/pi/442/8000380153442/IDShot_90x90.jpg	Loacker Napolitaner Wafer 90G	0.99	73724069	1.1
98	0.036	G	30.0				1	100G	[Soft sponge cake with chocolate filling (30%).]	http://img.tesco.com/Groceries/pi/672/7622210126672/IDShot_90x90.jpg	Barny Chocolate Filling 30G	0.4	77054509	1.34
99	0.183	G	154.0				1	100G	[Biscuit with chocolate]	http://img.tesco.com/Groceries/pi/763/5410126106763/IDShot_90x90.jpg	Lotus Biscoff Belgian Chocolate 154G	1.49	73686355	0.968
0	0.144	G	120.0		True	Any 2 for £2.00	1	100G	[Puffed rice cereal bars with milk flavoured base with added vitamins, Cereal & Milk Flavoured Bars]	http://img.tesco.com/Groceries/pi/468/5052910231468/IDShot_90x90.jpg	Tesco Rice Snaps Cereal And Milk 6 Bars 120G	1.19	72707437	0.992
1	0.175	G	135.0		True	Any 2 for £2.00	1	100G	[Apple & custard flavoured cereal bars with dried apple pieces, Apple Crumble cereal bars layered cereal bar with Oats & Apple, reminiscent of a classic apple crumble.]	http://img.tesco.com/Groceries/pi/397/5054402005397/IDShot_90x90.jpg	Tesco Apple Crumble Cereal 5 Bars 135G	1.19	77545361	0.882
2	0.185	G	160.0				1	100G	[Digestives made with gluten free oat flour, oat bran and soya flour., Free From Digestive Biscuits]	http://img.tesco.com/Groceries/pi/421/5054775347421/IDShot_90x90.jpg	Tesco Free From Digestive Biscuits 160G	0.8	80567906	0.5
3	0.46	G	400.0				1	KG	[A complementary pet food for dogs, Crunchy biscuit bones which can assist in keeping teeth clean.  Vitamin & Mineral enriched. Tasty meaty biscuit with a gravy coating.]	http://img.tesco.com/Groceries/pi/223/5051140168223/IDShot_90x90.jpg	Tesco Gravy Bites Treats For Dogs 400G	1.0	59016992	2.5
4	0.214	G	150.0		False	Half Price Was £1.25 Now 59p	1	100G	[Light Sponge Cakes with Dark Crackly Chocolate and a Smashing Orangey Centre, To find out how exercise and a balanced diet can help a healthy lifestyle, visit www.123healthybalance.com, Join us at facebook/jaffacakes]	http://img.tesco.com/Groceries/pi/071/5000168002071/IDShot_90x90.jpg	Mcvities Jaffa Cakes 150G	1.19	50068523	0.793
5	0.258	G	288.0		True	Save 99p Was £2.99 Now £2.00	1	100G	[Crispy grains of toasted rice cereal and milk chocolate chunks with a chocolate flavour coating.]	http://img.tesco.com/Groceries/pi/424/5050083496424/IDShot_90x90.jpg	Kelloggs Rice Krispie Square Chocolatey8x36g	2.0	65028596	0.694
6	0.325	G	300.0				1	100G	[Milk chocolate & orange digestives, The Prince's Countryside Fund, Supporting British Farmers & Rural Communities, www.123healthybalance.com]	http://img.tesco.com/Groceries/pi/922/5000168180922/IDShot_90x90.jpg	Mcvities Chocolate Orange Digestives 300G	1.5	75703828	0.5
7	0.014	G	160.0				1	100G	[Biscuit break oat & fruit, If you are concerned about safely including oats in your gluten free diet, visit the 'pure oats' pages in the gluten free section of our website., Come and find out more about us, our gluten free products, the benefits of oats, and some tasty gluten free recipes., www.nairns oatcakes.com/gluten free, Palm Fruit Oil, This product is made with palm fruit oil from sustainable sources. For further information visit nairns oatcakes.com]	http://img.tesco.com/Groceries/pi/018/0612322030018/IDShot_90x90.jpg	Nairns Oats And Fruit Biscuits 160G	1.8	73546527	1.13
8	0.162	G	125.0				1	100G	[Luxury sponge cakes with a tangy orange fruit filling (53%) half-coated in dark chocolate (19%)., Find us on Facebook: www.facebook.com/bahlsenbiscuits, Find out more of our history at www.bahlsen.co.uk]	http://img.tesco.com/Groceries/pi/054/4017100305054/IDShot_90x90.jpg	Bahlsen Messino Chocolate Orange Biscuits 125G	1.19	54712659	0.952
9	0.349	SNGL	12.0		True	Half Price Was £2.75 Now £1.37	1	EACH		http://img.tesco.com/Groceries/pi/960/5000168180960/IDShot_90x90.jpg	Jacobs Mini Cheddars Variety 12 Pack	1.37	75960154	0.114
10	0.137	G	120.0				1	100G	[Milk and Dark Chocolate Coated Biscuit Balls, www.123healthybalance.com]	http://img.tesco.com/Groceries/pi/812/5000168191812/IDShot_90x90.jpg	Mcvities Digestive Double Chocolate Nibble 120G	1.5	80809034	1.25
11	0.03	G	25.0		True	Any 5 for £2.00	1	100G	[A mix of sultanas, dried cranberries sweetened with fruit derived syrup and white chocolate coated shortcake biscuit balls., To find out more visit: whitworths.co.uk, Find us on Facebook, Twitter and Instagram]	http://img.tesco.com/Groceries/pi/067/5000234050067/IDShot_90x90.jpg	Whitworths Fruity Biscuit Shot 25G	0.49	77618707	1.96
12	0.254	G	145.0		True	Save 99p Was £1.99 Now £1.00	1	100G	[Mixed cereal bar with fruit & nut, dipped and drizzled with milk chocolate.]	http://img.tesco.com/Groceries/pi/030/5010029211030/IDShot_90x90.jpg	Alpen Fruit And Nut With Chocolate Cereal Bar 5X29g	1.0	56810160	0.69
13	0.248	G	200.0				1	100G	[Cookies containing chocolate chips]	http://img.tesco.com/Groceries/pi/160/0072417136160/IDShot_90x90.jpg	Maryland Chocolate Chip Cookies 200G	1.15	65608692	0.575
14	0.159	G	159.0			70p off selected Nestle Chocolate Bar Multipack	1	100G	[Chunky milk chocolate with raisins (13%) and biscuits (4%), www.facebook.com/yorkieofficial, Good to remember, Enjoying chocolate as part of a varied, balanced diet and a healthy lifestyle, is one of life's little pleasures.]	http://img.tesco.com/Groceries/pi/616/7613034872616/IDShot_90x90.jpg	Yorkie Raisin And Biscuit 3 Pack 159G	1.5	71816413	0.943
15	0.167	G	135.0				1	100G	[Organic gingerbread men biscuits containing wholegrain flour, grape juice and ginger with added vitamin B1, Do you have a question for us? Join us online for tips, recipes and to share your stories. You'll find us at:, facebook/organixfood, twitter@organixbrands, Goodies Gang created by Caroline Jayne Church www.carolinejaynechurch.com]	http://img.tesco.com/Groceries/pi/207/5024121222207/IDShot_90x90.jpg	Organix Goodies Gingerbread Men 135G	2.0	51408685	1.49
16	0.326	G	300.0				1	100G	[Ginger flavoured biscuits with a mallow centre sprinkled with sugar.]	http://img.tesco.com/Groceries/pi/147/0870719000147/IDShot_90x90.jpg	Bolands Kimberley Biscuits 300G	1.5	71006531	0.5
17	0.107	G	90.0				1	100G	[Crispy wafers filled with cocoa and chocolate cream (75% cream filling).]	http://img.tesco.com/Groceries/pi/466/8000380153466/IDShot_90x90.jpg	Loacker Chocolate Wafer 90G	0.99	73724052	1.1
18	0.144	G	120.0		True	Any 2 for £2.00	1	100G	[Puffed rice cereal bars with chocolate and a milk flavoured base, Cereal & Milk Flavoured Bars]	http://img.tesco.com/Groceries/pi/406/5052910231406/IDShot_90x90.jpg	Tesco Choco Snap 6 Bars 120G	1.19	72707408	0.992
19	0.11	G	75.0				1	100G	[Butter Crisps, Connect, Twitter@DestrooperJules, Facebook: www.facebook.com/Julesdestrooper, YouTube: www.youtube.com/Julesdestrooper1886]	http://img.tesco.com/Groceries/pi/002/5410471110002/IDShot_90x90.jpg	Jules Destrooper Butter Crisp 75 G	1.19	67609434	1.59
20	0.068	G	60.0		True	Any 3 for 2 Cheapest Product Free	1	KG	[Grow happy ™, 12 finger biscuits., Made with baby grade ingredients and with iron for healthy brain development. Heinz Biscotti are made in Italy to our unique recipe and have a gentle crunch which softens in little mouths., Apple flavoured finger biscuits.]	http://img.tesco.com/Groceries/pi/845/5000157067845/IDShot_90x90.jpg	Heinz Apple Biscotti 60G	0.75	62864606	12.5
21	0.131	SNGL	5.0				1	EACH	[Milk chocolate coated biscuit bars with a lemon flavoured filling.]	http://img.tesco.com/Groceries/pi/689/5010035065689/IDShot_90x90.jpg	Fox's Chocolatey Milk Chocolate And Lemon Biscuit Bars 5 Pack	1.79	80067611	0.358
22	0.72	G	650.0				1	KG	[Dog Biscuit Chicken Flavour]	http://img.tesco.com/Groceries/pi/430/7613032982430/IDShot_90x90.jpg	Bonio Chicken 650G	1.65	66367974	2.54
23	0.198	G	135.0				1	100G	[3 bars of nuts, dried fruit, crisped rice and honey with dark chocolate.]	http://img.tesco.com/Groceries/pi/002/5013803666002/IDShot_90x90.jpg	Eat Natural Dark Chocolate Cranberry And Macadamia Bars 3X45g	1.99	58033765	1.48
24	0.15	G	125.0				1	100G	[All Butter Shortbread Fingers]	http://img.tesco.com/Groceries/pi/644/0655762001644/IDShot_90x90.jpg	Deans All Butter Shortbread Fingers 125G	1.0	63745163	0.8
25	0.266	G	350.0		False	Save 88p Was £1.88 Now £1.00	1	100G	[Cheese Snack Biscuits, To find out how exercise and a balanced diet can help a healthy lifestyle, visit www.123healthybalance.com]	http://img.tesco.com/Groceries/pi/078/5000168131078/IDShot_90x90.jpg	Jacobs Mini Cheddars Original 7X25g	1.79	50470392	0.511
26	2.025	KG	2.0				1	KG	[Complete Pet Food for Adult Cats.]	http://img.tesco.com/Groceries/pi/049/3065890071049/IDShot_90x90.jpg	Whiskas 1+ Dry Cat Food Biscuits Tuna & Veg 2kg	4.5	55999801	2.25
27	0.188	G	120.0				1	100G	[High in fibre brownie with chocolate flavour fudge pieces (11%) and chocolate flavour drizzle (7%).]	http://img.tesco.com/Groceries/pi/002/8410076620002/IDShot_90x90.jpg	Fibre One Chocolate Fudge Brownie Bars 5 Pack 120G	2.89	80120220	2.41
28	0.264	G	224.0		True	Save 99p Was £2.99 Now £2.00	1	100G	[Crispy grains of toasted rice cereal covered in chewy melted marshmallow.]	http://img.tesco.com/Groceries/pi/751/5050083451751/IDShot_90x90.jpg	Kelloggs Rice Krispies Squares Marshmallows 8X28g	2.99	62128396	1.34
29	0.327	G	210.0		True	Save 51p Was £2.51 Now £2.00	1	100G	[Crunchy cereal bars made with whole grain rolled oats and Canadian maple syrup., Find us at www.naturevalley.com]	http://img.tesco.com/Groceries/pi/806/8410076600806/IDShot_90x90.jpg	Nature Valley Canadian Maple Syrup Bars 5X210g	2.39	54643458	1.14
30	0.15	G	126.0	False	True	Any 2 for £2.00	1	100G	[Oat cereal bars with banana pieces., oat cereal bars with banana pieces]	http://img.tesco.com/Groceries/pi/329/5052910082329/IDShot_90x90.jpg	Tesco Goodness Banana Cereal Bar 6X21g	1.19	72537350	0.944
31	0.132	G	120.0	False			1	100G	[Homemade sponge biscuits]	http://img.tesco.com/Groceries/pi/444/5905784910444/IDShot_90x90.jpg	Delicpol Homemade Sponge Biscuits 120G	0.99	77862077	0.825
32	0.136	G	144.0				1	100G	[Crispy grains of toasted rice cereal covered in chewy marshmallow with milk chocolate chunks and a chocolate flavour coating.]	http://img.tesco.com/Groceries/pi/428/5053827116428/IDShot_90x90.jpg	Kelloggs Squares Chocmallow 4X36g	1.99	76955706	1.39
33	0.232	G	210.0		True	Save 51p Was £2.51 Now £2.00	1	100G	[Crunchy cereal bars made with whole grain rolled oats and chocolate pieces., Nature Valley and associated words and designs are trademarks of General Mills © 2013]	http://img.tesco.com/Groceries/pi/479/8410076600479/IDShot_90x90.jpg	Nature Valley Crunchy Oat And Chocolate 5 Pack 210G	2.39	67673569	1.14
34	0.206	G	150.0				1	100G	[3 bars of nuts, dried fruit, crisped rice and honey with a yoghurt flavour coating.]	http://img.tesco.com/Groceries/pi/332/5013803620332/IDShot_90x90.jpg	Eat Natural Yoghurt Almond And Apricot Bars 3X50g	1.99	56857398	1.33
35	0.166	G	126.0				1	100G	[Chewy chocolate flavoured cereal bar with chocolate chip pieces]	http://img.tesco.com/Groceries/pi/069/5054402919069/IDShot_90x90.jpg	Tesco Everyday Value Chocolate Chip Cereal Bars 6 Pack 126G	0.7	80010137	0.556
36	0.175	G	135.0		True	Any 2 for £2.00	1	100G	[Sticky toffee flavoured cereal bar with caramel flavoured fudge pieces and date pieces, Sticky toffee cereal bars with toffee fudge pieces and dates reminiscent of the classic sticky toffee pudding]	http://img.tesco.com/Groceries/pi/359/5054402005359/IDShot_90x90.jpg	Tesco Sticky Toffee Cereal 5 Bars 135G	1.19	77536896	0.882
37	0.31	G	252.0		True	Any 2 for £2.00	1	100G	[6 Individually wrapped packs containing 2 oats & maple syrup crunchy bars, Twin packs of maple syrup oaty granola bars]	http://img.tesco.com/Groceries/pi/354/5052320238354/IDShot_90x90.jpg	Tesco 6 Maple Syrup Oaty Granola Bars 6 Pack 252G	1.19	67337916	0.472
38	0.019	G	63.0				1	100G	[Milk chocolate speciality with a fine hazelnut cream filling (54%) and crispy leaves of wafer.]	http://img.tesco.com/Groceries/pi/791/8000380154791/IDShot_90x90.jpg	Loacker Tortina Chocolate Covered Wafer Biscuit 3X21g	1.79	73724081	2.85
39	0.227	G	150.0	False	True	Any 2 for £1.50	1	100G	[Biscuits Half Coated with Cadbury Milk Chocolate.]	http://img.tesco.com/Groceries/pi/797/0072417161797/IDShot_90x90.jpg	Cadburys Festive Friends 150G	1.0	57915115	0.667
40	0.241	G	180.0				1	100G	[Wholegrain oat cereal bars with strawberry & blueberry infused diced cranberries, raisins and strawberry & raspberry flakes., Jordans Farm Partnership, Since 1985, Jordans has worked with British farmers to dedicate land for nature and wildlife   creating a huge nature reserve to help birds, bees and butterflies thrive., We work with wildlife experts and The Prince's Countryside Fund to help our farmers manage 10% of their land for wildlife and provide funding to support rural communities., So, by picking Jordans cereal bars you are helping our British farmers protect the countryside and look after the communities that make it so special., The Prince's Countryside Fund, To discover more about Jordans, visit: www.jordanscereals.co.uk]	http://img.tesco.com/Groceries/pi/118/5010477323118/IDShot_90x90.jpg	Jordans Frusli Wild Berry 6X30g	1.99	53708937	1.11
41	0.142	G	100.0				1	100G	[Puff pastry biscuits with fruit filling (19%)., Like us on Facebook: www.facebook.com/Bahlsen]	http://img.tesco.com/Groceries/pi/006/4017100140006/IDShot_90x90.jpg	Bahlsen Deloba 100G	1.29	51435675	1.29
42	0.188	SNGL	6.0	False	True	Save £1.00 Was £2.55 Now £1.55	1	EACH	[Milk Chocolate Florentines, Send us a note at: hello@thomasjfudges.co.uk, See what's baking at: www.thomasjfudges.co.uk, Follow us at: facebook.com/thomasjfudges or tweet us at: @thomasjfudges]	http://img.tesco.com/Groceries/pi/082/5026139000082/IDShot_90x90.jpg	Fudges Belgian Milk Chocolate Florentines 140G	1.55	73724075	0.258
43	0.244	SNGL	7.0				1	EACH		http://img.tesco.com/Groceries/pi/616/5000168184616/IDShot_90x90.jpg	Jacobs Mini Cheddars Variety 7 Pack	1.79	50771076	0.256
44	0.578	SNGL	24.0				1	EACH	[Whole Wheat Cereal with Crispy Pieces and Added Vitamins and Iron.]	http://img.tesco.com/Groceries/pi/701/5010029221701/IDShot_90x90.jpg	Weetabix Protein 24'S	2.99	81134450	0.125
45	0.178	G	140.0	False	True	Save £1.00 Was £2.55 Now £1.55	1	EACH	[Dark Chocolate Florentines, Send us a note at: hello@thomasjfudges.co.uk, See what's baking at: www.thomasjfudges.co.uk, Follow us at: facebook.com/thomasjfudges or tweet us at: @thomasjfudges]	http://img.tesco.com/Groceries/pi/617/5026139000617/IDShot_90x90.jpg	Fudges Decandent Dark Chocolate Florentines X 6	2.55	62547762	0.0
46	0.175	G	107.5		True	Any 2 for £3.00	1	100G	[Wholewheat flakes, cereal pieces, with dried peach, apricot and apple pieces in a bar dipped in a smooth vanilla flavour layer]	http://img.tesco.com/Groceries/pi/935/5053827140935/IDShot_90x90.jpg	Kelloggs Special K Peach And Apricot 5 Pack 115G	1.99	57514117	1.86
47	0.241	G	180.0				1	100G	[Wholegrain oat cereal bars with raisins and roasted chopped hazelnuts., Jordans Farm Partnership, Since 1985, Jordans has worked with British farmers to dedicate land for nature and wildlife   creating a huge nature reserve to help birds, bees and butterflies thrive., We work with wildlife experts and The Prince's Countryside Fund to help our farmers manage 10% of their land for wildlife and provide funding to support rural communities., So, by picking Jordans cereal bars you are helping our British farmers protect the countryside and look after the communities that make it so special., The Prince's Countryside Fund, To discover more about Jordans, visit: www.jordanscereals.co.uk]	http://img.tesco.com/Groceries/pi/071/5010477323071/IDShot_90x90.jpg	Jordans Frusli Bar Raisin And Hazelnut 6X30g	1.99	51684840	1.11
48	0.175	G	135.0		True	Any 2 for £2.00	1	100G	[Raspberry and almond flavoured cereal bar with chocolate chips, Berry & almond bakewell cereal bars with dark chocolate chips, raspberry flavoured fruit pieces & almons, reminiscent of a bakewell tart]	http://img.tesco.com/Groceries/pi/373/5054402005373/IDShot_90x90.jpg	Tesco Berry And Almond Bakewell Cereal 5 Bars 135G	1.19	77536913	0.882
49	0.623	G	400.0				1	100G	[The Original Caramelised Biscuit Spread]	http://img.tesco.com/Groceries/pi/953/5410126116953/IDShot_90x90.jpg	Lotus Biscuit Spread Smooth 400G	2.25	75792715	0.563
50	178.833	G	125.0		True	Any 2 for £3.00	1	100G	[Chocolate flavoured filling in a cocoa biscuit topped with a vanilla flavour drizzle.]	http://img.tesco.com/Groceries/pi/838/5053827500838/IDShot_90x90.jpg	Special K Biscuit Moment Double Chocolate 5 X 25G	1.99	80165725	1.6
51	71.25	G	80.0		True	Any 2 for £3.00	1	100G	[Raisin + Oat Cookies, P.S. let's be friends, Sign up at ellaskitchen.co.uk]	http://img.tesco.com/Groceries/pi/445/5060107336445/IDShot_90x90.jpg	Ella's Kitchen Raisin Spelt Biscuits 80G	2.0	76580291	2.5
52	0.22	G	200.0		True	Any 2 for £2.00	1	100G	[Crunchy Biscuits with Seeds, Nuts and Currants, Crunchy Biscuits with Seeds, Nuts and Currants]	http://img.tesco.com/Groceries/pi/492/5051399076492/IDShot_90x90.jpg	Tesco Crispy Seedy Nutty Bites 200G	1.19	60793386	0.595
53	0.018	G	16.0	False	True	5 for 50p	1	10G		http://img.tesco.com/Groceries/pi/602/5900352000602/IDShot_90x90.jpg	Jutrzenka Bebe Herbatniki 16G	0.15	72759732	0.094
