	AverageSellingUnitWeight	ContentsMeasureType	ContentsQuantity	IsNew	IsSpecialOffer	PromotionDescription	UnitOfSale	UnitQuantity	description	image	name	price	tpnb	unitprice
41	0.321	G	150.0	False	True	Any 2 for £4.00	1	100G	[Chewy peanut, chocolate and oat bar dipped in a smooth nutty flavour coating.]	http://img.tesco.com/Groceries/pi/171/8410076610171/IDShot_90x90.jpg	Nature Valley Sweet And Nutty Chocolate 5X30g	2.39	75007299	1.6
42	0.163	G	100.0	True	True	Any 2 for £1.50	1	100G	[Ginger flavour shaped biscuits., Mini Gingerbread Men Biscuits]	http://img.tesco.com/Groceries/pi/353/5057008349353/IDShot_90x90.jpg	Tesco Mini Gingerbread Men 100G	1.0	81639423	1.0
43	0.042	G	36.0	False	True	Any 3 for £1.00	1	100G		http://img.tesco.com/Groceries/pi/167/5900394006167/IDShot_90x90.jpg	Goplana Grzeski Chocolate Wafer 36G	0.45	61035442	1.25
44	0.101	KG	0.08		True	Any 2 for £3.00	1	KG	[Parsnip + Poppy Seed Savoury Biccies, P.S. let's be friends, Sign up at ellaskitchen.co.uk]	http://img.tesco.com/Groceries/pi/422/5060107339422/IDShot_90x90.jpg	Ella's Kitchen Parsnip And Poppyseed Savoury Biscuits 4X20g	2.0	81244262	25.0
45	0.137	G	90.0				1	100G	[Digestive biscuit crumb topped with cheesecake filling and strawberry compote, Digestive biscuit crumb topped with cheesecake filling and strawberry compote]	http://img.tesco.com/Groceries/pi/148/5050179879148/IDShot_90x90.jpg	Tesco Everyday Value Strawberry Cheesecake 90G	0.3	55765623	0.333
46	2.177	KG	2.0				1	KG	[A complementary pet food for adult dogs., Please visit the Winalot website www.winalot dog.co.uk]	http://img.tesco.com/Groceries/pi/762/7613031329762/IDShot_90x90.jpg	Winalot Shapes 2Kg	3.0	50845675	1.5
47	0.129	G	104.0		True	Any 2 for £2.00	1	100G	[Cold pressed fruit and nut bar with dates, soy protein crispies, raisins, cashew nuts and banana., Banana Bliss Fruity Bars]	http://img.tesco.com/Groceries/pi/628/5054402921628/IDShot_90x90.jpg	Tesco Banana Bliss Fruit Bars 4 Pack 104G	1.19	80054079	1.15
48	0.263	ML	330.0				1	100ML	[Chocolate flavoured sandwich biscuits filled with vanilla flavour ice cream with crushed biscuit pieces with a vanilla flavour filling]	http://img.tesco.com/Groceries/pi/555/5010238013555/IDShot_90x90.jpg	Oreo Ice Cream Sandwich 6 X 55Ml	2.99	76170724	0.906
49	0.806	G	343.0	False			1	100G	[An Assortment of Biscuits with Milk Chocolate, White Chocolate and Dark Chocolate.]	http://img.tesco.com/Groceries/pi/087/0072417158087/IDShot_90x90.jpg	Cadbury Chocolate Collection Tin 340G	5.0	59416334	1.46
50	0.913	G	500.0	False			1	100G	[All butter shortbread assortment., All butter Scottish shortbread.]	http://img.tesco.com/Groceries/pi/095/5054268303095/IDShot_90x90.jpg	Tesco Scottish Shortbread Assortment Tin 500G	4.0	76725754	0.8
51	0.929	G	750.0		True	Save £1.19 Was £3.19 Now £2.00	1	100G	[100% Whole grain wheat cereal biscuits, Reducing consumption of saturated fat contributes to the maintenance of normal blood cholesterol levels. Shredded Wheat is low in saturated fat.]	http://img.tesco.com/Groceries/pi/502/5011476100502/IDShot_90x90.jpg	Nestle Shredded Wheat Cereal Bitesize 750G	2.0	51767466	0.267
52	0.146	G	120.0				1	100G	[Strawberry crunch raw fruit, crunchies & nut bars, Join the Wholefood Revolution at eatnakd.com. Replace over processed foods with nourishing wholefoods and get ready to be happy. Simply Yummy, We'd love you to join us and discover the delightful world of wholefood alternatives:, Eatnakd.com, Find us on Facebook, Twitter @nakd]	http://img.tesco.com/Groceries/pi/529/5060088702529/IDShot_90x90.jpg	Nakd Strawberry Crunch 4X30g	2.49	76535363	2.08
53	0.137	G	112.0		True	Any 2 for £2.00	1	100G	[Cold pressed fruits, oat and nut bar with dates, raisins, cashew nuts and cranberries., Berry Blast Fruity Bars]	http://img.tesco.com/Groceries/pi/574/5054402921574/IDShot_90x90.jpg	Tesco Berry Blast Fruit Bars 4 Pack 112G	1.19	80054027	1.07
54	0.039	G	33.0	False			1	100G	[Wafer layered with coconut cream covered with white chocolate]	http://img.tesco.com/Groceries/pi/504/5900090017504/IDShot_90x90.jpg	Nestle Princessa Coconut Wafer Bar 33G	0.49	50642241	1.49
55	0.42	G	420.0	False			1	100G	[All butter shortbread fingers., Deliciously crumbly all butter shortbread made in Edinburgh to a traditional recipe]	http://img.tesco.com/Groceries/pi/597/5052109810597/IDShot_90x90.jpg	Tesco Scottish Shortbread Fingers 420G	2.0	70462204	0.476
56	0.4	G	375.0				1	KG	[Wholegrain Wheat & Rice Flakes, Fortified with Vitamins & Iron.]	http://img.tesco.com/Groceries/pi/286/5010029207286/IDShot_90x90.jpg	Weetabix Weetaflakes 375G	1.0	74276689	2.67
57	1.02	KG	1.0				1	KG	[Demerara cane sugar, Ideal for biscuits and crumbles]	http://img.tesco.com/Groceries/pi/294/5000119003294/IDShot_90x90.jpg	Tesco Demerara Sugar 1Kg	1.49	50039149	1.49
58	0.5	KG	0.5				1	KG	[Demerara cane sugar, Ideal for biscuits and crumbles]	http://img.tesco.com/Groceries/pi/221/5000119113221/IDShot_90x90.jpg	Tesco Demerara Sugar 500G	0.79	50039132	1.58
59	0.033	G	30.0	False	True	Any 4 for £1.00	1	100G		http://img.tesco.com/Groceries/pi/076/5900352010076/IDShot_90x90.jpg	Jutrzenka Jezyki Coconut Bar 30G	0.29	66861884	0.967
60	0.22	G	200.0				1	100G	[Scottish porridge oat bars with dried raspberries and honey., Find out more @ eatstoats.com]	http://img.tesco.com/Groceries/pi/522/5060183671522/IDShot_90x90.jpg	Stoats Raspberry And Honey Porridge Bar Multipacks 4X50g	2.49	74666775	1.25
61	1.633	KG	1.5				1	KG	[Complementary pet food for adult dogs.]	http://img.tesco.com/Groceries/pi/836/5010394984836/IDShot_90x90.jpg	Pedigree Gravy Bones 1.5Kg	4.0	55869570	2.67
62	0.142	G	100.0	False			1	100G	[The Caribbean Classic.]	http://img.tesco.com/Groceries/pi/992/0064396543992/IDShot_90x90.jpg	Wibisco Shirley Coconut Biscuits 100G	0.49	54877248	0.49
63	0.542	G	450.0	False	True	Any 2 for £6.00	1	100G		http://img.tesco.com/Groceries/pi/806/5057008252806/IDShot_90x90.jpg	Tesco Chocolate Biscuit Assortment 450G	4.0	81543602	0.889
64	0.187	G	180.0	False	True	Any 2 for £1.00	1	100G		http://img.tesco.com/Groceries/pi/555/5900352001555/IDShot_90x90.jpg	Jutrzenka Familijne Chocolate Wafers 180G	0.75	60865411	0.417
65	0.173	G	114.0	True			1	100G	[Oat Digestive Biscuits, Visit us:, weightwatchersfoods.co.uk, weloveweightwatchersfoods.co.uk, For great free recipes ideas, money off coupons and information about new products in our range., weightwatchers.co.uk, Our food range is just part of what we have to offer. We also run thousands of friendly meetings across the UK each week, or you can follow our plant step by step completely online., For more information, call 03456092462.]	http://img.tesco.com/Groceries/pi/455/0039047153455/IDShot_90x90.jpg	Weight Watchers Oat Digestive Biscuits 114G	0.85	81930803	0.746
66	0.137	G	120.0				1	100G	[Crispy Grains of Toasted Rice Cereal with Chewy Salted Caramel.]	http://img.tesco.com/Groceries/pi/087/5053827144087/IDShot_90x90.jpg	Kellogg's Square Salted Caramel Bars 4 Pack 120G	1.99	79983408	1.66
67	0.183	G	135.0	True			1	100G	[Viennese Biscuits Dipped in Milk Chocolate, Quality Guarantee, When we first opened our bakehouse in Victorian Yorkshire we were dedicated to quality and delighted in making our customers smile, and little has changed in over 160 years. So, if you have any comments on any of our products, we'd like to hear from you   email careline@foxs biscuits.co.uk]	http://img.tesco.com/Groceries/pi/020/5010035066020/IDShot_90x90.jpg	Fox's Milk Chocolate Viennese Dipped Fingers 135G	1.99	81812425	1.48
68	0.22	G	200.0				1	100G	[Scottish porridge oat bars with dried apple and cinnamon., Find out more @ eatstoats.com]	http://img.tesco.com/Groceries/pi/621/5060183671621/IDShot_90x90.jpg	Stoats Apple And Cinnamon Porridge Bars 4X50g	2.49	74636546	1.25
69	0.178	G	140.0				1	KG	[Peanut, almond, cranberry fruit pieces, raisin and oat cereal bar.]	http://img.tesco.com/Groceries/pi/914/5053827149914/IDShot_90x90.jpg	Kelloggs Nutty Chewy Cranberry And Almond Bar 4X35g	2.59	80619915	18.5
70	0.93	SNGL	30.0				1	EACH	[100% Whole Grain Wheat Cereals Biscuits, Reducing consumption of saturated fat contributes to the maintenance of normal blood cholesterol levels. Shredded Wheat is low in saturated fat., Shredded Wheat: 100% Whole Grain Wheat Biscuits]	http://img.tesco.com/Groceries/pi/113/7613031473113/IDShot_90x90.jpg	Nestle Shredded Wheat Cereal 30'S	2.18	61708303	0.073
71	0.512	KG	0.5				1	KG	[Light Brown Soft Cane Sugar, IDEAL FOR FRUIT CAKES, PUDDINGS, BISCUITS AND SAVOURY SAUCES]	http://img.tesco.com/Groceries/pi/245/5000119113245/IDShot_90x90.jpg	Tesco Light Soft Brown Sugar 500G	1.39	50196653	2.78
72	0.508	KG	0.5				1	KG	[Self raising wheat flour., ideal for cakes, scones and biscuits]	http://img.tesco.com/Groceries/pi/587/5000119101587/IDShot_90x90.jpg	Tesco Self Raising Flour 500G	0.4	50360948	0.8
73	0.22	G	200.0	False			1	100G	[Scottish porridge oat bars with dried blueberries and honey., Find out more @ eatstoats.com]	http://img.tesco.com/Groceries/pi/546/5060183671546/IDShot_90x90.jpg	Stoats Blueberry Honey Porridge Bar Multipacks4x50g	2.49	74636575	1.25
74	0.323	G	270.0		True	Any 2 for £3.00	1	100G	[30 Mini gingerbread biscuits., 30 Mini gingerbread biscuits]	http://img.tesco.com/Groceries/pi/913/5052109748913/IDShot_90x90.jpg	Tesco Mini Gingerbread Men 270G	1.6	72317910	0.593
75	0.114	SNGL	1.0				1	EACH	[Chocolate sandwich biscuit with a chocolate flavoured filling, A Giant bourbon biscuit with a chocolate flavoured filling   fun to share but you may not want to]	http://img.tesco.com/Groceries/pi/207/5054269154207/IDShot_90x90.jpg	Giant Bourbon Biscuit	0.85	78922869	0.85
76	0.05	G	47.0	False	True	Any 3 for £1.00	1	100G		http://img.tesco.com/Groceries/pi/827/5900102011827/IDShot_90x90.jpg	Wawel Maciek Adwokat Chocolate Bar 40G	0.39	64882614	0.83
77	0.585	G	500.0				1	100G	[Shredded whole grain wheat biscuits with apricot filling., Shredded whole grain wheat biscuits with apricot filling]	http://img.tesco.com/Groceries/pi/490/5010204520490/IDShot_90x90.jpg	Tesco Apricot Wheats Cereal 500G	1.79	57243898	0.358
78	0.232	G	200.0				1	100G	[Baked Mixed Seeds Snack Bar with Almonds and Raspberries, Enjoy 9BAR as part of a varied, balanced diet and healthy lifestyle., The Power of Deeds..., 'Good Energy, twice' means... Energy for you and energy for others  Every 9BAR we sell = A night of light for a child in Africa. We're working with solaraid to provide solar lights to families who would otherwise rely on dirty, dangerous kerosene lamps, See the Impact..., Our solar lights mean crucial hours of study for children without access to proper lighting. Trace the impact of your night of light at 9bar.com/impactmap, Thanks for joining our movement... let's light up the night, one bar at a time  9bar.com]	http://img.tesco.com/Groceries/pi/050/5024278005050/IDShot_90x90.jpg	9Bar Almond And Raspberry Breakfast Boost Bar 4X50g	2.99	80100935	1.5
79	0.906	G	750.0				1	100G	[An assortment of milk chocolates and a milk chocolate covered biscuit]	http://img.tesco.com/Groceries/pi/641/5000159461641/IDShot_90x90.jpg	Celebrations Tub 750G	5.0	73905057	0.667
80	0.248	G	200.0				1	100G	[Chocolate flavoured cookies containing chocolate chips]	http://img.tesco.com/Groceries/pi/177/0072417136177/IDShot_90x90.jpg	Maryland Double Chocolate Cookies 200G	1.15	65607128	0.575
81	0.146	G	120.0				1	100G		http://img.tesco.com/Groceries/pi/984/5060088703984/IDShot_90x90.jpg	Nakd Crunch Mix 4 X 30G	2.49	80101525	2.08
82	0.223	G	200.0	False	True	Save 24p Was 99p Now 75p	1	100G	[Full product range available online: www.shopatregal.com]	http://img.tesco.com/Groceries/pi/118/5027738101118/IDShot_90x90.jpg	Regal Puff Pastry Finger Biscuits 200G	0.75	66739726	0.375
83	0.574	G	500.0				1	100G	[Shredded whole grain wheat biscuits with raisin filling., Shredded whole grain wheat biscuits with raisin filling]	http://img.tesco.com/Groceries/pi/937/5054268779937/IDShot_90x90.jpg	Tesco Raisin Wheats Cereal 500G	1.79	77279497	0.358
84	0.232	G	200.0				1	100G	[Baked Mixed Seeds Snack Bar with Peanuts and Raisins, Enjoy 9BAR as part of a varied, balanced diet and healthy lifestyle., The Power of Deeds..., 'Good Energy, twice' means... Energy for you and energy for others  Every 9BAR we sell = A night of light for a child in Africa. We're working with solaraid to provide solar lights to families who would otherwise rely on dirty, dangerous kerosene lamps, See the Impact..., Our solar lights mean crucial hours of study for children without access to proper lighting. Trace the impact of your night of light at 9bar.com/impactmap, Thanks for joining our movement... let's light up the night, one bar at a time  9bar.com]	http://img.tesco.com/Groceries/pi/074/5024278005074/IDShot_90x90.jpg	9Bar Peanut And Raisin Breakfast Boost Bar 4X50g	2.99	80101102	1.5
85	0.175	G	37.0		True	Any 3 for £1.20	1	100G	[Cereal bar with chewy oats, roasted peanuts and chocolate chips (6.2%), www.marsnutrition.co.uk]	http://img.tesco.com/Groceries/pi/444/0000050159444/IDShot_90x90.jpg	Tracker Cereal Bar Chocolate Chip 37G (Pfs)	0.6	50770866	1.63
86	0.321	ML	440.0				1	100ML	[Strawberry and vanilla flavour ice creams in a biscuit cone coated with chocolate flavour coating, rippled and topped with strawberry sauce, 4 Strawberry and Vanilla Cones]	http://img.tesco.com/Groceries/pi/499/5052910707499/IDShot_90x90.jpg	Tesco Strawberry And Vanilla Cones 4 X 110Ml	1.0	70520954	0.227
87	0.297	G	240.0				1	100G	[An assortment of milk chocolates and a milk chocolate covered biscuit]	http://img.tesco.com/Groceries/pi/873/5000159457873/IDShot_90x90.jpg	Celebrations Carton 240G	2.0	75236396	0.833
88	1.04	G	600.0	False			1	100G		http://img.tesco.com/Groceries/pi/832/5010035065832/IDShot_90x90.jpg	Fox's Fabulously 600G	5.0	77427334	0.833
89	0.533	G	450.0	True			1	100G	[All butter shortbread petticoat tails., All Butter Shortbread Petticoat Tails]	http://img.tesco.com/Groceries/pi/414/5057008349414/IDShot_90x90.jpg	Tesco Scot Shortbread Petticoat Tails 450G	2.0	81639567	0.444
90	0.2	G	180.0		True	Save 89p Was £1.89 Now £1.00	1	100G	[White Chocolate Chunks Cookies, Vinnie's Quality Guarantee, A large part of my job making biscwits, is tasting biscwits. So I can personally guarantee that these biscwits are not just delicious, but have more yum per crumb in every bite. Got something to say on the matter, contact me at TalktoVinnie@foxs biscuits.co.uk]	http://img.tesco.com/Groceries/pi/807/5010035063807/IDShot_90x90.jpg	Fox's White Chocolate Chunky Cookies 180G	1.0	76968501	0.556
91	0.476	SNGL	16.0				1	EACH	[100% Whole Grain Wheat Cereal Biscuits, Reducing consumption of saturated fat contributes to the maintenance of normal blood cholesterol levels. Shredded Wheat is low in saturated fat., Shredded Wheat: 100% Whole Grain Wheat Biscuits]	http://img.tesco.com/Groceries/pi/090/7613031473090/IDShot_90x90.jpg	Nestle Shredded Wheat Cereal 360G (16S)	1.69	61708378	0.106
92	0.86	G	400.0	False			1	KG	[A Selection of Dark, Milk and White Chocolate Biscuits, www.123healthybalance.com]	http://img.tesco.com/Groceries/pi/714/5000168178714/IDShot_90x90.jpg	Mcvitie's Moments 400G	5.0	70540193	12.5
93	0.722	G	400.0	False			1	100G	[A selection of cream, chocolate and jam filled biscuits.]	http://img.tesco.com/Groceries/pi/616/5054269446616/IDShot_90x90.jpg	Tesco Teatime Assortment Tin 400G	3.0	79311548	0.75
94	0.453	G	397.0		True	Save 44p Was £1.44 Now £1.00	1	KG	[Sweetened Condensed Milk, Why not try our easy yet delicious Strawberry Cheesecake for all the family to enjoy? All you need is:, 397g Carnation Sweetened Condensed Milk, 100g butter, 200g digestive biscuits, 2 lemons, 300g of fresh strawberries, 300g full fat soft cheese, 3tbsp strawberry jam, For this plus more great recipe ideas and inspiration, visit www.carnation.co.uk]	http://img.tesco.com/Groceries/pi/720/8715000934720/IDShot_90x90.jpg	Carnation Sweetened Condensed Milk 397G	1.0	50031745	2.52
95	0.195	G	180.0	False	True	Any 2 for £1.00	1	100G	[Wafers with nut flavoured cream]	http://img.tesco.com/Groceries/pi/514/5900352002514/IDShot_90x90.jpg	Jutrzenka Familijne Hazelnut Wafers 180G	0.75	60866312	0.417
96	0.209	G	170.0	True			1	100G	[Gluten Free Breakfast Biscuit Breaks Oats & Berries, Palm Fruit Oil, This product is made with palm fruit oil from sustainable sources. For further information visit nairns oatcakes.com, Oats are naturally nutritious, high in fibre and complex carbohydrate. Health bodies, such as the NHS, say energy from oats is released slowly and helps keep you going for longer*, *To find out more, visit: nairns oatcakes.com/benefitsofoats, Come and find out more about us, our gluten free products, the benefits of oats, and some tasty gluten free recipes., www.nairns oatcakes.com/gluten free, Find us on Facebook and Twitter]	http://img.tesco.com/Groceries/pi/288/0612322000288/IDShot_90x90.jpg	Nairns Gf Oats And Berries Breakfast Biscuits 170G	2.0	81544402	1.18
97	0.019	G	17.5	False			1	100G	[Chocolate (37%) coated wafer with cocoa cream (44%)]	http://img.tesco.com/Groceries/pi/361/7622210310361/IDShot_90x90.jpg	Olza Prince Polo Bar 17.5G	0.25	70830656	1.43
98	0.352	ML	400.0		True	Half Price Was £2.00 Now £1.00	1	100ML	[Vanilla Flavour Ice Cream in a Biscuit Cone with Chocolate Flavour Coating and Crushed Chocolate Flavour Biscuits]	http://img.tesco.com/Groceries/pi/339/5010693603339/IDShot_90x90.jpg	Oreo Cones 4 X 100Ml	1.0	73532474	0.25
99	0.2	G	200.0		True	Save 59p Was £1.59 Now £1.00	1	100G	[Stem ginger cookies fully coated in Belgian dark chocolate., Finest Dark Chocolate Ginger Cookies]	http://img.tesco.com/Groceries/pi/252/5052109810252/IDShot_90x90.jpg	Tesco Finest Dark Chocolate Ginger Cookies 200G	1.0	70461574	0.5
0	0.19	SNGL	5.0				1	EACH	[Rolled Oats Baked with Crushed Hobnob Biscuit Pieces, Syrup & Butter, www.123healthybalance.com]	http://img.tesco.com/Groceries/pi/147/5000168118147/IDShot_90x90.jpg	Mcvities Original Hobnobs Flapjack 5 Pack	1.3	64251653	0.26
1	0.524	KG	0.5				1	KG	[Dark brown Soft cane sugar, Ideal for fruit cakes, puddings, biscuits and savoury sauces]	http://img.tesco.com/Groceries/pi/252/5000119113252/IDShot_90x90.jpg	Tesco Dark Soft Brown Sugar 500G	1.39	50196647	2.78
2	0.146	G	120.0				1	100G	[Banana crunch raw fruit, crunchies & nut bars, Join the Wholefood Revolution at eatnakd.com. Replace over processed foods with nourishing wholefoods and get ready to be happy. Simply Yummy, We'd love you to join us and discover the delightful world of wholefood alternatives:, Eatnakd.com, Find us on Facebook, Twitter @nakd]	http://img.tesco.com/Groceries/pi/482/5060088702482/IDShot_90x90.jpg	Nakd Banana Crunch 4X30g	2.49	76535599	2.08
3	0.25	G	200.0				1	100G	[Cookies with milk chocolate and dark chocolate chunks., A combination of milk and dark chocolate chunks in a crumbly and moreish cookie.]	http://img.tesco.com/Groceries/pi/805/5054402920805/IDShot_90x90.jpg	Tesco Chunky Chocolate 10 Cookies 200G	0.99	80051595	0.495
4	0.209	G	170.0	True			1	100G	[Gluten Free Breakfast Biscuit Breaks Oats & Apricot, Palm Fruit Oil, This product is made with palm fruit oil from sustainable sources. For further information visit nairns oatcakes.com, Oats are naturally nutritious, high in fibre and complex carbohydrate. Health bodies, such as the NHS, say energy from oats is released slowly and helps keep you going for longer*, *To find out more, visit: nairns oatcakes.com/benefitsofoats, Come and find out more about us, our gluten free products, the benefits of oats, and some tasty gluten free recipes., www.nairns oatcakes.com/gluten free, Find us on Facebook and Twitter]	http://img.tesco.com/Groceries/pi/295/0612322000295/IDShot_90x90.jpg	Nairn's Gluten Freee Oats& Apricot Breakfast Biscuits 170G	2.0	81544419	1.18
5	0.423	G	385.0				1	100G	[Golden Sponge Cake with Creamy Chocolate Flavour Filling, Facebook.com/hostess, Twitter.com/hostess_snacks]	http://img.tesco.com/Groceries/pi/417/0888109000417/IDShot_90x90.jpg	Hostess Twinkies Chocolate 10S 385G	5.5	80200834	1.43
6	0.327	ML	440.0				1	100ML	[Toffee and vanilla flavour ice creams in a biscuit cone coated with chocolate flavour coating, rippled and topped with toffee sauce, finished with toffee pieces, 4 Toffee & Vanilla Cones]	http://img.tesco.com/Groceries/pi/482/5052910707482/IDShot_90x90.jpg	Tesco Toffee And Vanilla Cones 4 X 110Ml	1.0	70521187	0.227
7	0.413	ML	480.0				1	100ML	[Vanilla Flavour Ice Cream with Crushed Chocolate Flavour Biscuits]	http://img.tesco.com/Groceries/pi/852/5010238013852/IDShot_90x90.jpg	Oreo Ice Cream 480Ml	3.0	73532526	0.625
8	0.237	G	200.0		True	Save 59p Was £1.59 Now £1.00	1	100G	[All Butter quadruple Belgian chocolate cookies half coated in milk chocolate., Our all butter cookies are wonderfully crunchy. We've used silky smooth dark, milk and white Belgian chocolate for a really intense taste, and extra Belgian chocolate pieces for a lovely chunky texture.]	http://img.tesco.com/Groceries/pi/857/5052319508857/IDShot_90x90.jpg	Tesco Finest Quadruple Chocolate Cookie 200G	1.0	57601544	0.5
9	0.25	G	200.0	True			1	100G	[Milk Chocolate Coated Biscuit Balls, www.123healthybalance.com]	http://img.tesco.com/Groceries/pi/060/5000168196060/IDShot_90x90.jpg	Mcvities Nibbles Milk Chocolate Christmas Sharing Box 200G	2.5	81829279	1.25
10	0.204	G	155.0		True	Any 2 for £2.00	1	100G		http://img.tesco.com/Groceries/pi/060/5010254018060/IDShot_90x90.jpg	Counter Market Fresh Sweet Chilli Oat Biscuits 155G	1.5	67811044	0.968
11	0.038	G	35.0	False			1	100G	[Fig & mango wholesome bar, For more information on healthy eating visit thefooddoctor.com]	http://img.tesco.com/Groceries/pi/202/5060021080202/IDShot_90x90.jpg	The Food Doctor Wholesome Fig& Mango Bar 35G	0.8	80258529	2.29
12	0.217	SNGL	6.0	False			1	EACH	[Biscuit Slices Topped with Milk Chocolate, www.123healthybalance.com]	http://img.tesco.com/Groceries/pi/406/5000168192406/IDShot_90x90.jpg	Hobnob Chocolate Slice 6 Pack	1.3	80473591	0.217
13	0.1	SNGL	1.0				1	EACH	[Shortcake sandwich biscuit with a vanilla custard flavour filling, Giant Shortcake biscuit with a vanilla flavour creamed filling   can be shared but you may not want to]	http://img.tesco.com/Groceries/pi/221/5054269154221/IDShot_90x90.jpg	Tesco Giant Custard Cream Biscuit	0.85	78922944	0.85
14	0.051	G	45.0	False			1	100G	[Wheat and oatmeal bakes with raisins]	http://img.tesco.com/Groceries/pi/024/5000127700024/IDShot_90x90.jpg	Kelloggs Nutri Grain Elevenses Bar Raisin 45G	0.6	55063618	1.34
15	0.16	G	120.0				1	KG	[Oats, wheat, barley, rye and triticale bar with dried apple, peanuts, pumpkin and sunflower seeds.]	http://img.tesco.com/Groceries/pi/976/5053827149976/IDShot_90x90.jpg	Klog 5Grainmueli Barred Apl,P/Nut &Pmpkinseed4x30g	2.59	80619944	21.59
16	0.2	G	200.0				1	100G	[Light salted savoury biscuits, Light salted savoury biscuits]	http://img.tesco.com/Groceries/pi/986/5000358493986/IDShot_90x90.jpg	Tesco Snackers 200G	0.99	51148788	0.495
17	0.063	G	48.0	False	True	Any 3 for £1.00	1	100G	[Milk Chocolate Bar with Caramel Filling (50%).]	http://img.tesco.com/Groceries/pi/302/5900102013302/IDShot_90x90.jpg	Wawel Krowkowy 48G	0.39	70812816	0.813
18	0.125	G	125.0				1	100G	[Salt & Vinegar Flavour Mini Baked Snack Biscuits]	http://img.tesco.com/Groceries/pi/616/0072417150616/IDShot_90x90.jpg	Burtons Fish And Chips 125G	1.59	75740259	1.28
19	0.375	G	400.0		True	Save 99p Was £1.99 Now £1.00	1	100G	[Chocolate flavour cookies containing chocolate chips]	http://img.tesco.com/Groceries/pi/985/0072417159985/IDShot_90x90.jpg	Maryland Cookies Double Chocolate Chip 400G	1.0	80165777	0.25
20	0.108	G	99.0				1	100G	[Coconut & Marshmallow Covered Chocolate Cake with Creamy Filling]	http://img.tesco.com/Groceries/pi/096/0888109010096/IDShot_90x90.jpg	Hostess Sno Balls 2S 99G	2.0	80200805	2.03
21	0.042	G	36.0	False	True	Any 3 for £1.00	1	100G	[Milk chocolate-coated wafer bar with hazelnut cream]	http://img.tesco.com/Groceries/pi/204/5900394006204/IDShot_90x90.jpg	Goplana Grzeski Hazelnut Wafer 36G	0.45	60864696	1.25
22	0.703	G	365.0	False			1	100G		http://img.tesco.com/Groceries/pi/856/5010035065856/IDShot_90x90.jpg	Fox's Chocolatey Tin 365G	6.0	77427426	1.65
23	0.178	G	100.0				1	KG	[Chewy popcorn bar with cranberry pieces and sunflower seeds dipped in a smooth yogurt flavour coating.]	http://img.tesco.com/Groceries/pi/263/8410076610263/IDShot_90x90.jpg	Nature Valley Popcorn Cranberry And Yoghurt 5 X 20G	2.89	79380914	28.9
24	0.222	G	180.0		True	Save 89p Was £1.89 Now £1.00	1	100G	[Dark chocolate chunk cookies, Vinnie's quality guarantee, A large part of my job making biscwits, is tasting biscwits. So I can personally guarantee that these biscwits are not just delicious, but have more yum per crumb in every bite. Got something to say on the matter, contact me at, TalktoVinnie@fox's biscuits.co.uk]	http://img.tesco.com/Groceries/pi/183/5010035062183/IDShot_90x90.jpg	Fox's Dark Chocolate Chunkie Cookies 180G	1.0	62622045	0.556
25	0.729	G	500.0	False			1	100G	[Savoury Biscuit Selection, www.123healthybalance.com]	http://img.tesco.com/Groceries/pi/895/5000168176895/IDShot_90x90.jpg	Carrs Selection Box 500G	5.0	59398757	1.0
26	0.072	G	65.0	False			1	100G	[Sesame halva vanilla flavour.]	http://img.tesco.com/Groceries/pi/415/5900278005415/IDShot_90x90.jpg	Odra Vanilla Flavoured Halva With Sesame 65G	0.55	77862083	0.846
27	0.196	SNGL	5.0	False			1	EACH	[Rolled Oats Baked with Hobnobs Biscuits Pieces, Syrup, Butter and Raspberry Flavour Fruit Pieces, www.123healthybalance.com]	http://img.tesco.com/Groceries/pi/444/5000168192444/IDShot_90x90.jpg	Hobnob Raspberry Flapjacks 5 Pack	1.3	80457294	0.26
28	0.326	ML	440.0				1	100ML	[Mint flavoured ice creams in a biscuit cone coated with chocolate flavour coating, rippled and topped with chocolate flavour sauce, finished with dark chocolate coated sugar mint pieces., 4 Mint & Chocolate Cones]	http://img.tesco.com/Groceries/pi/437/5052910707437/IDShot_90x90.jpg	Tesco Mint And Chocolate Cones 4 X 110Ml	1.0	70521066	0.227
