	AverageSellingUnitWeight	ContentsMeasureType	ContentsQuantity	IsNew	IsSpecialOffer	PromotionDescription	UnitOfSale	UnitQuantity	description	image	name	price	tpnb	unitprice
0	0.328	G	300.0		True	Half Price Was £2.59 Now £1.29	1	100G	[Cocoa Flavoured Biscuits Made with Wholegrain Cereals, Chocolate Chips and Added Vitamins and Minerals., Enjoy as part of a varied and balanced diet and healthy lifestyle., Visit www.facebook.com/BelvitaUK]	http://img.tesco.com/Groceries/pi/820/7622210189820/IDShot_90x90.jpg	Belvita Cocoa Chocolate Chip 300G	1.29	75173924	0.43
1	0.38	SNGL	18.0				1	EACH	[Milk Chocolate Digestive Bars]	http://img.tesco.com/Groceries/pi/938/5051898569938/IDShot_90x90.jpg	Tesco Everyday Value Chocolate Digestive Bars Biscuit 18 Pack	1.2	57181008	0.067
2	0.157	G	140.0		True	Save 69p Was £1.69 Now £1.00	1	100G	[Milk chocolate bar (45%) between two crisp biscuits., Bahlsen Pick Up  supports sustainable cocoa farming with UTZ certified cocoa., For more information please visit: www.utzcertified.org, Join us on: www.facebook.com/PickupUK]	http://img.tesco.com/Groceries/pi/154/4017100283154/IDShot_90x90.jpg	Bahlsen Pick Up! Biscuit 5 Pack 140G	1.0	73739311	0.714
3	0.3	G	250.0				1	100G	[Biscuits Made with Wholegrain Cereals and Coated with a Chocolate Flavour and Hazelnut Topping (25%) and Added Vitamins and Minerals., Enjoy as part of a varied and balanced diet and healthy lifestyle., Visit www.facebook.com/BelvitaUK]	http://img.tesco.com/Groceries/pi/328/7622210328328/IDShot_90x90.jpg	Belvita Tops Choco Hazelnut 250G	2.79	78055046	1.12
4	0.166	G	154.0		True	Half Price Was £1.08 Now 54p	1	100G	[Chocolate Flavour Sandwich Biscuits with a Chocolate Flavour Filling (29 %).]	http://img.tesco.com/Groceries/pi/245/7622300315245/IDShot_90x90.jpg	Oreo Chocolate Cookies 154G	0.54	64273080	0.351
5	0.093	G	157.0		True	Half Price Was £1.08 Now 54p	1	100G	[Chocolate Flavour Sandwich with a Vanilla Flavour Filling (45%).]	http://img.tesco.com/Groceries/pi/483/7622210148483/IDShot_90x90.jpg	Oreo Double Stuff 157G	0.54	67609889	0.344
6	0.329	G	280.0				1	100G	[Shortcake biscuits with a raspberry flavoured apple jam]	http://img.tesco.com/Groceries/pi/731/0072417143731/IDShot_90x90.jpg	Jammie Dodgers Twin Pack 280G	1.29	50739692	0.461
7	0.18	G	165.6			70p off selected Nestle Biscuit Bar Multipack	1	100G	[Eight bars of two crispy wafer fingers covered in cookie flavour milk (36%) and white (29%) chocolates., Check out our YouTube Channel at www.youtube.com/user/KITKAT, Join us at facebook.com/KITKATuk, Visit www.KITKAT.co.uk, Share your break with #MyBreak, Good to remember: enjoying chocolate as part of a varied, balanced diet and a healthy lifestyle, is one of life's little pleasures.]	http://img.tesco.com/Groceries/pi/502/7613035219502/IDShot_90x90.jpg	Kit Kat 2 Finger Cookies And Cream 8 Pack 166.4G	1.59	71843553	0.96
8	0.667	G	600.0				1	100G	[Crisp Biscuits, www.123healthybalance.com]	http://img.tesco.com/Groceries/pi/858/5000168124858/IDShot_90x90.jpg	Mcvities Rich Tea Twin Pack 2 X 300G	1.89	51429994	0.315
9	0.246	G	300.0				1	100G	[Ginger Nut Biscuits, Ginger Nut Biscuits]	http://img.tesco.com/Groceries/pi/830/5054402919830/IDShot_90x90.jpg	Tesco Ginger Nuts 300G	0.4	50065808	0.133
10	0.328	G	300.0		True	Half Price Was £2.59 Now £1.29	1	100G	[Biscuits Made with Wholegrain Cereals and Added Vitamins and Minerals., Enjoy as part of a varied and balanced diet and healthy lifestyle., Visit www.facebook.com/BelvitaUK]	http://img.tesco.com/Groceries/pi/993/7622300555993/IDShot_90x90.jpg	Belvita Golden Oats Biscuits 300G	1.29	67336140	0.43
11	0.349	G	300.0				1	100G	[Oaty Biscuits, www.123healthybalance.com]	http://img.tesco.com/Groceries/pi/073/5000168008073/IDShot_90x90.jpg	Mcvities Hobnob 300G	1.0	50375643	0.333
12	0.22	G	220.0				1	100G	[Chocolate Flavour Sandwich Biscuits with a Vanilla Flavour Filling (29%).]	http://img.tesco.com/Groceries/pi/502/7622210021502/IDShot_90x90.jpg	Oreo Vanilla Snack Pack 220G	1.89	71822929	0.859
13	0.256	G	220.0				1	EACH	[Biscuit filled with mallow and covered with chocolate flavoured coating.]	http://img.tesco.com/Groceries/pi/956/5010049001956/IDShot_90x90.jpg	Burtons Wagon Wheels Original Biscuit 6 Pack	0.99	50807370	0.0
14	0.208	G	165.6			70p off selected Nestle Biscuit Bar Multipack	1	100G	[Eight bars of two crispy wafer fingers covered with orange flavoured milk chocolate (66%)., Check out our YouTube Channel at www.youtube.com/user/KITKAT, Join us at facebook.com/KITKATuk, Visit www.KITKAT.co.uk, Share your break with #MyBreak, Good to remember: enjoying chocolate as part of a varied, balanced diet and a healthy lifestyle, is one of life's little pleasures.]	http://img.tesco.com/Groceries/pi/441/7613035219441/IDShot_90x90.jpg	Kit Kat 2 Finger Orange Chocolate Biscuit 8 Pack 166.4G	1.59	52427833	0.96
15	0.364	G	300.0		True	Half Price Was £2.75 Now £1.37	1	100G	[Cheese Snack Biscuits, To find out how exercise and a balanced diet can help a healthy lifestyle, visit www.123healthybalance.com]	http://img.tesco.com/Groceries/pi/092/5000168131092/IDShot_90x90.jpg	Jacobs Mini Cheddars 12X25g	1.37	51453653	0.457
16	0.299	G	253.0				1	100G	[Biscuits Made with Wholegrain Cereals with a Live Yogurt Filling (13.5%) and a Strawberry Filling (13.5%) and Added Vitamins and Minerals., Enjoy as part of a varied and balanced diet and healthy lifestyle., Visit www.facebook.com/BelvitaUK]	http://img.tesco.com/Groceries/pi/130/7622210020130/IDShot_90x90.jpg	Belvita Strawberry And Yoghurt Crunch 253G	2.79	71819139	1.11
17	0.419	G	400.0				1	100G	[Chocolate Chip Digestives]	http://img.tesco.com/Groceries/pi/483/5052003547483/IDShot_90x90.jpg	Tesco Chocolate Chip Digestive Biscuits 400G	0.6	64613715	0.15
18	0.255	G	177.5		True	Save 99p Was £1.99 Now £1.00	1	100G	[Yogurt Flavour Topping on a Light, Crispy Biscuit with a Sultana and Berry Flavoured Filling, To find out how exercise and a balanced diet can help a healthy lifestyle, visit www.123healthybalance.com, Find out more at www.goahead.co.uk]	http://img.tesco.com/Groceries/pi/578/5000168181578/IDShot_90x90.jpg	Go Ahead Forest Fruit Yoghurt Breaks Bars 5 Pack 177G	1.0	50327920	0.563
19	0.325	G	300.0				1	100G	[Digestive Biscuit half coated with Plain Chocolate.]	http://img.tesco.com/Groceries/pi/436/5052004078436/IDShot_90x90.jpg	Tesco Plain Chocolate Digestives 300G	0.6	71666486	0.2
20	0.095	G	75.0		True	Half Price Was £1.39 Now 69p	1	100G	[Biscuits coated with milk chocolate (49 %)., Find us on Facebook]	http://img.tesco.com/Groceries/pi/396/3017760363396/IDShot_90x90.jpg	Mikado Milk 75G	0.69	63761362	0.92
21	0.305	G	250.0				1	100G	[Soft baked biscuits made with wholegrain cereals and cranberries and added vitamins and minerals., Enjoy as part of a varied and balanced diet and healthy lifestyle., Visit www.facebook.com/BelvitaUK]	http://img.tesco.com/Groceries/pi/144/7622210443144/IDShot_90x90.jpg	Belvita Soft Bakes Red Berries 250G	2.79	79839189	1.12
22	0.25	G	250.0				1	100G	[Traditional Scottish Shortbread Fingers]	http://img.tesco.com/Groceries/pi/932/5018374596932/IDShot_90x90.jpg	Tesco Thick All Butter Shortbread Fingers 250G	0.79	51969711	0.316
23	0.236	G	195.0				1	100G	[Sultana and Apple Flavoured Filling in a Light Crispy Biscuit, www.goahead.co.uk, www.123healthybalance.com]	http://img.tesco.com/Groceries/pi/346/5000168182346/IDShot_90x90.jpg	Go Ahead Crispy Apple Slices 5 Pack 195G	1.69	57459332	0.867
24	0.285	G	250.0				1	100G	[The Original Caramelised Biscuit, For more information about Lotus Biscoff range, visit www.lotusbiscuits.co.uk or call freephone 0800 834050]	http://img.tesco.com/Groceries/pi/016/5410126716016/IDShot_90x90.jpg	Lotus Biscoff 250G	0.99	51976161	0.396
25	0.85	G	800.0				1	KG	[A complementary pet food for dogs, Crunchy biscuit bones which can assist in keeping teeth clean. Vitamin & mineral enriched.  Oven baked wheatmeal biscuits. Suitable for puppies and small dogs.  No artificial colours or flavours.]	http://img.tesco.com/Groceries/pi/143/5051399921143/IDShot_90x90.jpg	Tesco Small Bite Biscuit Bone Selection 800G	1.65	51341209	2.07
26	0.26	G	150.0				1	100G	[Cocoa biscuits made with wholegrain wheat flour and milk chocolate chips.]	http://img.tesco.com/Groceries/pi/027/7622210988027/IDShot_90x90.jpg	Barny Abc Bears Cocoa Biscuits 150G	1.69	81408222	1.13
27	0.785	G	800.0				1	100G	[Digestive Biscuits]	http://img.tesco.com/Groceries/pi/802/5054402921802/IDShot_90x90.jpg	Tesco Digestive Biscuits 800G	0.7	80065469	0.088
28	0.223	SNGL	6.0		True	Save 49p Was £1.49 Now £1.00	1	EACH	[Mini chocolate chip biscuits, Vinnie's Quality Guarantee, A large part of my job making biscwits, is tasting biscwits. So I can personally guarantee that these biscwits are not just delicious, but have more yum per crumb in every bite. Got something to say on the matter, contact me at, TalktoVinnie@foxs biscuits.co.uk]	http://img.tesco.com/Groceries/pi/978/5010035059978/IDShot_90x90.jpg	Fox's Mini Moos Chocolate Chip 150G 6 Pack	1.0	66379574	0.167
29	0.178	G	168.0				1	100G	[Chocolate flavoured biscuits sandwiched with a cream cheese flavour filling, A Taste of New York, Wondering why New York's the city that never sleeps?, We're pretty sure it's 'cause everyone's too busy snacking on biscwits., Give these NY inspired bad boys a taste and you'll never look back., Contact me at TalkToVinnie@foxs biscuits.co.uk]	http://img.tesco.com/Groceries/pi/061/5010035065061/IDShot_90x90.jpg	Fox's Red Velvet Crunch Creams Biscuits 168G	0.99	80066382	0.589
30	0.186	G	150.0				1	100G	[Soft cocoa sponge cake with milk flavoured filling (28 %).]	http://img.tesco.com/Groceries/pi/696/7622210126696/IDShot_90x90.jpg	Barny Milk Kids Sponge Bear 5 Pack 150G	1.69	73826012	1.13
31	0.22	G	120.0				1	100G	[Toasted rice cereal and milk bar]	http://img.tesco.com/Groceries/pi/069/5000127660069/IDShot_90x90.jpg	Kellogg's Rice Krispies Cereal Milk Bars 6X20g	1.99	55879932	1.66
32	0.256	G	177.5		True	Save 99p Was £1.99 Now £1.00	1	100G	[Yogurt Flavour Topping on a Light, Crispy Biscuit with a Sultana and Raspberry Flavoured Filling, To find out how exercise and a balanced diet can help a healthy lifestyle, visit www.123healthybalance.com, Find out more at www.goahead.co.uk]	http://img.tesco.com/Groceries/pi/677/5000168181677/IDShot_90x90.jpg	Go Ahead Raspberry Yoghurt Breaks Cereal Bars 5 Pack 177G	1.0	61498475	0.563
33	0.154	SNGL	12.0		True	2 for £1.00	1	EACH	[Soft sponge base with an orange flavoured centre half coated in plain chocolate, Sponge biscuit with orange fruit filling and dark chocolate]	http://img.tesco.com/Groceries/pi/836/5000119087836/IDShot_90x90.jpg	Tesco Jaffa Cakes 12 Pack	0.6	50203865	0.05
34	0.329	G	270.0		True	Save 79p Was £2.29 Now £1.50	1	100G	[Wheat and oatmeal bakes with raisins.]	http://img.tesco.com/Groceries/pi/787/5050083344787/IDShot_90x90.jpg	Kelloggs Breakfast Bakes Raisin 6 X 45G	1.5	54996627	0.556
35	0.319	SNGL	36.0				1	EACH	[Mini light sponge cakes with dark crackly chocolate and smashing orangey centre, www.123healthybalance.com, Join us at facebook/jaffacakes]	http://img.tesco.com/Groceries/pi/890/5000168001890/IDShot_90x90.jpg	Mcvities Mini Jaffa Cakes Portion Pack	1.69	51850943	0.047
36	0.328	G	300.0		True	Half Price Was £2.59 Now £1.29	1	100G	[Biscuits Made with Wholegrain Cereals, Fig and added Vitamins and Minerals., Enjoy as part of a varied and balanced diet and healthy lifestyle., Visit www.facebook.com/BelvitaUK]	http://img.tesco.com/Groceries/pi/601/7622300421601/IDShot_90x90.jpg	Belvita Fruit And Fibre Biscuits 300G	1.29	65631231	0.43
37	0.567	G	500.0				1	100G	[A selection of plain and savoury biscuits]	http://img.tesco.com/Groceries/pi/783/5000119767783/IDShot_90x90.jpg	Tesco Biscuits For Cheese 500G	2.99	50972656	0.598
38	0.527	SNGL	24.0				1	EACH	[Whole Wheat Cereal with Added Vitamins & Iron.]	http://img.tesco.com/Groceries/pi/016/5010029000016/IDShot_90x90.jpg	Weetabix Cereal 24 Pack	2.39	50061006	0.1
39	0.335	G	270.0		True	Save 79p Was £2.29 Now £1.50	1	100G	[Wheat and oatmeal bakes with chocolate chips]	http://img.tesco.com/Groceries/pi/756/5050083344756/IDShot_90x90.jpg	Kelloggs Breakfast Bakes Chocolate Chip 6X45g	1.5	52213654	0.556
40	0.213	G	150.0				1	100G	[Milk chocolate topped embossed mini wheatmeal biscuits, To find out how exercise and a balanced diet can help a healthy lifestyle, visit www.123healthybalance.com]	http://img.tesco.com/Groceries/pi/617/5000168132617/IDShot_90x90.jpg	Mcvities Mini Milk Chocolate Digestives 6X25g	1.69	58113538	1.13
41	0.467	G	431.0		True	Half Price Was £2.29 Now £1.14	1	100G	[Milk Chocolate Oaty, Nobbly Biscuits, www.123healthybalance.com]	http://img.tesco.com/Groceries/pi/713/5000168188713/IDShot_90x90.jpg	Mcvities Chocolate Hobnobs 431G	1.14	79552717	0.265
42	0.125	G	125.0		True	Save 49p Was £1.49 Now £1.00	1	100G	[Butter biscuits set in milk chocolate (63%)., Find us on Facebook:, www.facebook.com/bahlsenbiscuits, Find out more of our history at www.bahlsen.co.uk]	http://img.tesco.com/Groceries/pi/239/4017100209239/IDShot_90x90.jpg	Bahlsen Milk Choco Leibniz 125G	1.0	51486297	0.8
43	0.219	G	175.0				1	100G	[Dark Chocolate Gingers, We are happy to declare that the palm oil contained within the ingredients we buy is certified as sustainable., Find us on Facebook and Twitter]	http://img.tesco.com/Groceries/pi/104/0652655000104/IDShot_90x90.jpg	Border Biscuits Dark Chocolate Gingers 175G	1.49	54749178	0.851
44	0.328	G	300.0		True	Half Price Was £2.59 Now £1.29	1	100G	[Biscuits Made with Wholegrain Cereals, Forest Fruits and Added Vitamins., Enjoy as part of a varied and balanced diet and healthy lifestyle., Visit www.facebook.com/BelvitaUK]	http://img.tesco.com/Groceries/pi/267/7622300715267/IDShot_90x90.jpg	Belvita Forest Fruits Biscuits 300G	1.29	71040685	0.43
45	0.15	G	200.0				1	100G	[Shortcake biscuits with currants, www.123healthybalance.com]	http://img.tesco.com/Groceries/pi/621/5000168104621/IDShot_90x90.jpg	Mcvities Fruit Shortcake 200G	1.0	67576356	0.5
46	0.362	G	300.0				1	100G	[Biscuits made with wholegrain cereals and chocolate and added vitamins., Enjoy as part of a varied and balanced diet and healthy lifestyle, Visit www.facebook.com/BelvitaUK]	http://img.tesco.com/Groceries/pi/281/7622210328281/IDShot_90x90.jpg	Belvita Crunchy Chocolate Chips 300G	2.79	77618344	0.93
47	0.305	G	250.0				1	100G	[Soft baked biscuits made with wholegrain cereals and added vitamins and minerals., Enjoy as part of a varied and balanced diet and healthy lifestyle., Visit www.facebook.com/BelvitaUK]	http://img.tesco.com/Groceries/pi/083/7622210443083/IDShot_90x90.jpg	Belvita Soft Bakes Golden Grain 250G	2.79	79839270	1.12
48	0.267	G	210.0		True	Half Price Was £1.99 Now 99p	1	100G	[Cereal (40%) and Milk Chocolate Chip (5%) Bar Half Covered with Milk Chocolate (22%)]	http://img.tesco.com/Groceries/pi/718/7622210149718/IDShot_90x90.jpg	Cadbury Brunch Chocolate Chip 6 X 32G	0.99	61322367	0.471
49	0.89	KG	0.8				1	KG	[A complementary pet food for adult dogs, Please visit the Winalot website www.winalot dog.co.uk]	http://img.tesco.com/Groceries/pi/232/5000161004232/IDShot_90x90.jpg	Winalot Shapes 800G	1.65	50096040	2.07
50	0.22	G	168.0				1	100G	[Ginger biscuits sandwiched with a ginger flavour cream, Vinnie's Quality Guarantee, A large part of my job making biscwits, is tasting biscwits. So I can personally guarantee that these biscwits are not just delicious, but have more yum per crumb in every bite., Got something to say on the matter, contact me at TalktoVinnie@foxs biscuits.co.uk]	http://img.tesco.com/Groceries/pi/452/5010035061452/IDShot_90x90.jpg	Foxs Ginger Crunch Creams 168G	0.99	50754333	0.589
51	0.194	G	125.0				1	100G	[Milk chocolate topped biscuits, To find out how exercise and a balanced diet can help a healthy lifestyle, visit www.123healthybalance.com]	http://img.tesco.com/Groceries/pi/541/5000168141541/IDShot_90x90.jpg	Mcvities Chocolate Gems 5 X 25G	1.69	61550119	1.36
52	0.163	G	140.0				1	100G	[2 Shortcake biscuits with a raspberry flavour jam filling]	http://img.tesco.com/Groceries/pi/365/5051277474365/IDShot_90x90.jpg	Tesco Jammy Rings 140G	0.4	60159016	0.286
53	0.262	G	200.0				1	100G	[Stem Ginger Oat Biscuits, Find us on Facebook and Twitter, Our product contains sustainable palm fruit oil. For more information please visit our website.]	http://img.tesco.com/Groceries/pi/047/0061232201047/IDShot_90x90.jpg	Nairns Stem Ginger Oat Biscuit 200G (L)	1.35	50250134	0.675
54	0.343	G	308.0				1	100G	[Chocolate Flavour Sandwich Biscuits with a Vanilla Flavour Filling (29%)]	http://img.tesco.com/Groceries/pi/269/7622300315269/IDShot_90x90.jpg	Oreo Vanilla 2 X 154G	1.85	71275286	0.601
55	0.36	G	300.0				1	100G	[Shortcake biscuits sandwiched with vanilla flavour cream and raspberry jam., Vinnie's Quality Guarantee, A large part of my job making biscuits, is tasting biscuits., So I can personally guarantee that these biscuits are not just delicious, but you have more yum per crumb in every bite., Get something to say on the matter, contact me at TalktoVinnie@foxs biscuits.co.uk]	http://img.tesco.com/Groceries/pi/356/5010035060356/IDShot_90x90.jpg	Foxs Jam Sandwich Creams Biscuits Twin Pack 2X150g	1.0	67986280	0.333
56	0.16	G	150.0				1	100G	[Cheddar Cheese Biscuits, www.123healthybalance.com]	http://img.tesco.com/Groceries/pi/101/0000050168101/IDShot_90x90.jpg	Jacobs Baked Cheddar Biscuits Cheese 150G	1.29	50069770	0.86
57	0.27	G	200.0		True	Half Price Was £1.99 Now 99p	1	100G	[Cereal (34%) and Raisin (9%) Bar Half Covered with Milk Chocolate (22%)]	http://img.tesco.com/Groceries/pi/688/7622210149688/IDShot_90x90.jpg	Cadbury's Brunch Bars Raisin 6X32g	0.99	55885803	0.495
58	0.248	G	200.0				1	100G	[Dark Chocolate Chip Oat Biscuits, For further information please visit our website., Find us on Facebook and Twitter]	http://img.tesco.com/Groceries/pi/556/0061232202556/IDShot_90x90.jpg	Nairns Dark Chocolate Oat Biscuits 200G	1.35	66803925	0.675
59	0.178	G	125.0		True	Any 2 for £3.00	1	100G	[Chocolate flavoured filling in biscuit topped with a vanilla flavour drizzle.]	http://img.tesco.com/Groceries/pi/265/5050083767265/IDShot_90x90.jpg	Kelloggs Special Biscuit Moments Chocolate 125G	1.99	73134519	1.6
60	0.139	G	120.0				1	100G	[Chocolate flavour toasted rice cereal and milk bar]	http://img.tesco.com/Groceries/pi/064/5000127780064/IDShot_90x90.jpg	Kelloggs Coco Pops Cereal Bar 6 X 20G	1.99	54298273	1.66
61	0.16	G	132.0				1	100G	[Half Coated Milk Chocolate Digestive Biscuits, Visit us:, weightwatchersfoods.co.uk, weloveweightwatchersfoods.co.uk, For great free recipe ideas, money off coupons and information about new products in our range., weightwatchers.co.uk, Our food range is just part of what we have to offer. We also run thousands of friendly meetings across the UK each week, or you can follow our plan step by step completely online., For more information, call 03456092462.]	http://img.tesco.com/Groceries/pi/105/0039047146105/IDShot_90x90.jpg	Weight Watchers Milk Chocolate Digestive Biscuit 132G	1.48	71980666	1.13
62	0.098	G	92.0				1	100G	[Milk Chocolate Coated Caramel Wafer Bars, Visit us:, weightwatchersfoods.co.uk, weloveweightwatchersfoods.co.uk, For great free recipe ideas, money off coupons and information about new products in our range., weightwatchers.co.uk, Our food range is just part of what we have to offer. We also run thousands of friendly meetings across the UK each week, or you can follow our plan step by step completely online., For more information, call 03456092462.]	http://img.tesco.com/Groceries/pi/764/0039047145764/IDShot_90x90.jpg	Weight Watchers Caramel Wafers 5X18.4G	1.48	62537751	1.61
63	0.313	G	262.0		True	Half Price Was £1.50 Now 75p	1	100G	[Plain chocolate oaty, nobbly biscuits, www.123healthybalance.com]	http://img.tesco.com/Groceries/pi/819/5000168176819/IDShot_90x90.jpg	Mcvities Dark Chocolate Hobnob 262G	0.75	62397875	0.286
64	0.225	G	180.0		True	Any 2 for £2.00	1	100G	[Biscuits made with cereals and chocolate chips.]	http://img.tesco.com/Groceries/pi/822/5054402552822/IDShot_90x90.jpg	Tesco Mini Chocolate Breakfast Biscuit 180G	1.19	78239365	0.661
65	0.302	G	228.0		True	Half Price Was £2.49 Now £1.24	1	100G	[Crisp Biscuits Covered with Cadbury Milk Chocolate.]	http://img.tesco.com/Groceries/pi/152/0072417159152/IDShot_90x90.jpg	Cadbury Milk Chocolate Fingers 2 X 114G	1.24	80012052	0.544
66	0.208	G	150.0				1	100G	[Biscuit & Cereal Bars with Caramel and Milk Chocolate, www.123healthybalance.com]	http://img.tesco.com/Groceries/pi/904/5000168188904/IDShot_90x90.jpg	Mcvities Medley Digestive Caramel And Milk Chocolate 5X30g	1.6	70555792	1.07
67	0.146	G	125.0				1	100G	[Butter Biscuits in Milk Chocolate]	http://img.tesco.com/Groceries/pi/495/5051277445495/IDShot_90x90.jpg	Tesco Milk Chocolate Butter Biscuits125g	0.87	60129892	0.696
68	0.236	G	218.0				1	100G	[Sultana and Raspberry Flavoured Filling in a Light Crispy Biscuit, www.goahead.co.uk, www.123healthybalance.com]	http://img.tesco.com/Groceries/pi/407/5000168182407/IDShot_90x90.jpg	Go Ahead Crispy Fruit Slices Raspberry 5 Pack 218G	1.69	64252370	0.775
69	0.15	G	150.0				1	100G	[Soft sponge cake with apple-strawberry filling (28 %).]	http://img.tesco.com/Groceries/pi/660/7622210233660/IDShot_90x90.jpg	Barny Strawberry Sponge Bears 5 Pack 150G	1.69	75742113	1.13
70	0.171	G	154.0		True	Half Price Was £1.08 Now 54p	1	100G	[Sandwich Biscuits with a Vanilla Flavour Filling (29%).]	http://img.tesco.com/Groceries/pi/729/7622210464729/IDShot_90x90.jpg	Oreo Golden 154G	0.54	79839984	0.351
71	0.433	G	360.0		True	Save £1.00 Was £3.00 Now £2.00	1	100G	[An Assortment of plain, creams, chocolate and jam biscuits, www.123healthybalance.com]	http://img.tesco.com/Groceries/pi/420/5000168189420/IDShot_90x90.jpg	Mcvities Family Circle Biscuits 360G	2.0	76969454	0.556
72	0.379	G	275.0				1	100G	[Sweet biscuit selection, www.123healthybalance.com]	http://img.tesco.com/Groceries/pi/431/5000168165431/IDShot_90x90.jpg	Crawfords Teatime Assortment Biscuits 275G	1.0	50067737	0.364
73	0.32	G	222.0		True	Save 49p Was £1.99 Now £1.50	1	100G	[A soft golden baked crust made with wholewheat, wheat, wholegrain oats, barley and a strawberry filling.]	http://img.tesco.com/Groceries/pi/787/5050083542787/IDShot_90x90.jpg	Kelloggs Nutrigrain Strawberry 6X37g	1.5	52820528	0.676
74	0.113	G	90.0	False			1	100G	[Milk Chocolate Coated Biscuits, About Weight Watchers®, Our food range is just part of what we have to offer. We also run thousands of friendly meetings across the UK each week, or you can follow our plan step by step completely online., For more information, call 08457 123 000 or visit weightwatchers.co.uk, Be Inspired, For great free recipe ideas, money off coupons and information about new products in our range, visit weloveweightwatchersfoods.co.uk, Useful tip #40, Too shy for the gym?, Get an exercise DVD and you won't need to leave the house]	http://img.tesco.com/Groceries/pi/757/0039047145757/IDShot_90x90.jpg	Weight Watchers Chocolate Biscuits 5 Pack 90G	1.48	63783981	1.65
75	0.196	G	125.0		True	Any 2 for £3.00	1	100G	[Blueberry flavoured filling in a biscuit topped with vanilla flavour drizzle.]	http://img.tesco.com/Groceries/pi/129/5050083731129/IDShot_90x90.jpg	Kelloggs Special K Biscuit Moments Blueberry 125G	1.99	72033911	1.6
76	0.163	G	144.0				1	100G	[Crispy Grains of Toasted Rice Cereal and Milk Chocolate Chunks with a Chocolate Flavour Coating.]	http://img.tesco.com/Groceries/pi/048/5050083449048/IDShot_90x90.jpg	Kelloggs Rice Krispie Squares Chocolatley4x36g	1.99	63888346	1.39
77	0.125	G	125.0		True	Save 49p Was £1.49 Now £1.00	1	100G	[Butter biscuits set in dark chocolate (63%)., Find us on Facebook:, www.facebook.com/bahlsenbiscuits, To find out more visit www.bahlsen.co.uk]	http://img.tesco.com/Groceries/pi/237/4017100287237/IDShot_90x90.jpg	Bahlsen Dark Choco Leibniz 125G	1.0	50362860	0.8
78	0.256	G	177.5		True	Save 99p Was £1.99 Now £1.00	1	100G	[Yogurt Flavour Topping on a Light, Crispy Biscuit with a Sultana & Strawberry Flavoured Filling, To find out how exercise and a balanced diet can help a healthy lifestyle, visit www.123healthybalance.com, Find out more at www.goahead.co.uk]	http://img.tesco.com/Groceries/pi/639/5000168181639/IDShot_90x90.jpg	Go Ahead Strawberry Yoghurt Breaks Cereal Bars 5 Pack 177G	1.0	63672703	0.563
79	0.222	G	156.0		True	Save 99p Was £1.99 Now £1.00	1	100G	[Cereal bar with chewy oats, roasted peanuts and chocolate chips (6.2%)]	http://img.tesco.com/Groceries/pi/305/5000159468305/IDShot_90x90.jpg	Tracker Chocolate Chip 6 Pack 156G	1.0	73826421	0.641
80	0.459	G	400.0				1	100G	[A Selection of Plain, Filled and Chocolate Coated Biscuits., A Selection of Plain, Filled and Chocolate Coated Biscuits.]	http://img.tesco.com/Groceries/pi/822/5052910721822/IDShot_90x90.jpg	Tesco Sweet Biscuit Assortment 400G	1.99	73385129	0.498
81	0.223	G	200.0				1	100G	[Wheatmeal and Oat Biscuits with Sultanas and Apple Flavoured Filling and Added Vitamins and Iron, www.123healthybalance.com]	http://img.tesco.com/Groceries/pi/651/5000168185651/IDShot_90x90.jpg	Mcvities Breakfast Fruit And Oat Bakes Apple 5 Pack 200G	1.99	79677374	0.995
82	0.135	G	110.0				1	100G	[Mallow covered with chocolate flavoured coating and desiccated coconut]	http://img.tesco.com/Groceries/pi/280/5010082132280/IDShot_90x90.jpg	Lees 6 Snowballs 110G	0.59	71763866	0.536
83	0.317	G	248.0				1	100G	[Oaty Biscuits with Golden Syrup and Added Vitamins and Iron, To find out how exercise and a balanced diet can help a healthy lifestyle, visit www.123healthybalance.com, Visit us at: www.mcvities.co.uk]	http://img.tesco.com/Groceries/pi/672/5000168186672/IDShot_90x90.jpg	Mcvities Breakfast Oaty Breaks Golden Syrup 6 Pack 248G	1.99	79677408	0.802
