	AverageSellingUnitWeight	ContentsMeasureType	ContentsQuantity	IsNew	IsSpecialOffer	PromotionDescription	UnitOfSale	UnitQuantity	description	image	name	price	tpnb	unitprice
63	0.374	G	340.0	False			1	100G	[Sugar Frosted Corn Puff Cereal with Cocoa & Marshmallows, Helping Families in Need, We were taught that helping others is the right thing to do. Through our Million Bowls® program, we partner with hunger relief agencies to provide nutritious breakfasts to families in need. Learn more at: mombrands.com/our values., See how our mission continually helps your family save money at mombrands.com/our values.]	http://img.tesco.com/Groceries/pi/634/0042400236634/IDShot_90x90.jpg	Malt-O-Meal Marshmallow Mateys Chocolate Flavoured 340G	3.0	80222318	0.882
64	0.36	G	300.0				1	100G	[Shortcake biscuits sandwiched with vanilla flavour cream and raspberry jam., Vinnie's Quality Guarantee, A large part of my job making biscuits, is tasting biscuits., So I can personally guarantee that these biscuits are not just delicious, but you have more yum per crumb in every bite., Get something to say on the matter, contact me at TalktoVinnie@foxs biscuits.co.uk]	http://img.tesco.com/Groceries/pi/356/5010035060356/IDShot_90x90.jpg	Foxs Jam Sandwich Creams Biscuits Twin Pack 2X150g	1.0	67986280	0.333
65	0.237	G	200.0		True	Save 59p Was £1.59 Now £1.00	1	100G	[All Butter quadruple Belgian chocolate cookies half coated in milk chocolate., Our all butter cookies are wonderfully crunchy. We've used silky smooth dark, milk and white Belgian chocolate for a really intense taste, and extra Belgian chocolate pieces for a lovely chunky texture.]	http://img.tesco.com/Groceries/pi/857/5052319508857/IDShot_90x90.jpg	Tesco Finest Quadruple Chocolate Cookie 200G	1.0	57601544	0.5
66	0.248	G	200.0				1	100G	[Dark Chocolate Chip Oat Biscuits, For further information please visit our website., Find us on Facebook and Twitter]	http://img.tesco.com/Groceries/pi/556/0061232202556/IDShot_90x90.jpg	Nairns Dark Chocolate Oat Biscuits 200G	1.35	66803925	0.675
67	0.785	G	800.0				1	100G	[Digestive Biscuits]	http://img.tesco.com/Groceries/pi/802/5054402921802/IDShot_90x90.jpg	Tesco Digestive Biscuits 800G	0.7	80065469	0.088
68	0.482	G	397.0		True	Any 2 for £4.00	1	100G	[Golden Syrup Flavour Microwaveable Oats, Throughout our long term partnership with the charity Magic Breakfast, we have helped deliver free porridge to those children arriving at school who might otherwise be too hungry to learn. ***, You can support too at: www.magicbreakfast.com, Magic breakfast, fuel for learning, *** Every day in the UK Quaker makes 16,000 breakfasts available for children at schools in the greatest need., Enjoy as part of a varied and balanced diet and healthy lifestyle. Oat beta glucan has been shown to lower blood cholesterol. High cholesterol is a risk factor in the development of coronary heart disease. Coronary heart disease has multiple risk factors and altering one of these risk factors may or may not have a beneficial effect., For further information on cooking instructions and microwave settings, please visit our website. www.quaker.co.uk, For topping and recipe ideas visit @Quakeroatsuk on Instagram]	http://img.tesco.com/Groceries/pi/226/5000108468226/IDShot_90x90.jpg	Quaker Oats Big Bowl Golden Syrup 397G	2.45	72675934	0.617
69	175.0	G	125.0				1	100G	[Very Berry Fruit & Oat Bites with freeze dried Strawberries, Raspberries and other dried fruits., Find us on facebook and twitter]	http://img.tesco.com/Groceries/pi/565/5060145254565/IDShot_90x90.jpg	Harvest Chewee Fruit&Oat Bites Very Berry 125G	1.69	79996088	1.36
70	0.525	G	450.0	False	True	Save £1.00 Was £2.99 Now £1.99	1	100G	[Nuts and seeds with toasted oats and honey.]	http://img.tesco.com/Groceries/pi/233/5013803000233/IDShot_90x90.jpg	Eat Natural Breakfast Plus Benefit Honey 450G	1.99	81672653	0.442
71	0.187	G	138.0				1	100G	[Crisp Biscuits Covered with White Chocolate., Did you know that Cadbury fingers are great to dunk?, Do you bite off one end & dunk slowly? Or are you a dunk in one kind of person? #Freethejoy]	http://img.tesco.com/Groceries/pi/145/0072417159145/IDShot_90x90.jpg	Cadbury Fingers White Chocolate 138G	1.55	80930085	1.13
72	0.458	G	416.0		True	Save 50p Was £3.50 Now £3.00	1	100G	[Pop Tarts Frosted Raspberry, Visit us at poptarts.com]	http://img.tesco.com/Groceries/pi/104/0038000316104/IDShot_90x90.jpg	Kelloggs Pop Tarts Frosted Raspberry 416G	3.0	77965710	0.721
73	0.459	G	400.0				1	100G	[A Selection of Plain, Filled and Chocolate Coated Biscuits., A Selection of Plain, Filled and Chocolate Coated Biscuits.]	http://img.tesco.com/Groceries/pi/822/5052910721822/IDShot_90x90.jpg	Tesco Sweet Biscuit Assortment 400G	1.99	73385129	0.498
74	0.146	G	120.0				1	KG	[Banana Bread raw fruit, oat & nut bars, Join the Wholefood Revolution at eatnakd.com. Replace over processed foods with nourishing wholefoods and get ready to be happy. Simply Yummy, We'd love you to join us and discover the delightful world of wholefood alternatives:, Eatnakd.com, Find us on Facebook, Twitter @nakd]	http://img.tesco.com/Groceries/pi/720/5060088701720/IDShot_90x90.jpg	Nakd Banana Bread Bar 120G	2.49	70627650	20.75
75	0.83	G	700.0	False			1	100G	[Mixed Cereal with Wholegrain Flakes, Sultanas, Cranberry, Dates, Apricot and Sunflower Seeds.]	http://img.tesco.com/Groceries/pi/414/5053827160414/IDShot_90x90.jpg	Kelloggs Muesli Fruit 700G	2.99	81493482	0.427
76	0.375	G	400.0		True	Save 99p Was £1.99 Now £1.00	1	100G	[Chocolate flavour cookies containing chocolate chips]	http://img.tesco.com/Groceries/pi/985/0072417159985/IDShot_90x90.jpg	Maryland Cookies Double Chocolate Chip 400G	1.0	80165777	0.25
77	0.35	G	300.0				1	100G	[Oaty Biscuits with Chocolate Chips, www.123healthybalance.com]	http://img.tesco.com/Groceries/pi/000/5000168176000/IDShot_90x90.jpg	Mcvitie's Hobnob Chocolate Chip 300G	1.0	73805325	0.333
78	0.208	G	165.0				1	100G	[All butter Scottish shortbread fingers, Our classic shortbread fingers come from a small, second generation family bakery in Aberdeenshire. They use a traditional all butter recipe, tray bake them from a beautiful melt in the mouth texture and 'dock' them by hand for a traditional finish.]	http://img.tesco.com/Groceries/pi/458/5010204049458/IDShot_90x90.jpg	Tesco Finest Shortbread Fingers 165G	1.29	57928486	0.782
79	0.37	G	336.0				1	100G	[Oat biscuits sandwiched with a vanilla flavour cream, Vinnie's Quality Guarantee, A large part of my job making biscwits, is tasting biscwits. So I can personally guarantee that these biscwits are not just delicious, but have more yum per crumb in every bite. Got something to say on the matter, contact me at TalktoVinnie@foxs biscuits.co.uk]	http://img.tesco.com/Groceries/pi/391/5010035061391/IDShot_90x90.jpg	Foxs Golden Crunch Creams Big Value Twin Pack 336G	1.0	67986579	0.298
80	0.173	G	114.0	True			1	KG	[Ginger Cookies Containing Crystallised Stem Ginger and Lemon Peel, Visit us:, weightwatchersfoods.co.uk, weloveweightwatchersfoods.co.uk, For great free recipe ideas, money off coupons and information about new products in our range., weightwatchers.co.uk, Our food range is just part of what we have to offer. We also run thousand of friendly meetings across the UK each week, or you can follow our plan step by step completely online., For more information, call 03456092462.]	http://img.tesco.com/Groceries/pi/400/0039047153400/IDShot_90x90.jpg	Weight Watchers Ginger And Lemon Cookies 10X114g	0.85	73318544	7.46
81	0.222	G	180.0		True	Save 89p Was £1.89 Now £1.00	1	100G	[Dark chocolate chunk cookies, Vinnie's quality guarantee, A large part of my job making biscwits, is tasting biscwits. So I can personally guarantee that these biscwits are not just delicious, but have more yum per crumb in every bite. Got something to say on the matter, contact me at, TalktoVinnie@fox's biscuits.co.uk]	http://img.tesco.com/Groceries/pi/183/5010035062183/IDShot_90x90.jpg	Fox's Dark Chocolate Chunkie Cookies 180G	1.0	62622045	0.556
82	0.2	G	180.0		True	Save 98p Was £1.98 Now £1.00	1	100G	[Orange Flavoured Cookies Baked with Milk and Dark Chocolate Chunks., Vinnie's Quality Guarantee, A large part of my job making biscwits, is tasting biscwits. So I can personally guarantee that these biscwits are not just delicious, but have more yum per crumb in every bite. Got something to say on the matter, contact me at TalktoVinnie@foxs biscuits.co.uk]	http://img.tesco.com/Groceries/pi/825/5010035065825/IDShot_90x90.jpg	Fox's Chunkie Orange Biscuits 180G	1.0	81067811	0.556
83	0.213	G	95.0	False			1	100G	[Mini Cookies Containing Dark Chocolate Chips, Visit us:, weightwatchersfoods.co.uk, weloveweightwatchersfoods.co.uk, For great free recipe ideas, money off coupons and information about new products in our range., weightwatchers.co.uk, Our food range is just part of what we have to offer. We also run thousands of friendly meetings across the UK each week, or you can follow our plan step by step completely online. For more information, call 03456092462.]	http://img.tesco.com/Groceries/pi/509/0039047153509/IDShot_90x90.jpg	Weight Watchers Chocolate Chip Cookies 5 Pack 95G	1.48	65627882	1.56
84	0.273	ML	250.0	False			1	100ML	[Strawberry Flavour Breakfast Drink, Fortified with vitamins & minerals (UHT), Facebook/upandgouk, Twitter@upandgouk]	http://img.tesco.com/Groceries/pi/018/5060406460018/IDShot_90x90.jpg	Up And Go Breakfast Strawberry 250Ml	1.39	79649270	0.556
85	0.448	G	385.0	False	True	Any 2 for £4.00	1	100G	[Berry Flavour Microwaveable Oats with Sultanas, Raisins, Cranberry & Apple, Caring for those who need it most, In partnership with the charity Magic Breakfast to provide free porridge to children in the primary schools in greatest need^. www.magicbreakfast.com, Magic breakfast, fuel for learning, ^Quaker makes 16,000 breakfasts available every day to children in the primary schools in greatest need., Enjoy as part of a varied and balanced diet and a healthy lifestyle. Oat beta glucan has been shown to lower blood cholesterol. High cholesterol is a risk factor in the development of coronary heart disease. Coronary heart disease has multiple risk factors and altering one of these risk factors may or may not have a beneficial effect., For further information on cooking instructions and microwave settings, please visit our website: www.quaker.co.uk, Did you know you can use the sachet to measure the milk?]	http://img.tesco.com/Groceries/pi/591/5000108030591/IDShot_90x90.jpg	Quaker Oat So Simple Sultana Raisin Cranberry 10X38.5G	2.45	62710880	0.636
86	0.218	G	180.0		True	Save 79p Was £1.79 Now £1.00	1	100G	[Cookies containing milk chocolate chunks and dark chocolate chunks.]	http://img.tesco.com/Groceries/pi/707/0072417160707/IDShot_90x90.jpg	Maryland Big And Chunky, Milk And Dark Chocolate 180G	1.0	81067707	0.556
87	0.171	G	154.0		True	Half Price Was £1.08 Now 54p	1	100G	[Cocoa Flavoured Sandwich Biscuits with a Peanut Butter Flavour Filling (29%).]	http://img.tesco.com/Groceries/pi/627/7622210449627/IDShot_90x90.jpg	Oreo Peanut Butter 154G	0.54	79839914	0.351
88	0.173	G	114.0	True			1	100G	[Oat Digestive Biscuits, Visit us:, weightwatchersfoods.co.uk, weloveweightwatchersfoods.co.uk, For great free recipes ideas, money off coupons and information about new products in our range., weightwatchers.co.uk, Our food range is just part of what we have to offer. We also run thousands of friendly meetings across the UK each week, or you can follow our plant step by step completely online., For more information, call 03456092462.]	http://img.tesco.com/Groceries/pi/455/0039047153455/IDShot_90x90.jpg	Weight Watchers Oat Digestive Biscuits 114G	0.85	81930803	0.746
89	0.83	G	700.0	True			1	100G	[Mixed cereal with wholegrain flakes, raisins, cashews and almond]	http://img.tesco.com/Groceries/pi/384/5053827160384/IDShot_90x90.jpg	Kelloggs Muesli Nut 700G	2.99	81493450	0.427
90	1.668	G	650.0	True	True	Save 69p Was £2.69 Now £2.00	1	100G	[Muesli with Freeze dried strawberries, nuts and sunflower seeds, Enjoy as part of a varied and balanced diet and a healthy lifestyle. Oat beta glucan has been shown to lower blood cholesterol. High cholesterol is a risk factor in the development of coronary heart disease. Coronary heart disease has multiple risk factors and altering one of these risk factors may or may not have a beneficial effect.]	http://img.tesco.com/Groceries/pi/490/5000108612490/IDShot_90x90.jpg	Quaker Oat Strawberry Muesli No Added Sugar 650G	2.0	81465213	0.308
91	0.146	G	120.0				1	KG	[Berry Cheeky flavour raw fruit, oat & nut bars, Join the Wholefood Revolution at eatnakd.com. Replace over processed foods with nourishing wholefoods and get ready to be happy. Simply Yummy, We'd love you to join us and discover the delightful world of wholefood alternatives:, Eatnakd.com, Find us on Facebook, Twitter @nakd]	http://img.tesco.com/Groceries/pi/737/5060088701737/IDShot_90x90.jpg	Nakd Berry Cheeky Bar 120G	2.49	70627667	20.75
92	0.217	G	200.0				1	100G	[Sun Drenched Figs Baked in Golden Pastry, For more information visit: www.valeofoods.com]	http://img.tesco.com/Groceries/pi/365/0074448403365/IDShot_90x90.jpg	Bolands Fig Rolls 200G	0.85	71006560	0.425
93	0.458	G	416.0		True	Save 50p Was £3.50 Now £3.00	1	100G	[Toaster Pastries with Blueberry Fruit Filling]	http://img.tesco.com/Groceries/pi/102/0038000310102/IDShot_90x90.jpg	Kelloggs Pop Tarts Frosted Blueberry 416G	3.0	71888943	0.721
94	0.273	ML	250.0				1	100ML	[Vanilla Flavour Breakfast Drink, Fortified with vitamins & minerals (UHT), Facebook/upandgouk, Twitter@upandgouk]	http://img.tesco.com/Groceries/pi/001/5060406460001/IDShot_90x90.jpg	Up&Go Vanilla Breakfast 250Ml	1.39	78595086	0.556
95	0.083	G	400.0	True	True	Save 99p Was £2.99 Now £2.00	1	100G	[Crunchy Muesli with Mixed Fruit Pieces]	http://img.tesco.com/Groceries/pi/812/5060201621812/IDShot_90x90.jpg	Fuel Loaded Fruit 400G	2.0	70753799	0.5
96	0.113	G	90.0	False			1	100G	[Milk Chocolate Coated Biscuits, About Weight Watchers®, Our food range is just part of what we have to offer. We also run thousands of friendly meetings across the UK each week, or you can follow our plan step by step completely online., For more information, call 08457 123 000 or visit weightwatchers.co.uk, Be Inspired, For great free recipe ideas, money off coupons and information about new products in our range, visit weloveweightwatchersfoods.co.uk, Useful tip #40, Too shy for the gym?, Get an exercise DVD and you won't need to leave the house]	http://img.tesco.com/Groceries/pi/757/0039047145757/IDShot_90x90.jpg	Weight Watchers Chocolate Biscuits 5 Pack 90G	1.48	63783981	1.65
97	0.233	G	200.0		True	Save 59p Was £1.59 Now £1.00	1	100G	[All butter cookies with sultanas, coconut, apricots, hazelnuts, sunflower seeds and pumpkin seeds., Finest Fruity Flapjack Cookies]	http://img.tesco.com/Groceries/pi/276/5052109810276/IDShot_90x90.jpg	Tesco Finest Fruity Flapjack Cookies 200G	1.0	70461643	0.5
98	0.539	G	500.0				1	100G	[Cookies with chocolate chips, Cookies with chocolate chips]	http://img.tesco.com/Groceries/pi/973/5054402920973/IDShot_90x90.jpg	Tesco Chocolate Chip Cookie 2 X 250G	1.0	80052225	0.2
99	0.146	G	120.0				1	100G	[Apple Pie, raw fruit, oat & nut bars, Join the Wholefood Revolution at eatnakd.com. Replace over processed foods with nourishing wholefoods and get ready to be happy. Simply Yummy, We'd love you to join us and discover the delightful world of wholefood alternatives:, Eatnakd.com, Find us on Facebook, Twitter @nakd]	http://img.tesco.com/Groceries/pi/713/5060088701713/IDShot_90x90.jpg	Nakd Apple Pie Bars Multi-Pack 120G	2.49	70627638	2.08
0	0.095	G	53.0	False	True	Any 5 for £4.00	1	100G	[Strawberry Jam Flavour Hot Oat Cereal.]	http://img.tesco.com/Groceries/pi/979/5000108281979/IDShot_90x90.jpg	Quaker Oat So Simple Strawberry Jam Pot Porridge 53G	0.99	77576738	1.87
1	0.452	G	390.0				1	100G	[Golden syrup flavour oat flakes, Oatflakes with golden syrup flavour. Made with Scottish Oats]	http://img.tesco.com/Groceries/pi/346/5054268892346/IDShot_90x90.jpg	Tesco Easy Oats Golden Syrup 390G	0.99	50210234	0.254
2	0.225	G	200.0				1	100G	[All butter cookies with sultanas and oats., All butter cookies with sultanas and oats.]	http://img.tesco.com/Groceries/pi/560/5054402920560/IDShot_90x90.jpg	T.Sultana And Oat Cookies 200G	0.99	80033565	0.495
3	0.066	G	51.0	False	True	Half Price Was £1.39 Now 69p	1	100G	[Biscuit partially covered with chocolate couverture (72,7%).]	http://img.tesco.com/Groceries/pi/673/7622210989673/IDShot_90x90.jpg	Mikado Tender Chocolate 51G	0.69	81685822	1.36
4	0.15	G	125.0				1	100G	[All Butter Shortbread Fingers]	http://img.tesco.com/Groceries/pi/644/0655762001644/IDShot_90x90.jpg	Deans All Butter Shortbread Fingers 125G	1.0	63745163	0.8
5	0.333	G	295.0				1	100G	[Chocolate Flavour Sandwich Biscuits, To find out how exercise and a balanced diet can help a healthy lifestyle, visit www.123healthybalance.com, Find us at www.mcvities.co.uk]	http://img.tesco.com/Groceries/pi/727/5000168176727/IDShot_90x90.jpg	Bn Chocolate 295G	1.39	73708072	0.471
6	0.379	G	275.0				1	100G	[Sweet biscuit selection, www.123healthybalance.com]	http://img.tesco.com/Groceries/pi/431/5000168165431/IDShot_90x90.jpg	Crawfords Teatime Assortment Biscuits 275G	1.0	50067737	0.364
7	0.057	G	300.0				1	100G	[Gluten free cereal hoops made with maize flour and honey coating.]	http://img.tesco.com/Groceries/pi/444/5053526970444/IDShot_90x90.jpg	Free From Honey Hoops 300G	1.5	76091114	0.5
8	0.609	G	590.4				1	100G	[Milk Chocolate Covered Biscuit Bars Filled with Chocolate Cream, To find out how exercise and a balanced diet can help a healthy lifestyle, visit www.123healthybalance.com, Visit us at www.mcvities.co.uk]	http://img.tesco.com/Groceries/pi/341/5000168187341/IDShot_90x90.jpg	Mcvities Penguin Milk Chocolate Biscuit 24 Pack 590.4G	3.99	54342601	0.676
9	0.364	G	270.0	False			1	100G	[Rolled oat flakes, Made with Scottish Oats]	http://img.tesco.com/Groceries/pi/285/5054268892285/IDShot_90x90.jpg	Tesco Easy Oats Original 270G	0.99	50210113	0.367
10	0.433	G	360.0		True	Save £1.00 Was £3.00 Now £2.00	1	100G	[An Assortment of plain, creams, chocolate and jam biscuits, www.123healthybalance.com]	http://img.tesco.com/Groceries/pi/420/5000168189420/IDShot_90x90.jpg	Mcvities Family Circle Biscuits 360G	2.0	76969454	0.556
11	0.221	G	200.0				1	100G	[Arrowroot Biscuits, www.123healthybalance.com]	http://img.tesco.com/Groceries/pi/265/5000168001265/IDShot_90x90.jpg	Mcvities Crawford Thin Arrowroot Biscuits 200G	1.49	50066519	0.745
12	0.548	G	500.0				1	100G	[Quaker Rolled Oats, Caring for those who need it most, In partnership with the charity Magic Breakfast to provide free porridge to children in the primary schools in greatest need^. www.magicbreakfast.com, Magic breakfast, fuel for learning, ^Quaker makes 16,000 breakfasts available every day to children in the primary schools in greatest need., Enjoy as part of a varied and balanced diet and a healthy lifestyle. Oat beta glucan has been shown to lower blood cholesterol. High cholesterol is a risk factor in the development of coronary heart disease. Coronary heart disease has multiple risk factors and altering one of these risk factors may or may not have a beneficial effect., For further information on cooking instructions and microwave settings, please visit our website: www.quaker.co.uk]	http://img.tesco.com/Groceries/pi/900/5000108814900/IDShot_90x90.jpg	Quaker Traditional Porridge Oats 500G	1.09	72679705	0.218
13	0.405	G	339.0		True	Any 2 for £4.00	1	100G	[Strawberry, Raspberry & Cranberry Flavour Microwaveable Oats, Caring for those who need it most, In partnership with charity Magic Breakfast to provide free porridge to children in the primary schools in greatest need.^ www.magicbreakfast.com, Magic breakfast, fuel for learning, ^Quaker makes 16,000 breakfasts available every day to children in the primary schools in greatest need., Enjoy as part of a varied and balanced diet and healthy lifestyle. Oat beta glucan has been shown to lower blood cholesterol. High cholesterol is a risk factor in the development of coronary heart disease. Coronary heart disease has multiple risk factors and altering one of these risk factors may or may not have a beneficial effect., For further information on cooking instructions and microwave settings, please visit our website: www.quaker.co.uk, Did you know you can use the sachet to measure the milk?]	http://img.tesco.com/Groceries/pi/841/5000108357841/IDShot_90x90.jpg	Quaker Oat So Simple Strawberry, Raspberry Porridge 339G	2.45	72678021	0.723
14	0.603	G	400.0	False		£1 WYS £5 on fresh pre-packed meat and fish	1	KG	[Our Organic beef comes from farms which are audited by one of the organic farm, bodies, such as Soil Association or Organic Farmers and Growers. Organic beef, farmers only feed organic cereals and manage their pasture land without using, artificial fertilisers and pesticides. They also have strict veterinary health, plans which minimise their requirements to use medicines or antibiotics. Meaty, and versatile   slow cook., Suggested serving per person of raw meat 125g   140g (as a guide for meal, planning)]	http://img.tesco.com/Groceries/pi/290/5053526261290/IDShot_90x90.jpg	Tesco Organic Diced Beef 400G	4.0	62499334	10.0
15	0.468	G	240.0	False	True	Save 49p Was £1.99 Now £1.50	1	100G	[Original Oat Cereal, fortified with vitamins, iron and calcium.]	http://img.tesco.com/Groceries/pi/180/5010029219180/IDShot_90x90.jpg	Ready Brek Original 240G	1.5	77641517	0.625
16	0.057	G	300.0	False			1	100G	[Gluten free cereal pillows made with rice flour, gluten free oat flour and cornflour and with hazelnut and chocolate flavoured filling., made using gluten free oat flour]	http://img.tesco.com/Groceries/pi/413/5053526970413/IDShot_90x90.jpg	Free From Choco- Nut Pillows 300G	1.8	76091092	0.6
17	0.234	G	200.0				1	100G	[Milk chocolate chunk cookies half coated in milk chocolate.]	http://img.tesco.com/Groceries/pi/912/5052004242912/IDShot_90x90.jpg	Tesco Heavenly Chocolate Cookies 200G	0.99	54252903	0.495
18	0.09	G	62.0				1	100G	[Instant Porridge Lyle's Golden Syrup Flavour]	http://img.tesco.com/Groceries/pi/281/5010026513281/IDShot_90x90.jpg	Mornflake Oats2go Pots Golden Syrup 62G	0.4	75844540	0.645
19	0.626	G	500.0				1	100G	[Sweet biscuit assortment]	http://img.tesco.com/Groceries/pi/907/5052910721907/IDShot_90x90.jpg	T.Continental Biscuit Assortment 500G	3.0	73385360	0.6
20	0.447	G	330.0		True	Any 2 for £4.00	1	100G	[Sweet Cinnamon Flavour Microwaveable Oats, Throughout our long term partnership with the charity Magic Breakfast, we have helped deliver free porridge to those children arriving at school who might otherwise be too hungry to learn. **, You can support too at: www.magicbreakfast.com, Magic breakfast, fuel for learning, ** Every day in the UK Quaker makes 16,000 breakfasts available for children at schools in the greatest need., Enjoy as part of a varied and balanced diet and healthy lifestyle. Oat beta glucan has been shown to lower blood cholesterol. High cholesterol is a risk factor in the development of coronary heart disease. Coronary heart disease has multiple risk factors and altering one of these risk factors may or may not have a beneficial effect., For further information on cooking instructions and microwave settings, please visit our website www.quaker.co.uk, For topping and recipe ideas visit @Quakeroatsuk on Instagram]	http://img.tesco.com/Groceries/pi/858/5000108162858/IDShot_90x90.jpg	Quaker Oat So Simple Sweet Cinnamon Porridge 330G	2.45	63572171	0.742
21	0.218	G	180.0		True	Save 79p Was £1.79 Now £1.00	1	100G	[Chocolate flavour cookies containing dark chocolate chunks and half covered in milk chocolate]	http://img.tesco.com/Groceries/pi/714/0072417160714/IDShot_90x90.jpg	Maryland Chocolate Dipped Dark Chocolate Chunk 180G	1.0	81067713	0.556
22	0.825	G	750.0				1	100G		http://img.tesco.com/Groceries/pi/537/5000168108537/IDShot_90x90.jpg	Mcvities Digestive/Hobnob /Richtea 750G	2.5	57179006	0.333
23	0.146	G	120.0				1	KG	[Cocoa Loco flavour raw fruit, oat & nut bars, Join the Wholefood Revolution at eatnakd.com. Replace over processed foods with nourishing wholefoods and get ready to be happy. Simply Yummy, We'd love you to join us and discover the delightful world of wholefood alternatives:, Eatnakd.com, Find us on Facebook, Twitter @nakd]	http://img.tesco.com/Groceries/pi/744/5060088701744/IDShot_90x90.jpg	Nakd Cocoa Loco Bar Frt, Oat And Nut Multi Pk120g	2.49	70627684	20.75
24	0.25	G	200.0				1	100G	[Ginger flavoured cookies with crystallised ginger pieces., Warming, ginger spiced cookie, with soft, stem ginger pieces]	http://img.tesco.com/Groceries/pi/898/5054402920898/IDShot_90x90.jpg	Tesco Spiced Stem Ginger 10 Cookies 200G	0.99	80051831	0.495
25	0.226	G	200.0				1	100G	[Traditional Puff Pastry Biscuits Sandwiched with a Light Flavoured Cream Filling]	http://img.tesco.com/Groceries/pi/010/5011021106010/IDShot_90x90.jpg	Mcvities Lemon Puff 200G	1.69	55100092	0.845
26	0.2	G	200.0	False			1	100G	[Custard cream biscuits, Vinnie's Quality Guarantee, A large part of my job making biscwits, is tasting biscwits. So I can personally guarantee that these biscwits are not just delicious, but have more yum per crumb in every bite., Got something to say on the matter, contact me at, talktovinnie@foxs biscuits.co.uk]	http://img.tesco.com/Groceries/pi/788/5010035065788/IDShot_90x90.jpg	Fox's Custard Creams Biscuits 200G	0.8	80165702	0.4
27	0.168	G	154.0	False	True	Half Price Was £1.08 Now 54p	1	100G	[Chocolate Flavour Sandwich Biscuits with a Mint Flavour Filling (28.8%).]	http://img.tesco.com/Groceries/pi/028/7622210626028/IDShot_90x90.jpg	Oreo Mint Creme 154G	0.54	81829164	0.351
