	AverageSellingUnitWeight	ContentsMeasureType	ContentsQuantity	IsNew	IsSpecialOffer	PromotionDescription	UnitOfSale	UnitQuantity	description	image	name	price	tpnb	unitprice
20	0.557	G	475.0	True			1	100G	[Bitesize Whole Wheat Cereal with a Topping of Rye and Quinoa, Reducing consumption of saturated fat contributes to the maintenance of normal blood cholesterol levels. Shredded Wheat is low in saturated fat.]	http://img.tesco.com/Groceries/pi/353/7613035732353/IDShot_90x90.jpg	Nestle Shredded Wheat Rye And Quinoa 475G	2.49	81503365	0.524
21	0.302	G	228.0		True	Half Price Was £2.49 Now £1.24	1	100G	[Crisp Biscuits Covered with Cadbury Milk Chocolate.]	http://img.tesco.com/Groceries/pi/152/0072417159152/IDShot_90x90.jpg	Cadbury Milk Chocolate Fingers 2 X 114G	1.24	80012052	0.544
22	0.178	G	100.0				1	KG	[Chewy popcorn bar with cranberry pieces and sunflower seeds dipped in a smooth yogurt flavour coating.]	http://img.tesco.com/Groceries/pi/263/8410076610263/IDShot_90x90.jpg	Nature Valley Popcorn Cranberry And Yoghurt 5 X 20G	2.89	79380914	28.9
23	0.123	G	37.0				1	100G	[Cereal bar with roasted peanuts and chewy oats]	http://img.tesco.com/Groceries/pi/376/0000050159376/IDShot_90x90.jpg	Tracker Roast Nut 37G	0.6	51807506	1.63
24	0.246	G	300.0				1	100G	[Ginger Nut Biscuits, Ginger Nut Biscuits]	http://img.tesco.com/Groceries/pi/830/5054402919830/IDShot_90x90.jpg	Tesco Ginger Nuts 300G	0.4	50065808	0.133
25	0.038	G	35.0				1	100G	[Pineapple & banana wholesome bar, For more information on healthy eating visit thefooddoctor.com]	http://img.tesco.com/Groceries/pi/219/5060021080219/IDShot_90x90.jpg	The Food Doctor Pineapple And Banana 35G	0.8	80258541	2.29
26	0.561	G	500.0				1	100G	[Rolled oat flakes]	http://img.tesco.com/Groceries/pi/909/5000119095909/IDShot_90x90.jpg	Tesco Scottish Porridge 500G	0.59	50185361	0.118
27	0.325	G	300.0				1	100G	[Digestive Biscuit half coated with Plain Chocolate.]	http://img.tesco.com/Groceries/pi/436/5052004078436/IDShot_90x90.jpg	Tesco Plain Chocolate Digestives 300G	0.6	71666486	0.2
28	0.21	G	200.0				1	100G	[Shortcake biscuits, Shortcake biscuits]	http://img.tesco.com/Groceries/pi/noimage.jpg	Tesco Shortcake Biscuits 200G	0.4	50065843	0.2
29	0.42	SNGL	6.0				1	EACH	[East Anglian 6 Free Range Eggs, Tesco Free Range Eggs. These freshly laid Tesco free range eggs come from carefully selected East Anglian farms, that ensure high standards of both hen & environmental welfare. Our hens enjoy a cereal based vegetarian diet and are free to roam outdoors during the day. The Lion Quality mark guarantees that the eggs have been laid in the U.K. and produced to the highest standards of food safety. All Lion Quality eggs are date stamped for freshness. Our hens have been vaccinated against salmonella.]	http://img.tesco.com/Groceries/pi/423/5053947394423/IDShot_90x90.jpg	Tesco East Anglian Free Range Eggs Very Large 6 Pack	1.5	74179096	0.25
30	0.349	G	300.0				1	100G	[Oaty Biscuits, www.123healthybalance.com]	http://img.tesco.com/Groceries/pi/073/5000168008073/IDShot_90x90.jpg	Mcvities Hobnob 300G	1.0	50375643	0.333
31	0.425	ML	250.0		True	Save 39p Was £1.39 Now £1.00	1	100ML	[Chocolate flavoured breakfast milk drink with added vitamins and iron. (UHT)., Follow us on Facebook]	http://img.tesco.com/Groceries/pi/933/5010029217933/IDShot_90x90.jpg	Weetabix On The Go Chocolate Drink 250Ml	1.0	76017619	0.4
32	0.557	G	475.0	True			1	100G	[Bitesize Whole Wheat Cereal with a Topping of Barley and Spelt, Reducing consumption of saturated fat contributes to the maintenance of normal blood cholesterol levels. Shredded Wheat is low in saturated fat.]	http://img.tesco.com/Groceries/pi/387/7613035731387/IDShot_90x90.jpg	Nestle Shredded Wheat Barley And Spelt 475G	2.49	81503405	0.524
33	0.22	G	220.0				1	100G	[Chocolate Flavour Sandwich Biscuits with a Vanilla Flavour Filling (29%).]	http://img.tesco.com/Groceries/pi/502/7622210021502/IDShot_90x90.jpg	Oreo Vanilla Snack Pack 220G	1.89	71822929	0.859
34	0.147	G	138.0		True	Save 29p Was £1.29 Now £1.00	1	100G	[Milk Chocolate Coated Crunchy Biscuit with a Toffee Flavour Cream, To find out how exercise and a balanced diet can help a healthy lifestyle, visit www.123healthybalance.com]	http://img.tesco.com/Groceries/pi/648/5000168190648/IDShot_90x90.jpg	Mcvities Trio Biscuits 6 Pack	1.0	81067736	0.725
35	0.186	G	150.0				1	100G	[Soft cocoa sponge cake with milk flavoured filling (28 %).]	http://img.tesco.com/Groceries/pi/696/7622210126696/IDShot_90x90.jpg	Barny Milk Kids Sponge Bear 5 Pack 150G	1.69	73826012	1.13
36	0.224	G	160.0	True			1	KG	[Chewy protein bar with peanuts and almonds dipped in a salted caramel flavoured coating., Find out more about our delicious products and new flavours at www.naturevalley.com, Enjoy as part of a balanced diet and active lifestyle.]	http://img.tesco.com/Groceries/pi/362/8410076610362/IDShot_90x90.jpg	Nature Valley Protein Salted Caramek Bar4x40g	2.89	81780605	18.07
37	0.319	SNGL	36.0				1	EACH	[Mini light sponge cakes with dark crackly chocolate and smashing orangey centre, www.123healthybalance.com, Join us at facebook/jaffacakes]	http://img.tesco.com/Groceries/pi/890/5000168001890/IDShot_90x90.jpg	Mcvities Mini Jaffa Cakes Portion Pack	1.69	51850943	0.047
38	0.335	SNGL	6.0				1	EACH	[Biscuit filled with mallow and jam and covered with chocolate flavoured coating.]	http://img.tesco.com/Groceries/pi/970/5010049001970/IDShot_90x90.jpg	Burtons Wagon Wheels Jammie Biscuit 6 Pack	0.99	51502095	0.165
39	0.432	G	400.0		True	Save 99p Was £1.99 Now £1.00	1	100G	[Cookies Containing Chocolate Chips]	http://img.tesco.com/Groceries/pi/894/0072417855894/IDShot_90x90.jpg	Maryland Cookies 400G	1.0	80065636	0.25
40	0.208	G	165.6			70p off selected Nestle Biscuit Bar Multipack	1	100G	[Eight bars of two crispy wafer fingers covered with orange flavoured milk chocolate (66%)., Check out our YouTube Channel at www.youtube.com/user/KITKAT, Join us at facebook.com/KITKATuk, Visit www.KITKAT.co.uk, Share your break with #MyBreak, Good to remember: enjoying chocolate as part of a varied, balanced diet and a healthy lifestyle, is one of life's little pleasures.]	http://img.tesco.com/Groceries/pi/441/7613035219441/IDShot_90x90.jpg	Kit Kat 2 Finger Orange Chocolate Biscuit 8 Pack 166.4G	1.59	52427833	0.96
41	0.225	G	42.0				1	100G	[Crunchy cereal bars made with whole grain rolled oats and honey.]	http://img.tesco.com/Groceries/pi/666/0016000502666/IDShot_90x90.jpg	Nature Valley Granola Oats And Honey 42G	0.6	51563033	1.43
42	0.428	G	400.0				1	100G	[Reduced Fat Digestive Biscuits]	http://img.tesco.com/Groceries/pi/332/5010204631332/IDShot_90x90.jpg	Tesco Reduced Fat Digestive Biscuits 400G	0.4	57390671	0.1
43	0.269	G	250.0				1	100G	[Wheatmeal Biscuits, www.123healthybalance.com]	http://img.tesco.com/Groceries/pi/142/5000168001142/IDShot_90x90.jpg	Mcvities Digestive 250G	0.89	50066393	0.356
44	0.143	G	500.0	True			1	100G	[Toasted oat clusters with freeze dried cranberry pieces and flaked almonds., Toasted oat clusters with freeze dried cranberry pieces and flaked almonds.]	http://img.tesco.com/Groceries/pi/879/5057008100879/IDShot_90x90.jpg	Tesco Reduced Sugar Cranberry And Almond Granola 500G	1.49	81344282	0.298
45	0.829	G	750.0				1	100G	[Organic Rolled Oats, Whole Rolled Jumbo Oats]	http://img.tesco.com/Groceries/pi/719/5018374072719/IDShot_90x90.jpg	Tesco Organic Porridge 750G	1.29	51258994	0.172
46	1.125	G	1000.0		True	Any 2 for £3.00	1	100G	[Scott's Rolled Oats, Enjoy as part of a varied and balanced diet and a healthy lifestyle. Oat beta glucan has been shown to lower blood cholesterol. High cholesterol is a risk factor in the development of coronary heart disease. Coronary heart disease has multiple risk factors and altering one of these risk factors may or may not have a beneficial effect.]	http://img.tesco.com/Groceries/pi/176/5000108022176/IDShot_90x90.jpg	Scott's Porridge Oats 1Kg	2.0	54196094	0.2
47	0.203	G	150.0	False			1	100G	[Wheat bakes with chocolate chips.]	http://img.tesco.com/Groceries/pi/230/5053827160230/IDShot_90x90.jpg	Kellogg's Choco Bakes Chocolate 5X30g	1.99	81829204	1.33
48	0.546	G	450.0	False	True	Save 50p Was £2.00 Now £1.50	1	100G	[Hot Oat Cereal with Chocolate, fortified with vitamins, iron and calcium., Enjoy as part of a healthy diet and lifestyle.]	http://img.tesco.com/Groceries/pi/500/5010029219500/IDShot_90x90.jpg	Weetabix Ready Brek Chocolate 450G	1.5	61717183	0.333
49	0.417	G	380.0				1	100G	[Delicious Shortbread Fingers, Follow us on Twitter @PatersonSbread, Like us on Facebook]	http://img.tesco.com/Groceries/pi/142/5010745063142/IDShot_90x90.jpg	Paterson's Shortbread Fingers 380G (L)	1.0	56282017	0.263
50	0.383	ML	330.0		True	Save 49p Was £1.49 Now £1.00	1	100ML	[Chocolate Flavour Breakfast Milk Drink, Join Us, Post a photo of your morning regime using #EveryHourCounts on Instagram for a chance to win either free Fuel10k products, financial support for your 10,000 hour journey or even a chance to have your photo on one of our cereal boxes.]	http://img.tesco.com/Groceries/pi/836/5060201621836/IDShot_90x90.jpg	Fuel Energy Drink Chocolate 330Ml	1.0	73292786	0.303
51	0.425	ML	250.0		True	Save 39p Was £1.39 Now £1.00	1	100ML	[Strawberry flavoured breakfast milk drink with added vitamins and iron (UHT)., Follow us on Facebook]	http://img.tesco.com/Groceries/pi/902/5010029217902/IDShot_90x90.jpg	Weetabix On The Go Strawberry Drink 250Ml	1.0	76017510	0.4
52	0.55	SNGL	1.0				1	EACH		http://img.tesco.com/Groceries/pi/432/5053526805432/IDShot_90x90.jpg	Tesco Two Tone Stoneware Cereal Bowl Red	1.75	75897972	1.75
53	0.167	G	500.0	False			1	100G	[Cereal flakes with mixed nuts, dried apple and coconut., Carefully selected ingredients for superb flavour]	http://img.tesco.com/Groceries/pi/992/5057008100992/IDShot_90x90.jpg	Tesco Finest Six Nut Muesli 500G	1.99	81344506	0.398
54	0.438	G	810.0				1	100G	[6 whole milk split pot yogurts   3 milk chocolate coated raisins  and 3 milk and white chocolate coated cereal balls., 6 Whole milk split pot yogurts   3 Milk and white chocolate coated cereal balls and 3 milk chocolate coated raisins]	http://img.tesco.com/Groceries/pi/768/5053947518768/IDShot_90x90.jpg	Tesco Splitpot Chocolate Ball Raisin Yoghurt 6X135g	2.0	74364118	0.247
55	0.393	G	340.0				2	100G	[4 x Chocolate dairy desserts with milk chocolate coated cereal balls (13%)]	http://img.tesco.com/Groceries/pi/730/4025500189730/IDShot_90x90.jpg	Muller Corner Pud. Chocolate Balls 4 X 85G	2.0	78747437	0.588
56	0.223	SNGL	6.0		True	Save 49p Was £1.49 Now £1.00	1	EACH	[Mini chocolate chip biscuits, Vinnie's Quality Guarantee, A large part of my job making biscwits, is tasting biscwits. So I can personally guarantee that these biscwits are not just delicious, but have more yum per crumb in every bite. Got something to say on the matter, contact me at, TalktoVinnie@foxs biscuits.co.uk]	http://img.tesco.com/Groceries/pi/978/5010035059978/IDShot_90x90.jpg	Fox's Mini Moos Chocolate Chip 150G 6 Pack	1.0	66379574	0.167
57	0.212	G	192.0	True			1	100G	[Artificially Sweetened, Frosted Toasted Oat Cereal Bar with Marshmallows, Meet all of Lucky's Charmin' Friends, Hourglass, clover hat, rainbow, shooting star, pink heart, blue moon, red balloon, purple horseshoe]	http://img.tesco.com/Groceries/pi/576/0016000467576/IDShot_90x90.jpg	Lucky Charms Treats Marshmallow Cereal Bars 192G	4.9	81596334	2.56
58	0.218	G	200.0				1	100G	[Malted Milk Biscuits, Vinnie's Quality Guarantee, A large part of my job making biscwits, is tasting biscwits. So I can personally guarantee that these biscwits are not just delicious, but have more yum per crumb in every bite. Got something to say on the matter, contact me at TalktoVinnie@foxs biscuits.co.uk]	http://img.tesco.com/Groceries/pi/783/5000148000783/IDShot_90x90.jpg	Fox's Moos Biscuits 200G	0.99	65661172	0.495
59	0.056	G	42.0				1	100G	[Crunchy cereal bars made with whole grain rolled oats and Canadian maple syrup.]	http://img.tesco.com/Groceries/pi/642/0016000502642/IDShot_90x90.jpg	Nature Valley Canadian Maple Syrup Bar 42G	0.6	66981678	1.43
60	0.285	G	250.0				1	100G	[The Original Caramelised Biscuit, For more information about Lotus Biscoff range, visit www.lotusbiscuits.co.uk or call freephone 0800 834050]	http://img.tesco.com/Groceries/pi/016/5410126716016/IDShot_90x90.jpg	Lotus Biscoff 250G	0.99	51976161	0.396
61	0.041	G	37.0		True	Any 3 for £1.20	1	100G	[A soft golden baked crust made with wholewheat, wheat, wholegrain oats, barley and a strawberry filling.]	http://img.tesco.com/Groceries/pi/755/5000127743755/IDShot_90x90.jpg	Kelloggs Nutrigrain Strawberry 37G	0.6	52822647	1.63
62	0.222	G	175.0				1	100G	[Rich Tea biscuits sandwich with vanilla flavour cream., Vinnie's Quality Guarantee, A large part of my job making biscwits, is tasting biscwits. So I can personally guarantee that these biscwits are not just delicious, but have more yum per crumb in every bite. Got something to say on the matter, contact me at TalktoVinnie@foxs biscuits.co.uk]	http://img.tesco.com/Groceries/pi/339/5010035061339/IDShot_90x90.jpg	Fox's Rich Tea Finger Creams Biscuits 175G	0.99	51810853	0.566
63	0.295	G	230.0				1	KG	[Rice, banana and peach blended with milk enriched with calcium, iron and vitamin A, C and D, HiPP Organic products should be enjoyed as part of a varied and balanced weaning diet., For handy hints and fantastic freebies to help wean your baby visit hipp.co.uk/wow]	http://img.tesco.com/Groceries/pi/010/4062300077010/IDShot_90x90.jpg	Hipp Organic 4 Month Banana And Peach Breakfast 230G	2.7	62946497	11.74
64	0.419	G	450.0				1	KG	[Soft sponge base with an orange flavoured centre half coated in plain chocolate]	http://img.tesco.com/Groceries/pi/590/5010204271590/IDShot_90x90.jpg	Tesco Jaffa Cakes 36 Pack 450G	1.7	56911455	3.78
65	0.58	G	500.0	True			1	100G	[Clusters made with oat flakes, barley flakes and chocolate crisped rice garnished with dark chocolate curls., Clusters made with oat flakes, barley flakes and Chocolate crisped rice garnished with Dark Chocolate Curls.]	http://img.tesco.com/Groceries/pi/601/5057008079601/IDShot_90x90.jpg	Tesco Chocolate Crisp 500G	1.49	81343726	0.298
66	0.098	G	92.0				1	100G	[Milk Chocolate Coated Caramel Wafer Bars, Visit us:, weightwatchersfoods.co.uk, weloveweightwatchersfoods.co.uk, For great free recipe ideas, money off coupons and information about new products in our range., weightwatchers.co.uk, Our food range is just part of what we have to offer. We also run thousands of friendly meetings across the UK each week, or you can follow our plan step by step completely online., For more information, call 03456092462.]	http://img.tesco.com/Groceries/pi/764/0039047145764/IDShot_90x90.jpg	Weight Watchers Caramel Wafers 5X18.4G	1.48	62537751	1.61
67	0.125	G	125.0		True	Save 49p Was £1.49 Now £1.00	1	100G	[Butter biscuits set in milk chocolate (63%)., Find us on Facebook:, www.facebook.com/bahlsenbiscuits, Find out more of our history at www.bahlsen.co.uk]	http://img.tesco.com/Groceries/pi/239/4017100209239/IDShot_90x90.jpg	Bahlsen Milk Choco Leibniz 125G	1.0	51486297	0.8
68	0.44	G	400.0		True	Save 50p Was £3.50 Now £3.00	1	100G	[Toaster Pastries with Chocolate Cookie & Cream Flavour Filling]	http://img.tesco.com/Groceries/pi/948/0038000235948/IDShot_90x90.jpg	Kelloggs Pop Tarts Cookies And Creme 400G	3.0	71889441	0.75
69	0.467	G	431.0		True	Half Price Was £2.29 Now £1.14	1	100G	[Milk Chocolate Oaty, Nobbly Biscuits, www.123healthybalance.com]	http://img.tesco.com/Groceries/pi/713/5000168188713/IDShot_90x90.jpg	Mcvities Chocolate Hobnobs 431G	1.14	79552717	0.265
70	0.205	G	180.0		True	Save 89p Was £1.89 Now £1.00	1	100G	[Milk chocolate chunk cookies, Vinnie's Quality Guarantee, A large part of my job making biscwits, is tasting biscwits. So I can personally guarantee that these biscwits are not just delicious, but have more yum per crumb in every bite., Got something to say on the matter, contact me at TalktoVinnie@foxs biscuits.co.uk]	http://img.tesco.com/Groceries/pi/190/5010035062190/IDShot_90x90.jpg	Fox's Milk Chocolate Chunk Cookies 180G	1.0	59580040	0.556
71	0.143	G	500.0	True			1	100G	[Toasted oat clusters with sultanas, sweetened dried fruits, coconut and almonds., Honey toasted oat clusters with tropical fruits & sunflower seeds]	http://img.tesco.com/Groceries/pi/800/5057008100800/IDShot_90x90.jpg	Tesco Tropical Granola 500G	1.49	81344155	0.298
72	0.425	ML	250.0	False	True	Save 39p Was £1.39 Now £1.00	1	100ML	[Vanilla flavoured breakfast milk drink with added vitamins and iron (UHT)., Follow us on Facebook]	http://img.tesco.com/Groceries/pi/872/5010029217872/IDShot_90x90.jpg	Weetabix On The Go Vanilla Drink 250Ml	1.0	76017585	0.4
73	0.44	SNGL	1.0	False			1	EACH		http://img.tesco.com/Groceries/pi/231/5052109992231/IDShot_90x90.jpg	Tesco Super White Porcelain Cereal Bowl	2.0	70186214	2.0
74	0.166	G	57.0	False	True	Any 5 for £4.00	1	100G	[Honey & Vanilla Flavour - Hot Oat cereal, Enjoy as part of a varied and balanced diet and healthy lifestyle. Oat beta glucan has been shown to lower blood cholesterol. High cholesterol is a risk factor in the development of coronary heart disease. Coronary heart disease has multiple risk factors and altering one of these risk factors may or may not have a beneficial effect.]	http://img.tesco.com/Groceries/pi/656/5000108962656/IDShot_90x90.jpg	Quaker Oat So Simple Honey Vanilla Porridge 57G	0.99	73312706	1.74
75	0.183	G	130.0				1	100G	[Shortcake biscuit coated in milk chocolate.]	http://img.tesco.com/Groceries/pi/798/5010035064798/IDShot_90x90.jpg	Fox's Chocolatey Ring Biscuits 130G	1.79	58183650	1.38
76	0.135	G	110.0				1	100G	[Mallow covered with chocolate flavoured coating and desiccated coconut]	http://img.tesco.com/Groceries/pi/280/5010082132280/IDShot_90x90.jpg	Lees 6 Snowballs 110G	0.59	71763866	0.536
77	0.44	G	400.0	False	True	Save 50p Was £3.50 Now £3.00	1	100G	[Toaster Pastries with Chocolate & Cookie Dough Flavour Filling, Kellogg's, Family Rewards, KelloggsFamilyRewards.com, Visit us at poptarts.com]	http://img.tesco.com/Groceries/pi/944/0038000204944/IDShot_90x90.jpg	Kelloggs Pop Tarts Chocolate Chip Cookie Dough 400G	3.0	74533748	0.75
78	0.123	G	110.0				1	100G	[Crisp Chocolate Flavoured Biscuits Fully Covered in White Chocolate and Milk Chocolate.]	http://img.tesco.com/Groceries/pi/866/0072417135866/IDShot_90x90.jpg	Cadbury Fabulous Fingers 110G	1.49	70691214	1.36
79	0.213	G	150.0				1	100G	[Milk chocolate topped embossed mini wheatmeal biscuits, To find out how exercise and a balanced diet can help a healthy lifestyle, visit www.123healthybalance.com]	http://img.tesco.com/Groceries/pi/617/5000168132617/IDShot_90x90.jpg	Mcvities Mini Milk Chocolate Digestives 6X25g	1.69	58113538	1.13
80	0.043	G	36.0	False			1	100G	[Crispy grains of toasted rice cereal and milk chocolate chunks with a chocolate flavour coating.]	http://img.tesco.com/Groceries/pi/031/5050083449031/IDShot_90x90.jpg	Kelloggs Rice Krispie Squares Chocolatley 36G	0.6	63887566	1.67
81	0.22	G	168.0				1	100G	[Ginger biscuits sandwiched with a ginger flavour cream, Vinnie's Quality Guarantee, A large part of my job making biscwits, is tasting biscwits. So I can personally guarantee that these biscwits are not just delicious, but have more yum per crumb in every bite., Got something to say on the matter, contact me at TalktoVinnie@foxs biscuits.co.uk]	http://img.tesco.com/Groceries/pi/452/5010035061452/IDShot_90x90.jpg	Foxs Ginger Crunch Creams 168G	0.99	50754333	0.589
82	0.325	G	300.0	False			1	100G	[Chocolate flavoured wheatmeal biscuits with chocolate chips, half coated in milk chocolate, www.123healthybalance.com, The Prince's Countryside Fund, Supporting British Farmers & Rural Communities]	http://img.tesco.com/Groceries/pi/310/5000168174310/IDShot_90x90.jpg	Mcvitie's Double Chocolate Digestives 300G	1.5	73135604	0.5
83	0.256	G	220.0				1	EACH	[Biscuit filled with mallow and covered with chocolate flavoured coating.]	http://img.tesco.com/Groceries/pi/956/5010049001956/IDShot_90x90.jpg	Burtons Wagon Wheels Original Biscuit 6 Pack	0.99	50807370	0.0
84	0.324	ML	250.0	False	True	Save 39p Was £1.39 Now £1.00	1	100ML	[Banana flavoured breakfast milk drink with added vitamins and iron (UHT)., Follow us on Facebook]	http://img.tesco.com/Groceries/pi/473/5010029218473/IDShot_90x90.jpg	Weetabix On The Go Banana Drink 250Ml	1.0	77545401	0.4
85	0.053	G	48.4		True	Any 3 for £1.20	1	100G	[Milk chocolate with caramel (30 %), peanut (13 %), crispy cereal (10 %) & dried grapes (7 %) centre.]	http://img.tesco.com/Groceries/pi/131/5000312002131/IDShot_90x90.jpg	Cadbury Picnic 48.4G	0.6	54231456	1.24
86	0.15	G	200.0				1	100G	[Shortcake biscuits with currants, www.123healthybalance.com]	http://img.tesco.com/Groceries/pi/621/5000168104621/IDShot_90x90.jpg	Mcvities Fruit Shortcake 200G	1.0	67576356	0.5
87	0.15	G	150.0				1	100G	[Soft sponge cake with apple-strawberry filling (28 %).]	http://img.tesco.com/Groceries/pi/660/7622210233660/IDShot_90x90.jpg	Barny Strawberry Sponge Bears 5 Pack 150G	1.69	75742113	1.13
88	0.317	G	248.0				1	100G		http://img.tesco.com/Groceries/pi/noimage.jpg	Mcvities Oaty Breakfast Breaks Cranberry 248G	1.99	81026964	0.802
89	0.423	G	384.0		True	Save 50p Was £3.50 Now £3.00	1	100G	[Toaster Pastries with Artificial Fudge Sundae Ice-Cream Filling, Visit us at poptarts.com, Kellogg's Family Rewards, www.KFR.com]	http://img.tesco.com/Groceries/pi/381/0038000500381/IDShot_90x90.jpg	Kelloggs Pop Tarts Frosted Hot Fudge Sundae 384G	3.0	71889556	0.781
90	0.44	G	400.0				1	100G	[Reduced Fat Wheatmeal Biscuits, www.123healthybalance.com]	http://img.tesco.com/Groceries/pi/008/5000168039008/IDShot_90x90.jpg	Mcvitie Light Digestive 400G	1.0	51504507	0.25
91	0.521	G	450.0		True	Any 2 for £2.00	1	100G	[Strawberry Yogurt with Wholegrain Cereals, Find us on Facebook/Onkendairy]	http://img.tesco.com/Groceries/pi/438/7610900037438/IDShot_90x90.jpg	Onken Wholegrain Strawberry Yoghurt 450G	1.3	51268711	0.289
92	0.343	G	308.0				1	100G	[Chocolate Flavour Sandwich Biscuits with a Vanilla Flavour Filling (29%)]	http://img.tesco.com/Groceries/pi/269/7622300315269/IDShot_90x90.jpg	Oreo Vanilla 2 X 154G	1.85	71275286	0.601
93	0.243	G	227.7				1	100G	[Milk chocolate coated sandwich biscuit bars with chocolate flavoured filling, Milk chocolate coated sandwich biscuits with chocolate flavour filling]	http://img.tesco.com/Groceries/pi/662/5052909732662/IDShot_90x90.jpg	Tesco Choky Sandwich Bars Biscuit 9 Pack	0.89	72008994	0.391
94	0.194	G	125.0				1	100G	[Milk chocolate topped biscuits, To find out how exercise and a balanced diet can help a healthy lifestyle, visit www.123healthybalance.com]	http://img.tesco.com/Groceries/pi/541/5000168141541/IDShot_90x90.jpg	Mcvities Chocolate Gems 5 X 25G	1.69	61550119	1.36
95	0.542	SNGL	1.0	False			1	EACH		http://img.tesco.com/Groceries/pi/208/5052109996208/IDShot_90x90.jpg	Tesco Square Porcelain Cereal Bowl	3.0	70186289	3.0
96	0.55	SNGL	1.0				1	EACH		http://img.tesco.com/Groceries/pi/763/5053947021763/IDShot_90x90.jpg	Tesco Two Tone Cereal Taupe	1.75	73736366	1.75
97	0.167	KG	1.0	False			1	KG	[Oat and honey clusters with chopped almonds., Honey toasted oat clusters with chopped almonds. A crunchy granola to eat with milk or yogurt or make your own with fruits, nuts & seeds.]	http://img.tesco.com/Groceries/pi/noimage.jpg	Tesco Honey And Almond Granola 1Kg	1.49	81344184	1.49
98	0.313	G	262.0		True	Half Price Was £1.50 Now 75p	1	100G	[Plain chocolate oaty, nobbly biscuits, www.123healthybalance.com]	http://img.tesco.com/Groceries/pi/819/5000168176819/IDShot_90x90.jpg	Mcvities Dark Chocolate Hobnob 262G	0.75	62397875	0.286
99	0.383	ML	330.0	False	True	Save 49p Was £1.49 Now £1.00	1	100ML	[Vanilla Flavour Breakfast Milk Drink, Join Us, Post a photo of your morning regime using #EVERYHOURCOUNTS on Instagram for a chance to win either free Fuel10k products, financial support for your 10,000 hour journey or even a chance to have your photo on one of our cereal boxes.]	http://img.tesco.com/Groceries/pi/898/5060201621898/IDShot_90x90.jpg	Fuel 10K Vanilla Liquid Breakfast 330Ml	1.0	76796116	0.303
0	21.0	G	200.0	True			1	100G	[Scottish porridge oat bars with orange and dark chocolate., Find out more @ eatstoats.com, Find us on Facebook, Twitter and Instagram]	http://img.tesco.com/Groceries/pi/904/5060183671904/IDShot_90x90.jpg	Stoats Orange And Dark Chocolate Porridge Oat Bar 4X50g	2.49	81262240	1.25
1	0.597	G	594.0				1	100G	[Original Microwaveable Oats, Throughout our long term partnership with the charity Magic Breakfast, we have helped deliver free porridge to those children arriving at school who might otherwise be too hungry to learn. **, You can support too at: www.magicbreakfast.com, Magic breakfast, fuel for learning, ** Every day in the UK Quaker makes 16,000 breakfasts available for children at schools in the greatest need., Enjoy as part of a varied and balanced diet and healthy lifestyle. Oat beta glucan has been shown to lower blood cholesterol. High cholesterol is a risk factor in the development of coronary heart disease. Coronary heart disease has multiple risk factors and altering one of these risk factors may or may not have a beneficial effect., For further information on cooking instructions and microwave settings, please visit our website: www.quaker.co.uk, For topping and recipe ideas visit @Quakeroatsuk on Instagram]	http://img.tesco.com/Groceries/pi/787/5000108291787/IDShot_90x90.jpg	Quaker Oat So Simple Original Porridge 22 X 27G	3.99	59151871	0.672
2	0.2	G	200.0				1	100G	[Chocolate flavoured biscuits sandwiched with a chocolate flavoured filling]	http://img.tesco.com/Groceries/pi/771/5010035065771/IDShot_90x90.jpg	Fox's Bourbon Creams Biscuits 200G	0.8	80166217	0.4
