	AverageSellingUnitWeight	ContentsMeasureType	ContentsQuantity	IsNew	IsSpecialOffer	PromotionDescription	UnitOfSale	UnitQuantity	description	image	name	price	tpnb	unitprice
0	1.064	G	950.0	False		£1 WYS £5 on fresh pre-packed meat and fish	1	KG	[This product can contain a variable number of chicken breast portions in each, pack., Make light work of midweek meals with our naturally lean and tender chicken, breast. These hand trimmed, skinless fillet portions are perfect for fajita, wraps, sliced in a stir fry or diced in curry. For a healthy teatime treat, simply season and grill and serve with roasted vine tomatoes and fresh rocket, salad., Click the Recipes tab at the top of this page to find Real Food recipes with, ingredients you can add straight to your basket., Expertly selected for freshness and quality. We care about welfare, that's why, these Tesco chickens are reared by British farmers and enjoy an enriched, environment with natural daylight and bales to improve the activity and, wellbeing of the birds. Our chicken meets Red Tractor standards, as well as our, own strict agricultural requirements.]	http://img.tesco.com/Groceries/pi/283/5054775750283/IDShot_90x90.jpg	Tesco British Chicken Breast Portions 950G	5.5	77453861	5.79
1	0.558	G	450.0		True	Save 50p Was £3.50 Now £3.00	1	KG	"[""Make light work of midweek meals with our diced British chicken breast. It’s, your go to ingredient for a quick and easy curry, stir fry, pasta dish, tasty, wrap or succulent skewer. Spicy food fan? Turn up the heat with a Tesco Tikka, Masala sauce or try our Real Food recipe for Curried chicken kebabs., Click on the Recipes tab at the top of this page to see Real Food chicken, recipes with ingredients you can add straight to your basket., Raw chicken should always be kept at the bottom of the fridge (in its original, packaging or a sealed container) and there is no need to wash it before, cooking., Tesco chickens are reared by British farmers who are passionate about welfare, and meet Red Tractor standards as well as our own stringent Agricultural, Requirements. Our chickens are reared in houses with natural daylight and bales, as studies have shown this type of enrichment improves the activity and, wellbeing of the birds.""]"	http://img.tesco.com/Groceries/pi/473/5054268736473/IDShot_90x90.jpg	Tesco British Diced Chicken Breast 450G	3.0	73049747	6.67
2	1.792	KG	1.65		True	Save 50p Was £4.50 Now £4.00	1	KG	[Our range of whole chickens are perfect for a succulent roast, and midweek, meals made from tasty leftovers. Use up lean chicken breast in a stir fry or, salad while tasty thighs and drumsticks sizzle in casseroles, on the barbecue,, or in a curry., Click the Recipes tab at the top of this page to find Real Food recipes with, ingredients you can add straight to your basket., Expertly selected for freshness and quality. We care about welfare, that's why, these Tesco chickens are reared by British farmers and enjoy an enriched, environment with natural daylight and bales to improve the activity and, wellbeing of the birds. Our chicken meets Red Tractor standards, as well as our, own strict agricultural requirements.]	http://img.tesco.com/Groceries/pi/531/5054775703531/IDShot_90x90.jpg	Tesco British Large Whole Chicken 1.65-1.95Kg	4.0	64083120	2.43
3	0.338	G	300.0			£1 WYS £5 on fresh pre-packed meat and fish	1	KG	[Willow Farms chicken reared exclusively for Tesco., Grill and slice these chicken breasts to top a healthy salad. Make the most of, your breast fillets with tasty RealFood recipes to feed your family., Willow Farms chickens are reared to Red Tractor assured welfare standards, to, find out more about our Farms Range visit: www.tesco.com/thefarmsrange]	http://img.tesco.com/Groceries/pi/282/5054775702282/IDShot_90x90.jpg	Willow Farms Chicken Breast Portions 300G	1.89	81006055	6.3
4	0.656	G	600.0			£1 WYS £5 on fresh pre-packed meat and fish	1	KG	[For midweek meals that won’t break the budget, our succulent boneless, skinless, chicken thigh fillets are a tasty option. Our succulent chicken thighs are, delicious in a curry sauce with a naan, pilau rice and chutney. Or try slow, cooked in a stew, casserole or in pies., Click on the Recipes tab at the top of this page to find Real Food recipes with, ingredients to add straight to your basket., Expertly selected for freshness and quality. We care about welfare, that's why, these Tesco chickens are reared by British farmers and enjoy an enriched, environment with natural daylight and bales to improve the activity and, wellbeing of the birds. Our chicken meets Red Tractor standards, as well as our, own strict agricultural requirements.]	http://img.tesco.com/Groceries/pi/978/5054269362978/IDShot_90x90.jpg	Tesco British Chicken Thigh Fillets 600G	3.5	74567783	5.84
5	1.564	KG	1.3			£1 WYS £5 on fresh pre-packed meat and fish	1	KG	[Our range of whole chickens are perfect for a succulent roast, and midweek, meals made from tasty leftovers. Use up lean chicken breast in a stir fry or, salad while tasty thighs and drumsticks sizzle in casseroles, on the barbecue,, or in a curry., Click the Recipes tab at the top of this page to find Real Food recipes with, ingredients you can add straight to your basket., Expertly selected for freshness and quality. We care about welfare, that's why, these Tesco chickens are reared by British farmers and enjoy an enriched, environment with natural daylight and bales to improve the activity and, wellbeing of the birds. Our chicken meets Red Tractor standards, as well as our, own strict agricultural requirements.]	http://img.tesco.com/Groceries/pi/221/5054775750221/IDShot_90x90.jpg	Tesco British Whole Medium Chicken 1.3-1.5Kg	3.5	77965664	2.7
6	0.513	G	500.0			£1 WYS £5 on fresh pre-packed meat and fish	1	KG	[Make light work of midweek meals with our naturally lean and tender British, chicken breast mini fillets. Perfect for fajitas with tortillas, grated cheese,, roasted peppers and red onion or in a stir fry with noodles and bean sprouts., Looking for something everyday easy? Bring a taste of Texmex to your table with, a Tesco fajita kit., Click on the Recipes tab at the top of this page to find Real Food recipes with, ingredients to add straight to your basket., Expertly selected for freshness and quality. We care about welfare, that's why, these Tesco chickens are reared by British farmers and enjoy an enriched, environment with natural daylight and bales to improve the activity and, wellbeing of the birds. Our chicken meets Red Tractor standards, as well as our, own strict agricultural requirements.]	http://img.tesco.com/Groceries/pi/450/5054775750450/IDShot_90x90.jpg	Tesco British Chicken Breast Mini Fillets 500G	4.0	64097835	8.0
7	0.258	G	240.0				1	100G	[Cooked and sliced chicken, Everyday Value Sliced Chicken. Prepared using meat that complies with our strict welfare and quality standards]	http://img.tesco.com/Groceries/pi/043/5051898889043/IDShot_90x90.jpg	Tesco Everyday Value Sliced Cooked Chicken 240G	2.0	56293578	0.833
8	0.38	G	300.0			£1 WYS £5 on fresh pre-packed meat and fish	1	KG	[Make light work of midweek meals with our naturally lean and tender chicken, breast. These hand trimmed, skinless fillet portions are perfect for fajita, wraps, sliced in a stir fry or diced in curry. For a healthy teatime treat, simply season and grill and serve with roasted vine tomatoes and fresh rocket, salad., Click the Recipes tab at the top of this page to find Real Food recipes with, ingredients you can add straight to your basket., Expertly selected for freshness and quality. We care about welfare, that's why, these Tesco chickens are reared by Scottish farmers and enjoy an enriched, environment with natural daylight and bales to improve the activity and, wellbeing of the birds. Our chicken meets Red Tractor standards, as well as our, own strict agricultural requirements.]	http://img.tesco.com/Groceries/pi/602/5054268934602/IDShot_90x90.jpg	Tesco 2 British Chicken Breast Fillets 300G	2.5	77453671	8.34
9	0.135	G	125.0		True	Any 2 for £3.00	1	100G	[Sliced, cooked and roasted formed chicken breast., 5 Slices.]	http://img.tesco.com/Groceries/pi/928/5052910805928/IDShot_90x90.jpg	Tesco British Roast Chicken 125G	1.8	55204793	1.44
10	0.357	G	270.0	False		£1 WYS £5 on fresh pre-packed meat and fish	1	KG	[Chopped and shaped chicken breast in a crispy breadcrumb coating., Easy to prepare and delicious with dips our chicken goujons made from 100% chicken breast are a hit with kids and a must have for barbecues, buffets and picnics. Sharing a bowl of golden crispy crumbed chicken goujons with delicious dips is the essence of social eating so why not get friends and family involved. For a simple teatime treat try them in tortilla wraps with salad and zingy salsa or in soft white burger baps with lettuce, tomato and cool mayonnaise. Serve with  a spicy salad and grilled corn on the cob.]	http://img.tesco.com/Groceries/pi/276/5053947839276/IDShot_90x90.jpg	Tesco Breaded Chicken Goujons 270G	2.0	50497297	7.41
11	0.224	G	250.0				1	100G	[WAFER THIN ROAST CHICKEN, Tesco Wafer Thin Roast Chicken]	http://img.tesco.com/Groceries/pi/791/5054775860791/IDShot_90x90.jpg	Tesco Wafer Thin Roast Chicken 250G	1.6	53573127	0.64
12	0.36	G	305.0			£1 WYS £5 on fresh pre-packed meat and fish	1	KG	[Chopped and shaped chicken breast with a garlic butter filling in a crispy golden breadcrumb coating., Make light work of midweek meals with our 100% chicken breast kievs. Cut into the tender chicken breast meat and delicious melting garlic butter flecked with parsley oozes out. This fast family favourite works well with any side you like from chips to couscous, mash or salad, so serve it to suit your mood. Try slicing your kievs over a bed of fresh green salad for instant teatime presentation points, or reinvent your greens with our simple Real Food recipe for Minted peas and beans.]	http://img.tesco.com/Groceries/pi/481/5053947839481/IDShot_90x90.jpg	Tesco 2 Garlic Chicken Kievs 305G	2.0	50808893	6.56
13	0.245	KG	0.18				1	KG	[Prefried portions of chicken formed from marinated chunks of chicken breast coated in breadcrumbs blended with spices., For more, visit birdseye.co.uk]	http://img.tesco.com/Groceries/pi/888/5000116104888/IDShot_90x90.jpg	Birds Eye 2 Southern Fried Chicken 200G	1.5	62046001	8.34
14	0.455	G	365.0			£1 WYS £5 on fresh pre-packed meat and fish	1	KG	[Willow Farms chicken reared exclusively for Tesco., Stir fry these chicken breast mini fillets and add to fajitas with peppers and, salsa. Make the most of your chicken with tasty RealFood recipes to feed your, family., Willow Farms chickens are reared to Red Tractor assured welfare standards, to, find out more about our Farms Range visit: www.tesco.com/thefarmsrange]	http://img.tesco.com/Groceries/pi/732/5054775702732/IDShot_90x90.jpg	Willow Farms Chicken Mini Fillets 365G	2.23	81017402	6.11
15	2.392	KG	2.05			£1 WYS £5 on fresh pre-packed meat and fish	1	KG	[Our range of whole chickens are perfect for a succulent roast, and midweek, meals made from tasty leftovers. Use up lean chicken breast in a stir fry or, salad while tasty thighs and drumsticks sizzle in casseroles, on the barbecue,, or in a curry., Click the Recipes tab at the top of this page to find Real Food recipes with, ingredients you can add straight to your basket., Expertly selected for freshness and quality. We care about welfare, that's why, these Tesco chickens are reared by British farmers and enjoy an enriched, environment with natural daylight and bales to improve the activity and, wellbeing of the birds. Our chicken meets Red Tractor standards, as well as our, own strict agricultural requirements.]	http://img.tesco.com/Groceries/pi/456/5054775703456/IDShot_90x90.jpg	Tesco Whole Chicken Extra Large 2.05-2.35Kg	5.5	77190284	2.69
16	1.227	KG	1.0			£1 WYS £5 on fresh pre-packed meat and fish	1	KG	[Perfect for midweek meals, these flavourful British chicken thighs with skin on, for succulence are a tasty option. Delicious roasted or add a delicious, marinade and cook until crispy. A must have for a traditional teatime served, with mashed potato and green beans, or for succulent meat that falls off the, bone try slow cooking in a stew, casserole or curry., Click on the Recipes tab at the top of this page to find Real Food recipes with, ingredients to add straight to your basket., Expertly selected for freshness and quality. We care about welfare, that's why, these Tesco chickens are reared by British farmers and enjoy an enriched, environment with natural daylight and bales to improve the activity and, wellbeing of the birds. Our chicken meets Red Tractor standards, as well as our, own strict agricultural requirements.]	http://img.tesco.com/Groceries/pi/725/5054268934725/IDShot_90x90.jpg	Tesco British Chicken Thighs 1Kg	3.0	77453757	3.0
17	1.044	KG	1.0				1	KG	[Skinless and Boneless cut Chicken Breast Fillets with added water and salt, Skinless and Boneless Chicken Breast Fillets with added water and salt]	http://img.tesco.com/Groceries/pi/159/5051008376159/IDShot_90x90.jpg	Tesco Everyday Value Chicken Breast Fillets 1Kg	3.82	54625138	3.82
18	6.208	G	250.0				1	100G	[Reformed cooked chicken with added water and pea protein., 20 Slices.]	http://img.tesco.com/Groceries/pi/692/5054775860692/IDShot_90x90.jpg	Tesco Everyday Value Chicken Roll 250G	0.6	53332684	0.24
19	0.288	G	245.0				1	100G	[Roasted chicken breasts with a brown sugar marinade, Tasty and ready to eat hot or cold.Looking for a midweek teatime treat? Choose our roasted boneless chicken breasts. For a quick, easy roast dinner simply heat the chicken breasts and serve with mashed potato, fresh vegetables and gravy. Or for a light lunch slice the chicken over a bed of salad with some baby potatoes and dressing.For more chicken recipes check out Tesco Real Food.]	http://img.tesco.com/Groceries/pi/489/5051898591489/IDShot_90x90.jpg	Tesco 2 Ready To Eat Roast Chicken Breasts 245G	4.0	52631176	1.64
20	0.216	G	255.0		True	Save 50p Was £1.50 Now £1.00	1	KG	[Portions formed from marinated chunks of chicken breast coated in a light crispy batter, prefried., Why not try in a wrap..., Visit birdseye.co.uk for more ideas]	http://img.tesco.com/Groceries/pi/506/5000116110506/IDShot_90x90.jpg	Birds Eye 2 Crispy Chicken 180G	1.0	51582603	3.93
21	0.238	G	186.0		True	Save 50p Was £1.50 Now £1.00	1	KG	[Portions of chicken formed from marinated chunks of chicken breast, prefried, seared and glazed., For more, visit birdseye.co.uk, Visit birdeye.co.uk for more ideas]	http://img.tesco.com/Groceries/pi/544/5000116110544/IDShot_90x90.jpg	Birds Eye 2 Original Chicken Chargrills 182G	1.0	53304574	5.38
22	0.211	G	186.0		True	Save 50p Was £1.50 Now £1.00	1	KG	[Portions of chicken formed from marinated chunks of chicken breast, prefried, seared and coated with a sweet barbecue glaze., For more, visit birdseye.co.uk, Visit birdseye.co.uk for more ideas]	http://img.tesco.com/Groceries/pi/551/5000116110551/IDShot_90x90.jpg	Birds Eye 2 Sticky And Sweet Bbq Chicken Chargrills 186G	1.0	72395954	5.38
23	1.237	KG	1.0	False	True	Save 50p Was £2.50 Now £2.00	1	KG	[Easy to prepare and a treat to eat, our British chicken drumsticks with skin on, for flavour are a must have at a barbecue, buffet or picnic. Roast your drums, with sticky sauces and tasty marinades or slow cook them in a stew or, casserole. Go for sweet and spicy BBQ flavour by adding Tesco barbecue, seasoning, and don't forget the napkins, Click the Recipes tab at the top of this page to find Real Food recipes with, ingredients you can add straight to your basket., Expertly selected for freshness and quality. We care about welfare, that's why, these Tesco chickens are reared by British farmers and enjoy an enriched, environment with natural daylight and bales to improve the activity and, wellbeing of the birds. Our chicken meets Red Tractor standards, as well as our, own strict agricultural requirements.]	http://img.tesco.com/Groceries/pi/688/5054268934688/IDShot_90x90.jpg	Tesco British Chicken Drumsticks 1Kg	2.0	77453728	2.0
24	0.564	G	513.0				1	KG	[Dippers formed from chopped marinated chicken breast coated in a light batter, prefried., For more, visit birdseye.co.uk]	http://img.tesco.com/Groceries/pi/599/5000116110599/IDShot_90x90.jpg	Birds Eye 28 Crispy Chicken Dippers 513G	3.0	80918377	5.85
25	48.74	G	180.0		True	Any 2 for £5.00	1	100G	[Cooked and sliced chicken breast fillets in a sweet and smoky barbecue tomato marinade., Tasty and ready to eat hot or cold. Liven up your lunchtime with tasty chunks of BBQ marinated roast chicken. Bored of ham sandwiches? Try packing a pitta with BBQ chicken, leafy salad and a squirt of light mayonnaise. Throw some chicken into a salad or simply nibble it as a tasty protein packed snack. Barbecue chicken is the perfect topping for your own homemade pizzas. Start with a Tesco pizza base and top with passata, mozzarella and BBQ chicken chunks for family friendly food fun  For more chicken recipes check out Tesco Real Food.]	http://img.tesco.com/Groceries/pi/079/5053947788079/IDShot_90x90.jpg	Tesco Ready To Eat Bbq Chicken Breast Pieces 180G	3.0	56454114	1.67
26	0.51	KG	0.43		True	Any 2 for £6.00	1	KG	[Skinless chicken breast fillets with smoked dry cure bacon, Cheddar & Red Leicester cheese and a smoky barbecue sauce., Two chicken breasts individually wrapped in smoked dry cure bacon and topped with grated Red Leicester & Cheddar cheeses, accompanied by a sweet and smoky BBQ sauce. Oven ready and cook in 40 minutes, serving 2 people. Why not try with rustic chips and side salad?]	http://img.tesco.com/Groceries/pi/553/5052320400553/IDShot_90x90.jpg	Tesco 2 Hunters Chicken Breasts 430G	3.5	51039764	8.14
27	0.79	KG	0.77				1	KG	[Dippers formed from chopped marinated chicken breast coated in a light batter, prefried., For more, visit birdseye.co.uk]	http://img.tesco.com/Groceries/pi/634/5000116101634/IDShot_90x90.jpg	Birds Eye 42 Crispy Chicken Dippers 770G	4.0	64776118	5.2
28	0.114	G	100.0	False			1	100G	[Cooked, sliced and seasoned flamegrilled chicken breast fillets., Tasty and ready to eat hot or cold. Liven up your lunchtime with tasty chunks of flame grilled roast chicken. Bored of ham sandwiches? Serve up a superior sandwich with chicken, bacon & lettuce. Throw some chicken into a caesar salad or simply nibble it as a tasty protein packed snack. Flamegrilled chicken is the perfect topping for your own homemade pizzas. Start with a Tesco thin & crispy pizza base and top with passata, mozzarella and flamegrilled chicken chunks for family friendly food fun  For more chicken recipes check out Tesco Real Food.]	http://img.tesco.com/Groceries/pi/340/5052004469340/IDShot_90x90.jpg	Tesco Chunky Flamed Grilled Chicken 100g	1.79	51514806	1.79
29	0.258	G	240.0	False			1	100G	[Cooked and sliced Chicken with a Tikka marinade, Everyday Value Tikka Sliced Chicken. Prepared using meat that complies with our strict welfare and quality standards]	http://img.tesco.com/Groceries/pi/067/5051898889067/IDShot_90x90.jpg	Tesco Everyday Value Sliced Tikka Chicken 240G	2.0	59817194	0.833
30	0.671	KG	0.32				1	KG	[Chopped and shaped chicken in a crispy breadcrumb coating, Everyday Value chicken nuggets]	http://img.tesco.com/Groceries/pi/376/5051898462376/IDShot_90x90.jpg	Tesco Everyday Value Chicken Nuggets 320G	0.72	60590856	2.25
31	0.434	G	375.0			£1 WYS £5 on fresh pre-packed meat and fish	1	KG	[Willow Farms chicken reared exclusively for Tesco., Cook up these diced chicken breasts in a curry with rice and naans. Make the, most of your chicken with tasty RealFood recipes to feed your family., Willow Farms chickens are reared to Red Tractor assured welfare standards, to, find out more about our Farms Range visit: www.tesco.com/thefarmsrange]	http://img.tesco.com/Groceries/pi/718/5054775702718/IDShot_90x90.jpg	Willow Farms Diced Chicken Breast 375G	2.29	81017376	6.11
32	0.654	G	650.0		True	Save £1.00 Was £5.00 Now £4.00	1	KG	[Make light work of midweek meals with our naturally lean and tender British, chicken breast mini fillets. Perfect for fajitas with tortillas, grated cheese,, roasted peppers and red onion or in a stir fry with noodles and bean sprouts., Looking for something everyday easy? Bring a taste of Texmex to your table with, a Tesco fajita kit., Click on the Recipes tab at the top of this page to find Real Food recipes with, ingredients to add straight to your basket., Expertly selected for freshness and quality. We care about welfare, that's why, these Tesco chickens are reared by British farmers and enjoy an enriched, environment with natural daylight and bales to improve the activity and, wellbeing of the birds. Our chicken meets Red Tractor standards, as well as our, own strict agricultural requirements.]	http://img.tesco.com/Groceries/pi/375/5054775750375/IDShot_90x90.jpg	Tesco British Mini Chicken Fillets 650G	4.0	51720245	6.16
33	0.344	G	305.0	False	True	Save 50p Was £2.00 Now £1.50	1	KG	[Chopped and shaped chicken filled with a smoked bacon with added water and cheese sauce in a crispy breadcrumb coating, Packed with popular family friendly flavours, our cheesy Cheddar and bacon chicken kievs are a teatime triumph. The tender 100% chicken breast meat, creamy melting cheese and bacon pieces topped with a light, crisp golden crumb makes dinner delicious. For a low fuss midweek meal add mash to mop up the sauce, or serve on a bed of salad and try cooking up a homemade side like our Salt and vinegar wedges recipe on Real Food.]	http://img.tesco.com/Groceries/pi/375/5053947839375/IDShot_90x90.jpg	Tesco 2 Cheese And Bacon Chicken Kievs 305G	1.5	55755612	4.92
34	0.567	KG	1.0			£1 WYS £5 on fresh pre-packed meat and fish	4	KG	[Tesco Fresh Finest Free Range Chicken Skinless Breast Fillets Corn Fed]	http://img.tesco.com/Groceries/pi/000/0253650000000/IDShot_90x90.jpg	Tesco Finest British Cornfed Free Range Chicken Fillets 2 Pack	13.0	72710634	13.0
35	0.568	KG	0.5				1	KG	[Chopped and shaped chicken filled with garlic butter in a crispy breadcrumb coating, Classic chicken kievs are a real family favourite and it's easy to see why. Fuss free, quick cooking for hungry tummies at teatime. These chicken kievs, made with 100% breast meat in a crispy breadcrumb coating, have a tasty garlic butter centre and cook from frozen in just 17 minutes. Make a teatime treat with herby new potatoes and petits pois or for simple suppers team your kievs with potato waffles, frozen peas and a dollop of tomato ketchup. This product is made with 100% chicken breast with no artificial flavours, colours or preservatives.]	http://img.tesco.com/Groceries/pi/666/5051898462666/IDShot_90x90.jpg	Tesco 4 Garlic Butter Chicken Kievs 500G	2.0	60590919	4.0
36	0.524	G	365.0		True	Any 2 for £6.00	1	KG	[Chicken breast fillets with a hot & spicy marinade and Piri Piri spicy seasoning., Chicken breast fillets marinated in an aromatic spicy piri piri sauce and delicately finished with a piri piri spicy seasoning. Oven ready and cooks in 45 minutes, serving 2 people. Why not try with spicy rice and roasted peppers?]	http://img.tesco.com/Groceries/pi/122/5054402100122/IDShot_90x90.jpg	Tesco Piri Piri Chicken Breast Fillets 365G	3.5	65837881	9.59
37	49.257	G	180.0		True	Any 2 for £5.00	1	100G	[Cooked and sliced chicken breast fillets in a sweet chilli marinade., Tasty and ready to eat hot or cold. Liven up your lunch time with chunky slices of sweet chilli marinated roast chicken. Bored of ham sandwiches? Try mini tortilla wraps loaded with sweet chilli chicken, baby leaf salad and soft cheese. Create a salad with an oriental twist or simply eat this chicken as a tasty protein packed snack. Sweet chilli chicken is the perfect topping for your own homemade pizzas. Start with a Tesco pizza base and top with passata, mozzarella and sweet chilli chicken pieces for family friendly food fun   For more chicken recipes check out Tesco Real Food]	http://img.tesco.com/Groceries/pi/130/5053947788130/IDShot_90x90.jpg	Tesco Ready To Eat Sweet Chilli Chicken Breast Pieces 180G	3.0	63969128	1.67
38	0.865	G	750.0			£1 WYS £5 on fresh pre-packed meat and fish	1	KG	[Willow Farms chicken reared exclusively for Tesco., Marinade these chicken thighs in sweet and sticky teriyaki sauce with rice and, spring onions. Make the most of your thighs with tasty RealFood recipes to feed, your family., Willow Farms chickens are reared to Red Tractor assured welfare standards, to, find out more about our Farms Range visit: www.tesco.com/thefarmsrange]	http://img.tesco.com/Groceries/pi/268/5054775702268/IDShot_90x90.jpg	Willow Farms Chicken Thighs 750G	1.49	81006049	1.99
39	0.135	G	125.0				1	100G	[Wafer thin sliced, cooked and roasted reformed chicken with added water., Using only chicken from Tesco approved suppliers.  Succulent wafer thin roast Chicken slices. Ideal for sandwiches or salads. Source of protein. Cooked and ready to eat.]	http://img.tesco.com/Groceries/pi/146/5054269138146/IDShot_90x90.jpg	Tesco Waferthin Chicken 125G	1.0	77660903	0.8
40	0.354	G	305.0			£1 WYS £5 on fresh pre-packed meat and fish	1	KG	[Chicken breast fillet pieces in a crispy breadcrumb coating, Our tender 100% chicken breast mini fillets in a crisp golden crumb are perfect for fuss free teatimes. Easy to prepare and a must have for speedy suppers, try them in wraps, rolls and warm salads, or snack on them with dips and a movie. Looking for a quick dinner winner? Wrap your mini fillets in soft Tesco tortillas with salad and zingy salsa or serve them in soft white burger baps with lettuce, tomato and cool mayonnaise. Add a homemade side with our Real Food recipe for Spicy salad with grilled corn on the cob.]	http://img.tesco.com/Groceries/pi/457/5051898684457/IDShot_90x90.jpg	Tesco Breaded Chicken Mini Fillets 305G	2.5	57532061	8.2
