	AverageSellingUnitWeight	ContentsMeasureType	ContentsQuantity	IsNew	IsSpecialOffer	PromotionDescription	UnitOfSale	UnitQuantity	description	image	name	price	tpnb	unitprice
82	1.344	KG	1.0			£1 WYS £5 on fresh pre-packed meat and fish	4	KG	[Perfect for a traditional, juicy roast., Bone in. Hand butchered. Grass fed.]	http://img.tesco.com/Groceries/pi/000/0230850000000/IDShot_90x90.jpg	Tesco Lamb Half Leg - Price Shown Per Kilograms	10.0	51329951	10.0
83	0.3	G	200.0				1	100G	[Ham formed from cuts of pork legs with added water and pork gelatine]	http://img.tesco.com/Groceries/pi/836/5050179916836/IDShot_90x90.jpg	Tesco Danish Ham 200G	1.0	55826293	0.5
84	0.97	G	605.0	False		£1 WYS £5 on fresh pre-packed meat and fish	1	KG	[2 British/Scotch beef steak minced burgers with slow cooked pork shoulder marinated in a blend of herb and spices, 2 brioche rolls, apple & bourbon sauce, 2 slices of Cheddar cheese with chillies., Burger cravings? Build your own with our gourmet burger kit made from prime cuts of pulled pork blended with onions, red pepper and garlic, and marinated in hickory for a smoky, barbecue flavour.   Bursting with enough on trend pulled pork to fill a burger bun to the brim this quick kit is your one stop shop for fast food made better, by you. Serve with Tesco Chunky fried potato chips or stay gourmet with our Real Food recipe: Sweet potato chips with satay dip.]	http://img.tesco.com/Groceries/pi/071/5054402787071/IDShot_90x90.jpg	Tesco Finest Burger Kit With Pulled Pork 605G	5.0	78587165	8.27
85	0.56	G	500.0			£1 WYS £5 on fresh pre-packed meat and fish	1	KG	[Pork mince 12% fat., Northern Irish Pork Lean Mince]	http://img.tesco.com/Groceries/pi/702/5054775750702/IDShot_90x90.jpg	Woodside Farms 12% Fat Pork Mince 500G	1.89	81026866	3.78
86	0.142	G	120.0	False			1	100G	[Cooked, formed ham., Italian cooked ham]	http://img.tesco.com/Groceries/pi/243/5054775147243/IDShot_90x90.jpg	Tesco Prosciutto Cotto 120G	2.0	80318845	1.67
87	0.583	G	500.0		True	Save 15% Was £2.90 Now £2.46	1	KG	[Skinless and Boneless 100% Chicken Mini Breast Fillets, 100% mini breast fillets 500g]	http://img.tesco.com/Groceries/pi/151/5054775147151/IDShot_90x90.jpg	Tesco Mini Chicken Breast Fillets 500G	2.46	80318534	4.92
88	0.261	G	100.0			Save £1 on Tesco or Finest fresh pre-packed salmon	1	100G	[12 Smoked salmon (Salmo salar) rolls, 4 with soft cheese, salmon and dill, 4 with soft cheese and lemon filling, and 4 with soft cheese, red pepper and paprika filling., Melt in the mouth mousses with creamy soft cheese, pieces of Atlantic salmon and seasoning all wrapped up in swathes of tender smoked salmon, from Scotland and Norway. Individually infused with lemon, dill, paprika and pepper flavours, these mini mousses are excellent when served as appetisers or part of a buffet. Find more sensational finger food ideas at www.tesco.com/realfood]	http://img.tesco.com/Groceries/pi/230/5054402953230/IDShot_90x90.jpg	Tesco Smoked Salmon Appetisers 100G	2.5	63753926	2.5
89	0.11	G	100.0	False	True	Any 3 for £1.00	1	KG	[Podlaski Poultry Pâté with Tomatoes]	http://img.tesco.com/Groceries/pi/553/5901204002553/IDShot_90x90.jpg	Drosed Podlaski Chicken Pate And Tomatoes 100G	0.45	64961469	4.5
90	0.278	G	300.0	False		£1 WYS £5 on fresh pre-packed meat and fish	1	KG	[Smoked rindless back bacon rashers with added water, 12 THIN CUT SMOKED BACK BACON RASHERS]	http://img.tesco.com/Groceries/pi/839/5052910804839/IDShot_90x90.jpg	Tesco Smoked Thin And Crispy Bacon 300G	2.0	73470063	6.67
91	0.807	G	640.0			£1 WYS £5 on fresh pre-packed meat and fish	1	KG	[Boneless basted turkey breast joint with added water and milk proteins from cow's milk seasoned with black pepper, Fresh british turkey selected from Tesco approved farms across East Anglia are used to produce this breast joint. Basted for a succulent and delicious savory flavour finished with a crushed black pepper sprinkle]	http://img.tesco.com/Groceries/pi/540/5052004647540/IDShot_90x90.jpg	Tesco Butter Basted Turkey Breast Joint 640G	5.0	51501620	7.82
92	0.194	G	158.0	False			1	100G	[Pieces of cooked pork sausagemeat and egg omelette with hash browns, crispy bacon and processed cheese slices served in a white tortilla wrap.]	http://img.tesco.com/Groceries/pi/135/5023823004135/IDShot_90x90.jpg	Heat Em Up Tesco Breakfast Wrap 158G	1.0	81051904	0.633
93	0.4	G	400.0				1	G	[Chicken breast pieces in a rich and creamy white sauce]	http://img.tesco.com/Groceries/pi/716/5000232846716/IDShot_90x90.jpg	Princes Chicken White Sauce 400G	1.0	76055130	0.0
94	0.234	G	200.0	False			1	KG	[Portions formed from marinated chunks of chicken breast coated in breadcrumbs blended with red pepper, parsley and spices, prefried., For more, visit birdseye.co.uk, Visit birdseye.co.uk for more ideas]	http://img.tesco.com/Groceries/pi/537/5000116110537/IDShot_90x90.jpg	Birds Eye 2 Hot And Spicy Chicken 200G	1.5	80830664	7.5
95	0.342	KG	0.25				1	KG	[Chopped and shaped chicken with added wheat protein with a garlic filling in a crispy breadcrumb coating, Everyday Value 2 Chicken kievs]	http://img.tesco.com/Groceries/pi/345/5051898462345/IDShot_90x90.jpg	Tesco Everyday Value 2 Chicken Kievs 250G	0.88	60590810	3.52
96	1.292	CL	75.0				1	75CL	[Red Wine, Wine of South Eastern Australia, A smooth, medium bodied red with berry fruit flavours. Grown in the warm, sunny vineyards of South Eastern Australia. Serve with any red meat dishes, pizza or pasta.]	http://img.tesco.com/Groceries/pi/027/5018374186027/IDShot_90x90.jpg	Tesco Australian Red 75Cl	3.75	51447943	3.75
97	0.413	G	397.0				1	KG	[8 Beef burgers made with chopped and shaped beef with onion, rusk and seasoning., 8 Beef Burgers]	http://img.tesco.com/Groceries/pi/758/5053947126758/IDShot_90x90.jpg	Tesco Everyday Value 8 Beef Burgers 397G	1.1	73837212	2.78
98	2.353	KG	1.0			£1 WYS £5 on fresh pre-packed meat and fish	4	KG	[Our succulent silverside joint is matured for at least 21 days to tenderise it, and is vacuum packed for added tenderness. It comes from prime cattle raised to, Tesco’s high welfare standards on quality assured farms in Britain and Ireland., Farms supplying our beef also have standards of quality, animal husbandry and, welfare informed by the Tesco Livestock Code of Practice., Around 5 120g servings per kg. Get creative with our delicious beef dinner, ideas at  http://realfood.tesco.com/]	http://img.tesco.com/Groceries/pi/000/0244200000000/IDShot_90x90.jpg	Tesco Large Beef Roasting Joint With Basting Fat	10.0	72706127	10.0
99	0.968	G	700.0	False	True	Save £1.00 Was £6.00 Now £5.00	1	KG	[Roast in the bag Beef Joint.]	http://img.tesco.com/Groceries/pi/679/5054402552679/IDShot_90x90.jpg	Tesco Roast In The Bag Beef Joint Basting Fat 700G	5.0	78238971	7.15
0	0.913	G	800.0				1	KG	[Boneless chicken breast joint with added water and butter basting., Chicken Breast Joint with Butter baste]	http://img.tesco.com/Groceries/pi/360/5052909571360/IDShot_90x90.jpg	Tesco Simply Chicken Breast Joint 800G	3.75	56565038	4.69
1	0.434	KG	1.0	False		£1 WYS £5 on fresh pre-packed meat and fish	4	KG	[Tesco’s sirloin steak is a very succulent cut of beef prized for its full, flavour and tenderness. In addition, our delicious Finest beef comes from, younger cattle raised on Red Tractor assured farms in Britain, and is trimmed, to our highest standard by skilled butchers. We also mature the beef longer on, the bone and for 28 days altogether and it is now vacuum packed, to ensure the, best flavour and tenderness. Farms supplying our Finest beef have standards of, quality, animal husbandry and welfare informed by the Tesco Livestock Code of, Practice., Shallow fry and serve your steak for 2, with a side of healthy greens. Try our, tenderstem and beef pattini salad recipe at http://realfood.tesco.com/]	http://img.tesco.com/Groceries/pi/000/0231510000000/IDShot_90x90.jpg	Tesco Finest 1 Pack Sirloin Steak	22.0	58297398	22.0
2	0.189	G	141.0				1	100G	[Cooked pork sausagemeat pattie and an egg omelette with a slice of processed cheese served in a bread bun.]	http://img.tesco.com/Groceries/pi/210/5023823004210/IDShot_90x90.jpg	Heat Em Up- Tesco Breakfast Butty 141G	1.0	81068113	0.709
3	0.165	G	120.0	False			1	100G	[Southern Style BBQ Flavour Corn Snack]	http://img.tesco.com/Groceries/pi/002/5000328594002/IDShot_90x90.jpg	Walkers Bugles Southern Style Bbq 6X20g	1.5	81234562	1.25
4	0.328	G	160.0	False		£1 WYS £5 on fresh pre-packed meat and fish	1	KG	[Oak and beech smoked Wiltshire cured rindless back bacon medallions with added water., TRADITIONALLY CURED: Steeped in an aged brine. Matured and smoked over oak and beech, for a really rich flavour.]	http://img.tesco.com/Groceries/pi/164/5052910805164/IDShot_90x90.jpg	Tesco Finest Smoked Bacon Medallions 160G	2.5	73470535	15.63
5	0.151	G	150.0				1	100G	[Roast Lamb and Rosemary seasoned potato crisps]	http://img.tesco.com/Groceries/pi/174/5060042649174/IDShot_90x90.jpg	Tyrrells Sunday Best Roast Lamb Crisps 150G	1.99	80053846	1.33
6	0.851	G	792.0		True	Save £1.00 Was £4.00 Now £3.00	1	KG	[Nugget formed form chopped and marinated breast, coated in wholegrain breadcrumbs, prefried., For more, visit birdseye.co.uk]	http://img.tesco.com/Groceries/pi/841/5000116110841/IDShot_90x90.jpg	Birds Eye 38 Chicken Nuggets 792G	3.0	80831219	3.79
7	0.471	G	454.0				1	KG	[4 Aberdeen Angus quarter pound beef burgers enhanced with sea salt and cracked black pepper, Country Store Aberdeen Angus 4 Quarter pounder beef burgers]	http://img.tesco.com/Groceries/pi/734/5053947126734/IDShot_90x90.jpg	Country Store Aberdeen Angus 4 Quarter Pounders 454G	2.19	73837206	4.83
8	0.5	G	412.0	False			1	100G	[A meal kit comprising pad thai noodles, pad thai sauce and a peanut & vegetable garnish, Just add chicken or prawns, an egg and a splash of oil]	http://img.tesco.com/Groceries/pi/917/5052910832917/IDShot_90x90.jpg	Tesco Pad Thai Meal Kit 412G	1.99	73490010	0.483
9	0.84	SNGL	1.0				1	EACH	[Electric Wax Melter Summer Delights]	http://img.tesco.com/Groceries/pi/233/5011417564233/IDShot_90x90.jpg	Airwick Life Scent Wax Melt Summer Delight	7.0	79802526	7.0
10	0.517	KG	1.0			£1 WYS £5 on fresh pre-packed meat and fish	4	KG	[Sliced Pork Liver]	http://img.tesco.com/Groceries/pi/000/0236390000000/IDShot_90x90.jpg	Tesco Pigs Liver	1.7	51571426	1.7
11	0.276	G	240.0		True	Any 3 for 2 Cheapest Product Free	1	KG	[Prefried chicken portions formed from marinated chunks of chicken breast with a garlic and herb filling coated in breadcrumb., For more, visit birdseye.co.uk]	http://img.tesco.com/Groceries/pi/787/5000116108787/IDShot_90x90.jpg	Birds Eye Inspirations 2 Chicken With Garlic And Herb Sauce 240G	2.0	76088465	8.34
12	0.392	G	300.0	True			1	100G	[6 Outrageously Succulent Vegetarian Chorizo & Red Pepper Sausages]	http://img.tesco.com/Groceries/pi/708/5056053300708/IDShot_90x90.jpg	Linda Mccartney Chorizo Sausage 300G	1.95	81767098	0.65
13	0.83	G	832.0	False			1	100G	[Strawberry Flavour Jelly]	http://img.tesco.com/Groceries/pi/524/5060391621524/IDShot_90x90.jpg	Hartleys Multipack Ready To Eat Strawberry Jelly 6 X 125G	2.35	81344466	0.283
14	0.5	G	400.0	False		£1 WYS £5 on fresh pre-packed meat and fish	1	KG	[Chicken sausage., Butcher's Choice Chicken Sausages 400g]	http://img.tesco.com/Groceries/pi/329/5054775603329/IDShot_90x90.jpg	Tesco 6 British Chicken Sausages 400G	1.5	80845301	3.75
15	4.73	KG	1.0				3	KG	[Medium rare cooked and roasted Scotch topside of beef., Finest topside of medium rare beef roasted for that extra succulence and flavour.]	http://img.tesco.com/Groceries/pi/000/0212090000000/IDShot_90x90.jpg	Tesco Finest Counter Medium Rare Roast Beef	20.0	64391671	20.0
16	0.636	KG	0.454			£1 WYS £5 on fresh pre-packed meat and fish	1	KG	[Thick Succulent Pork Sausages]	http://img.tesco.com/Groceries/pi/109/5000187113109/IDShot_90x90.jpg	Walls Classic 8 Pork Sausages 454G	2.0	63036121	4.41
17	0.175	ML	150.0				1	100ML	[Pain Relief Spray]	http://img.tesco.com/Groceries/pi/513/5011501040513/IDShot_90x90.jpg	Deep Heat Spray 150Ml	3.0	56168378	2.0
18	0.348	G	290.0		True	Any 3 for £10.00	1	100G	[Tesco Ultra Slim meal replacement shake for weight control, milk chocolate flavour with sugars and sweetener., Tesco Ultra Slim Chocolate Flavour Meal Replacement Powder]	http://img.tesco.com/Groceries/pi/943/5052910473943/IDShot_90x90.jpg	Tesco Ultraslim Chocolate 10X29grams	4.0	73023490	1.38
19	0.09	G	240.0		True	Any 3 for £5.00	1	KG	[Best of British Sausages are meat free and made with mycoprotein., To discover lots of Quorn recipes visit www.quorn.co.uk]	http://img.tesco.com/Groceries/pi/936/5019503021936/IDShot_90x90.jpg	Quorn Best Of British Sausages 240G	2.5	71842104	10.42
20	0.825	G	620.0			£1 WYS £5 on fresh pre-packed meat and fish	1	KG	[Gammon joint with added water and honey glaze., Succulent gammon with a sticky honey glaze]	http://img.tesco.com/Groceries/pi/019/5054269603019/IDShot_90x90.jpg	Tesco Gammon Joint With Honey Glaze 620G	5.0	50426336	8.07
21	0.288	G	245.0				1	100G	[Carrot and courgette with sweet chilli marinated chicken breast, edamame soya beans and coriander with a Vietnamese inspired dressing., Spiralised vegetables in a tangy Vietnamese inspired dressing with sweet chilli chicken.]	http://img.tesco.com/Groceries/pi/339/0000003268339/IDShot_90x90.jpg	Tesco Thai Chicken With Spiralised Salad 245G	3.0	81188921	1.23
22	0.5	G	400.0		True	Any 2 for £2.00	1	KG	[Chicken breast pieces in a medium curry sauce with yogurt, double cream, tomatoes and aromatic spices.]	http://img.tesco.com/Groceries/pi/289/5010204733289/IDShot_90x90.jpg	Tesco Chicken Tikka Masala 400G	1.29	57538999	3.23
23	0.478	G	400.0		True	Save 58p Was £2.58 Now £2.00	1	KG	[Stewed Steak in a rich meaty gravy]	http://img.tesco.com/Groceries/pi/235/5000232859235/IDShot_90x90.jpg	Princes Stewed Steak In Gravy 400G	2.0	50646323	5.0
24	0.261	G	180.0	False		£1 WYS £5 on fresh pre-packed meat and fish	1	100G	[Piri piri chilli sauce with lemon & a touch of garlic, Piri Piri Pour Over Sauce]	http://img.tesco.com/Groceries/pi/388/5053947796388/IDShot_90x90.jpg	Tesco Piri Piri Sauce 180G	1.0	73447247	0.556
25	0.114	G	85.0	False	True	Save 34p Was £1.09 Now 75p	1	KG	[Pasta in a Cajun style sauce., facebook.com/mugshotuk]	http://img.tesco.com/Groceries/pi/244/5050665030244/IDShot_90x90.jpg	Mugshot Big Eat Cajun 85G	0.75	79605155	8.83
26	0.367	G	275.0			£1 WYS £5 on fresh pre-packed meat and fish	1	KG	[Cooked Pork Sausages]	http://img.tesco.com/Groceries/pi/117/5000187145117/IDShot_90x90.jpg	Walls Ready Baked Pork Sausages 275G X6	2.0	63256046	7.28
27	0.54	G	340.0	False		£1 WYS £5 on fresh pre-packed meat and fish	1	KG	[Formed seasoned lamb grillsteaks with rosemary., Tasty and tender, seasoned with rosemary.]	http://img.tesco.com/Groceries/pi/291/5054402666291/IDShot_90x90.jpg	Tesco 2 Lamb Grill Steaks With Rosemary 340G	2.0	78393198	5.89
28	0.1	SNGL	1.0				1	EACH	[Wax Melts - Spiced Apple & Cinnamon]	http://img.tesco.com/Groceries/pi/261/5000204811261/IDShot_90x90.jpg	Glade Wax Melt Refill Apple And Cinnamon	4.0	79800148	4.0
29	0.533	G	370.0	False	True	Any 2 for £6.00	1	KG	[Skinless chicken breast fillets in a tikka marinade with tikka sauce., Glossy marinated chicken Tikka breasts with a smooth Tikka sauce. Oven ready and cooks in 35 minutes, serving 2 people. Why not try with aromatic pilau rice and naan bread?]	http://img.tesco.com/Groceries/pi/357/5053947598357/IDShot_90x90.jpg	Tesco 2 Chicken Breast Fillets With Tikka Masala Sauce 370G	3.5	74439025	9.46
30	0.266	G	220.0				1	100G	[Cooked seasoned beef burger with added soya and a slice of processed cheese served in a sesame seeded bread bun with a portion of chips.]	http://img.tesco.com/Groceries/pi/012/5023823004012/IDShot_90x90.jpg	Heat Em Up-Tesco Cheese Burger And Chips 220G	1.0	81050782	0.455
31	0.196	G	175.0		True	Any 6 for £3.00	1	100G	[Cranberry & Raspberry flavour jelly made with sweeteners, Like us on Facebook at www.facebook.com/hartleysjelly, Follow us on Twitter @hartleysjelly]	http://img.tesco.com/Groceries/pi/135/5000354163135/IDShot_90x90.jpg	Hartley's Ready To Eat Reduced Sugar Cranberry & Raspberry Jelly 175G	0.69	59357599	0.394
32	0.088	G	80.0	False			1	100G	[Mama - Thai Green Curry Flavour Instant Fried Rice with Fish]	http://img.tesco.com/Groceries/pi/011/8851876010011/IDShot_90x90.jpg	Mama Thai Green Curry Rice With Fish Meat 80G	1.2	74746047	1.5
33	0.22	G	200.0				1	100G	[Chunky Pieces of Cured Chopped Pork, Find us on Facebook]	http://img.tesco.com/Groceries/pi/057/5010801001057/IDShot_90x90.jpg	Pek Chopped Pork 200G Can	1.49	50351781	0.745
34	0.776	G	667.0	False		£1 WYS £5 on fresh pre-packed meat and fish	1	KG	[Pork blended with Bramley apple, dried apple, honey and seasonings filled into natural pork casings., 10 BRITISH PORK & BRAMLEY APPLE SAUSAGES]	http://img.tesco.com/Groceries/pi/243/5053947859243/IDShot_90x90.jpg	Tesco Finest British 10 Pork And Apple Sausages 667G	3.5	66265576	5.25
35	1.569	KG	1.45		True	Save £1.50 Was £6.50 Now £5.00	1	KG	[Chicken tikka masala, chicken korma, 4 onion bhajis, pilau rice and 2 naan breads., TESCO TIKKA / KORMA MEAL FOR TWO 1.45Kg]	http://img.tesco.com/Groceries/pi/817/5054402152817/IDShot_90x90.jpg	Tesco Tikka And Korma Meal For Two 1.45Kg	5.0	52890997	3.45
36	0.82	G	400.0				1	KG	[Shaped minced beef with kidney and pinto beans in a spicy chili sauce.]	http://img.tesco.com/Groceries/pi/776/0071106061776/IDShot_90x90.jpg	Stagg Chili Classic Chili Con Carne 400G	1.79	54384142	4.48
37	0.553	G	525.0				1	100G	[Roasted chicken wings coated in a hot and spicy glaze, Tasty and ready to eat hot or cold. Turn up the heat with these hot and spicy British chicken wings   the ultimate finger food. Easy to prepare and messy fun to eat, they’re a hit at parties or picnics and a must have for big nights in with a movie. Hot & spicy wings are perfect for sharing so try serving with a tear 'n' share tomato & garlic flatbread, a bowl of fresh salad and cool off with a sour cream & chive dip. For more chicken recipes check out Tesco Real Food.]	http://img.tesco.com/Groceries/pi/482/5053947788482/IDShot_90x90.jpg	Tesco British Ready To Eat Hot And Spicy Roast Chicken Wings 525G	3.0	54412790	0.571
38	0.679	G	700.0	False		£1 WYS £5 on fresh pre-packed meat and fish	1	KG	[Chicken breast fillets in a crispy breadcrumb coating, For stress free school night teatimes rustle up our 100% chicken breast fillets in a light, crispy crumb. Easy to prepare and perfect with salad or seasonal veg, and for building burgers, they are a hit with kids and a must have for speedy midweek meals. For a fun diner style dinner serve your chicken fillets in crusty rolls with lettuce, tomato and cool mayonnaise. Instead of chunky chips why not try our Real Food recipe: Sweet potato fries and a crisp salad.]	http://img.tesco.com/Groceries/pi/373/5053526492373/IDShot_90x90.jpg	Tesco 4 Breaded Chicken Breast Fillets 700G	5.0	57539802	7.15
39	0.39	G	390.0			£1 WYS £5 on fresh pre-packed meat and fish	1	KG	[Chopped and shaped turkey coated in breadcrumbs.]	http://img.tesco.com/Groceries/pi/411/5010236061411/IDShot_90x90.jpg	Bernard Matthews Breaded Turkey Escalopes 390G	2.5	53578577	6.42
40	0.65	G	400.0				1	100G	[Parma ham   Italian dry cured ham made from whole pork leg; salami Milano   seasoned pork salami; coppa ham   dry cured pork flavoured with spices; salami spianata piccante   spicy pork salami., Delicate slices of finest Parma Ham with Coppa, Salami Milano and Salami Spianata Piccante.]	http://img.tesco.com/Groceries/pi/084/5054775603084/IDShot_90x90.jpg	Easy Entertaining Finest Italian Meat Selection 400G Serves 6-8	10.0	80844976	2.5
41	0.408	KG	1.0	False		£1 WYS £5 on fresh pre-packed meat and fish	4	KG	[Finest Beef Fillet Steaks. Ideal for frying]	http://img.tesco.com/Groceries/pi/000/0242860000000/IDShot_90x90.jpg	Tesco Finest 1 Beef Fillet Steak	34.0	72264925	34.0
42	0.576	KG	1.0	False	True	Save £2.00 PER KG Was £15.38 PER KG Now £13.38 PER KG	4	KG	[Selected for a fuller flavour., 21 day matured. Hand trimmed. Prime beef.]	http://img.tesco.com/Groceries/pi/000/0231320000000/IDShot_90x90.jpg	Tesco 2 Beef Rump Steaks	13.38	51330735	13.38
43	0.117	G	100.0				1	KG	[Quorn Smoky Ham Slices are meat free and made with mycoprotein., To discover lots of Quorn recipes and to explore the whole range simply visit www.quorn.co.uk, Facebook, Twitter, Pinterest @Quornfoods, www.facebook.com/Quornfoods]	http://img.tesco.com/Groceries/pi/625/5019503020625/IDShot_90x90.jpg	Quorn Smokey Ham Style Slices 100G	1.5	66028938	15.0
44	0.569	G	425.0	False	True	Save 99p Was £1.99 Now £1.00	1	KG	[Minced beef & onion in gravy topped with puff pastry]	http://img.tesco.com/Groceries/pi/503/5012427043503/IDShot_90x90.jpg	Fray Bentos Mince Beef And Onion Pie 425G	1.0	51426761	2.36
45	0.595	G	540.0			£1 WYS £5 on fresh pre-packed meat and fish	1	KG	[Chopped and shaped chicken in a crispy breadcrumb coating., Chopped and shaped chicken pieces in a crispy breadcrumb coating. Farms supplying our poultry are all recognised by national farm assurance schemes with standards of quality, animal husbandry and welfare informed by the Tesco Livestock Code of Practice. Cook in the oven. Perfect with a green salad and creamy dressing in a soft tortilla.]	http://img.tesco.com/Groceries/pi/421/5054268892421/IDShot_90x90.jpg	Tesco Breaded Chicken Goujons 540G	3.5	77393885	6.49
46	0.163	G	120.0				1	100G	[Cooked, formed ham with herbs and spices., Succulent pork leg, carefully rolled in a fragrant blend of Juniper, marjoram, oregano, thyme, parsley and fennel.]	http://img.tesco.com/Groceries/pi/357/5054269107357/IDShot_90x90.jpg	Tesco Finest Tuscan Cooked Ham 120G	2.65	78866324	2.21
47	0.605	KG	1.0			£1 WYS £5 on fresh pre-packed meat and fish	4	KG	[Tesco’s sirloin steak is a very succulent cut of beef prized for its full, flavour and tenderness. In addition, our delicious Finest beef comes from, younger cattle raised on Red Tractor assured farms in Britain, and is trimmed, to our highest standard by skilled butchers. We also mature the beef longer on, the bone and for 28 days altogether and it is now vacuum packed, to ensure the, best flavour and tenderness. Farms supplying our Finest beef have standards of, quality, animal husbandry and welfare informed by the Tesco Livestock Code of, Practice., Shallow fry and serve your steak for 2, with a side of healthy greens. Try our, tenderstem and beef pattini salad recipe at http://realfood.tesco.com/]	http://img.tesco.com/Groceries/pi/000/0230080000000/IDShot_90x90.jpg	Tesco Finest 2 Beef Sirloin Steak	22.0	51714783	22.0
48	0.367	G	300.0	False	True	Save 20p Was £1.15 Now 95p	1	KG	[Pork luncheon meat finely minced, sterilised.]	http://img.tesco.com/Groceries/pi/418/5907501002418/IDShot_90x90.jpg	Pamapol Konserwa Turystyczna 300G	0.95	65167538	3.17
49	0.1	SNGL	1.0				1	EACH	[Wax Melts - Bali Sandalwood & Jasmine]	http://img.tesco.com/Groceries/pi/292/5000204811292/IDShot_90x90.jpg	Glade Wax Melt Refill Bali And Sandlewood	4.0	79800234	4.0
50	0.784	G	500.0	False		£1 WYS £5 on fresh pre-packed meat and fish	1	KG	[Our succulent silverside joint is matured for at least 21 days to tenderise it, and is vacuum packed for added tenderness. It comes from prime cattle raised to, Tesco’s high welfare standards on quality assured farms. Farms supplying our, beef also have standards of quality, animal husbandry and welfare informed by, the Tesco Livestock Code of Practice., Around 5 120g servings per kg. Get creative with our delicious beef dinner, ideas at  http://realfood.tesco.com/]	http://img.tesco.com/Groceries/pi/795/5052910887795/IDShot_90x90.jpg	Tesco Small Beef Silverside Roast Joint 500G	5.5	73570987	11.0
51	0.5	G	400.0	False			1	KG	[Pieces of beef in gravy., No artificial preservatives, flavours or colours]	http://img.tesco.com/Groceries/pi/341/5052109965341/IDShot_90x90.jpg	Tesco Everyday Value Stewed Steak And Gravy 400G	1.4	70822292	3.5
52	0.75	G	720.0	False			1	100G	[Hot Dogs made with mechanically recovered turkey and chicken, and pork in brine.]	http://img.tesco.com/Groceries/pi/659/4010142055659/IDShot_90x90.jpg	Wikinger Hot Dogs 1030G	1.99	67485354	0.276
53	0.65	G	340.0	False			1	KG	[Ackees in Brine, For authentic Caribbean cooking tips simply visit, www.reggaekitchen.co.uk, Why not join Chef LeRoy in the Reggae Kitchen and learn how to make the perfect Callaloo and Saltfish plus he's got a host of top tips and other delicious Caribbean dishes., Visit: reggaekitchen.co.uk]	http://img.tesco.com/Groceries/pi/613/5020580161613/IDShot_90x90.jpg	Jamaicas Pride Ackees 540G	4.29	52172943	12.62
54	0.455	G	392.0		True	Any 2 for £2.00	1	KG	[Minced beef and onion in gravy]	http://img.tesco.com/Groceries/pi/012/5052909937012/IDShot_90x90.jpg	Tesco Minced Beef With Onion 392G	1.29	53854452	3.3
55	1.105	CL	75.0				1	75CL	[Shiraz, Wine of South Eastern Australia, A rich Shiraz with cherry, plum and damson fruit flavours. Made from Shiraz grapes grown in the warm sunny vineyards of South Eastern Australia. Serve with pasta dishes, red meats and BBQ foods.]	http://img.tesco.com/Groceries/pi/999/5054775860999/IDShot_90x90.jpg	Tesco Australian Shiraz 75Cl	3.95	81091608	3.95
56	1.025	G	700.0	False		£1 WYS £5 on fresh pre-packed meat and fish	1	KG	[Fresh chicken breast crown with garlic and rosemary coating, garnished with garlic and rosemary butter., British Chicken Crown with Garlic & Rosemary. Garlic and rosemary butter. Ready to roast.]	http://img.tesco.com/Groceries/pi/138/5053947795138/IDShot_90x90.jpg	Tesco Garlic And Rosemary Chicken Crown 700G	5.0	74760818	7.15
57	0.696	G	600.0				1	100G	[Ready to Eat UHT Custard, Delicious hot or cold]	http://img.tesco.com/Groceries/pi/500/5018374038500/IDShot_90x90.jpg	Tesco Ready To Eat Custard 4X150g	1.37	51215659	0.228
