	AverageSellingUnitWeight	ContentsMeasureType	ContentsQuantity	IsNew	IsSpecialOffer	PromotionDescription	UnitOfSale	UnitQuantity	description	image	name	price	tpnb	unitprice
93	0.667	KG	1.0			£1 WYS £5 on fresh pre-packed meat and fish	4	KG	[Rack of Pork Ribs, Rib Rack]	http://img.tesco.com/Groceries/pi/000/0244100000000/IDShot_90x90.jpg	Woodside Farms Rack Of Ribs	4.99	81026647	4.99
94	1.185	KG	1.0	False		£1 WYS £5 on fresh pre-packed meat and fish	4	KG	[Bone in. Slow cook. Selected for a fuller flavour., Tender and succulent leg shanks]	http://img.tesco.com/Groceries/pi/000/0247310000000/IDShot_90x90.jpg	Tesco Lamb Leg Shanks	7.0	61369486	7.0
95	0.02	G	20.0				1	100G	[Sea Salt Popcorn, Follow us on Facebook]	http://img.tesco.com/Groceries/pi/274/5000328573274/IDShot_90x90.jpg	Walkers Sunbites Popcorn Salted 20G	0.75	80917502	3.75
96	1.16	KG	1.0				1	KG	[Class A chicken thighs skin on, Tesco Class A Chicken Thighs skin on]	http://img.tesco.com/Groceries/pi/742/5051790471742/IDShot_90x90.jpg	Tesco Chicken Thighs 1Kg	2.5	56925638	2.5
97	0.133	G	97.0				1	100G	[Cooked back bacon served in a bread bun with sachets of tomato ketchup and brown sauce.]	http://img.tesco.com/Groceries/pi/234/5023823004234/IDShot_90x90.jpg	Heat Em Up - Tesco Bacon Butty 97G	1.0	81068159	1.04
98	0.77	G	115.0	False			1	100G	[Strawberry Flavour Jelly with Sweeteners]	http://img.tesco.com/Groceries/pi/739/5060391621739/IDShot_90x90.jpg	Hartleys Multi No Added Sugar Strawberry Jelly 6 X 115G	2.35	81367220	2.05
99	0.438	G	400.0				1	KG	[45% less saturated fat than butter. 70% blended spread with 31% vegetable oil, 21% olive oil and 18% milk fat., Unilever is committed to sustainable palm oil., Please visit: http://www.unilever.co.uk/sustainable living/sustainablesourcing, Keywords: spread, butter, spreadable butter, Goes Well With: pasta, sauted vegetables, frying meat or fish., For recipes by Gennaro Contaldo visit www.bertolli.co.uk.]	http://img.tesco.com/Groceries/pi/532/8712100575532/IDShot_90x90.jpg	Bertolli With Butter 400G	2.5	76741971	6.25
0	0.402	G	400.0	False	True	Save 49p Was £1.49 Now £1.00	1	100G	[6 Pork Meatballs in a Tomato and Chili Sauce with Red Beans, Spices and Herbs]	http://img.tesco.com/Groceries/pi/525/5022977008525/IDShot_90x90.jpg	Can Cook Mexican Style Pork Meatballs 400G	1.0	81037778	0.25
1	0.28	G	250.0			£1 WYS £5 on fresh pre-packed meat and fish	1	KG	[Seared ostrich meat, individually portioned and packed., For more recipes see www.kleinkaroomeat.com]	http://img.tesco.com/Groceries/pi/231/6008123006231/IDShot_90x90.jpg	Kleinkaroo 2 Ostrich Fillet Steaks 250G	5.0	78940536	20.0
2	0.342	G	227.0	False		£1 WYS £5 on fresh pre-packed meat and fish	1	KG	[Venison burgers, lightly seasoned., Lightly seasoned vension burgers, perfect for any meal occasion.]	http://img.tesco.com/Groceries/pi/861/5054402584861/IDShot_90x90.jpg	Tesco Venison Burgers 227G	3.0	72245073	13.22
3	0.202	SNGL	3.0		True	Any 2 for £5.50	1	EACH	[Tesco Ultra Slim  Meal Replacement Chocolate Crunch, Tesco Ultraslim Meal Replacement Chocolate Crunch Meal Bars (3 x 56g). No artifical preservatives, flavours, colours and hydrogenated fat.]	http://img.tesco.com/Groceries/pi/764/5054402296764/IDShot_90x90.jpg	Tesco Ultra Slim Meal Replacement Chocolate 3 Bars	3.6	77897905	1.2
4	0.2	G	145.0				1	100G	[Spring roll kit, Spring Roll Kit]	http://img.tesco.com/Groceries/pi/728/5053947950728/IDShot_90x90.jpg	Tesco Vietnamese Spring Roll Meal Kit 145G	1.99	76170459	1.38
5	0.092	SNGL	1.0				1	EACH	[Bottle and Teat Brush]	http://img.tesco.com/Groceries/pi/088/5010415323088/IDShot_90x90.jpg	Tommee Tippee Bottle And Teat Brush	2.5	57612312	2.5
6	0.821	KG	1.0	False		£1 WYS £5 on fresh pre-packed meat and fish	4	KG	[Lamb Kidneys]	http://img.tesco.com/Groceries/pi/000/0236450000000/IDShot_90x90.jpg	Tesco Lambs Kidneys	2.99	51571455	2.99
7	0.84	G	840.0	False	True	Save £1.00 Was £5.00 Now £4.00	1	KG	[Smoked gammon joint  made up of  selected cuts of cured pork thick flank or topside with added water., Cured for a fuller, smoky flavour.]	http://img.tesco.com/Groceries/pi/338/5052909185338/IDShot_90x90.jpg	Tesco Gammon Easy Roast Bag 840G - Smoked	4.0	71281537	4.77
8	0.56	G	480.0	False			1	100G	[A meal kit comprising red Thai curry paste, coconut milk, cooked rice and Thai herb garnish., Just add chicken and a splash of oil]	http://img.tesco.com/Groceries/pi/771/5052910832771/IDShot_90x90.jpg	Tesco Red Thai Curry Meal Kit 480G	1.99	73489888	0.415
9	0.066	G	60.0	False			1	100G	[Fudge caramel flavour bar, 18% milk chocolate, 15% caramel flavour layer, with sweeteners., Visit us on facebook or Atkins.com]	http://img.tesco.com/Groceries/pi/031/5060074631031/IDShot_90x90.jpg	Atkins Fudge Caramel 60G	2.2	80817364	3.67
10	0.559	G	450.0	False	True	Any 2 for £6.00	1	KG	[Pork fillet medallions with a tomato, white wine and vegetable sauce, Pork Medallions with a Mediterranean Sauce]	http://img.tesco.com/Groceries/pi/626/5053947597626/IDShot_90x90.jpg	Tesco Pork Fillets With Mediterranean Sauce 450G	3.5	74412978	7.78
11	0.18	G	180.0		True	Any 3 for £5.00	1	KG	[Quorn Classic Burgers are meat free and made with mycoprotein., Mycoprotein is a nutritious form of quality protein, naturally low in fat and high in protein and fibre., To discover lots of Quorn recipes and to explore the whole range, simply visit www.quorn.co.uk, Facebook, Twitter and Pinterest @Quornfoods, www.facebook.com/Quornfoods]	http://img.tesco.com/Groceries/pi/180/5019503024180/IDShot_90x90.jpg	Quorn Classic Burger 180G	2.5	73921711	13.89
12	0.55	G	400.0	False		£1 WYS £5 on fresh pre-packed meat and fish	1	KG	[2 Pekin Duck Breasts Marinated in a Cantonese style plum sauce, These are great with noodles or potatoes and veg, but visit our website for extra inspiration and how to videos., www.gressinghamduck.co.uk]	http://img.tesco.com/Groceries/pi/412/5034231003412/IDShot_90x90.jpg	Gressingham Duck Breasts In Plum Sauce 400G	6.0	71434761	15.0
13	0.522	KG	1.0	False			4	KG	[Cooked and smoked pork lion with added water.]	http://img.tesco.com/Groceries/pi/000/2082412000000/IDShot_90x90.jpg	Morliny Sopocka Smoked Pork Loin	7.0	74189176	7.0
14	0.439	G	400.0	False		£1 WYS £5 on fresh pre-packed meat and fish	1	KG	[Pork blended with cooked hickory marinated pulled pork, red pepper, onion, spices and seasoning, filled into natural pork casings, 6 BRITISH HICKORY SMOKED PULLED PORK SAUSAGES]	http://img.tesco.com/Groceries/pi/863/5054775859863/IDShot_90x90.jpg	Tesco Finest 6 Hickory Smoked Pulled Pork Sausages 400G	2.5	81081540	6.25
15	0.074	G	60.0				1	100G	[Chocolate flavoured high fibre protein bar in a dark chocolate coating with sugar and sweetener., GSK Human Performance Lab, WRU, Informed Sport.com   Trusted by sport, England Rugby, For more information, visit: www.maxinutrition.com, Enjoy as part of a balanced diet and a healthy lifestyle.]	http://img.tesco.com/Groceries/pi/676/5032543001676/IDShot_90x90.jpg	Maximuscle Promax Meal Bar Chocolate 60G	1.85	64024646	3.09
16	0.633	G	540.0				1	100G	[A Cooked and Smoked Pork Sausage]	http://img.tesco.com/Groceries/pi/756/5902160641756/IDShot_90x90.jpg	Morliny Morlinska 540G	3.25	80550027	0.602
17	0.202	SNGL	3.0		True	Any 2 for £5.50	1	EACH	[Tesco Ultra Slim Meal Replacement Raspberry with white chocolate coating, Tesco Ultraslim Meal Replacement Bars. Raspberry with white chocolate coating meal bars (3 x 56g). No artifical preservatives, flavours, colours and hydrogenated fat.]	http://img.tesco.com/Groceries/pi/788/5054402296788/IDShot_90x90.jpg	Tesco Ultra Slim Meal Replacement Raspberry 3 Bars	3.6	77897928	1.2
18	0.093	SNGL	1.0				1	EACH		http://img.tesco.com/Groceries/pi/859/5051622052859/IDShot_90x90.jpg	Tesco Self Service Meat Thermometer	3.0	62614815	3.0
19	0.423	KG	1.0			£1 WYS £5 on fresh pre-packed meat and fish	4	KG	[Delicious great flavour 21 day matured. Prime Beef]	http://img.tesco.com/Groceries/pi/000/0228720000000/IDShot_90x90.jpg	Tesco Beef Steak	10.0	81051524	10.0
20	0.52	KG	1.0				4	KG	[Sliced, cured, cooked and honey roasted formed ham.]	http://img.tesco.com/Groceries/pi/000/0213870000000/IDShot_90x90.jpg	From The Deli Honey Roast Ham 6 Slices	14.6	51244964	14.6
21	2.909	SNGL	1.0	False			1	EACH		http://img.tesco.com/Groceries/pi/664/0000003269664/IDShot_90x90.jpg	Tesco Oriental Woods 3 Pack Wax Melt	1.0	81343093	1.0
22	2.909	SNGL	1.0	True			1	EACH		http://img.tesco.com/Groceries/pi/718/0000003269718/IDShot_90x90.jpg	T.Wax Melt Vanilla Dreams 3 Pack	1.0	81343317	1.0
23	0.6	G	480.0	False			1	100G	[Strawberry flavour jelly]	http://img.tesco.com/Groceries/pi/067/5054268894067/IDShot_90x90.jpg	Tesco Strawberry Jelly 4X120g	1.5	77407681	0.313
24	0.375	G	342.0				1	KG	[Seasoned Pork burger with Sage, Parsley & Black Pepper., 6 Pork & Herb Sausage Patties]	http://img.tesco.com/Groceries/pi/052/5054269765052/IDShot_90x90.jpg	Tesco 6 Pork And Herb Sausage Patties 342G	2.0	79719164	5.85
25	0.3	KG	0.3			£1 WYS £5 on fresh pre-packed meat and fish	1	KG	[Venison Sausages, 6 VENISON SAUSAGES]	http://img.tesco.com/Groceries/pi/974/5051399686974/IDShot_90x90.jpg	Tesco 6 Venison Sausages 300G	3.0	61461432	10.0
26	0.278	G	232.0	True			1	100G	[Rice flour, corn starch and potato starch white rolls., Why not try our frozen free from Petit Pain. These part baked rolls are free from gluten, wheat, egg and dairy, cooking from frozen in 10 minutes.]	http://img.tesco.com/Groceries/pi/040/5057008313040/IDShot_90x90.jpg	Tesco Free From Petit Pain 232G	1.8	81609119	0.776
27	0.285	G	224.0				1	100G	[Tesco Ultra Slim meal replacement strawberry and Banana flavour smoothie for weight control., Tesco Ultraslim Meal replacement Strawberry and banana Smoothie Flavour Powder]	http://img.tesco.com/Groceries/pi/832/5054402746832/IDShot_90x90.jpg	Tesco Ultra Slim Meal Replacement Smoothie Banana And Strawberry 8X28g	3.8	78499914	1.7
28	0.591	KG	0.43	False	True	Any 2 for £6.00	1	KG	[Pork loin steaks with Bramley apple, cider and sage sauce., Fresh Pork loin steaks with a chunky Bramley apple, cider & sage sauce.]	http://img.tesco.com/Groceries/pi/649/5052004647649/IDShot_90x90.jpg	Tesco Pork Loin Steaks With Apple Sauce 430G	3.5	50447000	8.14
29	0.749	KG	1.0			£1 WYS £5 on fresh pre-packed meat and fish	4	KG	[British Turkey Whole Breast Fillet. Naturally lean and high in protein., Hand Trimmed. Fresh class A. Skinless.]	http://img.tesco.com/Groceries/pi/000/0224980000000/IDShot_90x90.jpg	Tesco Whole Turkey Fillet	8.75	74728789	8.75
30	0.176	G	138.0				1	100G	[Cooked pork hot dog sausage served in a subroll with a sachet of tomato ketchup.]	http://img.tesco.com/Groceries/pi/074/5023823004074/IDShot_90x90.jpg	Heat Em Up-Tesco Hot Dog 138G	1.0	81051372	0.725
31	0.263	G	200.0				1	100G	[Corned beef]	http://img.tesco.com/Groceries/pi/091/5000436770091/IDShot_90x90.jpg	Tesco Corned Beef 200G	1.49	54795491	0.745
32	0.994	G	900.0				1	KG	[20 (approx) Thick Pork & Beef seasoned sausages, 20 (approx) Thick Pork & Beef Sausages]	http://img.tesco.com/Groceries/pi/135/5052909825135/IDShot_90x90.jpg	Tesco 20 Thick Pork And Beef Sausages 900G	2.5	50766987	2.78
33	0.23	G	105.0				1	100G	[Bacon Jam, Check out our website for more recipe ideas]	http://img.tesco.com/Groceries/pi/002/5060282470002/IDShot_90x90.jpg	Eat 17 Bacon Jam 105G	2.5	72235177	2.39
34	0.223	G	220.0		True	Any 3 for £5.00	1	KG	[Meat free chicken flavour escalopes, made with mycoprotein topped with Emmental cheese, coated in a crispy coating., To discover lots of Quorn recipes and to explore the whole range, simply visit www.quorn.co.uk]	http://img.tesco.com/Groceries/pi/859/5019503009859/IDShot_90x90.jpg	Quorn 2 Cheese Escalopes 220G	2.5	50609909	11.37
35	1.25	KG	1.0			£1 WYS £5 on fresh pre-packed meat and fish	4	KG	[Bone in, rind on shoulder of pork, Pork Shoulder Joint]	http://img.tesco.com/Groceries/pi/000/0228530000000/IDShot_90x90.jpg	Tesco Bone In Pork Shoulder Joint	2.75	81018219	2.75
36	0.043	G	32.5				1	100G	[Smoky Bacon Flavour Potato Crisps, Follow us on:, Facebook and Twitter, For our latest news and competitions]	http://img.tesco.com/Groceries/pi/507/5000328338507/IDShot_90x90.jpg	Walkers Smokey Bacon Crisps 32.5G	0.55	50550637	1.7
37	0.196	G	196.0	False	True	Any 3 for £5.00	1	KG	[Meat free beef flavour steaks, made with mycoprotein, coated in a cracked pepper marinade., Mycoprotein is a nutritious form of quality protein, naturally low in fat, and high in protein and fibre., To discover lots of Quorn recipes and to explore the whole range, simply visit www.quorn.co.uk, Twitter@Quornfoods, Pintrest@Quornfoods, www.facebook.com/Quornfoods]	http://img.tesco.com/Groceries/pi/508/5019503002508/IDShot_90x90.jpg	Quorn 2 Peppered Steaks 196G	2.5	52609768	12.76
38	0.077	G	60.0	False			1	100G	[Finely chopped, cooked, smoked and dried snacking pork kabanos sausage.]	http://img.tesco.com/Groceries/pi/877/5901784152877/IDShot_90x90.jpg	Morliny Party Snack Classic 60G	1.0	81607473	1.67
39	0.242	G	225.0				1	100G	[Dry cured fermented pork sausage seasoned with smoked paprika & cayenne pepper.]	http://img.tesco.com/Groceries/pi/387/5010292933387/IDShot_90x90.jpg	The Delicatessen Noel Spicy Chorizo 225G	3.0	71356565	1.34
40	0.055	G	47.5				1	100G	[Flame Grilled Steak Flavour Potato Crisps, Snacks can be enjoyed as part of a balanced diet and healthy lifestyle, including regular exercise., mccoys.co.uk, Facebook/mccoyscrisps, Twitter@mccoys]	http://img.tesco.com/Groceries/pi/238/5000237121238/IDShot_90x90.jpg	Mccoys Flame Grilled Steak Crisps 47.5G	0.79	50709745	1.67
41	0.33	G	300.0		True	Save 50p Was £2.50 Now £2.00	1	100G	[A medium minced, cooked, smoked and dried, pork and beef sausage.]	http://img.tesco.com/Groceries/pi/275/5908230513275/IDShot_90x90.jpg	Tarczynski Geesowska Polish Sausages 300G	2.0	79130848	0.667
42	0.18	G	102.0	False			1	100G	[Sterilized canned fish]	http://img.tesco.com/Groceries/pi/631/5900653080631/IDShot_90x90.jpg	Neptun Mackerel Fillets In Oil 170G	1.09	62063585	1.07
43	1.0	SNGL	1.0				1	EACH		http://img.tesco.com/Groceries/pi/067/9771465626067/IDShot_90x90.jpg	Heat	1.75	81050842	1.75
44	0.805	SNGL	1.0		True	Save 50p Was £5.00 Now £4.50	1	EACH		http://img.tesco.com/Groceries/pi/652/5054402991652/IDShot_90x90.jpg	Tesco Toilet Seat Spot	4.5	80059863	4.5
45	0.517	G	425.0	False			1	KG	[4 Burgers in Rich Onion gravy.]	http://img.tesco.com/Groceries/pi/231/5010599007231/IDShot_90x90.jpg	Westler Burgers In Onion Gravy 4 Pack 425G	1.09	67488466	2.57
46	0.525	G	450.0	False	True	Save £1.00 Was £2.99 Now £1.99	1	100G	[Nuts and seeds with toasted oats and honey.]	http://img.tesco.com/Groceries/pi/233/5013803000233/IDShot_90x90.jpg	Eat Natural Breakfast Plus Benefit Honey 450G	1.99	81672653	0.442
47	0.233	G	225.0				1	KG	[Chicken Livers]	http://img.tesco.com/Groceries/pi/019/5025892300019/IDShot_90x90.jpg	Banham Poultry Chicken Livers 225G	0.5	73191784	2.23
48	0.038	G	110.0				1	100G	[Smoky & Sweet, with a Pep in its Step, Check out our website for more recipe ideas]	http://img.tesco.com/Groceries/pi/095/5060282470095/IDShot_90x90.jpg	Eat 17 Chorizo Jam 110G	2.5	77574907	2.28
49	0.276	G	240.0		True	Any 3 for 2 Cheapest Product Free	1	KG	[Chicken portions formed from marinated chunks of chicken breast with a creamy peppercorn filling, coated in breadcrumb, prefried., For more, visit birdseye.co.uk]	http://img.tesco.com/Groceries/pi/647/5000116109647/IDShot_90x90.jpg	Birds Eye Inspirations 2 Chicken With Peppercorn Sauce 240G	2.0	78458744	8.34
50	0.167	G	200.0	False			1	100G	[Formed from cuts of cured chicken breast with added water.]	http://img.tesco.com/Groceries/pi/810/5707196163810/IDShot_90x90.jpg	Tulip Premium Cured Chicken Breast 200G	1.49	75054870	0.745
51	0.41	G	400.0				1	KG	[Shaped minced beef with kidney and pinto beans in a hot chili sauce.]	http://img.tesco.com/Groceries/pi/813/0071106061813/IDShot_90x90.jpg	Stagg Chili Dynamite Hot Chili 400G	1.79	54613903	4.48
52	0.093	G	75.0				1	100G	[Epic Meat Snacks Made with 100% Prime Pork. Cured and Slowly Smoked for a More Intense Taste.]	http://img.tesco.com/Groceries/pi/480/5000178111480/IDShot_90x90.jpg	Mattessons Chorizo Savagers Intense Chilli 3X25g	1.69	81574395	2.26
53	1.25	CL	75.0				1	75CL	[Merlot. Valle Central. Wine of Chile., A soft, smooth red with light red cherry and raspberry flavours. Merlot grapes were sourced from selected vineyards within Chile's Valle Central.  Serve on its own or with lighter red meat dishes.]	http://img.tesco.com/Groceries/pi/773/5054775813773/IDShot_90x90.jpg	Tesco Chilean Merlot 75Cl	4.0	81068919	4.0
54	0.9	G	850.0				1	KG	[Diced Chicken breast fillet  with added water, dextrose and salt., Diced Chicken Breast Fillet]	http://img.tesco.com/Groceries/pi/828/5053526752828/IDShot_90x90.jpg	Tesco Everyday Value Diced Chicken Breast 850G	3.99	75809479	4.7
55	0.208	G	200.0				1	100G	[Chopped ham & pork]	http://img.tesco.com/Groceries/pi/476/5052320503476/IDShot_90x90.jpg	Tesco Chopped Ham And Pork 200G	1.0	67612199	0.5
56	1.4	KG	1.25				1	KG	[Class A whole chicken without giblets., Frozen class A whole chicken without giblets.]	http://img.tesco.com/Groceries/pi/113/5054269765113/IDShot_90x90.jpg	Tesco Frozen Whole Chicken 1.25 Kilograms	2.5	79719274	2.0
57	1.55	KG	1.5			£2 off when you spend £10 on any Asian products	1	KG	[Natco Fine Corn Meal is freshly milled from the grain of golden yellow maize and ground to a superfine texture., Also known as Maize Flour and Polenta, Corn Meal, high in protein and low in fat, is widely used in Mexican and Creole cuisine. Perfect for Italian polenta, American corn bread and Punjabi corn rotis, Natco Fine Corn Meal is 100% natural and free from gluten, preservatives and additives.]	http://img.tesco.com/Groceries/pi/939/5013531212939/IDShot_90x90.jpg	Natco Corn Meal Fine 1.5Kg	1.79	54615544	1.2
58	0.162	G	126.0	False			1	100G	[Slices of mozzarella and mature cheddar cheese and a creamy cheese sauce with diced tomato served in toasted sliced white bread.]	http://img.tesco.com/Groceries/pi/197/5023823004197/IDShot_90x90.jpg	Heat Em Up-Tesco Mozzarella And Tomato Toastie 126	1.0	81068050	0.794
59	0.341	KG	1.0				4	KG	[Sliced, cured and cooked formed ham made from selected cuts of pork leg meat, coated with breadcrumbs., 4 Slices or 6 Slices.]	http://img.tesco.com/Groceries/pi/000/0211360000000/IDShot_90x90.jpg	From The Deli Crumbed Ham 6 Slices	14.6	50966779	14.6
60	0.779	G	600.0	False			1	100G	[Ready to eat low fat UHT custard, A delicious thick and creamy ready to eat custard. Delicious hot or cold]	http://img.tesco.com/Groceries/pi/204/5018374338204/IDShot_90x90.jpg	Tesco Ready To Eat Low Fat Custard 4X150g	1.37	51653059	0.228
61	0.205	G	188.0				1	100G	[Seasoned sausage meat made with British pork, wrapped in an all butter puff pastry., Made in Leicestershire with all butter puff pastry and expertly seasoned succulent British pork.]	http://img.tesco.com/Groceries/pi/627/5054775226627/IDShot_90x90.jpg	Tesco Finest 4 Pork Sausage Rolls 188G	2.5	80384051	1.33
62	0.099	SNGL	1.0				1	EACH	[Life Scents Wax Melts Summer Delights, For ingredients: www.rbeuroinfo.com]	http://img.tesco.com/Groceries/pi/196/5011417564196/IDShot_90x90.jpg	Airwick Air Freshener Life Scents Wax Melts Refill Summer	5.0	79802555	5.0
63	2.909	SNGL	3.0	False			1	EACH		http://img.tesco.com/Groceries/pi/657/0000003269657/IDShot_90x90.jpg	Tesco Wax Melt 3 Pack Delicate Honeysuckle	1.0	81343041	0.333
64	0.33	G	300.0	False			1	100G		http://img.tesco.com/Groceries/pi/435/8433329004435/IDShot_90x90.jpg	El Corte Ingles Assorted Iberian Meats Sliced 300G	12.5	79839684	4.17
65	0.087	G	50.0	False			1	100G	[Cured Iberian Ham.]	http://img.tesco.com/Groceries/pi/762/8410783329762/IDShot_90x90.jpg	Noel Jamon Iberico 50G	3.5	77965543	7.0
66	10.73	G	100.0				1	100G		http://img.tesco.com/Groceries/pi/030/5011501060030/IDShot_90x90.jpg	Deep Freeze Cold Gel 100G	4.75	63110956	4.75
67	0.42	G	400.0	False	True	Save £1.00 Was £3.00 Now £2.00	1	100G	[Sliced, cooked reformed chicken with added water., 15 Slices.]	http://img.tesco.com/Groceries/pi/232/5054775299232/IDShot_90x90.jpg	Tesco Family Pack Chicken 400G	2.0	80474889	0.5
68	0.35	G	150.0	False		£1 WYS £5 on fresh pre-packed meat and fish	1	KG	[Rich, tender and full of flavour., Bone in. Hand trimmed. Grass fed.]	http://img.tesco.com/Groceries/pi/006/5054402198006/IDShot_90x90.jpg	Tesco 2 Lamb Chops 150G	2.0	77786034	13.34
69	0.213	G	200.0				1	KG	[Smoked full fat extra mature cheddar cheese., Made in Somerset by Wykes Farms.]	http://img.tesco.com/Groceries/pi/993/5054269138993/IDShot_90x90.jpg	Tesco Finest Smoked Extra Mat Cheddar 200G	2.5	78911456	12.5
70	3.75	SNGL	1.0		True	Save £5.00 Was £20.00 Now £15.00	1	EACH		http://img.tesco.com/Groceries/pi/941/5013314720941/IDShot_90x90.jpg	Richardson V Sabatier Meat Cleaver	15.0	73700996	15.0
71	0.933	G	900.0			£1 WYS £5 on fresh pre-packed meat and fish	1	KG	[Basted pork loin steaks with added water, Basted Pork Loin Steaks 900g]	http://img.tesco.com/Groceries/pi/474/5054775750474/IDShot_90x90.jpg	Woodside Farms Basted Pork Loin Steaks 900G	3.79	81026457	4.22
72	0.925	G	800.0	False			1	KG	[Boneless chicken breast joint with added water, a butter dressing and a sage and onion stuffing., Chicken Breast Joint with Sage & Onion Stuffing]	http://img.tesco.com/Groceries/pi/407/5052909571407/IDShot_90x90.jpg	Tesco Simply Chicken Breast Joint And Stuffing 800G	3.75	56619531	4.69
73	0.125	G	80.0				1	KG	[Feed Material: Meal Worms for Wild Birds]	http://img.tesco.com/Groceries/pi/011/5011914304011/IDShot_90x90.jpg	Natures Garden Meal Worms 80G	3.0	64740282	37.5
74	0.16	G	160.0			£1 WYS £5 on fresh pre-packed meat and fish	1	100G	[Yorkshire puddings, Traditionally made in the heart of Yorkshire with Free Range Eggs, Light and Crisp]	http://img.tesco.com/Groceries/pi/465/5053947693465/IDShot_90x90.jpg	Tesco Finest Yorkshire Puddings 4 Pack 160G	1.5	74592850	0.938
75	0.108	G	100.0				1	KG	[Tesco Wild Bird Meal Worm, DRIED MEALWORMS]	http://img.tesco.com/Groceries/pi/900/5054268867900/IDShot_90x90.jpg	Tesco Standard Wild Bird Food Meal Worm 100G	2.5	77337982	25.0
76	0.046	G	23.0				1	100G	[Barbeque popped potato chips, Hungry for more? pop over to:, popchips.co.uk, Facebook/popchips, Twitter@popchipsUK, Instagram@popchipsUK]	http://img.tesco.com/Groceries/pi/201/5060292302201/IDShot_90x90.jpg	Popchips Bbq Popped Potato Chips 23G	0.75	72568762	3.27
77	0.03	G	30.0				1	100G	[Sweet and Salty Popcorn, Follow us on Facebook]	http://img.tesco.com/Groceries/pi/007/5000328573007/IDShot_90x90.jpg	Walkers Sunbites Popcorn Sweet And Salty 30G	0.75	80917453	2.5
78	1.0	KG	1.0			£1 WYS £5 on fresh pre-packed meat and fish	4	KG	[British Turkey Drumstick. Perfect for roasts, with skin on for flavour. High in, protein. Fresh Class A.]	http://img.tesco.com/Groceries/pi/000/0252270000000/IDShot_90x90.jpg	Tesco Turkey Drumstick 700-900G	2.84	81017468	2.84
79	0.533	G	460.0	False			1	100G	[Baked vanilla cheesecake made with full fat soft cheese on a gluten free biscuit base, topped with blackcurrants and whole raspberries with a raspberry and blackcurrant sauce, decorated with white chocolate stars., Why not try our frozen free from mixed berry cheesecake with a wheat and gluten free digestive biscuit base, topped with a rich fruit sauce, Raspberries and Blackcurrants, finished with a scattering of white chocolate stars. For an extra treat why not serve it up with a scoop of our delicious Cornish Ice Cream made in Cornwall using clotted cream.]	http://img.tesco.com/Groceries/pi/026/5057008313026/IDShot_90x90.jpg	Tesco Free From Berry Cheesecake 460G	4.0	81609102	0.87
80	0.633	KG	0.45	False	True	Save 50p Was £3.25 Now £2.75	1	KG	[Spatchcock Poussin, The zingy peppers we've added   green, black, white and fresh red   make this poussin great with simple new potatoes and veg, but visit our website for other ideas and how to videos.]	http://img.tesco.com/Groceries/pi/641/5034231003641/IDShot_90x90.jpg	Gressingham Spatchcock Poussin 450G	2.75	66106306	6.12
81	0.303	G	1020.0		True	Any 2 for £8.00	1	KG	[Complete pet food for adults cats., Come and meet me on my very own website, I will tell you all about my favourite foods, special Gourmet offers and promotions and share a world of cat fun with you., www.gourmet cat.co.uk]	http://img.tesco.com/Groceries/pi/465/7613033581465/IDShot_90x90.jpg	Gourmet Perle Delicate Meat's Duo 12X85g	4.5	71169164	4.42
82	0.75	G	750.0	False		£1 WYS £5 on fresh pre-packed meat and fish	1	KG	[Honey cured and glazed British pork topside with added water and pork fat., FINEST Outdoor Bred Honey Cured British Topside Gammon with a blossom honey glaze]	http://img.tesco.com/Groceries/pi/921/5052910804921/IDShot_90x90.jpg	Tesco Finest Honey Gammon Joint 750G	7.0	73470190	9.34
83	0.439	G	400.0	True		£1 WYS £5 on fresh pre-packed meat and fish	1	KG	[Pork blended with oak smoked bacon, breadcrumb, maple syrup, honey, American style mustard, parsley, seasonings and spices, filled into natural pork casings., 6 SMOKED BACON & MAPLE SYRUP PORK SAUSAGES]	http://img.tesco.com/Groceries/pi/924/5054775859924/IDShot_90x90.jpg	Tesco Finest 6 Pork Smoked Bacon And Syrup Sausages 400G	2.5	81081592	6.25
84	0.536	KG	1.0				4	KG	[Smoked and Roasted Polish Ham]	http://img.tesco.com/Groceries/pi/000/2082416000000/IDShot_90x90.jpg	Krakus Smoked And Roasted Ham	9.0	75514349	9.0
85	0.32	G	240.0	False		£1 WYS £5 on fresh pre-packed meat and fish	1	KG	[Unsmoked sweetcured rindless back bacon rashers., 8 Unsmoked Sweetcure Back Bacon Rashers]	http://img.tesco.com/Groceries/pi/623/5052910096623/IDShot_90x90.jpg	Tesco Finest Sweet Cure Bacon 8 Rashers 240G	2.5	64619663	10.42
86	0.673	G	350.0	False		£1 WYS £5 on fresh pre-packed meat and fish	1	KG	[Turkey breast steaks with hot and spicy coating., British Turkey Hot & Spicy Breast Steaks]	http://img.tesco.com/Groceries/pi/474/5053526753474/IDShot_90x90.jpg	Tesco Turkey Breast Hot And Spicy Steaks 350G	3.0	75811222	8.58
