	AverageSellingUnitWeight	ContentsMeasureType	ContentsQuantity	IsNew	IsSpecialOffer	PromotionDescription	UnitOfSale	UnitQuantity	description	image	name	price	tpnb	unitprice
7	0.564	G	513.0				1	KG	[Dippers formed from chopped marinated chicken breast coated in a light batter, prefried., For more, visit birdseye.co.uk]	http://img.tesco.com/Groceries/pi/599/5000116110599/IDShot_90x90.jpg	Birds Eye 28 Crispy Chicken Dippers 513G	3.0	80918377	5.85
8	0.255	G	255.0				1	100G	[Family pack sliced, cooked and roasted topside of beef.]	http://img.tesco.com/Groceries/pi/766/5054268003766/IDShot_90x90.jpg	The Delicatessen Family Pack Roast Beef 255G	4.0	76275318	1.57
9	0.261	G	300.0			£1 WYS £5 on fresh pre-packed meat and fish	1	KG	[Smoked rindless streaky bacon with added water, Northern Irish Smoked Streaky bacon]	http://img.tesco.com/Groceries/pi/147/5053526420147/IDShot_90x90.jpg	Tesco Smoked Streaky Bacon 14 Rashers 300G	2.0	60666975	6.67
10	0.362	ML	250.0	False			1	100ML	[Authentic, extra thick BBQ sauce, deep and smoky., Unleash Your Meat Lust, Flavour fanatics and meat enthusiasts, we call upon you to share your creations., Find us on Twitter, Instagram and Facebook., #Meatlust]	http://img.tesco.com/Groceries/pi/213/5032457707213/IDShot_90x90.jpg	Meat Lust Bbq Mop Sauce 250Ml	2.49	80930488	0.996
11	0.15	G	125.0				1	100G	[Seasoned, cooked and roasted topside of beef, FINEST BRITISH MATURED ROAST TOPSIDE OF BEEF]	http://img.tesco.com/Groceries/pi/319/5057008101319/IDShot_90x90.jpg	Tesco Finest British Topside Of Roast Beef 125G	2.5	74410963	2.0
12	0.683	G	600.0		True	Save 50p Was £3.00 Now £2.50	1	KG	[Skinless and Boneless 90% Chicken Breast Fillets with added water, dextrose and salt, Cook from Frozen Chicken Breast Fillets]	http://img.tesco.com/Groceries/pi/137/5054775147137/IDShot_90x90.jpg	Tesco Chicken Fillets 600G	2.5	80318471	4.17
13	0.144	G	115.0				1	100G	[A selection of cooked German pork sausage: extrawurst, garlic sausage and bierwurst seasoned with mustard., A selection of cooked pork sausages, with spices, garlic & onion.  Perfect, served with crusty bread]	http://img.tesco.com/Groceries/pi/823/5052909256823/IDShot_90x90.jpg	Tesco German Sausage Selection 115G	1.7	51266172	1.48
14	0.658	G	300.0				1	100G	[6 Jumbo Hot Dogs]	http://img.tesco.com/Groceries/pi/361/5010431600361/IDShot_90x90.jpg	Ye Old Oak Jumbo Hot Dogs 560G	1.69	65174869	0.563
15	0.507	G	400.0			£1 WYS £5 on fresh pre-packed meat and fish	1	KG	[Diced beef]	http://img.tesco.com/Groceries/pi/818/5054775750818/IDShot_90x90.jpg	Boswell Farms Diced Beef 400G	2.89	81027145	7.23
16	0.434	G	375.0			£1 WYS £5 on fresh pre-packed meat and fish	1	KG	[Willow Farms chicken reared exclusively for Tesco., Cook up these diced chicken breasts in a curry with rice and naans. Make the, most of your chicken with tasty RealFood recipes to feed your family., Willow Farms chickens are reared to Red Tractor assured welfare standards, to, find out more about our Farms Range visit: www.tesco.com/thefarmsrange]	http://img.tesco.com/Groceries/pi/718/5054775702718/IDShot_90x90.jpg	Willow Farms Diced Chicken Breast 375G	2.29	81017376	6.11
17	0.484	G	320.0		True	Any 2 for £6.00	1	KG	[Slow cooked marinated beef with a sachet of smoky sweet barbecue sauce, Marinated in a blend of spices and slow cooked until it is perfect for shredding, served with a smoky bbq sauce]	http://img.tesco.com/Groceries/pi/184/5054402717184/IDShot_90x90.jpg	Tesco Smoky Bbq Pulled Beef 320G	3.5	78458324	10.94
18	0.137	G	125.0		True	Save 50p Was £2.50 Now £2.00	1	100G	[Seasoned, cooked and roasted formed turkey breasts., Lightly seasoned then gently roasted and caramelised for a delicate flavour.]	http://img.tesco.com/Groceries/pi/296/5057008101296/IDShot_90x90.jpg	Tesco Finest British Roast Turkey Breast 125G	2.0	74410911	1.6
19	0.594	G	454.0			£1 WYS £5 on fresh pre-packed meat and fish	1	KG	[A hearty succulent sausage brimming with coarsely minced pork, spices and a heavy sprinkling of traditional sausage know how., WE BELIEVE., Call us uncompromising, but at BROAD OAK FARM we only specialise in full bodied bangers brimming with prime meat and a GENEROUS splodge of savoury seasonings. We don't believe in feeble flavours or timid tastes. Our scrumptious sausages are primed to tantalise taste buds, because fabulous fare is our specialist subject, PREMIUM PORK SAUSAGES., Often less is more. We often feel naughty taking the credit for something whose very success hinges upon its uncompromising simplicity. Then again, not every savoury food supplier is happy to sit back and let its SAUSAGES take centre stage.]	http://img.tesco.com/Groceries/pi/116/5017317000116/IDShot_90x90.jpg	Broad Oak Farm 8 Premium Pork Sausages 454G	2.5	53097656	5.51
20	0.137	G	125.0				1	100G	[Wiltshire cured ham formed from selected cuts of pork leg meat., Steeped in aged brine and hung on the bone for a richer flavour.]	http://img.tesco.com/Groceries/pi/961/5057008100961/IDShot_90x90.jpg	Tesco Finest Wiltshire Cured Ham 125G	2.5	51152675	2.0
21	0.689	G	400.0			£1 WYS £5 on fresh pre-packed meat and fish	1	KG	[Pork and caramelised onion sausages filled into natural pork casings., Plump, juicy sausages made with our authentic Finest recipe using prime cuts of meat and chopped onions for extra flavour. Our British pork comes from pigs reared on Red Tractor assured farms with standards of quality, animal husbandry and welfare informed by the Tesco Livestock Code of Practice. Oven cook or grill for 2 3 people. Try one of our popular pork recipes at www.tesco.com/realfood]	http://img.tesco.com/Groceries/pi/283/5051898641283/IDShot_90x90.jpg	Tesco Finest 6 British Pork And Onion Sausages 400G	2.5	53319390	6.25
22	0.193	G	75.0	False	True	Any 2 for £1.00	1	100G	[Tuna and Mayonnaise Paste with Minced Haddock, To view our seafood sustainability statement visit princes.co.uk]	http://img.tesco.com/Groceries/pi/313/5000232816313/IDShot_90x90.jpg	Princes Tuna And Mayonnaise Paste 75G	0.69	51181064	0.92
23	0.451	G	300.0		True	Save 50p Was £3.50 Now £3.00	1	KG	[Recipe ready cuts of tender lamb., Grass fed. Selected for succulence and flavour. Delicious slow cooked.]	http://img.tesco.com/Groceries/pi/819/5053526970819/IDShot_90x90.jpg	Tesco Lamb Diced Leg 300G	3.0	64760373	10.0
24	0.047	G	45.0	False			1	100G		http://img.tesco.com/Groceries/pi/962/5026489483962/IDShot_90x90.jpg	Eat Real Hummus Chips Tomato Basil 45G	0.7	77142054	1.56
25	0.113	G	125.0				1	100G	[Smoked, sweet cured ham formed from selected cuts of pork leg meat., Cured and hung on the bone, then gently smoked using applewood chips.]	http://img.tesco.com/Groceries/pi/081/5057008101081/IDShot_90x90.jpg	Tesco Finest British Applewood Smoked Wafer Thin Ham 125G	2.5	60459345	2.0
26	0.46	G	380.0				1	100G	[Family pack slliced, cured and cooked formed ham.]	http://img.tesco.com/Groceries/pi/964/5054268623964/IDShot_90x90.jpg	The Delicatessen Family Pack Yorkshire Ham 380G	4.0	72427365	1.06
27	0.305	G	275.0			£1 WYS £5 on fresh pre-packed meat and fish	1	KG	[unsmoked streaky bacon with added water, Unsmoked Rindless Streaky Bacon Rashers]	http://img.tesco.com/Groceries/pi/655/5054775751655/IDShot_90x90.jpg	Woodside Farms Streaky Bacon 275G	1.04	81029172	3.79
28	0.43	G	340.0	False		£1 WYS £5 on fresh pre-packed meat and fish	1	KG	[85% Chicken Chipolatas with Mozzarella and Tomatoes, What the heck shall we have tonight?, Buck up your mealtime ideas online at www.heckfood.co.uk, For inspiring recipe ideas, go to www.heckfood.co.uk]	http://img.tesco.com/Groceries/pi/040/5060317350040/IDShot_90x90.jpg	Heck Chicken 10 Italia Sausages 340G	3.0	75387769	8.83
29	0.402	KG	0.38				1	KG	[Chopped and shaped chicken breast in a crispy breadcrumb coating, Take a bite of our tasty chicken steaks made with 100% chicken breast meat and coated in crunchy, crispy breadcrumbs. Totally tasty in simple suppers with french fries, frozen peas and a squirt of tomato ketchup   perfect to please those fussy eaters. These chicken steaks cook from frozen in just 32 minutes and are great freezer fillers to be served any way you like. For a healthier option slice up the chicken steak and toss it into a fresh caesar salad with croutons and lettuce leaves.  This product is made with 100% chicken breast with no artificial flavours, colours or preservatives.]	http://img.tesco.com/Groceries/pi/668/5010204929668/IDShot_90x90.jpg	Tesco 4 Breaded Chicken 380G	1.5	57784165	3.95
30	0.408	G	340.0				1	100G	[Corned beef]	http://img.tesco.com/Groceries/pi/022/5000436770022/IDShot_90x90.jpg	Tesco Corned Beef 340G	1.75	54795404	0.515
31	0.355	ML	250.0	False			1	100ML	[Fresh aromatic sweet chilli sauce with ginger & lime., Unleash Your Meat Lust, Flavour fanatics and meat enthusiasts, we call upon you to share your creations., Find us on Twitter, Instagram and Facebook., #Meatlust]	http://img.tesco.com/Groceries/pi/152/5032457707152/IDShot_90x90.jpg	Meat Lust Green Sweet Chilli Sauce 250Ml	2.49	80930471	0.996
32	1.066	KG	1.0	False		£1 WYS £5 on fresh pre-packed meat and fish	4	KG	[For midweek meals that won’t break the budget choose our British chicken, quarters. Lean breast meat left on the bone for extra flavour and succulence., Simply season, marinate and cook until crispy or slow cook for sumptuous, chicken that literally falls off the bone., Click the Recipes tab at the top of this page to find Real Food recipes with, ingredients you can add straight to your basket., Expertly selected for freshness and quality. We care about welfare, that's why, these Tesco chickens are reared by British farmers and enjoy an enriched, environment with natural daylight and bales to improve the activity and, wellbeing of the birds. Our chicken meets Red Tractor standards, as well as our, own strict agricultural requirements.]	http://img.tesco.com/Groceries/pi/000/0255520000000/IDShot_90x90.jpg	Tesco British Chicken Breast Quarters 240G-350G	4.0	54221952	4.0
33	0.654	G	650.0		True	Save £1.00 Was £5.00 Now £4.00	1	KG	[Make light work of midweek meals with our naturally lean and tender British, chicken breast mini fillets. Perfect for fajitas with tortillas, grated cheese,, roasted peppers and red onion or in a stir fry with noodles and bean sprouts., Looking for something everyday easy? Bring a taste of Texmex to your table with, a Tesco fajita kit., Click on the Recipes tab at the top of this page to find Real Food recipes with, ingredients to add straight to your basket., Expertly selected for freshness and quality. We care about welfare, that's why, these Tesco chickens are reared by British farmers and enjoy an enriched, environment with natural daylight and bales to improve the activity and, wellbeing of the birds. Our chicken meets Red Tractor standards, as well as our, own strict agricultural requirements.]	http://img.tesco.com/Groceries/pi/375/5054775750375/IDShot_90x90.jpg	Tesco British Mini Chicken Fillets 650G	4.0	51720245	6.16
34	0.136	G	120.0		True	Save 35p Was £2.35 Now £2.00	1	100G	[Italian sliced pepperoni salami, Finest Italian Pepperoni]	http://img.tesco.com/Groceries/pi/392/5052909459392/IDShot_90x90.jpg	Tesco Finest Italian Pepperoni 120G	2.0	58912854	1.67
35	0.615	G	500.0		True	Save 50p Was £3.00 Now £2.50	1	KG	[Lean pork mince 5% fat., Northern Irish Pork Lean Mince]	http://img.tesco.com/Groceries/pi/261/5000358051261/IDShot_90x90.jpg	Tesco Pork Lean Mince 5% Fat 500G	2.5	53066181	5.0
36	0.028	G	24.0				1	KG	[A complementary pet food for dogs, Vitamin enriched. Vitamin A for healthy skin and eyes, Vitamin D3 for healthy teeth and bones, Vitamin E to aid the Immune system. . No artificial colours or flavours.]	http://img.tesco.com/Groceries/pi/663/5051399081663/IDShot_90x90.jpg	Tesco Meaty Stick Treats For Dogs Beef 24G	0.5	57559421	20.84
37	0.46	G	400.0			£1 WYS £5 on fresh pre-packed meat and fish	1	KG	[Pork blended with sage and seasonings filled into natural pork casings., 6 OUTDOOR BRED BRITISH PORK CUMBERLAND SAUSAGES]	http://img.tesco.com/Groceries/pi/932/5053947858932/IDShot_90x90.jpg	Tesco Finest Outdr Bred 6 British Pork Cumberland Sausages 400G	2.5	51087429	6.25
38	0.117	KG	1.0	False			4	KG	[A traditional Italian dry cured ham, Traditional italian dry cured ham]	http://img.tesco.com/Groceries/pi/000/0211860000000/IDShot_90x90.jpg	From The Deli Sliced Prosciutto	20.0	66811996	20.0
39	0.261	G	180.0	False		£1 WYS £5 on fresh pre-packed meat and fish	1	100G	[A BBQ sauce with tomato & smoked paprika, Pour over BBQ sauce]	http://img.tesco.com/Groceries/pi/173/5053947796173/IDShot_90x90.jpg	Tesco Fresh Bbq Sauce 180G	1.0	65964316	0.556
40	0.137	G	125.0				1	100G	[Wiltshire cured ham formed from selected cuts of pork leg meat, coated with gluten free crumb., Cured and hung on the bone to mature, then rolled in gluten free golden breadcrumbs.]	http://img.tesco.com/Groceries/pi/012/5057008101012/IDShot_90x90.jpg	Tesco Finest Wiltshire Crumbed Ham 125G	2.5	58771948	2.0
41	0.567	KG	1.0			£1 WYS £5 on fresh pre-packed meat and fish	4	KG	[Tesco Fresh Finest Free Range Chicken Skinless Breast Fillets Corn Fed]	http://img.tesco.com/Groceries/pi/000/0253650000000/IDShot_90x90.jpg	Tesco Finest British Cornfed Free Range Chicken Fillets 2 Pack	13.0	72710634	13.0
42	0.568	G	535.0		True	Buy Any 2 Sides and 2 Mains for £6	1	100G	[A pizza base with a sweet chilli tomato sauce, mozzarella and Cheddar cheese topped with sweet chilli flavoured chicken, red pepper, red onion and Jalape&#241;o chilli, Really super tasty pizza dusted with semolina for a satisfying experience. First there's our sweet and sticky sweet chilli sauce. Loaded with cheesy mozzarella and mature cheddar cheese, succulent pieces of sweet chilli glazed chicken, red peppers and red onion that melts into a perfect mess of gooey gorgeousness.]	http://img.tesco.com/Groceries/pi/748/5052910683748/IDShot_90x90.jpg	"Tesco Big Night In Sweet Kickin Chicken 12"" Pizza 535G"	4.0	73324243	0.748
43	0.154	G	125.0		True	Any 2 for £3.00	1	100G	[Wafer thin sliced, cured and cooked formed ham made from selected cuts of pork leg meat, coated with gluten free breadcrumbs., With a gluten free crumb.]	http://img.tesco.com/Groceries/pi/957/5052910531957/IDShot_90x90.jpg	Tesco British Wafer Thin Crumbed Ham 125G	1.8	63967827	1.44
44	0.082	SNGL	70.0				2		[Pork meatballs seasoned with herbs and spices with added water., Seasoned peppery meat balls with pork, pork liver and selected herbs and spices.]	http://img.tesco.com/Groceries/pi/000/0218150000000/IDShot_90x90.jpg	Counter Tesco Faggots	0.4	52293742	0.0
45	0.45	G	454.0			£1 WYS £5 on fresh pre-packed meat and fish	1	KG	[Pork sausage., Butcher's Choice 8 British Lincolnshire Pork Sausages]	http://img.tesco.com/Groceries/pi/280/5051277937280/IDShot_90x90.jpg	Tesco Butchers Choice British 8 Lincolnshire Sausages 454G	1.5	60642220	3.31
46	0.283	G	225.0				1	100G	[Sliced Water Chestnuts with Water, For recipes and more information visit kingfisherfoods.co.uk]	http://img.tesco.com/Groceries/pi/205/5011826420205/IDShot_90x90.jpg	Kingfisher Sliced Water Chestnuts 225G	0.89	73489865	0.396
47	0.188	G	150.0				1	100G	[Steak and ale flavour crinkle cut potato crisps., Thick cut potato crisps with the flavour of grilled beefsteak marinated in real ale.]	http://img.tesco.com/Groceries/pi/106/5054402584106/IDShot_90x90.jpg	Tesco Finest Crinkle Cut Steak&Ale Crisps 150G	1.0	78256004	0.667
48	0.344	G	305.0	False	True	Save 50p Was £2.00 Now £1.50	1	KG	[Chopped and shaped chicken filled with a smoked bacon with added water and cheese sauce in a crispy breadcrumb coating, Packed with popular family friendly flavours, our cheesy Cheddar and bacon chicken kievs are a teatime triumph. The tender 100% chicken breast meat, creamy melting cheese and bacon pieces topped with a light, crisp golden crumb makes dinner delicious. For a low fuss midweek meal add mash to mop up the sauce, or serve on a bed of salad and try cooking up a homemade side like our Salt and vinegar wedges recipe on Real Food.]	http://img.tesco.com/Groceries/pi/375/5053947839375/IDShot_90x90.jpg	Tesco 2 Cheese And Bacon Chicken Kievs 305G	1.5	55755612	4.92
49	0.488	G	400.0	False		£1 WYS £5 on fresh pre-packed meat and fish	1	KG	[97% Pork Sausages, What the heck shall we have tonight?, Buck up your mealtime ideas online at www.heckfood.co.uk, For inspiring recipe ideas, go to www.heckfood.co.uk]	http://img.tesco.com/Groceries/pi/033/5060317350033/IDShot_90x90.jpg	Heck 6 97% Pork Sausages 400G	3.0	73760060	7.5
50	1.3	SNGL	20.0				1	EACH	[Chicken salad   malted brown bread with chicken breast, lemon and black pepper mayonnaise, lettuce, tomato and cucumber. BLT   malted brown bread with sweetcure bacon, tomato, mayonnaise and lettuce. Ham, cheese and pickle   malted brown bread with smoked ham formed from selected cuts of pork leg, Cheddar cheese, lettuce and pickle. Ham and mustard   white bread with smoked reformed ham with added water and mustard mayonnaise. Roast chicken, bacon and stuffing   malted brown bread with roasted chicken breast, mayonnaise, sweetcure bacon and sage and onion stuffing., Hearty fillings including chicken salad; ham, cheese and pickle; BLT; ham and mustard; and chicken, bacon and stuffing, on a choice of malted and soft white bread. Serves 5. 20 pieces.]	http://img.tesco.com/Groceries/pi/747/5052910156747/IDShot_90x90.jpg	Tesco Easy Entertaining 20 Meat Sandwich Platter	12.0	72629610	0.6
51	0.27	G	250.0			£1 WYS £5 on fresh pre-packed meat and fish	1	KG	[Smoked gammon steaks formed meat from selected cuts of cured pork leg with added water., SMOKED GAMMON STEAK]	http://img.tesco.com/Groceries/pi/419/5054775751419/IDShot_90x90.jpg	Woodside Farm Smoked Gammon Steak 250G	1.29	81028668	5.16
52	1.02	G	1020.0				1	KG	[a complete pet food for adult cats, Looks so Tasty  3 x with Chicken & Duck in Jelly, 3 x with Lamb & Heart in Jelly, 3 x with Beef & Kidney in Jelly,  3 x with Pork & Game in Jelly.]	http://img.tesco.com/Groceries/pi/736/5054775296736/IDShot_90x90.jpg	Tesco Cat's Choice Meat And Poutry Multipack 12X85g	2.4	80424108	2.36
53	0.238	G	186.0		True	Save 50p Was £1.50 Now £1.00	1	KG	[Portions of chicken formed from marinated chunks of chicken breast, prefried, seared and glazed., For more, visit birdseye.co.uk, Visit birdeye.co.uk for more ideas]	http://img.tesco.com/Groceries/pi/544/5000116110544/IDShot_90x90.jpg	Birds Eye 2 Original Chicken Chargrills 182G	1.0	53304574	5.38
54	0.413	G	400.0			£1 WYS £5 on fresh pre-packed meat and fish	1	KG	[6 Skinny Pig - Lean British pork sausages, Many of our sausages have enjoyed an award or two: Gold Medal Award   Guild of a Butchers, Gold Award   MLC Regional Excellence Awards, Gold   Smithfield Awards..., ...Voted 'Britain's Best Sausage'  Meat and Poultry News Industry Awards, Best Regional Product (Bronze)   Daily Telegraph Taste of Britain Awards.]	http://img.tesco.com/Groceries/pi/515/5028068000515/IDShot_90x90.jpg	Powters Skinny Pig Pork Sausages 400G (L	3.0	67679367	7.5
55	0.79	KG	0.77				1	KG	[Dippers formed from chopped marinated chicken breast coated in a light batter, prefried., For more, visit birdseye.co.uk]	http://img.tesco.com/Groceries/pi/634/5000116101634/IDShot_90x90.jpg	Birds Eye 42 Crispy Chicken Dippers 770G	4.0	64776118	5.2
56	0.216	G	255.0		True	Save 50p Was £1.50 Now £1.00	1	KG	[Portions formed from marinated chunks of chicken breast coated in a light crispy batter, prefried., Why not try in a wrap..., Visit birdseye.co.uk for more ideas]	http://img.tesco.com/Groceries/pi/506/5000116110506/IDShot_90x90.jpg	Birds Eye 2 Crispy Chicken 180G	1.0	51582603	3.93
57	0.211	G	186.0		True	Save 50p Was £1.50 Now £1.00	1	KG	[Portions of chicken formed from marinated chunks of chicken breast, prefried, seared and coated with a sweet barbecue glaze., For more, visit birdseye.co.uk, Visit birdseye.co.uk for more ideas]	http://img.tesco.com/Groceries/pi/551/5000116110551/IDShot_90x90.jpg	Birds Eye 2 Sticky And Sweet Bbq Chicken Chargrills 186G	1.0	72395954	5.38
58	0.208	G	400.0				1	KG	[Beef & Pork Kidney in Gravy with Suet Pastry.]	http://img.tesco.com/Groceries/pi/709/5012427005709/IDShot_90x90.jpg	Fray Bentos Steak And Kidney Pudding 400G	2.19	50024466	5.48
59	0.56	G	300.0				1	100G	[Check our website for plenty of simple & delicious ways to enjoy our Hot Dogs, www.yeoldeoak.co.uk]	http://img.tesco.com/Groceries/pi/897/5010431600897/IDShot_90x90.jpg	Ye Olde Oak Yoo Premium Jumbo Hot Dogs 560G	1.69	71393802	0.563
60	0.256	G	195.0			£1 WYS £5 on fresh pre-packed meat and fish	1	KG	[BOSWELL FARMS BEEF RIBEYE STEAK]	http://img.tesco.com/Groceries/pi/082/5054775751082/IDShot_90x90.jpg	Boswell Farms Beef Ribeye Steak 195G	2.82	81027963	14.47
61	0.07	G	65.0				1	KG	[A complementary pet food for cats, Vitamin enriched. Vitamin A for healthy skin and eyes, Vitamin D3 for healthy teeth and bones, Vitamin E to aid the Immune system. No artificial colours and flavours. With Added Taurine]	http://img.tesco.com/Groceries/pi/341/5053947492341/IDShot_90x90.jpg	Tesco Cat Treats Pick & Mix Meat 65G	0.8	74323951	12.31
62	0.157	SNGL	3.0				1	EACH	[Pain Relief Back & Shoulder Pain]	http://img.tesco.com/Groceries/pi/494/4987072017494/IDShot_90x90.jpg	Cura Heat Heat Pack 3 Pack	3.5	58523335	1.17
63	0.468	G	340.0	False		£1 WYS £5 on fresh pre-packed meat and fish	1	KG	[Pork sausage., Butcher's Choice 12 British Pork Chipolatas]	http://img.tesco.com/Groceries/pi/507/5051399057507/IDShot_90x90.jpg	Tesco 12 Chipolatas British Pork 340	1.5	60772096	4.42
64	0.129	G	125.0				1	100G	[Sliced, cured and cooked honey roast reformed ham with added water., 10 Slices.]	http://img.tesco.com/Groceries/pi/026/5052909459026/IDShot_90x90.jpg	Tesco Honey Roast Sandwich Ham 125G	1.0	53586792	0.8
65	0.467	G	400.0	False	True	Save 25p Was £1.00 Now 75p	1	KG		http://img.tesco.com/Groceries/pi/889/5054268735889/IDShot_90x90.jpg	Tesco Meat Free Bolognese 400G	0.75	77227640	1.88
66	0.347	ML	250.0	False			1	100ML	[Punchy cayenne spice with a mellow buttery finish, Unleash Your Meat Lust, Flavour fanatics and meat enthusiasts, we call upon you to share your creations., Find us on Twitter, Instagram and Facebook., #Meatlust]	http://img.tesco.com/Groceries/pi/971/5032457706971/IDShot_90x90.jpg	Meatl Lust Buffalo Sauce 250Ml	2.49	80930540	0.996
67	0.42	G	400.0		True	Save £1.00 Was £3.00 Now £2.00	1	100G	[Sliced, cured and cooked reformed ham with added water, coated with gluten free breadcrumbs., With a gluten free crumb.]	http://img.tesco.com/Groceries/pi/188/5054775299188/IDShot_90x90.jpg	Tesco Family Pack Crumbed Ham 400G	2.0	80474808	0.5
68	1.017	G	1000.0				1	KG	[Everyday Value 20 (approx) Pork Sausages, Everyday Value 20 (approx) Pork Sausages]	http://img.tesco.com/Groceries/pi/031/5053526206031/IDShot_90x90.jpg	Tesco Everyday Value 20 Pork Sausages 1Kg	1.09	62465167	1.09
69	0.163	G	135.0				1	100G	[A bar of nuts, fruit and seeds with crisped rice, honey and a yoghurt coating.]	http://img.tesco.com/Groceries/pi/127/5013803000127/IDShot_90x90.jpg	Eat Natural Bars Coconut, Apricot Yoghurt 3 Pack 45G	2.0	81245917	1.49
70	0.131	G	125.0		True	Any 2 for £3.00	1	100G	[Sliced, cured and cooked beef brisket., 10 Slices.]	http://img.tesco.com/Groceries/pi/034/5054775752034/IDShot_90x90.jpg	Tesco British Pastrami 125G	1.8	81036059	1.44
71	0.226	G	180.0			Save £1 on Tesco or Finest fresh pre-packed salmon	1	100G	[2 Hot smoked salmon (Salmo salar) fillets with lemon and parsley., Smoked Atlantic salmon fillets with lemon zest and herbs for a sharper flavour. Responsibly sourced from Scotland and Norway, a source of omega 3. Serve simply with mixed salad and baby potatoes, or find recipes from tarts to terrines at www.tesco.com/realfood]	http://img.tesco.com/Groceries/pi/295/5053526662295/IDShot_90x90.jpg	Tesco Cooked Lemon And Parsley Salmon Fillets 180G	4.0	66504732	2.23
72	0.1	G	75.0				1	100G	[Sliced Parma Ham. A traditional Italian dry cured ham, tbc]	http://img.tesco.com/Groceries/pi/482/5053526983482/IDShot_90x90.jpg	Tesco Finest 20 Month Parma Ham 75G	3.5	76111611	4.67
73	0.255	G	225.0				1	100G	[Smoked Chorizo Ring., Traditionally dry cured, then beechwood smoked, for a rich intense flavour.]	http://img.tesco.com/Groceries/pi/249/5054402272249/IDShot_90x90.jpg	Tesco Finest Smoked Chorizo Ring 225G	2.5	77880752	1.12
74	0.417	G	340.0		True	Save 49p Was £2.49 Now £2.00	1	100G	[Reduced salt corned beef, Environment, Princes is committed to sustainability and the beef we buy from Brazil is reared in accordance with strict animal welfare standards.]	http://img.tesco.com/Groceries/pi/279/5000232828279/IDShot_90x90.jpg	Princes Reduced Salt Corned Beef 340G	2.0	62258418	0.588
75	0.423	G	340.0				1	KG	[Skinless and boneless sliced cooked chicken breast fillets with added water, dextrose, salt and sunflower oil, Cooked Chicken Strips 340g]	http://img.tesco.com/Groceries/pi/069/5054775147069/IDShot_90x90.jpg	Tesco Cooked Sliced Chicken 340G	2.0	80318407	5.89
76	0.55	G	500.0		True	Save £1.00 Was £3.00 Now £2.00	1	100G	[Toasted Muesli Buckwheat]	http://img.tesco.com/Groceries/pi/590/5013803666590/IDShot_90x90.jpg	Eat Natural Toasted Muesli Buckwheat 500G	2.0	66106898	0.4
77	0.442	G	340.0			£1 WYS £5 on fresh pre-packed meat and fish	1	KG	[BOSWELL FARMS BEEF MEDALLION STEAKS]	http://img.tesco.com/Groceries/pi/962/5054775750962/IDShot_90x90.jpg	Boswell Farms Beef Medallion Steaks 340G	3.24	81027623	9.53
78	0.865	G	750.0			£1 WYS £5 on fresh pre-packed meat and fish	1	KG	[Willow Farms chicken reared exclusively for Tesco., Marinade these chicken thighs in sweet and sticky teriyaki sauce with rice and, spring onions. Make the most of your thighs with tasty RealFood recipes to feed, your family., Willow Farms chickens are reared to Red Tractor assured welfare standards, to, find out more about our Farms Range visit: www.tesco.com/thefarmsrange]	http://img.tesco.com/Groceries/pi/268/5054775702268/IDShot_90x90.jpg	Willow Farms Chicken Thighs 750G	1.49	81006049	1.99
