	AverageSellingUnitWeight	ContentsMeasureType	ContentsQuantity	IsNew	IsSpecialOffer	PromotionDescription	UnitOfSale	UnitQuantity	description	image	name	price	tpnb	unitprice
0	0.019	G	12.0		True	Any 4 for £2.00	1	KG	[Apples & concentrated apple juice puréed and made into wriggly fruit snacks, Visit www.kiddylicious.co.uk for new products and find us on Facebook to hear what other mums and dads think about Kiddylicious.]	http://img.tesco.com/Groceries/pi/038/5060040253038/IDShot_90x90.jpg	Kiddylicious Apple Fruit Wriggles 12G	0.6	70690187	50.0
1	0.266	G	350.0		False	Save 88p Was £1.88 Now £1.00	1	100G	[Cheese Snack Biscuits, To find out how exercise and a balanced diet can help a healthy lifestyle, visit www.123healthybalance.com]	http://img.tesco.com/Groceries/pi/078/5000168131078/IDShot_90x90.jpg	Jacobs Mini Cheddars Original 7X25g	1.79	50470392	0.511
2	0.252	SNGL	1.0				1	EACH	[Saucy BBQ Flavour Corn & Potato Snacks with Sugar & Sweetener]	http://img.tesco.com/Groceries/pi/918/5010052108918/IDShot_90x90.jpg	Golden Wonder Transform A Snack Bbq Flavoured	1.0	78682956	1.0
3	0.148	G	125.0	False			1	KG	[Cheddar flavour, Smoked cheese flavour and Blue cheese flavoured cheese snack cubes.]	http://img.tesco.com/Groceries/pi/697/3073781045697/IDShot_90x90.jpg	Mini Cravings 3 Cheeses 125G	2.0	79035627	16.0
4	0.337	G	354.0				1	100G	[Bacon Flavour Maize, Rice and Soya Snacks; Cheese Flavour Maize and Potato Snacks; Onion Flavour Maize and Wheat Semolina Snacks, 6x Bacon Rashers, 6x Cheese Balls, 6x Onion Rings]	http://img.tesco.com/Groceries/pi/978/5054402884978/IDShot_90x90.jpg	Tesco Variety Snacks 18X17g	1.49	76165777	0.421
5	0.18	G	142.0				1	KG	[Chopped and shaped chicken burger with a southern fried flavour breaded coating in a burger bun with a sachet of mayonnaise.]	http://img.tesco.com/Groceries/pi/063/5099556017063/IDShot_90x90.jpg	Speedy Snacks Chicken Burger 142G	1.0	79129914	7.05
6	0.091	G	80.0			50p off Tesco freshcut fruit, prepped veg or salad	1	KG	[Sliced apple, On the go]	http://img.tesco.com/Groceries/pi/240/0000010098240/IDShot_90x90.jpg	Tesco Pink Lady Snack Pack 80G	0.5	65133728	6.25
7	0.22	G	220.0				1	100G	[Chocolate Flavour Sandwich Biscuits with a Vanilla Flavour Filling (29%).]	http://img.tesco.com/Groceries/pi/502/7622210021502/IDShot_90x90.jpg	Oreo Vanilla Snack Pack 220G	1.89	71822929	0.859
8	0.246	G	180.0				1	100G	[Organic apple & raspberry soft oaty bars containing a blend of organic wholegrain oats, raisins, apple and raspberry juice, Colourful facts..., Did you know that raspberries aren't always pinky red? They can be purple, golden or black, Do you have a question for us?, Join us online for tips, recipes and to share your stories., You'll find us at:, Facebook /organixfood, Twitter @organixbrands, And at www.organix.com or you can call us on 0800 39 35 11 (UK) or 1 800 40 92 78 (ROI)]	http://img.tesco.com/Groceries/pi/304/5024121846304/IDShot_90x90.jpg	Organix 12 Month Apple And Raspberry Fruit And Cereal Bar 6X30g	2.5	57522234	1.39
9	0.375	G	282.0				1	KG	[Cheese dip (7 % fat) with added calcium and Corn and Potato Snack (33 %)., Go online: www.dairylea.co.uk]	http://img.tesco.com/Groceries/pi/090/7622300223090/IDShot_90x90.jpg	Dairylea Dunkers Jumbo (6X47g) 282G	3.0	65093319	10.64
10	0.038	G	20.0				1	KG	[Organic baked corn snack coated with carrot, Join in at organix.com, If you've got a question, need some help or want to chat, join us and lots of other parents online., See you there, Facebook/organixfood, Twitter@organixbrands, And at www.organix.com or call us on 0800 39 35 11 (UK) or 1800 40 92 78 (ROI)]	http://img.tesco.com/Groceries/pi/303/5024121885303/IDShot_90x90.jpg	Organix 7 Month Crunchy Sticks Carrot 20G	0.75	57188258	37.5
11	0.322	G	480.0		True	Half Price Was £2.50 Now £1.25	1	100G	[Lightly seasoned pork sausage meat wrapped in golden puff pastry., Lightly seasoned pork sausage meat wrapped in golden puff pastry.]	http://img.tesco.com/Groceries/pi/133/5054268265133/IDShot_90x90.jpg	Tesco 32 Mini Sausage Rolls 480G	1.25	76582110	0.26
12	0.263	G	190.0		True	Any 2 for £3.00	1	100G	[Cheese and Onion Flavour Savoury Snack]	http://img.tesco.com/Groceries/pi/788/5053990101788/IDShot_90x90.jpg	Pringles Cheese And Onion 190G	1.99	70822522	1.05
13	0.132	G	82.5		True	Save 99p Was £1.99 Now £1.00	1	100G	[Lime and Coriander Chutney Flavour Potato and Gram Flour Snack, Visit us at: www.walkers.co.uk, www.facebook.com/sensationscrisps]	http://img.tesco.com/Groceries/pi/581/5000328428581/IDShot_90x90.jpg	Sensations Lime/Coriander Chutney Poppadoms 82.5G	1.0	60862380	1.22
14	0.021	G	22.0		True	Any 3 for £1.00	1	100G	[Cheese & Onion Flavour Soya & Potato Snacks, Whether you’re planning to lose weight or just to replace the occasional meal, Tesco’s Ultra Slim range is a delicious way to help you control your nutritional intake. With a wide range of meal replacement shakes, smoothies and bars coupled with a choice of snacks there’s something for everyone.]	http://img.tesco.com/Groceries/pi/194/5052910394194/IDShot_90x90.jpg	Ultra Slim Cheese And Onion Soy Potato Snacks 22G	0.4	72925789	1.82
15	0.199	G	150.0		True	Save 50p Was £1.50 Now £1.00	1	100G	[6 x Cheese & Onion Flavour Baked Potato Snack]	http://img.tesco.com/Groceries/pi/810/5000328760810/IDShot_90x90.jpg	Walkers Baked Cheese And Onion 6X25g	1.0	59421644	0.667
16	0.24	G	240.0				1	KG	[Natural Reduced Fat Cheese]	http://img.tesco.com/Groceries/pi/358/3073780897358/IDShot_90x90.jpg	Mini Babybel Light 240G 12 Pack	2.74	59165463	11.42
17	0.163	SNGL	6.0	False			1	EACH	[Prawn Cocktail Flavour Tapioca Snack, Snacks can be enjoyed as part of a balanced diet and healthy lifestyle, including regular exercise.]	http://img.tesco.com/Groceries/pi/855/5000237074855/IDShot_90x90.jpg	Kp Skips Prawn Cocktail 6X14.4G	1.0	56752717	0.167
18	0.442	G	160.0				1	KG	[Medium fat hard cheese. Cheestrings in an unripened cheese., Consume as part of a healthy lifestyle & balanced diet.]	http://img.tesco.com/Groceries/pi/953/5000187130953/IDShot_90x90.jpg	Cheestrings Twisted 8 Pack 160G	2.75	53563295	17.19
19	0.3	G	270.0		True	Any 2 for £2.00	1	100G	[A blend of cheeses with chopped tomatoes wrapped in puff pastry., A blend of cheeses with tomatoes wrapped in a golden puff pastry.]	http://img.tesco.com/Groceries/pi/819/5054775261819/IDShot_90x90.jpg	Tesco 9 Cheese And Tomato Snack Rolls 270G	1.5	80399903	0.556
20	0.19	G	144.0	False			1	100G	[Crunchy Savory Wholewheat Sticks, To find out how exercise and a balanced diet can help a healthy lifestyle, visit www.123healthybalance.com]	http://img.tesco.com/Groceries/pi/713/5000237107713/IDShot_90x90.jpg	Jacobs Twiglets Snacks 6X24g	1.79	50550499	1.25
21	0.272	G	200.0		True	Save 99p Was £1.99 Now £1.00	1	100G	[Tangy Cheese Flavour Corn Chips]	http://img.tesco.com/Groceries/pi/463/5000328382463/IDShot_90x90.jpg	Doritos Tangy Cheese 200G	1.0	60854303	0.5
22	0.01	G	93.9				1	KG	[Cheese food slices (34%) with added calcium and vitamin D. Butter flavour wheat crackers. Cooked cured chicken breast slices (31%) formed from chicken breast pieces with starch.]	http://img.tesco.com/Groceries/pi/139/7622300498139/IDShot_90x90.jpg	Dairylea Lunchables Chicken And Cheese 93.9G	1.5	75886639	15.98
23	0.187	G	120.0		True	Any 2 for £2.00	1	100G	[Thai Chilli & Basil Flavour Cassava & Tapioca Snack, Snacks can be enjoyed as part of a balanced diet and healthy lifestyle, including regular exercise.]	http://img.tesco.com/Groceries/pi/321/5011096006321/IDShot_90x90.jpg	Velvet Crunch Thai Sweet Chilli 6X20g	1.5	65043028	1.25
24	0.272	G	225.0		True	Save 99p Was £1.99 Now £1.00	1	100G	[Chilli Heatwave Flavour Corn Chips]	http://img.tesco.com/Groceries/pi/129/5000328624129/IDShot_90x90.jpg	Doritos Chilli Heatwave 200G	1.0	60854316	0.444
25	0.16	G	175.0		True	Save 59p Was £1.59 Now £1.00	1	100G	[Original Sea Salted Wheat Pretzel Knots, Snacks can be enjoyed as part of a balanced diet and healthy lifestyle, including regular exercise., For more information about Penn State classic American snacks, please visit www.pennstate.co.uk]	http://img.tesco.com/Groceries/pi/070/5032439100070/IDShot_90x90.jpg	Penn State Salted Pretzels 175G	1.0	57061905	0.571
26	0.027	G	20.0		True	Any 4 for £2.00	1	KG	[Strawberry & Apple, For a Bear hug visit www.bearnibbles.co.uk or give us a growl on grrr@bearnibbles.co.uk or facebook.com/bearnibbles]	http://img.tesco.com/Groceries/pi/194/5060139431194/IDShot_90x90.jpg	Bear Pure Fruit Paws Dino 20G	0.55	75147772	27.5
27	0.145	G	99.0				1	KG	[Cheese & Toasties]	http://img.tesco.com/Groceries/pi/603/5000295145603/IDShot_90x90.jpg	Chedds Cheese And Toasties 3 Pack	1.5	68085630	15.16
28	0.158	SNGL	6.0		True	Any 2 for £2.50	1	EACH	[Ready Salted Flavour Crispy Potato Snack]	http://img.tesco.com/Groceries/pi/202/5000328107202/IDShot_90x90.jpg	Walkers French Fries Ready Salted 6X18g	1.5	74229251	0.25
29	0.617	G	60.0				1	100G	[BBQ flavour chopped and shaped chicken breast with added starch]	http://img.tesco.com/Groceries/pi/619/5000178108619/IDShot_90x90.jpg	Mattessons Fridge Raiders Bbq 60G	1.29	64048508	2.15
30	0.119	G	150.0			£1 off Tesco chilled Finest pies Excl dessert pies	1	100G	[Seasoned uncured pork encased in a pastry case., 2 Snack Melton Mowbray Uncured Pork Pies]	http://img.tesco.com/Groceries/pi/897/5018374112897/IDShot_90x90.jpg	Tesco 2 Snack Melton Mowbray Pork Pies 150G	1.2	51328520	0.8
31	0.111	G	100.0				1	100G	[Smoked Pork Salami Sausage.]	http://img.tesco.com/Groceries/pi/669/4251097401669/IDShot_90x90.jpg	Peperami Mini Original 10X10g	2.5	52194030	2.5
32	0.125	G	150.0		True	Half Price Was £1.89 Now 94p	1	100G	[Pickled Onion Flavour Mini Baked Snack Biscuits]	http://img.tesco.com/Groceries/pi/244/0072417162244/IDShot_90x90.jpg	Burtons Fish & Chips Pickled Onion Snack 6 X 25G	0.94	78683264	0.627
33	0.317	G	192.0		True	Save 95p Was £2.95 Now £2.00	1	100G	[Cheese Flavour Potato Snack]	http://img.tesco.com/Groceries/pi/394/5000328868394/IDShot_90x90.jpg	Walkers Quavers Cheese 12X16g	2.0	60266056	1.05
34	0.363	G	264.0		True	Save 95p Was £2.95 Now £2.00	1	100G		http://img.tesco.com/Groceries/pi/461/5000328542461/IDShot_90x90.jpg	Walkers Monster Munch Variety Snacks 12X22g	2.0	60369970	0.758
35	0.03	G	26.0	False			1	100G	[Milk chocolate coated soft nougat and caramel snack bar., SlimFast 3 2 1 Plan®, Pick 3 snacks a day, Had enough of complicated diets? Enjoy our delicious meal bars, shakes and indulgent snacks. Our plan is simple and it's proven to work *, Pick 3 snacks a day. Slimfast noodles & snacks or fruit & veg, Choose 2 SlimFast meals, shakes or bars, Have 1 sensible 600kcal meal (800kcal for men), *Substituting two daily meals of an energy restricted diet with meal replacements contributes to weight loss.]	http://img.tesco.com/Groceries/pi/536/5055967557536/IDShot_90x90.jpg	Slimfast Snack Bar Chocolate Caramel 26G	0.6	79698118	2.31
36	0.019	G	126.0				1	KG	[Raisins]	http://img.tesco.com/Groceries/pi/070/8680923210070/IDShot_90x90.jpg	Peppa Pig Mini Snack Raisins 9X14g	1.0	79402487	7.94
37	0.263	G	190.0	False	True	Any 2 for £3.00	1	100G	[Prawn Cocktail Flavour Savoury Snack, You don't just eat em™..., Pringles.com]	http://img.tesco.com/Groceries/pi/431/5053990106431/IDShot_90x90.jpg	Pringles Prawn Cocktail 190G	1.99	70822597	1.05
38	0.038	G	20.0				1	KG	[Organic baked corn snack coated with sweetcorn, Join in at organix.com, If you've got a question, need some help or want to chat, join us and lots of other parents online. See you there, Facebook/organixfood,, Twitter@organixbrands, and at www.organix.com or call us on 0800 39 35 11 (UK) or 1800 40 92 78 (ROI)]	http://img.tesco.com/Groceries/pi/306/5024121884306/IDShot_90x90.jpg	Organix 7 Month Crunchy Rings Sweetcorn 20G	0.75	57192370	37.5
39	0.1	G	100.0				1	KG	[Cheddar Cheese with Marmite® Yeast Extract]	http://img.tesco.com/Groceries/pi/427/8722700199427/IDShot_90x90.jpg	Marmite Cheddar Bites 100G (5X20g)	1.3	62896077	13.0
40	0.213	G	180.0				1	KG	[Reduced Fat Cheese Spread., Hop online: www.dairylea.co.uk or www.facebook.com/dairylea]	http://img.tesco.com/Groceries/pi/961/7622210318961/IDShot_90x90.jpg	Dairylea Light Cheese Spread 180G	1.5	73386520	8.34
41	0.457	G	40.0				1	KG	[Dried mango., Tropical taste]	http://img.tesco.com/Groceries/pi/510/0000010115510/IDShot_90x90.jpg	Tesco Dried Mango Snack Pack 40G	1.0	68265396	25.0
42	0.134	G	140.0		True	Save 25p Was 85p Now 60p	1	100G	[Salt Fish Patty]	http://img.tesco.com/Groceries/pi/084/5060035760084/IDShot_90x90.jpg	Port Royal Salt Fish Jamaican Patty 140G	0.6	59398665	0.429
43	0.406	G	200.0				1	KG	[Processed slices made using a blend of cheese, vegetable oil and milk proteins, Processed slices made using a blend of cheese, vegetable oil and milk proteins]	http://img.tesco.com/Groceries/pi/012/5000119517012/IDShot_90x90.jpg	Tesco 10 Cheesy Slices 200G	1.0	50851431	5.0
44	0.164	G	146.0		True	Any 2 for £3.00	1	KG	[Hot dog sausage in a soft bun with a sachet of tomato ketchup and mustard]	http://img.tesco.com/Groceries/pi/181/5099556009181/IDShot_90x90.jpg	Rustlers Hot Dog 146G	2.0	52170945	13.7
45	0.409	G	360.0				1	100G	[Apple and strawberry fruit snack]	http://img.tesco.com/Groceries/pi/378/5051140976378/IDShot_90x90.jpg	Tesco Goodness Apple And Strawberry Slurpers 4X90g	1.75	58828643	0.486
46	0.148	G	125.0				1	KG	[Smoked salmon and dill flavour, Onion and Goat cheese flavoured cheese snack cubes, Are you craving more?, Facebook/ The Laughing Cow UK   Official Page.]	http://img.tesco.com/Groceries/pi/396/3073781072396/IDShot_90x90.jpg	The Laughing Cow Mini Cravings Mixed 125G	2.0	80521379	16.0
47	0.454	G	375.0				1	100G	[Tomatoes, onions, green peppers and jalape&#241;o pepper salsa dip, seasoned with coriander and spices., Mild Salsa Dip]	http://img.tesco.com/Groceries/pi/480/0000003029480/IDShot_90x90.jpg	Tesco Mild Salsa Dip 300G	0.79	53232917	0.211
48	0.237	G	180.0				1	100G	[Cheese Flavour Savoury Snack]	http://img.tesco.com/Groceries/pi/261/5053990110261/IDShot_90x90.jpg	Pringles Tortilla Nacho Cheese 180G	1.99	78548788	1.11
49	0.104	G	126.0				1	100G	[Fine Milk Chocolate with a Milk Filling]	http://img.tesco.com/Groceries/pi/167/0000080310167/IDShot_90x90.jpg	Kinder Snack Bars 6 Pack 126G	1.25	56379094	0.992
50	0.204	G	175.0		True	Save 59p Was £1.59 Now £1.00	1	100G	[Sour Cream & Chive Flavour Wheat & Potato Pretzel Knots, Snacks can be enjoyed as part of a balanced diet and healthy lifestyle, including regular exercise.]	http://img.tesco.com/Groceries/pi/179/5032439100179/IDShot_90x90.jpg	Penn State Sour Cream And Chive Pretzels 175G	1.0	57062121	0.571
51	0.025	KG	0.015		True	Any 4 for £2.00	1	KG	[Bite-sized crunchy slices of real banana, Did you know...? A bunch of bananas is known as a hand., For more info and find us on Facebook to hear what other mums & dads think about our products.]	http://img.tesco.com/Groceries/pi/785/5060040250785/IDShot_90x90.jpg	Kiddylicious Banana Bites 15G	0.6	63719235	40.0
52	0.153	G	60.0				1	KG	[Cashew nut kernels.]	http://img.tesco.com/Groceries/pi/566/0000003246566/IDShot_90x90.jpg	Tesco Snack Pack Cashew Nuts 45G	1.0	59730748	16.67
53	0.1	G	80.0			50p off Tesco freshcut fruit, prepped veg or salad	1	KG	[A selection of apple slices and grapes, On the go]	http://img.tesco.com/Groceries/pi/480/0000010003480/IDShot_90x90.jpg	Tesco Pink Lady And Grapes Snack Pack 80G	0.5	65910195	6.25
54	0.318	G	270.0				1	KG	[Cheese spread with added calcium., Go online: www.dairylea.co.uk]	http://img.tesco.com/Groceries/pi/985/7622210318985/IDShot_90x90.jpg	Dairylea Cheese Spread 270G	2.15	52283253	7.97
55	0.267	G	180.0				1	100G	[Organic apple & orange soft oaty bars containing a blend of organic wholegrain oats, raisins, apple juice and orange oil, All shapes and sizes..., Did you know apples can grow to be as small as cherries or as big as grapefruits?, Do you have a question for us?, Join us online for tips, recipes and to share your stories., You'll find us at:, Facebook /organixfood, Twitter @organixbrands, And at www.organix.com or you can call us on 0800 39 35 11 (UK) or 1 800 40 92 78 (ROI)]	http://img.tesco.com/Groceries/pi/301/5024121847301/IDShot_90x90.jpg	Organix 12 Month Apple And Orange Fruit And Cereal Bar 6X30g	2.5	57852816	1.39
56	1.163	G	240.0				1	KG	[Medium fat hard cheese. Cheestrings is an unripened cheese., Consume as part of a healthy lifestyle and balanced diet.]	http://img.tesco.com/Groceries/pi/885/5000187130885/IDShot_90x90.jpg	Cheestrings Original 12 Pack 240G	3.5	54430186	14.59
57	0.633	G	600.0				1	100G	[Seasoned pork sausage meat wrapped in puff pastry, 40 Mini Pork Sausage Rolls]	http://img.tesco.com/Groceries/pi/604/5054775261604/IDShot_90x90.jpg	Tesco 40 Mini Sausage Rolls 600G	2.5	80399356	0.417
58	0.267	G	180.0				1	100G	"[Organic apple & strawberry soft oaty bars containing a blend of organic wholegrain oats, raisins, apple and strawberry juice, Wonder of nature..., Did you know strawberries are the only fruit that grow their seeds on the outside?, ""If you're a little explorer like me who loves growing things, why not pop some cress seeds on damp cotton wool in a tray somewhere sunny? Water them little and often, and soon you'll have some fresh tasty cress to eat."", Alfie, Do you have a questions for us? Join us online for tips, recipes, and to share your stories., You'll find us at:, facebook/organixfood, twitter@organixbrands, And at www.organix.com or you can call us on 0800 39 35 11 (UK) or 1 800 40 92 78 (ROI), Goodies Gang created by Caroline Jayne Church www.carolinejaynechurch.com]"	http://img.tesco.com/Groceries/pi/212/5024121437212/IDShot_90x90.jpg	Organix 12 Month Strawberry Cereal Bar 6X30g	2.5	74070120	1.39
59	0.333	G	46.0		True	Half Price Was £2.25 Now £1.12	1	KG	[Cheese dip with added calcium and bacon flavour (7 % fat) and Corn & Potato Snack (33 %)., Go online: www.dairylea.co.uk]	http://img.tesco.com/Groceries/pi/669/7622210397669/IDShot_90x90.jpg	Dairylea Dunkers Cheesy Bacon 4 X 46G	1.12	79079143	24.35
60	0.157	G	120.0				1	100G	[A Spicy Flavour Mix of Corn and Potato Snacks.]	http://img.tesco.com/Groceries/pi/166/5000328308166/IDShot_90x90.jpg	Walkers Mix Ups Spicy Snacks 120G	1.99	78538161	1.66
61	0.199	G	150.0		True	Save 50p Was £1.50 Now £1.00	1	100G	[6 x Salt & Malt Vinegar Flavour Baked Potato Snack]	http://img.tesco.com/Groceries/pi/676/5000328865676/IDShot_90x90.jpg	Walkers Baked Salt And Vinegar 6X25g	1.0	59421621	0.667
62	0.027	G	20.0		True	Any 4 for £2.00	1	KG	[Paws Jungle Apple & Blackcurrant, For a Bear hug visit www.bearnibbles.co.uk or give us a growl on grrr@bearnibbles.co.uk or facebook.com/bearnibbles]	http://img.tesco.com/Groceries/pi/217/5060139431217/IDShot_90x90.jpg	Bear Pure Fruit Paws Jungle 20G	0.55	75147645	27.5
63	0.13	G	60.0				1	KG	[Baked corn and potato snack coated with carrot and coriander with added vitamin B1, Colourful facts... Did you know carrots aren't always orange? They can be purple, red, white or yellow too, Do you have a question for us? Join us online for tips, recipes and to share your stories. You'll find us at:, Facebook/organixfood, Twitter@organixbrands, and at www.organix.com or you can call us on 0800 39 35 11 (UK) or 1 800 40 92 78 (ROI)]	http://img.tesco.com/Groceries/pi/301/5024121889301/IDShot_90x90.jpg	Organix Goodies Carrot Stix Multi Pack 4X15g	2.0	59512940	33.34
64	0.389	G	75.0				1	100G	[Cheese & Onion Flavour Teddy Shaped Potato Snack, Visit Pom Bear online at www.pom bear.co.uk, Like us on Facebook: facebook.com/PomBearUK]	http://img.tesco.com/Groceries/pi/760/4000522006760/IDShot_90x90.jpg	Pom Bear Cheese And Onion 5 X 15G	1.0	74178166	1.34
65	0.167	G	125.0		True	Half Price Was £2.50 Now £1.25	1	100G	[Smoked Pork Salami Sausage.]	http://img.tesco.com/Groceries/pi/546/4251097401546/IDShot_90x90.jpg	Peperami Original 5X25g	1.25	50894040	1.0
66	0.206	G	255.0				1	KG	[A blend of cheese, milk protein and vegetable oil, Everyday value 15 singles]	http://img.tesco.com/Groceries/pi/118/5052909615118/IDShot_90x90.jpg	Tesco Everyday Value 15 Cheese Slices 255G	0.9	52703155	3.53
67	0.113	G	100.0				1	100G	[Sweet chilli flavour rice crackers, Design: fabdesign.co.uk]	http://img.tesco.com/Groceries/pi/806/9417986941806/IDShot_90x90.jpg	Snack Organisation Sweet Chilli Cracker 100G	1.0	78718754	1.0
68	0.099	G	70.0				1	100G	[Pitted Black Olives with Olive Oil.]	http://img.tesco.com/Groceries/pi/317/8410134020317/IDShot_90x90.jpg	Fragata Snack Spanish Black Olives Sea Salt 70G	0.99	79552487	1.42
69	0.283	G	300.0				1	100G	[Seasoned pork sausagemeat wrapped in puff pastry]	http://img.tesco.com/Groceries/pi/185/5000187142185/IDShot_90x90.jpg	Walls 10 Cocktail Sausage Rolls 300G	2.0	65961934	0.667
70	0.333	G	184.0		True	Half Price Was £2.25 Now £1.12	1	KG	[Cheese dip (12 % fat) with added calcium and mini-sized Ritz savoury crackers (31 %)., Go online: www.dairylea.co.uk]	http://img.tesco.com/Groceries/pi/043/7622210421043/IDShot_90x90.jpg	Dairylea Dunkers Cheesy Cheddar 4 X 46G	1.12	79079108	6.09
71	0.183	G	120.0		True	Any 2 for £2.00	1	100G	[Salt & Balsamic Vinegar Flavour Cassava & Tapioca Snack, Snacks can be enjoyed as part of a balanced diet and healthy lifestyle, including regular exercise.]	http://img.tesco.com/Groceries/pi/338/5011096006338/IDShot_90x90.jpg	Velvet Crunch Salt And Vinegar 6X20g	1.5	70648262	1.25
72	0.409	G	360.0				1	100G	[Apple and banana fruit snack]	http://img.tesco.com/Groceries/pi/224/5051140976224/IDShot_90x90.jpg	Tesco Goodness Apple And Banana Fruit Slurpers 4X90g	1.75	58828516	0.486
73	0.099	G	70.0	False			1	100G	[Pitted green manzanilla olives with lemon and olive oil.]	http://img.tesco.com/Groceries/pi/284/8410134018284/IDShot_90x90.jpg	Fragata Snack 'N Green Olives With Pinch Of Lemon 70G	0.99	75947171	1.42
74	0.153	G	216.0		True	Any 2 for £3.00	1	100G	[Minced and seasoned chicken filled with garlic and cream cheese, coated in breadcrumbs.]	http://img.tesco.com/Groceries/pi/110/5052320432110/IDShot_90x90.jpg	Tesco Chicken Kiev Bites 216G	1.75	67538696	0.81
75	0.148	G	125.0				1	KG	[Ham & herb, Garlic & herb and Three cheese flavour cheese snack cubes.]	http://img.tesco.com/Groceries/pi/942/3073781060942/IDShot_90x90.jpg	Mini Cravings Mixed Herbs 125G	2.0	79035656	16.0
76	0.247	G	200.0				1	100G	[Cool Flavour Maize Tortilla Chips, Tesco Cool Flavour Tortilla Chips]	http://img.tesco.com/Groceries/pi/402/5000436802402/IDShot_90x90.jpg	Tesco Cool Tortilla Chips 200G	0.85	54843325	0.425
77	0.221	SNGL	1.0				1	EACH		http://img.tesco.com/Groceries/pi/704/5000237015704/IDShot_90x90.jpg	Kp Frisps Assorted 6 Pack	1.0	78865504	1.0
78	0.265	G	98.1				1	KG	[Pizza flavoured wheat crackers (35%). Cheese food slices with added calcium and vitamin D. Cooked cured pepperoni slices (31%).]	http://img.tesco.com/Groceries/pi/501/7622210619501/IDShot_90x90.jpg	Dairylea Lunchables Pepperoni Pizza 98.1G	1.5	81342595	15.3
79	0.19	G	150.0	False	True	Save 99p Was £1.99 Now £1.00	1	100G	[Sour Cream & Chive Flavour Crisp Snack Biscuits, To find out how exercise and a balance diet can help a healthy lifestyle, visit www.123healthybalance.com]	http://img.tesco.com/Groceries/pi/610/5000168186610/IDShot_90x90.jpg	Jacobs Cracker Crisps Sour Cream And Chive 150G	1.0	78775069	0.667
80	0.213	G	150.0	False	False	Save 73p Was £1.73 Now £1.00	1	KG	[Cheddar and Caramelised Onion Flavour Multigrain Snack, Follow us on Facebook]	http://img.tesco.com/Groceries/pi/919/5000328195919/IDShot_90x90.jpg	Walkers Sunbites Cheddar And Onion Crisps 6 Pack	1.5	67684936	10.0
81	0.263	G	190.0		True	Any 2 for £3.00	1	100G	[Smokey Bacon Flavour Savoury Snack, You don't just eat em™..., Pringles.com]	http://img.tesco.com/Groceries/pi/165/5053990106165/IDShot_90x90.jpg	Pringles Smokey Bacon 190G	1.99	70822418	1.05
82	0.124	G	100.0				1	KG	[Mediterranean style semi-hard cow's milk cheese with olives and garlic in oil]	http://img.tesco.com/Groceries/pi/840/5760466985840/IDShot_90x90.jpg	Apetina Snack Pack Garlic & Olive 100G	1.2	73573206	12.0
83	0.227	G	165.0	False			1	100G	[Lightly Salted Potato Snacks]	http://img.tesco.com/Groceries/pi/991/5052109971991/IDShot_90x90.jpg	Tesco Chipz Original 165G	0.85	70832942	0.515
84	0.113	G	106.0				1	100G	[4 Falafels with houmous dip]	http://img.tesco.com/Groceries/pi/591/0000003264591/IDShot_90x90.jpg	Tesco Falafel And Houmous Snack Pot 106G	1.5	80317938	1.42
85	0.064	G	50.0				1	100G	[Smoked pork salami sausage with Mexican flavour]	http://img.tesco.com/Groceries/pi/011/4251097404011/IDShot_90x90.jpg	Peperami Snack Pack Tex Mex 50G	1.49	81542272	2.98
86	0.19	G	150.0		True	Save 99p Was £1.99 Now £1.00	1	100G	[Sea Salt & Balsamic Vinegar Flavour Crisp Snack Biscuits, To find out how exercise and a balanced diet can help a healthy lifestyle, visit www.123healthybalance.com]	http://img.tesco.com/Groceries/pi/634/5000168186634/IDShot_90x90.jpg	Jacobs Cracker Crisps Sea Salt And Balsamic Vinegar 150G	1.0	78775109	0.667
87	0.55	G	384.0				1	100G	[Cheese Flavour Potato Snack]	http://img.tesco.com/Groceries/pi/635/5000328358635/IDShot_90x90.jpg	Walkers Quavers Cheese Crisps 24X16g	4.0	78550992	1.05
88	0.229	G	216.0	False	True	Any 2 for £3.00	1	100G	[Cooked seasoned minced pork and bacon filled with an egg mayonnaise and coated in breadcrumbs]	http://img.tesco.com/Groceries/pi/530/5052320979530/IDShot_90x90.jpg	Tesco 18 Bacon And Egg Bites 216G	1.75	64494549	0.81
89	0.015	G	12.0		True	Any 4 for £2.00	1	KG	[Raspberry & apple juice concentrate with apple purée mixed with puffed rice., Visit www.kiddylicious.co.uk for new products and find us on Facebook to hear what other mums and dads think about Kiddylicious.]	http://img.tesco.com/Groceries/pi/207/5060040259207/IDShot_90x90.jpg	Kiddylicious Raspberry Crispie Tiddlers 12G	0.6	76360966	50.0
90	1.015	G	140.0				1	KG	[Cheese spread]	http://img.tesco.com/Groceries/pi/130/3073780774130/IDShot_90x90.jpg	Laughing Cow Cheese Triangles 140G	1.35	50240780	9.65
