	AverageSellingUnitWeight	ContentsMeasureType	ContentsQuantity	IsNew	IsSpecialOffer	PromotionDescription	UnitOfSale	UnitQuantity	description	image	name	price	tpnb	unitprice
85	0.017	G	10.0		True	Any 3 for £1.40	1	100G	[Deliciously light, blueberry corn puff snacks, Visit wwww.kiddylicious.co.uk for new products and find us on Facebook to hear what other mums and dads think about Kiddylicious.]	http://img.tesco.com/Groceries/pi/043/5060040257043/IDShot_90x90.jpg	Kiddylicious Blueberry Fruity Puffs 10G	0.55	76360465	5.5
86	0.154	KG	0.11				1	KG		http://img.tesco.com/Groceries/pi/113/5024121453113/IDShot_90x90.jpg	Organix Mini Oaty Bites 11X10g	2.0	81232558	18.19
87	0.031	G	25.0				1	100G	[Mini Oat Biscuits made with wholegrain oats, flax & chia seeds, and protein]	http://img.tesco.com/Groceries/pi/706/5060121671706/IDShot_90x90.jpg	Little Dish Go Gos Vanilla 25G	0.6	80307236	2.4
88	0.2	G	200.0				1	KG	[Reduced Fat Processed Slices made using a blend of cheese, vegetable oil and milk proteins, Reduced Fat Processed Slices made using a blend of cheese, vegetable oil and milk proteins]	http://img.tesco.com/Groceries/pi/476/5051622468476/IDShot_90x90.jpg	Tesco Lighter 10 Cheese Singles 200G	1.0	50947589	5.0
89	0.144	G	125.0	False			1	100G	[Pickled Onion Flavour Mini Baked Snack Biscuits]	http://img.tesco.com/Groceries/pi/539/0072417154539/IDShot_90x90.jpg	Burtons Fish & Chips Pickled Onion Snack 125G	1.59	79550253	1.28
90	0.128	G	128.0				1	KG	[Reduced fat cheese spread with Blue Cheese]	http://img.tesco.com/Groceries/pi/072/3073781031072/IDShot_90x90.jpg	The Laughing Cow Light Blue Triangles 128G	1.35	72173508	10.55
91	0.188	G	150.0		True	Any 3 for £4.00	1	100G	[Cheese & Onion Flavour Potato Crisps, Follow us on:, Facebook and Twitter, For our latest news and competitions]	http://img.tesco.com/Groceries/pi/373/5000328375373/IDShot_90x90.jpg	Walkers Cheese And Onion Crisps 6X25g	1.5	51933448	1.0
92	0.13	G	60.0				1	KG	[Baked corn snack coated with tomato and onion with added vitamin B1, Wonder of nature..., Did you know the tomato is really a fruit, not a vegetable at all?, Do you have a question for us? Join us online for tips, recipes and to share your stories., You'll find us at:, Facebook/organixfood, Twitter@organixbrands, And at www.organix.com or you can call us on 0800 39 35 11 (UK) or 1 800 40 92 78 (ROI)]	http://img.tesco.com/Groceries/pi/307/5024121890307/IDShot_90x90.jpg	Organix Tomatoe Saucy Noughts And Crosses 4X15g	2.0	70816265	33.34
93	0.359	G	250.0	False			1	KG	[Natural California Raisins]	http://img.tesco.com/Groceries/pi/659/0041143025659/IDShot_90x90.jpg	Sunmaid Raisin Snacks 250G	2.79	50436981	11.16
94	0.068	G	60.0		True	Any 3 for 2 Cheapest Product Free	1	KG	[Grow happy ™, 12 finger biscuits., Made with baby grade ingredients and with iron for healthy brain development. Heinz Biscotti are made in Italy to our unique recipe and have a gentle crunch which softens in little mouths., Apple flavoured finger biscuits.]	http://img.tesco.com/Groceries/pi/845/5000157067845/IDShot_90x90.jpg	Heinz Apple Biscotti 60G	0.75	62864606	12.5
95	0.2	G	200.0				1	KG	[Cheese Spread, Profits from Primula go to charity, www.kavlitrust.com, Spread more smiles... Primula is owned by the Kavli Trust which supports good causes both in the UK and abroad., Visit www.kavlitrust.com to find out more.]	http://img.tesco.com/Groceries/pi/000/0074472082000/IDShot_90x90.jpg	Primula Original Cheese Spread 200G Pack	1.45	50319319	7.25
96	0.283	G	200.0				1	KG	[4 Onion Bhajis and 4 Vegetable Samosas., Selection of Onion Bhajis and Vegetable Samosas.]	http://img.tesco.com/Groceries/pi/720/5054775752720/IDShot_90x90.jpg	Tesco Indian Snack Selection 200G	1.0	81037507	5.0
97	0.125	G	125.0		True	Half Price Was £2.50 Now £1.25	1	100G	[Hot Smoked Pork Salami Sausage.]	http://img.tesco.com/Groceries/pi/508/4251097401508/IDShot_90x90.jpg	Peperami Hot 5X25g	1.25	51618033	1.0
98	0.304	G	280.0				1	KG	[Reduced fat cheese spread]	http://img.tesco.com/Groceries/pi/111/3073780836111/IDShot_90x90.jpg	Laughing Cow Light Cheese Triangles 280G	2.0	56086970	7.15
99	0.016	G	125.0		True	Any 2 for £3.00	1	KG	[Strawberries + Apples Oaty Fingers, P.S. let's be friends, Sign up at ellaskitchen.co.uk]	http://img.tesco.com/Groceries/pi/690/5060107332690/IDShot_90x90.jpg	Ella's Strawberries And Apples Nibbly Fingers 5 X 25G	2.5	70701470	20.0
0	0.143	G	90.0	False			1	100G	[Salted Flavour Wheat & Potato Snacks, Snacks can be enjoyed as part of a balanced diet and healthy lifestyle, including regular exercise.]	http://img.tesco.com/Groceries/pi/828/5000237117828/IDShot_90x90.jpg	Hula Hoops Puft Salted 6X15g	1.7	78472335	1.89
1	0.171	G	150.0		True	Save 45p Was £1.45 Now £1.00	1	KG	[Cheese Spread with Chives, Did you know?, Our profits go to charity  We're owned by the Kavli Trust and their mission is to help good causes here in the UK and across the globe. So, every time you pick up a tube of Primula, you're helping a good cause too., For recipe ideas visit www.primula.co.uk]	http://img.tesco.com/Groceries/pi/229/0074472281229/IDShot_90x90.jpg	Primula Cheese Spread With Chives 150G	1.0	50173951	6.67
2	0.196	G	130.0	False			1	100G	[Beef Flavour Corn Snacks, Snacks can be enjoyed as part of a balanced diet and healthy lifestyle, including regular exercise.]	http://img.tesco.com/Groceries/pi/416/5000237110416/IDShot_90x90.jpg	Space Raiders Beef 130G	1.0	73856166	0.769
3	0.143	G	142.0				1	100G	[Cooked Pork Cocktail Sausages with a tomato ketchup dip, Oven baked Pork Cocktail Sausages]	http://img.tesco.com/Groceries/pi/355/5054775190355/IDShot_90x90.jpg	Tesco Cocktail Sausages Ketchup Dip 142G	1.25	80350650	0.88
4	0.51	G	450.0				1	100G	[Dry Roasted Peanuts, Snacks can be enjoyed as part of a balanced diet and healthy lifestyle, including regular exercise.]	http://img.tesco.com/Groceries/pi/635/5000237108635/IDShot_90x90.jpg	Kp Dry Roasted Peanuts Caddy 450G	3.0	66194607	0.667
5	0.355	G	270.0		True	Any 2 for £3.00	1	KG	[Roasted Salted Peanuts, We take pride in developing the ethical sourcing of our nuts and being as environmentally friendly as possible., For more information visit www.kpnuts.com, Snacks can be enjoyed as part of a balanced diet and healthy lifestyle, including regular exercise.]	http://img.tesco.com/Groceries/pi/880/5000237120880/IDShot_90x90.jpg	Kp Salted Peanuts 270G	1.99	50072287	7.38
6	0.135	G	110.0				1	100G	[Cheese Flavour Corn Snack]	http://img.tesco.com/Groceries/pi/082/5000328541082/IDShot_90x90.jpg	Walkers Bugles Cheese 110G	1.99	81201434	1.81
7	0.171	G	150.0		True	Save 45p Was £1.45 Now £1.00	1	KG	[Cheese Spread with Ham, For recipe ideas visit www.primula.co.uk]	http://img.tesco.com/Groceries/pi/236/0074472281236/IDShot_90x90.jpg	Primula Cheese Spread With Ham 150G	1.0	50173968	6.67
8	0.218	G	200.0				1	KG	[Reduced Fat Cheese Spread Slices with added Calcium., Go online: www.dairylea.co.uk]	http://img.tesco.com/Groceries/pi/489/5000136091489/IDShot_90x90.jpg	Dairylea Light Slices 8'S 200G	1.45	52980067	7.25
9	0.149	G	72.0		False	Save 88p Was £1.88 Now £1.00	1	100G	[Wholegrain Popcorn Sweet and Salty Flavour, Follow us on Facebook]	http://img.tesco.com/Groceries/pi/097/5000328602097/IDShot_90x90.jpg	Walkers Sunbites Popcorn Sweet And Salty 6X12g	1.79	81234867	2.49
10	0.053	KG	0.04				1	KG	[Organic sweet cinnamon puffcorn baked corn and rice snack coated with apple juice & cinnamon with added vitamin B1, Wonder of nature..., Did you know that cinnamon comes from the bark of a tree?, Do you have a question for us?, Join us online for tips, recipes and to share your stories., You'll find us at:, Facebook/organixfood, Twitter@organixbrands, And at www.organix.com or call us on 0800 39 35 11 (UK) or 1 800 40 92 78 (ROI), Goodies Gang created by Caroline Jayne Church www.carolinejaynechurch.com]	http://img.tesco.com/Groceries/pi/418/5024121345418/IDShot_90x90.jpg	Organix Sweet Cinnamon Puffcorn 4X10g	2.0	81219097	50.0
11	0.032	G	18.0	False	True	Save 25p Was £1.00 Now 75p	1	KG	[Freeze-Dried Strawberry, Design: fabdesign.co.uk]	http://img.tesco.com/Groceries/pi/377/9417986942377/IDShot_90x90.jpg	Snack Organisation Dry Strawberry 18G	0.75	79550132	41.67
12	0.057	G	40.0				1	100G		http://img.tesco.com/Groceries/pi/noimage.jpg	Mini Pringles Original 40G	0.5	80100768	1.25
13	0.266	G	168.0				1	100G		http://img.tesco.com/Groceries/pi/465/5000237112465/IDShot_90x90.jpg	Kp Hula Hoops Family 7 X 24G	1.7	50312085	1.02
14	0.142	G	140.0	False			1	KG	[Low fat and low saturated fat cheese spread portions]	http://img.tesco.com/Groceries/pi/338/3073780914338/IDShot_90x90.jpg	Laughing Cow Extra Light Cheese 8 Portions 140G	1.35	52071398	9.65
15	0.127	G	96.0		True	Save 50p Was £1.50 Now £1.00	1	100G	[Cheese flavour potato snack.]	http://img.tesco.com/Groceries/pi/321/5000328329321/IDShot_90x90.jpg	Walkers Quavers Cheese 6X16g	1.0	50390912	1.05
16	0.4	G	400.0				1	KG	[Processed slices made using a blend of cheese, vegetable oil and milk proteins, Processed slices made using a blend of cheese, vegetable oil and milk proteins]	http://img.tesco.com/Groceries/pi/036/5000119517036/IDShot_90x90.jpg	Tesco 20 Processed Cheesy Slices 400G	1.9	50851419	4.75
17	0.308	G	300.0				1	100G	[Soured cream dip with onions, chives and garlic., Sour Cream and Chive Dip]	http://img.tesco.com/Groceries/pi/060/5052909824060/IDShot_90x90.jpg	Tesco Sour Cream And Chive Dip 300G	0.79	72170874	0.263
18	0.2	G	130.0				1	100G	[Pickled Onion Flavour Corn Snacks, Snacks can be enjoyed as part of a balanced diet and healthy lifestyle, including regular exercise.]	http://img.tesco.com/Groceries/pi/430/5000237110430/IDShot_90x90.jpg	Space Raiders Pickled Onion 10X13g	1.0	70646638	0.769
19	0.046	G	75.0				1	100G	[100% Prime Pork Chorizo Sausage]	http://img.tesco.com/Groceries/pi/742/5000178110742/IDShot_90x90.jpg	Mattessons Savagers Chorizo 3X25g	1.69	78924354	2.26
20	0.362	SNGL	10.0				1	EACH	[10 Heavy Duty Tie Top Refuse Sack]	http://img.tesco.com/Groceries/pi/001/5026824651001/IDShot_90x90.jpg	Heavy Duty Tie Top Refuse Sacks 10 Pack (70L)	2.0	79891269	0.2
21	0.299	G	250.0	False	True	Save 45p Was £1.95 Now £1.50	1	KG	[Reduced fat cheese spread., Go online: www.dairylea.co.uk]	http://img.tesco.com/Groceries/pi/848/7622210318848/IDShot_90x90.jpg	Dairylea Light Triangles 250G	1.5	71166093	6.0
22	0.265	G	255.0				1	KG	[Natural California Raisins, Please visit us on the Web at www.sunmaid.org]	http://img.tesco.com/Groceries/pi/180/0041143020180/IDShot_90x90.jpg	Sunmaid Raisin Snacks 6 X 42.5G	2.19	51250720	8.59
23	0.348	G	168.0				1	100G	[Organic raisins in mini boxes, Where it all began..., Did you know that raisins were sun dried from grapes as long as 1490 BC?, Do you have a question for us? Join us online for tips, recipes and to share your stories., You'll find us at:, Facebook/organixfood, Twitter@organixbrands, And at www.organix.com or you can call us on 0800 39 35 11 (UK) or 1 800 40 92 78 (ROI), For more information on children's portion size please visit us at organix.com, Goodies Gang created by Caroline Jayne Church www.carolinejaynechurch.com]	http://img.tesco.com/Groceries/pi/116/5024121519116/IDShot_90x90.jpg	Organix Goodies Raisins 168G	2.49	80569334	1.49
24	0.7	G	700.0			30p off Tesco chilled soup	1	100G	[Fresh Carrot & Butternut Squash Soup, For all things soup visit our kitchen at www.newcoventgardensoup.com, Find us on Facebook and Twitter]	http://img.tesco.com/Groceries/pi/618/5060045386618/IDShot_90x90.jpg	New Covent Garden Carrot And Butternut Squash Soup 700G	2.35	74533754	0.336
25	0.487	G	350.0		True	Half Price Was £3.10 Now £1.47	1	100G		http://img.tesco.com/Groceries/pi/056/5000328588056/IDShot_90x90.jpg	Walkers Variety Crisps 14 X 25G	2.0	57094267	0.571
26	0.171	G	130.0			£1 off Tesco chilled Finest pies Excl dessert pies	1	100G	[Seasoned cured pork encased in pastry., 2 Snack Pork Pies made with hot water pastry and filled with seasoned cured pork.]	http://img.tesco.com/Groceries/pi/061/5054269196061/IDShot_90x90.jpg	Tesco 2 Snack Classic Pork Pies 130G	1.2	65668844	0.923
27	0.604	G	600.0		True	Save 50p Was £1.50 Now £1.00	1	100G	[A tomato and bean soup with chilli., Tesco Mexican Chilli Bean Soup 600g]	http://img.tesco.com/Groceries/pi/963/5052003557963/IDShot_90x90.jpg	Tesco Mexican Chilli Bean Soup 600G	1.0	64627516	0.167
28	0.56	G	300.0		True	Save 99p Was £1.99 Now £1.00	1	100G	[Doritos Sour Cream and Chives.]	http://img.tesco.com/Groceries/pi/327/5000328637327/IDShot_90x90.jpg	Doritos Sour Cream And Chive Dip 300G	1.0	51250668	0.333
29	0.188	G	150.0		True	Any 3 for £4.00	1	100G	[Salt & Vinegar Flavour Potato Crisps]	http://img.tesco.com/Groceries/pi/618/5000328375618/IDShot_90x90.jpg	Walkers Salt And Vinegar Crisps 6X25g	1.5	51933552	1.0
30	0.135	G	110.0	False			1	100G	[Southern Style BBQ Flavour Corn Snack]	http://img.tesco.com/Groceries/pi/290/5000328540290/IDShot_90x90.jpg	Walkers Bugles Southern Style Bbq 110G	1.99	81201365	1.81
31	0.342	G	105.0	False	True	Save £1.00 Was £2.99 Now £1.99	1	100G	[3 Peanut & Protein Bars with Maple Syrup, Read the Pulsin' story at: www.pulsin.co.uk]	http://img.tesco.com/Groceries/pi/183/0886054001183/IDShot_90x90.jpg	Pulsin' Maple And Peanut Snack Bar 3 X 35G	1.99	81068735	1.9
32	0.297	G	171.0		True	Save 70p Was £1.70 Now £1.00	1	100G		http://img.tesco.com/Groceries/pi/573/5000237121573/IDShot_90x90.jpg	Mccoys Classic Crisps 6X28.5G	1.0	50767577	0.585
33	0.105	G	105.0		True	Save 99p Was £1.99 Now £1.00	1	100G	[Baked Pea and Rice Snacks Lightly Seasoned with Salt., The Calbee Promise., Our commitment to a healthier future, Find out more, visit www.yushoi.co.uk]	http://img.tesco.com/Groceries/pi/133/5060413750133/IDShot_90x90.jpg	Yushoi Snapea Rice Sticks Lightly Salted 105G	1.0	79760131	0.952
34	0.125	G	125.0				1	KG	[Reduced Fat Cheddar Cheese Spread., For tasty inspiration go to www.seriouslystrongcheddar.co.uk]	http://img.tesco.com/Groceries/pi/890/5017838816890/IDShot_90x90.jpg	Seriously Strong Spreadable Lighter 125G	1.45	73397046	11.6
35	0.249	G	171.0		True	Save 70p Was £1.70 Now £1.00	1	100G	[Cheddar & Onion Flavour Potato Crisps, Snacks can be enjoyed as part of a balanced diet and healthy lifestyle, including regular exercise., mccoys.co.uk, Facebook/mccoyscrisps, Twitter@mccoys]	http://img.tesco.com/Groceries/pi/610/5000237121610/IDShot_90x90.jpg	Mccoys Cheese And Onion Crisps 6X28.5G	1.0	58514323	0.585
36	0.172	G	102.0	False			1	100G	[Sweet 'n salt flavoured popped corn, Pop online & say hello:, Twitter, Facebook, Instagram, Tweet me before you eat me]	http://img.tesco.com/Groceries/pi/407/5060262482407/IDShot_90x90.jpg	Metcalfe's Skinny Popcorn Sweet And Salt 6X17g	1.79	81082781	1.76
37	0.603	G	600.0		True	Save 50p Was £1.50 Now £1.00	1	100G	[A soup made with tomatoes and basil.]	http://img.tesco.com/Groceries/pi/964/5050179965964/IDShot_90x90.jpg	Tesco Tomato And Basil Soup 600G	1.0	55934850	0.167
38	0.604	G	600.0	False	True	Save 50p Was £1.50 Now £1.00	1	100G	[A soup made with sweetcorn, chicken and spring onion.]	http://img.tesco.com/Groceries/pi/070/5051008022070/IDShot_90x90.jpg	Tesco Chicken And Sweetcorn Soup 600G	1.0	52875328	0.167
39	16.853	G	25.0	False			1	100G	[Smoked Pork Salami Sausage.]	http://img.tesco.com/Groceries/pi/690/4251097401690/IDShot_90x90.jpg	Peperami Original 25G	0.7	50893663	2.8
40	0.477	G	40.0		True	Any 3 for £5.00	1	100G	[Rice wafers with a hint of carrot, Join us online for information, freebies, competitions and more. Visit our website www.kiddylicious.co.uk/join in]	http://img.tesco.com/Groceries/pi/424/5060040254424/IDShot_90x90.jpg	Kiddylicious Wafers Carrot 40G	2.0	78173764	5.0
41	0.556	G	465.0				1	100G	[Roasted Salted Peanuts, Snacks can be enjoyed as part of a balanced diet and healthy lifestyle, including regular exercise.]	http://img.tesco.com/Groceries/pi/598/5000237108598/IDShot_90x90.jpg	Kp Original Jumbo Salted Peanuts Caddy 465G	3.0	66196110	0.645
42	0.15	G	100.0				1	100G	[Strawberry & Apple, Bear Fact, Research shows that time outdoors makes kids happier and more confident as they grrrow, Visit bearnibbles.co.uk for more activities & info about our work together]	http://img.tesco.com/Groceries/pi/231/5060139431231/IDShot_90x90.jpg	Bear Fruit Paws Dino 5 X 20G	2.5	77474467	2.5
43	0.323	G	270.0		True	Any 2 for £3.00	1	KG	[Dry Roasted Peanuts, We take pride in developing the ethical sourcing of our nuts and being as environmentally friendly as possible., For more information visit www.kpnuts.com, Snacks can be enjoyed as part of a balanced diet and healthy lifestyle, including regular exercise.]	http://img.tesco.com/Groceries/pi/866/5000237120866/IDShot_90x90.jpg	Kp Dry Roasted Peanuts 270G	1.99	50385683	7.38
44	0.133	G	100.0				1	100G	[Crispy Potato Thins with Cream Cheese and Onion Flavour.]	http://img.tesco.com/Groceries/pi/758/7622210400758/IDShot_90x90.jpg	Ritz Crisp&Thin Cream Cheese And Onion 100G	1.99	79184640	1.99
45	0.143	G	90.0				1	100G	[Salt & Vinegar Flavour Wheat & Potato Snacks, Snacks can be enjoyed as part of a balanced diet and healthy lifestyle, including regular exercise.]	http://img.tesco.com/Groceries/pi/842/5000237117842/IDShot_90x90.jpg	Hula Hoops Puft Salt And Vinegar 6X15g	1.7	78472364	1.89
46	0.904	G	600.0		True	Save 50p Was £1.50 Now £1.00	1	100G	[A soup made with broccoli and blue Stilton&#174; cheese.]	http://img.tesco.com/Groceries/pi/022/5050179966022/IDShot_90x90.jpg	Tesco Broccoli And Stilton Soup 600G	1.0	55934936	0.167
47	0.068	G	60.0		True	Any 3 for 2 Cheapest Product Free	1	KG	[Grow happy ™, 12 finger biscuits., Made with baby grade ingredients and with iron for healthy brain development. Heinz Biscotti are made in Italy to our unique recipe and have a gentle crunch which softens in little mouths., Banana flavoured finger biscuits.]	http://img.tesco.com/Groceries/pi/609/5000157070609/IDShot_90x90.jpg	Heinz Banana Biscotti 60G	0.75	67269795	12.5
48	0.016	G	125.0		True	Any 2 for £3.00	1	KG	[Banana + Raisin Oaty Fingers, P.S. let's be friends, Sign up at ellaskitchen.co.uk]	http://img.tesco.com/Groceries/pi/737/5060107332737/IDShot_90x90.jpg	Ella's Banana And Raisin Nibbly Fingers 5 X 25G	2.5	70701245	20.0
49	0.083	G	75.0	False	True	Save 29p Was 79p Now 50p	1	100G	[Plantain Chips Naturally Sweet, Care enough, We support Ecuadorian rainforest communities]	http://img.tesco.com/Groceries/pi/595/0832697000595/IDShot_90x90.jpg	Samai Sweet Plantain Chips 75G	0.5	62935994	0.667
50	0.022	G	20.0				1	100G	[Cheese flavour potato snack.]	http://img.tesco.com/Groceries/pi/839/5000328583839/IDShot_90x90.jpg	Walkers Quavers Cheese Snack 20G	0.55	50518124	2.75
51	0.74	G	600.0				1	100G		http://img.tesco.com/Groceries/pi/629/5000328377629/IDShot_90x90.jpg	Walkers Variety Crisps 24X25g	4.0	78568695	0.667
52	0.133	G	100.0				1	100G	[Crispy Potato Thins with Sea Salt and Vinegar Flavour.]	http://img.tesco.com/Groceries/pi/734/7622210400734/IDShot_90x90.jpg	Ritz Crisp&Thin Sea Salt And Vinegar 100G	1.99	79184611	1.99
53	0.019	KG	0.006				1	KG	[Freeze-dried Strawberry Slices and Yoghurt Pieces]	http://img.tesco.com/Groceries/pi/986/5051594004986/IDShot_90x90.jpg	Super Yummies Strawberry And Yoghurt Pieces By Cow & Gate 6G	0.75	80502771	125.0
54	0.057	G	40.0				1	100G		http://img.tesco.com/Groceries/pi/noimage.jpg	Mini Pringles Sour Cream And Onion 40G	0.5	80100702	1.25
55	0.4	G	400.0				1	KG	[Cheese Spread Slices with added Calcium., Go online: www.dairylea.co.uk]	http://img.tesco.com/Groceries/pi/952/5000224009952/IDShot_90x90.jpg	Dairylea Slices 400G	2.5	51363955	6.25
56	0.099	G	70.0	False			1	100G	[Pitted green manzanilla olives with olive oil, garlic and thyme.]	http://img.tesco.com/Groceries/pi/431/8410134010431/IDShot_90x90.jpg	Fragata Spanish Olive With Andalusia 70G	0.99	75947107	1.42
57	0.099	G	90.0			£2 off when you spend £10 on any Asian products	1	100G	[Chilli & Lemon Flavoured Potato Snack Mix (Grills, Crinkles, Sticks, Hoops, Spirals)]	http://img.tesco.com/Groceries/pi/851/5026489475851/IDShot_90x90.jpg	Cofresh Chilli And Lemon Party Snack Mix 90G	0.7	66641956	0.778
58	0.128	KG	0.108				1	KG	[Organic berry crispy bars containing a blend of raisins, puffed rice, strawberry and raspberry juice, Wonder of nature..., Did you know that the strawberry plant, along with its good friend the raspberry, are all part of the rose family?, Do you have a question for us?, Join us online for tips, recipes and to share your stories., You'll find us at:, Facebook/organixfood, Twitter@organixbrands, And at www.organix.com or you can call us on 0800 39 35 11 (UK) or 1 800 40 92 78 (ROI), Goodies Gang created by Caroline Jayne Church www.carolinejaynechurch.com]	http://img.tesco.com/Groceries/pi/213/5024121443213/IDShot_90x90.jpg	Organix Berry Crispy Bar 6X18g	2.5	81219045	23.15
59	0.7	G	700.0			30p off Tesco chilled soup	1	100G	[Fresh Vegetable & Red Split Lentil Soup, For all things soup visit our kitchen at www.newcoventgardensoup.com, Find us on Facebook and Twitter]	http://img.tesco.com/Groceries/pi/519/5060045386519/IDShot_90x90.jpg	New Covent Garden Hearty Five Vegetable Soup 700G	2.35	74533702	0.336
60	0.184	G	168.0				1	100G	[Salt & Vinegar Flavour Potato Rings, Snacks can be enjoyed as part of a balanced diet and healthy lifestyle, including regular exercise.]	http://img.tesco.com/Groceries/pi/403/5000237112403/IDShot_90x90.jpg	Kp Hula Hoops Salt And Vinegar 7X24g	1.7	64384328	1.02
61	0.303	G	270.0		True	Any 2 for £2.00	1	100G	[Seasoned pork sausage meat with sweet chilli sauce wrapped in puff pastry., 9 Pork & Sweet Chilli Sausage Rolls]	http://img.tesco.com/Groceries/pi/697/5054775261697/IDShot_90x90.jpg	Tesco 9 Pork And Sweet Chilli Sausages Rolls 270G	1.5	80399492	0.556
62	0.265	G	250.0				1	KG	[Cheddar Cheese Spread., For tasty inspiration go to www.seriouslystrongcheddar.co.uk]	http://img.tesco.com/Groceries/pi/763/5017838815763/IDShot_90x90.jpg	Seriously Strong Cheddar Spreadable 250G	2.5	67539303	10.0
63	0.101	KG	0.08		True	Any 2 for £3.00	1	KG	[Parsnip + Poppy Seed Savoury Biccies, P.S. let's be friends, Sign up at ellaskitchen.co.uk]	http://img.tesco.com/Groceries/pi/422/5060107339422/IDShot_90x90.jpg	Ella's Kitchen Parsnip And Poppyseed Savoury Biscuits 4X20g	2.0	81244262	25.0
64	0.083	G	75.0	False	True	Save 29p Was 79p Now 50p	1	100G	[Plantain Chips - Pacific Sea Salt, Care enough, We support Ecuadorian rainforest communities]	http://img.tesco.com/Groceries/pi/564/0832697000564/IDShot_90x90.jpg	Samai Salted Plantain Chips 75G	0.5	62935936	0.667
65	0.14	KG	0.1				1	KG	[Organic farm animal biscuits containing wholegrain wheat flour and grape juice with added vitamin B1, Did you know as people started to explore the globe, biscuits were great for travelling as they stayed fresh and tasty for a really long time, Do you have a question for us? Join us online for tips, recipes and to share your stories., You'll find us at:, Facebook/organixfood, Twitter@organixbrands, And at www.organix.com or call us on 0800 39 35 11 (UK) or 1 800 40 92 78 (ROI), Goodies Gang created by Caroline Jayne Church www.carolinejaynechurch.com]	http://img.tesco.com/Groceries/pi/300/5024121617300/IDShot_90x90.jpg	Organix 12 Month Goodies Animal Biscuits 100G	1.3	65514497	13.0
66	0.071	G	50.0				1	100G	[Organic rice cakes coated with banana & apple juice, Join in at organix.com, If you've got a question, need some help or want to chat, join us and lots of other parents online., See you there, Facebook/organixfood, Twitter@organixbrands, And at www.organix.com or call us on 0800 39 35 11 (UK) or 1800 40 92 78 (ROI)]	http://img.tesco.com/Groceries/pi/114/5024121865114/IDShot_90x90.jpg	Organix Banana Rice Cake 50G	1.2	73361716	2.4
67	0.128	KG	0.108				1	KG	[Organic cocoa & orange crispy bars containing a blend of raisins, puffed rice, cocoa & orange oil, From across the seas..., Did you know that around one third of all orange are grown in Brazil?, Do you have a question for us?, Join us online for tips, recipes and to share your stories., You'll find us at:, Facebook/organixfood, Twitter@organixbrands, And at www.organix.com or you can call us on 0800 39 35 11 (UK) or 1 800 40 92 78 (ROI), Goodies Gang created by Caroline Jayne Church www.carolinejaynechurch.com]	http://img.tesco.com/Groceries/pi/219/5024121441219/IDShot_90x90.jpg	Organix Cocoa And Orange Crispy Bar 6X18g	2.5	81218956	23.15
68	0.28	G	280.0				1	KG	[Cheese spread]	http://img.tesco.com/Groceries/pi/242/3073780574242/IDShot_90x90.jpg	Laughing Cow Cheese Triangles 280G	2.0	55005504	7.15
69	0.2	G	200.0				1	KG	[Processed slices made using a blend of cheese, vegetable oil and milk proteins, Mature cheese flavoured processed slices, great on a burger]	http://img.tesco.com/Groceries/pi/059/5052909781059/IDShot_90x90.jpg	Tesco Full Fat 10 Mature Cheese Slices 200G	1.0	72068697	5.0
70	0.904	G	600.0		True	Save 50p Was £1.50 Now £1.00	1	100G	[A creamy soup made with carrot and coriander., Tesco Carrot & Coriander Soup 600g]	http://img.tesco.com/Groceries/pi/940/5050179965940/IDShot_90x90.jpg	Tesco Carrot And Coriander Soup 600G	1.0	55934815	0.167
71	0.19	G	160.0				1	100G	[A microwaveable pizza slice topped with Italian tomato sauce, mozzarella, mature Cheddar cheese, pepperoni, black pepper and oregano., A microwaveable pizza slice topped with Italian tomato sauce, mozzarella & Cheddar cheese, pepperoni and black pepper & oregano.]	http://img.tesco.com/Groceries/pi/664/5054402181664/IDShot_90x90.jpg	Tesco Pepperoni Pizza Wedges 160G	1.5	77747865	0.938
72	0.225	G	100.0				1	100G	[Free range hard boiled eggs with spinach., Egg and Spinach Protein Pot]	http://img.tesco.com/Groceries/pi/621/0000003264621/IDShot_90x90.jpg	Tesco Egg And Spinach Protein Pot 100G	1.5	80319585	1.5
73	0.525	G	300.0		True	Save 99p Was £1.99 Now £1.00	1	100G	[Doritos Nacho Cheese Dip., Facebook/doritos, Twitter@doritosuk]	http://img.tesco.com/Groceries/pi/844/5000328181844/IDShot_90x90.jpg	Doritos Nacho Cheese Dip 300G	1.0	67823214	0.333
