	AverageSellingUnitWeight	ContentsMeasureType	ContentsQuantity	IsNew	IsSpecialOffer	PromotionDescription	UnitOfSale	UnitQuantity	description	image	name	price	tpnb	unitprice
57	0.33	G	300.0		True	Save 90p Was £2.90 Now £2.00	1	100G	[Rich and nutty bites crammed with chunky chickpeas, spinach and pine nuts with fragrant herbs and spices - simply blended and baked]	http://img.tesco.com/Groceries/pi/692/5036829750692/IDShot_90x90.jpg	Great Food Spin And Pinenut Bites 300G	2.0	76781433	0.667
58	0.142	G	100.0	False			1	100G	[The Caribbean Classic.]	http://img.tesco.com/Groceries/pi/992/0064396543992/IDShot_90x90.jpg	Wibisco Shirley Coconut Biscuits 100G	0.49	54877248	0.49
59	0.42	KG	0.36				1	KG	[Coconut Squishies Strawberry, Apple & Banana, Check out the full range at heavenlytasty.com, Follow us on Facebook and Twitter]	http://img.tesco.com/Groceries/pi/394/5060243220394/IDShot_90x90.jpg	Heavenly Coconut Squishie Strawberry Apple And Banana 360G	3.0	80010523	8.34
60	0.098	G	40.0				1	100G	[Sour Cream and Onion Flavour Savoury Snack]	http://img.tesco.com/Groceries/pi/384/5053990107384/IDShot_90x90.jpg	Pringles Sour Cream And Onion 40G	0.79	53292091	1.98
61	0.491	G	350.0		True	Half Price Was £3.10 Now £1.47	1	100G	[Cheese & Onion Flavour Potato Crisps]	http://img.tesco.com/Groceries/pi/350/5000328589350/IDShot_90x90.jpg	Walkers Cheese And Onion Crisps 14X25g	2.0	58062808	0.571
62	0.35	G	300.0				1	100G	[Marinated pork and vegetables in a spicy chilli and soy sauce, served with cooked noodles., Marinated pork and vegetables in a spicy chilli and soy sauce, served with cooked noodles.]	http://img.tesco.com/Groceries/pi/628/5054402161628/IDShot_90x90.jpg	Tesco Noodle Pot Spicy Bbq Pork 300G	1.5	77715166	0.5
63	0.75	G	600.0			30p off Tesco chilled soup	1	100G	[A soup made with cooked rice, cooked chicken, red lentils, coconut and spices.]	http://img.tesco.com/Groceries/pi/946/5000358400946/IDShot_90x90.jpg	Tesco Finest Chicken Mulligatawny Soup 600G	2.5	51043292	0.417
64	0.413	G	380.0	False	True	Save £1.00 Was £3.00 Now £2.00	1	KG	[Mexican sweet potato chilli: cooked brown rice & quinoa, black turtle beans, sweet potato and spinach in a spicy chilli sauce., We're social, follow us at:, Facebook/bolfoods, Twitter@bolfoods, Instagram@bolfoods]	http://img.tesco.com/Groceries/pi/049/5060430290049/IDShot_90x90.jpg	Bol Mexican Sweet Potato Chilli 380G	2.0	79102928	5.27
65	0.273	G	180.0				1	100G	[Sea salted potato crisps, There's more good stuff at www.seabrookcrisps.com]	http://img.tesco.com/Groceries/pi/110/5016451062110/IDShot_90x90.jpg	Seabrook Cut Sea Salted Crisps 6 Pack	1.4	53320266	0.778
66	0.06	G	55.0	False			1	100G	[Corn snack with hot & spicy flavour with sugar and sweetener]	http://img.tesco.com/Groceries/pi/514/4939826517514/IDShot_90x90.jpg	Wagaya Yamitsuki Corn Snack Hot And Spicy 55G	1.2	81464632	2.19
67	0.452	SNGL	1.0				1	EACH	[12 choux pastry cases filled with fresh stabilised cream (38%) and covered in Belgian chocolate (13%) sauce, Delicious profiteroles filled with fresh British cream and generously drizzled with thick, sticky Belgian chocolate sauce.]	http://img.tesco.com/Groceries/pi/967/5000436682967/IDShot_90x90.jpg	Tesco Fresh Cream Chocolate Profiterole Stack	2.5	54681965	2.5
68	0.125	G	88.0	False	True	Save 59p Was £1.59 Now £1.00	1	100G	[Lentil Snack with Sweet Chilli Seasoning., www.facebook.com/KETTLEChipsUK]	http://img.tesco.com/Groceries/pi/741/5017764701741/IDShot_90x90.jpg	Kettle Bites Lentil Curls Sweet Chilli 88G	1.0	81333197	1.14
69	0.413	G	380.0	False	True	Save £1.00 Was £3.00 Now £2.00	1	KG	[Sri Lankan lentil sambar: spinach, cauliflower and red lentils with basmati rice in a Sambar sauce., We're social, follow us at:, Facebook/bolfoods, Twitter@bolfoods, Instagram@bolfoods]	http://img.tesco.com/Groceries/pi/063/5060430290063/IDShot_90x90.jpg	Bol Sri Lankan Lentil Sambar 380G	2.0	79904348	5.27
70	0.4	G	400.0			30p off Tesco chilled soup	1	KG	[Positively Distinctly Pea & Minty Soup, Archaeologists have unearthed peas in ancient Chinese tombs. The Chinese believe that their emperor, Shu Nung, discovered peas 5, 000 years ago. He is said to have wandered through the countryside collecting plants suitable for food or medicine. Potential edibles were fed to a dog, then a servant and, if both survived, the emperor himself would taste the new food.]	http://img.tesco.com/Groceries/pi/414/5391511420414/IDShot_90x90.jpg	Cully And Sully Pea And Minty Soup 400G	1.5	67315165	3.75
71	0.199	G	125.0		True	Any 3 for £4.00	1	100G	[Beef & Onion Flavour Potato Crisps, Follow us on:, Facebook and Twitter, For our latest news and competitions]	http://img.tesco.com/Groceries/pi/626/5000328521626/IDShot_90x90.jpg	Walkers Beef And Onion Crisps 6 Pack	1.5	80089216	1.2
72	0.043	G	30.0	True			1	100G	[Plump Pears, Get Snacking..., For more information on our range visit our website, like us on Facebook and Instagram or follow us on Twitter., whitworths.co.uk]	http://img.tesco.com/Groceries/pi/715/5000234050715/IDShot_90x90.jpg	Whitworths Pear 30G Snack Pack	0.59	81623608	1.97
73	0.262	KG	0.2				1	KG	[Fruity Muesli with crispy ducks]	http://img.tesco.com/Groceries/pi/763/4062300270763/IDShot_90x90.jpg	Hipp Organic Crunchy Muesli 200G	2.4	81171439	12.0
74	0.093	G	75.0				1	100G	[Epic Meat Snacks Made with 100% Prime Pork. Cured and Slowly Smoked for a More Intense Taste.]	http://img.tesco.com/Groceries/pi/480/5000178111480/IDShot_90x90.jpg	Mattessons Chorizo Savagers Intense Chilli 3X25g	1.69	81574395	2.26
75	0.196	G	150.0		True	Save 99p Was £1.99 Now £1.00	1	100G	[Roasted Chicken & Thyme Flavour Potato Crisps, www.sensationscrisps.co.uk, www.facebook.com/sensationscrisps]	http://img.tesco.com/Groceries/pi/685/5000328197685/IDShot_90x90.jpg	Sensations Oven Roast Chicken And Thyme 150G	1.0	75157316	0.667
76	0.077	G	60.0	False			1	100G	[Finely chopped, cooked, smoked and dried snacking pork kabanos sausage seasoned with chilli.]	http://img.tesco.com/Groceries/pi/891/5901784152891/IDShot_90x90.jpg	Morliny Party Snack Chilli 60G	1.0	81607482	1.67
77	0.165	G	150.0	False	True	Save 29p Was £1.29 Now £1.00	1	100G	[Lightly Salted Popcorn, Full product range available online www.shopatregal.com, Join us on Facebook, Follow us on Twitter]	http://img.tesco.com/Groceries/pi/653/5027738011653/IDShot_90x90.jpg	Regal Lightly Salted Popcorn 150G	1.0	71232752	0.667
78	0.19	G	150.0				1	KG	[Smoky Flavour Cheddar cheese cubes made with natural flavouring., Smoky Flavour Cheddar Cubes]	http://img.tesco.com/Groceries/pi/499/5054775980499/IDShot_90x90.jpg	Tesco Smokey Cheddar Cubes 150G	1.5	81232489	10.0
79	0.495	G	396.0	False			1	100G	[Really Cheesy Flavour Corn Puffs]	http://img.tesco.com/Groceries/pi/127/5000328363127/IDShot_90x90.jpg	Walkers Wotsits Cheese Crisps 24X16.5G	4.0	78551000	1.02
80	0.608	G	600.0	False	True	Save 50p Was £1.50 Now £1.00	2	100G	[A soup made with tomatoes, lentils and cooked smoked bacon.]	http://img.tesco.com/Groceries/pi/709/5054775144709/IDShot_90x90.jpg	Tesco Tomato, Lentil And Bacon Soup 600G	1.0	80305653	0.167
81	0.233	G	227.0				1	100G	[Soya alternative to medium strength hard cheese.]	http://img.tesco.com/Groceries/pi/517/5052909007517/IDShot_90x90.jpg	Tesco Free From Soya Medium 227G	2.25	70914120	0.991
82	0.141	SNGL	6.0				1	EACH	[Popcorn Assortment: 2 x Salted Popped Maize Kernels, 2 x Popped Maize Kernels with Sugar, 2 x Popped Maize Kernels with Sugar and Salt]	http://img.tesco.com/Groceries/pi/826/5053947142826/IDShot_90x90.jpg	Tesco Popcorn Variety Multipack 6 Pack	1.39	73855564	0.232
83	0.26	G	180.0	False			1	100G	[Chilli Heatwave Flavour Corn Chips, Facebook/DoritosUK, Twitter@DoritosUK, www.doritos.co.uk]	http://img.tesco.com/Groceries/pi/805/5000328386805/IDShot_90x90.jpg	Doritos Chilli Heatwave 6 Pack	1.5	50561532	0.833
84	0.306	G	278.0	False			1	KG	[A lightly spiced snack with vegetables wrapped in a crisp pastry, Made with pan fried vegetables, onion seeds, chilli and garam masala, hand wrapped in crisp pastry]	http://img.tesco.com/Groceries/pi/569/5052909660569/IDShot_90x90.jpg	Tesco 4 Vegetable Samosas 278G	1.5	53742256	5.4
85	0.238	KG	0.14				1	KG	[Organic fruity multigrain cereal loops flavoured with fruit juice concentrates, HiPP Organic products should be enjoyed as part of a varied and balanced weaning diet.]	http://img.tesco.com/Groceries/pi/862/4062300270862/IDShot_90x90.jpg	Hipp Organic Fruity O's 2X70g	2.4	81171520	17.15
86	0.083	G	75.0		True	Save 29p Was 79p Now 50p	1	100G	[Plantain Chips - Jungle Chilli, We support Ecuadorian rainforest communities, Facebook.com/SamaiSnacks]	http://img.tesco.com/Groceries/pi/571/0832697000571/IDShot_90x90.jpg	Samai Chilli Plantain Chips 75G	0.5	62935464	0.667
87	0.133	G	100.0	False			1	100G	[Crispy Potato Thins with Sea Salt Flavour.]	http://img.tesco.com/Groceries/pi/169/7622210983169/IDShot_90x90.jpg	Ritz Crisp And Thin Sea Salt 100G	1.99	81158001	1.99
88	0.187	G	150.0	False			1	100G	[Salt & Vinegar Flavour Potato Crisps]	http://img.tesco.com/Groceries/pi/139/5000119126139/IDShot_90x90.jpg	Tesco Salt And Vinegar Crisps 6X25g	0.85	50286276	0.567
89	0.566	G	450.0	False			1	KG	[Roasted Salted Peanuts, Snacks can be enjoyed as part of a balanced diet and healthy lifestyle, including regular exercise., We take pride in developing the ethical sourcing of our nuts and being as environmentally friendly as possible., For more information visit www.kpnuts.com]	http://img.tesco.com/Groceries/pi/927/5000237120927/IDShot_90x90.jpg	Kp Salted Peanuts 450G	2.99	50072293	6.65
90	0.243	G	160.0				1	100G	[A Mediterranean style dip made with chickpeas, sesame seed paste, lemon juice and garlic., A Mediterranean style dip made with chickpeas, sesame seed paste, lemon juice and garlic.]	http://img.tesco.com/Groceries/pi/463/0000003244463/IDShot_90x90.jpg	Tesco Houmous Snacking Dips 160G	1.25	75917201	0.781
91	0.38	G	330.0				1	100G	[Pieces of chicken breast in a creamy onion, tomato and chilli sauce, served with pilau rice, Pieces of chicken breast in a creamy onion, tomato and chilli sauce, served with pilau rice]	http://img.tesco.com/Groceries/pi/390/5054402161390/IDShot_90x90.jpg	Tesco Chicken Tikka Masala Rice Pot 330G	1.5	77714910	0.455
92	0.19	G	150.0				1	KG	[Cheddar cheese with bell pepper, jalape&#241;o chilli peppers and spicy seasoning., Spicy Cheddar Cubes]	http://img.tesco.com/Groceries/pi/567/5054775980567/IDShot_90x90.jpg	Tesco Spicey Cheddar Cubes 150G	1.5	81232535	10.0
93	0.09	G	168.0				1	100G		http://img.tesco.com/Groceries/pi/625/5000237112625/IDShot_90x90.jpg	Kp Hula Hoops Meaty 7 X 24G	1.7	67754831	1.02
94	203.203	G	180.0		True	Any 2 for £5.00	1	100G	[Cooked and sliced chicken breast fillets in a piri piri style marinade., Tasty and ready to eat hot or cold. 100% chicken breast.  Liven up your lunch time with chunky slices of piri piri marinated roast chicken. Bored of ham sandwiches? Pack a pitta, build a bagel or assemble a salad with piri piri chicken, avocado and rocket leaves. Or simply eat your chicken as a tasty protein packed snack on the go.  Looking for inspiration? Piri piri chicken is the perfect topping for your own homemade pizzas. Start with a Tesco pizza base and top with passata, grated cheese and roast chicken pieces for family friendly food fun]	http://img.tesco.com/Groceries/pi/238/5053526878238/IDShot_90x90.jpg	Tesco Ready To Eat Piri Piri Chicken Breast Pieces 180G	3.0	75998478	1.67
95	0.239	G	150.0	False			1	100G	[Hand Cooked Potato Chips, Lightly Salted.]	http://img.tesco.com/Groceries/pi/209/5017764113209/IDShot_90x90.jpg	Kettle Lightly Salted Crisps 5X30g	1.79	62663537	1.2
96	0.05	KG	0.03				1	KG	[Crispy Veggie Waffles Sweet Beet and Shallot, Join us online to find out more about our story., Check out the full range at heavenlytasty.com]	http://img.tesco.com/Groceries/pi/486/5060243220486/IDShot_90x90.jpg	Heavenly Crispy Vegetable Waffles Sweet Beet&Shallot 30G	2.0	80990548	66.67
97	0.176	G	150.0				1	100G	[Ready Salted Potato Chips]	http://img.tesco.com/Groceries/pi/819/5000119794819/IDShot_90x90.jpg	Tesco Potato Chips 150G	0.85	50992119	0.567
98	0.26	G	215.0				1	100G	[Low fat yogurt with red quinoa, strawberry & raspberry sauce, honey oats and apple., Berry & Apple Breakfast Pot 215g]	http://img.tesco.com/Groceries/pi/345/0000003265345/IDShot_90x90.jpg	Tesco Berry And Apple Breakfast Pot 215G	1.5	80319579	0.698
99	0.192	G	150.0		True	Half Price Was £1.99 Now 99p	1	100G	[Hand Cooked Potato Chips with Smoky Barbecue Seasoning.]	http://img.tesco.com/Groceries/pi/813/5017764112813/IDShot_90x90.jpg	Kettle Chips Smoky Barbecue 150G	0.99	61196544	0.66
0	0.146	G	110.0				1	KG	[Popped Maize Kernels with Sugar coating]	http://img.tesco.com/Groceries/pi/212/5052320642212/IDShot_90x90.jpg	Tesco Sweet Popcorn 110G	1.0	67754376	9.1
1	0.413	G	380.0	False	True	Save £1.00 Was £3.00 Now £2.00	1	KG	[Jamaican jerk chicken: cooked marinated chicken with cooked rice, black barley, sweet potato, pineapple and peas in a Caribbean style sauce., We're social, follow us at:, Facebook/bolfoods, Twitter@bolfoods, Instagram@bolfoods]	http://img.tesco.com/Groceries/pi/223/5060430290223/IDShot_90x90.jpg	Bol Jamaican Jerk Chicken 380G	2.0	80296898	5.27
2	0.152	SNGL	6.0	False			1	EACH	[Prawn Cocktail Flavour Tapioca Snacks., Prawn Cocktail Flavour Tapioca Snacks.]	http://img.tesco.com/Groceries/pi/209/5054268623209/IDShot_90x90.jpg	Tesco Prawn Shells 6 Pack	0.85	77038103	0.142
3	0.067	G	37.5				1	100G	[Cheese & Onion Flavour Baked Potato Snack]	http://img.tesco.com/Groceries/pi/800/5000328774800/IDShot_90x90.jpg	Walkers Baked Cheese And Onion 37.5G	0.55	59460891	1.47
4	0.151	G	102.0	False			1	100G	[Strawberry, Blackcurrant & Pear Fruit Snack Roll, For more information see, www.kelloggs.co.uk, www.kelloggs.ie]	http://img.tesco.com/Groceries/pi/310/5050083236310/IDShot_90x90.jpg	Kelloggs Duo Fruit Winders Strawberry And Blackcurrant 6 Pack	1.79	50946423	1.76
5	0.292	G	265.0	False			1	100G	[Coconut Flavor Coated Peanut with Sugar and Sweetener]	http://img.tesco.com/Groceries/pi/248/8852023664248/IDShot_90x90.jpg	Koh Kae Coconut Cream Coated Peanuts 265G	1.79	65540062	0.676
6	0.387	G	300.0	False		£2 off when you spend £10 on any Asian products	1	100G	[Crunchy Savoury Rice Sticks]	http://img.tesco.com/Groceries/pi/962/5026489470962/IDShot_90x90.jpg	Cofresh Chakri Rice Sticks 300G	1.38	58119371	0.46
7	0.199	G	150.0		True	Any 3 for £4.00	1	100G	[Marmite® Flavour Potato Crisps, Follow us on:, Facebook and Twitter, For our latest news and competitions]	http://img.tesco.com/Groceries/pi/772/5000328486772/IDShot_90x90.jpg	Walkers Marmite Crisps 6X25g	1.5	79530876	1.0
8	0.111	SNGL	1.0	False	True	Save 60p Was £3.00 Now £2.40	1	EACH		http://img.tesco.com/Groceries/pi/799/9414202214799/IDShot_90x90.jpg	Sistema Snack Attack	2.4	79591630	2.4
9	0.438	G	400.0	False		30p off Tesco chilled soup	1	100G	"[A Hearty Chicken & Vegetable Soup, Also known as Jewish penicillin, chicken soup has, since the ancient Egyptian times, been a cure for the common cold. In the 12th century the Jewish sage maimonides wrote that chicken soup ""has virtue in rectifying corrupted humours"". Sipping warm soup can clear the sinuses, serving as a natural decongestant and so relieving cold and flu symptoms.]"	http://img.tesco.com/Groceries/pi/209/5391511420209/IDShot_90x90.jpg	Cully And Sully Chicken & Vegetable Soup 400G	1.5	62383413	0.375
10	0.259	G	190.0	False	True	Any 2 for £3.00	1	100G	[Chipolata and Bacon Flavour Savoury Snack, You Don't Just Eat'em™..., Pringles.com]	http://img.tesco.com/Groceries/pi/606/5053990113606/IDShot_90x90.jpg	Pringles Seasonal Pigs In Blanket 190G	1.99	79890881	1.05
11	0.413	G	380.0		True	Save £1.00 Was £3.00 Now £2.00	1	KG	[Cooked basmati & black rice with red peppers, coconut cream, water chestnuts, lime leaves and lemongrass in a Red Thai curry sauce, We're social, follow us at: Facebook bolfoods, twitter@bolfoods, instagrambolfoods, Upcycle your BOL, There are loads of great ways to re use your BOL and help the environment., For some fresh ideas go to bolfoods.com]	http://img.tesco.com/Groceries/pi/001/5060430290001/IDShot_90x90.jpg	Bol Thai Coconut Curry 380G	2.0	79102859	5.27
12	0.413	G	380.0		True	Save £1.00 Was £3.00 Now £2.00	1	KG	[Singapore vermicelli noodles: cooked vermicelli noodles, red peppers, shiitake mushrooms and edamame beans in a Singapore style sauce., We're social, follow us at:, Facebook/bolfoods, Twitter@bolfoods, Instagram@bolfoods]	http://img.tesco.com/Groceries/pi/100/5060430290100/IDShot_90x90.jpg	Bol Singapore Noodles 380G	2.0	79102986	5.27
13	0.088	G	80.0	False	True	Any 2 for £1.00	1	100G	[Hot & Spicy., Fresh Ideas, Our Chilli flavoured Potato Hoops are mildly spiced and made from the finest quality ingredients.]	http://img.tesco.com/Groceries/pi/668/5026489479668/IDShot_90x90.jpg	Cofresh Hot Chilli Flavour Potato Hoops 80G	0.7	78641101	0.875
14	0.049	G	25.0				1	100G	[Ready Salted Baked Potato Snack]	http://img.tesco.com/Groceries/pi/655/5000328877655/IDShot_90x90.jpg	Walkers Baked Ready Salted Crisps 37.5G	0.55	59460931	2.2
15	71.25	G	80.0		True	Any 2 for £3.00	1	100G	[Raisin + Oat Cookies, P.S. let's be friends, Sign up at ellaskitchen.co.uk]	http://img.tesco.com/Groceries/pi/445/5060107336445/IDShot_90x90.jpg	Ella's Kitchen Raisin Spelt Biscuits 80G	2.0	76580291	2.5
16	0.25	G	210.0				1	100G	[Salted Microwaveable Popcorn, To pop the perfect microwave corn, take a look at our handy video: www.butterkist.co.uk/product/salted microwave popcorn/, www.facebook.com/ButterkistPopcorn, www.twitter.com/ButterkistUK]	http://img.tesco.com/Groceries/pi/912/5010511474912/IDShot_90x90.jpg	Butterkist Salted Microwave Popcorn 3X70g	1.99	77425273	0.948
17	0.157	G	125.0				1	100G		http://img.tesco.com/Groceries/pi/809/0077975084809/IDShot_90x90.jpg	Snyders Hot Buffalo Wing Pretzel Pces125g	1.3	74546514	1.04
18	0.019	G	150.0				2	100G	[Sea salt & cider vinegar seasoned potato crisps., Keep your eyes peeled for our Veg Crisps, they're splendid, design: www.bigfish.co.uk]	http://img.tesco.com/Groceries/pi/406/5060042641406/IDShot_90x90.jpg	Tyrrells Crisps Sea Salted&Cider Vinegar150g	1.99	70602351	1.33
19	0.26	G	150.0				1	100G		http://img.tesco.com/Groceries/pi/196/5016451062196/IDShot_90x90.jpg	Seabrook Variety Crisps 6 Pack	1.4	62622876	0.933
20	0.413	G	380.0		True	Save £1.00 Was £3.00 Now £2.00	1	KG	[Keralan coconut chicken: marinated cooked chicken with cauliflower, green beans, beetroot and basmati rice in a Keralan style coconut sauce., We're social, follow us at:, Facebook/bolfoods, Twitter@bolfoods, Instagram@bolfoods]	http://img.tesco.com/Groceries/pi/209/5060430290209/IDShot_90x90.jpg	Bol Keralan Coconut Chicken 380G	2.0	80296846	5.27
21	0.146	G	150.0				1	100G	[Mature cheddar and caramelised onion flavour potato crisps., Tangy, robust cheddar and distinctly sweet onions.]	http://img.tesco.com/Groceries/pi/508/5000358776508/IDShot_90x90.jpg	Tesco Finest Mature Cheddar And Onion Crisps 150G	1.0	51046156	0.667
22	0.2	G	150.0	True			1	100G	[Sour Cream & Chive Flavour Wheat & Potato Hoop Shaped Savoury Snacks, Snacks can be enjoyed as part of a balanced diet and healthy lifestyle, including regular exercise.]	http://img.tesco.com/Groceries/pi/952/5000237122952/IDShot_90x90.jpg	Hula Hoops Golden Hoops Sour Cream And Chive 150G	1.5	81595370	1.0
23	0.248	G	150.0	False			1	100G		http://img.tesco.com/Groceries/pi/292/5017764113292/IDShot_90x90.jpg	Kettle Variety Crisps 5 Pack 5 Pack X 30G	1.79	61145790	1.2
24	0.028	G	25.0	False			1	100G	[Tasty Thin Strips of Select Beef - Seasoned & Dried]	http://img.tesco.com/Groceries/pi/918/4251097402918/IDShot_90x90.jpg	Jack Links Beef Jerky Sweet And Hot 25G	1.5	74624589	6.0
25	0.219	G	200.0	False	True	Any 2 for £1.50	1	100G		http://img.tesco.com/Groceries/pi/181/8904063200181/IDShot_90x90.jpg	Haldirams Khatta Meetha 200G	1.19	63384923	0.595
26	0.296	G	275.0				1	KG	[Roasted and salted jumbo peanuts.]	http://img.tesco.com/Groceries/pi/085/5052320565085/IDShot_90x90.jpg	Tesco Jumbo Roasted &Salted Peanuts 275G	1.19	67680176	4.33
27	0.198	G	138.0	False			1	100G	[6 x Salt & Malt Vinegar Flavour Potato Crisps, Visit Us At: walkers.co.uk and Facebook.com/walkers]	http://img.tesco.com/Groceries/pi/755/5000328515755/IDShot_90x90.jpg	Walkers Crinkles Salt And Malt Vinegar 6X23g	1.0	67686976	0.725
28	0.236	G	200.0				1	KG	[A mix of roasted and salted cashew nuts, almonds, hazelnuts and pecan nuts., A mix of roasted and salted cashew nuts, almonds, hazelnuts and pecan nuts.]	http://img.tesco.com/Groceries/pi/191/5052320565191/IDShot_90x90.jpg	Tesco Roasted And Salted Nut Assortment 200G	1.69	51324720	8.45
29	0.204	G	180.0		True	Any 2 for £3.00	1	KG	[Spicy Chilli Flavour Peanuts, We take pride in developing the ethical sourcing of our nuts and being as environmentally friendly as possible., For more information visit www.kpnuts.com, Snacks can be enjoyed as part of a balanced diet and healthy lifestyle, including regular exercise.]	http://img.tesco.com/Groceries/pi/155/5000237101155/IDShot_90x90.jpg	Kp Jumbo Spicy Chilli Peanuts 180G	1.99	51831200	11.06
30	0.358	G	325.0	False	True	Any 2 for £1.50	1	100G	[Mixture of Puffed Rice (45%), Savoury Noddles (33%) and Peanuts (22%)]	http://img.tesco.com/Groceries/pi/503/5026489477503/IDShot_90x90.jpg	Cofresh Sev Mamra 325G	1.0	78621194	0.308
31	0.358	G	260.0	False			1	100G	[Cheese Snack Biscuits, To find out how exercise and a balanced diet can help a healthy lifestyle, visit www.123healthybalance.com]	http://img.tesco.com/Groceries/pi/045/5000168180045/IDShot_90x90.jpg	Jacob's Mini Cheddars Christmas Caddy 260G	2.0	53557147	0.769
32	0.219	G	200.0	False	True	Save 19p Was £1.19 Now £1.00	1	100G		http://img.tesco.com/Groceries/pi/013/8904063200013/IDShot_90x90.jpg	Haldirams Aloo Bhujia 200G	1.0	63471601	0.5
33	0.163	G	143.0	False			1	100G		http://img.tesco.com/Groceries/pi/905/0052836145905/IDShot_90x90.jpg	Excelsior Water Crackers Cinnamon 143G	0.69	71028672	0.483
34	0.099	G	90.0	False		£2 off when you spend £10 on any Asian products	1	100G	[Chilli and Lemon Flavour Potato Snacks]	http://img.tesco.com/Groceries/pi/296/5052909164296/IDShot_90x90.jpg	Aasani Chilli And Lemon Potato Twists 90G	0.59	71198901	0.656
35	0.2	G	150.0	True			1	100G	[Salt & Vinegar Flavour Wheat & Potato Hoop Shaped Savoury Snacks, Snacks can be enjoyed as part of a balanced diet and healthy lifestyle, including regular exercise.]	http://img.tesco.com/Groceries/pi/976/5000237122976/IDShot_90x90.jpg	Hula Hoops Golden Hoops Salt And Vinegar 150G	1.5	81595387	1.0
36	0.088	G	80.0	False	True	Any 2 for £1.00	1	100G		http://img.tesco.com/Groceries/pi/527/5026489480527/IDShot_90x90.jpg	Cofresh Mild And Tangy Jalapeno Potato Grills 80G	0.7	78622268	0.875
37	0.031	G	27.2	False			1	10G	[Sezame Snacks]	http://img.tesco.com/Groceries/pi/998/5901588066998/IDShot_90x90.jpg	E.Wedel Aha! Sezamki Bar 27.2G	0.25	70830794	0.092
38	0.75	G	600.0			30p off Tesco chilled soup	1	100G	[A creamy mushroom soup finished with Madeira wine., Tesco Finest Chestnut Mushroom Soup 600g]	http://img.tesco.com/Groceries/pi/147/5010204431147/IDShot_90x90.jpg	Tesco Finest Chestnut Mushroom And Madeira Soup 600G	2.5	57124354	0.417
39	0.28	G	250.0	False			1	KG	[Ready to eat Partially Rehydrated Dried Apricots, Delicious as a snack]	http://img.tesco.com/Groceries/pi/202/5031021361202/IDShot_90x90.jpg	Tesco Ready To Eat Apricots 250G	2.5	52862271	10.0
40	0.139	G	100.0	False	True	Half Price Was £1.49 Now 74p	1	100G	[A mix of sugar coated and salted popcorn., www.facebook.com/ButterkistPopcorn, www.twitter.com/ButterkistUK]	http://img.tesco.com/Groceries/pi/896/5010511475896/IDShot_90x90.jpg	Butterkist Sweet And Salted Popcorn 100G	0.74	77425215	0.74
41	0.2	G	150.0	True			1	100G	[Cheese Flavour Wheat & Potato Hoop Shaped Savoury Snacks, Snacks can be enjoyed as part of a balanced diet and healthy lifestyle, including regular exercise.]	http://img.tesco.com/Groceries/pi/938/5000237122938/IDShot_90x90.jpg	Hula Hoops Golden Hoops Cheese 150G	1.5	81595364	1.0
42	0.047	G	30.0	False			1	100G	[A crunchy and crispy snack made from quinoa flour, flavoured with mild spices.]	http://img.tesco.com/Groceries/pi/778/5026489484778/IDShot_90x90.jpg	Eat Real Quinoa Chips Tomato And Roasted Garlic 30G	0.7	77018087	2.34
43	0.076	G	70.0	False			1	100G		http://img.tesco.com/Groceries/pi/378/5901151002378/IDShot_90x90.jpg	Flips Corn Puffs With Chocolate Flavour 70G	0.69	72694456	0.986
44	0.13	G	140.0	False	True	Save 79p Was £2.79 Now £2.00	1	KG	[Honey Roast Cashew Nuts, We take pride in developing the ethical sourcing of our nuts and being as environmentally friendly as possible., For more information visit www.kpnuts.com, Snacks can be enjoyed as part of a balanced diet and healthy lifestyle, including regular exercise.]	http://img.tesco.com/Groceries/pi/638/5000237110638/IDShot_90x90.jpg	Kp Jumbo Honey Roast Cashews 140G	2.0	67755104	14.29
45	0.18	G	150.0				1	100G	[Variety Flavour Potato Crisps: 2x Ready Salted, 2x Salt & Vinegar Flavour, 2x Cheese & Onion Flavour, Potato Crisps: 2x Ready Salted, 2x Salt & Vinegar, 2x Cheese & Onion]	http://img.tesco.com/Groceries/pi/020/5000119143020/IDShot_90x90.jpg	Tesco Variety Crisps 6X25g	0.85	50530581	0.567
46	0.227	G	200.0	False	True	Any 2 for £1.50	1	100G		http://img.tesco.com/Groceries/pi/365/8904063200365/IDShot_90x90.jpg	Haldirams Bombay Mix 200G	1.19	63384969	0.595
47	0.1	G	80.0				1	KG	[Sweet & salty popcorn, Find us at Facebook.com/tyrrellsposhcorn, Twitter: @tyrrellsposhcorn, chitchat@tyrrellsposhcorn.co.uk]	http://img.tesco.com/Groceries/pi/141/5060042643141/IDShot_90x90.jpg	Tyrrells Crisps Sweet And Salty Popcorn 80G	1.59	70862318	19.88
