	AverageSellingUnitWeight	ContentsMeasureType	ContentsQuantity	IsNew	IsSpecialOffer	PromotionDescription	UnitOfSale	UnitQuantity	description	image	name	price	tpnb	unitprice
0	0.147	ML	150.0		True	Save £1.50 Was £3.00 Now £1.50	1	100ML	[Body Spray Deodorant]	http://img.tesco.com/Groceries/pi/904/8717644277904/IDShot_90x90.jpg	Lynx Dark Temptation Body Spray 150Ml	1.5	61931320	1.0
1	0.7	ML	500.0				1	100ML	[soft & gentle, 2 in 1 bubble, bath & wash, helps leave baby's skin clean & soft, no tears, perfect for newborns, paediatrician approved, hypoallergenic, dermatologically tested]	http://img.tesco.com/Groceries/pi/451/5052910455451/IDShot_90x90.jpg	Tesco Baby Bath And Bodywash 500Ml	1.0	73022767	0.2
2	0.132	ML	150.0				1	100ML		http://img.tesco.com/Groceries/pi/798/4005808663798/IDShot_90x90.jpg	Nivea For Men Sensitive Protect Spray 150Ml	1.8	71083835	1.2
3	0.072	SNGL	10.0				1	EACH	[1 Sensitive 10 Razors]	http://img.tesco.com/Groceries/pi/119/3086125705119/IDShot_90x90.jpg	Bic 1 Sensitive Disposable Razor 10'S	1.0	50604892	0.1
4	0.039	ML	30.0		True	Any 3 for 2 Cheapest Product Free	1	100ML	[Extreme Style Texturising Gum]	http://img.tesco.com/Groceries/pi/055/0000096108055/IDShot_90x90.jpg	Vo5 Extremestyle Texturising Gum 30Ml	1.5	80930033	5.0
5	0.173	ML	200.0				1	100ML	[XL Dry Excite Anti-Perspirant 48H Fresh Protection]	http://img.tesco.com/Groceries/pi/715/8712561018715/IDShot_90x90.jpg	Lynx Dry Excite Antiperspirant Deodorant 200Ml	4.0	73370671	2.0
6	0.073	ML	75.0		True	Save 50p Was £1.50 Now £1.00	1	100ML	[Long lasting anti-perspirant]	http://img.tesco.com/Groceries/pi/979/0000096080979/IDShot_90x90.jpg	Sure Men Invisible Ice Antiperspirant Deodorant Compressed 75Ml	1.0	75620920	1.34
7	0.185	ML	125.0				1	100ML	[Men+Care Clean Comfort Compressed Antiperspirant, Dove Men+Care Clean Comfort, Dove Clean Comfort, Dove Clean Comfort deodorant, Dove deodorant for men, Dove antiperspirant, antiperspirant]	http://img.tesco.com/Groceries/pi/696/0000096080696/IDShot_90x90.jpg	Dove Men+Care Cleancomfort Antiperspirant Deodorant Compressed 125Ml	3.0	75622872	2.4
8	0.475	ML	400.0		True	Save £1.00 Was £2.50 Now £1.50	1	100ML	[Excite Body Wash]	http://img.tesco.com/Groceries/pi/871/8711600490871/IDShot_90x90.jpg	Lynx Excite Shower Gel 400Ml	1.5	67500809	0.375
9	0.088	ML	50.0				1	100ML	[Anti-perspirant deodorant]	http://img.tesco.com/Groceries/pi/392/0000030061392/IDShot_90x90.jpg	Sure Men Sensitive Stick Antiperspirant Deodorant 50Ml	2.75	57367538	5.5
10	0.183	ML	500.0				1	100ML	[soft & gentle, shampoo, helps cleanse baby's hair & scalp, no tears, perfect for newborns, paediatrician approved, hypoallergenic, dermatologically tested]	http://img.tesco.com/Groceries/pi/985/5052319403985/IDShot_90x90.jpg	Tesco Loves Baby And Toddler Soft Shampoo 500Ml	1.0	66639428	0.2
11	0.127	ML	150.0				1	100ML	[Nivea Men Stress Protect 48h Anti-Perspirant]	http://img.tesco.com/Groceries/pi/198/4005808719198/IDShot_90x90.jpg	Nivea Deo Stress Protect Male 150Ml	1.8	73372674	1.2
12	0.187	ML	200.0	False			1	100ML	[48 Hour Action, Less White Marks, Alcohol Free]	http://img.tesco.com/Groceries/pi/224/5054402464224/IDShot_90x90.jpg	Tesco Mens Revive Antiperspirant Deodorant 200Ml	0.8	78141969	0.4
13	0.053	SNGL	4.0				1	EACH		http://img.tesco.com/Groceries/pi/294/7702018851294/IDShot_90x90.jpg	Gillette Fusion Razor Blades 4 Pack	10.5	59354959	2.63
14	0.81	ML	500.0				1	100ML	[Baby Shampoo]	http://img.tesco.com/Groceries/pi/124/3574660048124/IDShot_90x90.jpg	Johnsons Baby Gold Shampoo 500Ml	2.25	55464213	0.45
15	0.205	ML	250.0				1	100ML	[Men Williams Racing Special Edition Aerosol Anti-Perspirant Deodorant, Williams Racing Official Partner]	http://img.tesco.com/Groceries/pi/498/8710908293498/IDShot_90x90.jpg	Sure For Men Williams Racing Antiperspirant Deodorant 250Ml	2.5	80446474	1.0
16	0.13	ML	150.0				1	100ML	[Xtreme Fresh 72H Protection Anti-Perspirant, Join us: Facebook.com/UKRightGuard]	http://img.tesco.com/Groceries/pi/915/5012583201915/IDShot_90x90.jpg	Right Guard Xtreme Silver Fresh Blast Antiperspirant Deodorant 150Ml	1.0	65667816	0.667
17	0.546	ML	200.0				1	100ML	[NIVEA MEN® Sensitive Shaving Foam]	http://img.tesco.com/Groceries/pi/698/4005808222698/IDShot_90x90.jpg	Nivea For Men Soothing Shave Foam 200Ml	2.5	56987558	1.25
18	0.16	ML	100.0		True	Save £1.00 Was £2.75 Now £1.75	1	100ML	[Advanced Control Men 48HR Protection Ice Fresh Anti-Perspirant & Deodorant]	http://img.tesco.com/Groceries/pi/114/0309975122114/IDShot_90x90.jpg	Mitchum Ice Fresh Roll On 100Ml	1.75	59559850	1.75
19	0.298	ML	250.0				1	100ML	[Apollo Body Wash]	http://img.tesco.com/Groceries/pi/728/8711700719728/IDShot_90x90.jpg	Lynx Apollo Shower Gel 250Ml	2.0	72618721	0.8
20	0.342	ML	300.0		True	Save 1/3 Was £1.50 Now £1.00	1	100ML	[Baby shampoo]	http://img.tesco.com/Groceries/pi/209/3574660048209/IDShot_90x90.jpg	Johnsons Baby Gold Shampoo 300Ml	1.0	55482963	0.333
21	0.539	G	500.0				1	100G	[Baby powder]	http://img.tesco.com/Groceries/pi/917/3574660026917/IDShot_90x90.jpg	Johnsons Baby Powder 500G	2.25	51008202	0.45
22	0.112	ML	50.0				1	100ML	[Anti-perspirant deodorant]	http://img.tesco.com/Groceries/pi/524/8717163611524/IDShot_90x90.jpg	Lynx Dry Africa Antiperspirant Deodorant Stick 50Ml	2.3	57412791	4.6
23	0.157	ML	150.0				1	100ML	[Tesco Revive Body Spray 150ml, Full On Freshness, Invigorating Fragrance]	http://img.tesco.com/Groceries/pi/286/5054402464286/IDShot_90x90.jpg	Tesco Mens Revive Bodyspray 150Ml	0.7	78142029	0.467
24	0.213	ML	250.0				1	100ML	[Join us: Facebook.com/UKRightGuard]	http://img.tesco.com/Groceries/pi/278/5012583203278/IDShot_90x90.jpg	Rightguard Total Defence 5 Invisible Antiperspirant Deodorant 250Ml	2.4	73292665	0.96
25	0.475	ML	400.0		True	Save £1.00 Was £2.50 Now £1.50	1	100ML	[Black Body Wash]	http://img.tesco.com/Groceries/pi/948/8712561643948/IDShot_90x90.jpg	Lynx Black Shower Gel 400Ml	1.5	78640989	0.375
26	0.24	SNGL	100.0				1	EACH	[100% pure cotton, soft & absorbent, approximately 100 balls]	http://img.tesco.com/Groceries/pi/544/5018374771544/IDShot_90x90.jpg	Tesco Loves Baby And Toddler Cotton Wool Balls 100 Pack	1.3	51298646	0.013
27	0.883	ML	500.0				1	100ML	[Baby Bath, For more information visit www.johnsonsbaby.co.uk]	http://img.tesco.com/Groceries/pi/599/3574660217599/IDShot_90x90.jpg	Johnsons Baby Bath 500Ml	2.25	50932975	0.45
28	0.453	ML	300.0				1	100ML	[Bedtime Baby Bath]	http://img.tesco.com/Groceries/pi/567/3574661217567/IDShot_90x90.jpg	Johnsons Baby Bedtime Bath 300Ml	2.0	55006774	0.667
29	0.313	ML	250.0				1	100ML	[Peace Body Wash]	http://img.tesco.com/Groceries/pi/015/8712561190015/IDShot_90x90.jpg	Lynx Peace Shower Gel 250Ml	2.0	75138304	0.8
30	0.169	ML	150.0				1	100ML		http://img.tesco.com/Groceries/pi/286/5012874212286/IDShot_90x90.jpg	Beckham Instinct Body Spray 150Ml	2.5	65404604	1.67
31	0.13	ML	150.0				1	100ML	[Xtreme Cool 72H Protection Anti-Perspirant, Join us: Facebook.com/UKRightGuard]	http://img.tesco.com/Groceries/pi/939/5012583201939/IDShot_90x90.jpg	Right Guard Xtreme Silver Cool Impact Antiperspirant Deodorant 150Ml	1.0	65667557	0.667
32	0.183	ML	250.0				1	100ML	[Men+Care Clean Comfort Body and Face Wash, Dove Clean Comfort, Dove men's body wash, body wash for men, face wash, clean face, clean body]	http://img.tesco.com/Groceries/pi/624/8717644627624/IDShot_90x90.jpg	Dove Men+Care Cleancomfort Body And Face Wash 250Ml	2.5	65375126	1.0
33	0.185	ML	200.0				1	100ML	[Body Spray Deodorant]	http://img.tesco.com/Groceries/pi/842/8712561613842/IDShot_90x90.jpg	Lynx Black Body Spray 200Ml	4.0	78596217	2.0
34	0.208	ML	250.0		True	Save £1.00 Was £2.50 Now £1.50	1	100ML	[Nivea Men Invisible for Black & White Clear 48 Hour Anti-Perspirant]	http://img.tesco.com/Groceries/pi/490/4005900036490/IDShot_90x90.jpg	Nivea Black And White Power Antiperspirant Deodorant 250Ml	1.5	67447204	0.6
35	0.167	ML	250.0				1	100ML	[Extra Fresh Aerosol Anti-Perspirant Deodorant]	http://img.tesco.com/Groceries/pi/478/8718114216478/IDShot_90x90.jpg	Dove Men+Care Extra Fresh Antiperspirant Deodorant 250Ml	3.0	65374258	1.2
36	0.112	ML	50.0				1	100ML	[Men+Care Clean Comfort Deodorant Stick, Dove Men+Care Clean Comfort, Dove Clean Comfort Deodorant, Dove deodorant, men's Dove deodorant, deodorant]	http://img.tesco.com/Groceries/pi/021/0000050220021/IDShot_90x90.jpg	Dove Men+Care Clean Comfort Stick Antiperspirant Deodorant 50Ml	2.0	65444677	4.0
37	0.034	SNGL	5.0				1	EACH	[Developed by shaving experts and approved by customers]	http://img.tesco.com/Groceries/pi/715/5054402632715/IDShot_90x90.jpg	Everyday Value Single Blade Disps 5 Pack	0.3	78305581	0.06
38	0.275	G	400.0				1	100G	[soft & gentle, baby, powder, helps leave baby's skin soft & dry, extra absorbent, perfect for newborns, paediatrician approved, hypoallergenic, dermatologically tested]	http://img.tesco.com/Groceries/pi/480/5052319403480/IDShot_90x90.jpg	Tesco Loves Baby And Toddler Soft And Gently/Gentle Powder 400G	1.25	66638965	0.313
39	0.185	ML	200.0				1	100ML	[Body Spray Deodorant]	http://img.tesco.com/Groceries/pi/164/8711600358164/IDShot_90x90.jpg	Lynx Dark Temptation Body Spray 200Ml	4.0	67217310	2.0
40	0.148	ML	150.0		True	Save £1.50 Was £3.00 Now £1.50	1	100ML	[Body Spray Deodorant]	http://img.tesco.com/Groceries/pi/989/8711700709989/IDShot_90x90.jpg	Lynx Apollo Body Spray 150Ml	1.5	72618335	1.0
41	0.035	ML	250.0				1	100ML	[Men Expert Thermic Resist 48H Anti-Perspirant]	http://img.tesco.com/Groceries/pi/133/3600522634133/IDShot_90x90.jpg	L'oreal Men Expert Thermic Resist Antiperspirant Deodorant 250Ml	2.6	77227997	1.04
42	0.227	ML	250.0				1	100ML	[Men Expert Carbon Protect Deodorant, For expert advice visit:, www.menexpert.co.uk]	http://img.tesco.com/Groceries/pi/460/3600522107460/IDShot_90x90.jpg	Loreal Men Deo Carbon Protect Intensive Ice 250Ml	2.6	71207304	1.04
43	0.095	ML	50.0		True	Save 50p Was £1.50 Now £1.00	1	100ML	[Long lasting anti-perspirant]	http://img.tesco.com/Groceries/pi/718/0000050096718/IDShot_90x90.jpg	Sure Men Quantum Roll-On Antiperspirant Deodorant 50Ml	1.0	62356319	2.0
44	0.227	ML	250.0				1	100ML	[Men Expert Invincible Deodorant, For expert advice visit:, www.menexpert.co.uk]	http://img.tesco.com/Groceries/pi/002/3600521977002/IDShot_90x90.jpg	Loreal Men 96Hour Deodorant Spray 250Ml	2.6	67487830	1.04
45	0.05	SNGL	4.0				1	EACH	[3 Sensitive 4 Razors]	http://img.tesco.com/Groceries/pi/862/3086126691862/IDShot_90x90.jpg	Bic 3 Sensitive Disposable Razor 4'S	2.0	59401386	0.5
46	0.7	ML	500.0				1	100ML	[Formulated by baby care experts to gently cleanse and moisturise]	http://img.tesco.com/Groceries/pi/001/5052910474001/IDShot_90x90.jpg	Tesco Everyday Value Baby 2 In 1 Bath & Shampoo 500Ml	0.5	73023576	0.1
47	0.297	ML	250.0				1	100ML	[Black Night Body Wash]	http://img.tesco.com/Groceries/pi/876/8710908402876/IDShot_90x90.jpg	Lynx Black Night Shower Gel 250Ml	2.0	80423412	0.8
48	0.105	SNGL	10.0				1	EACH	[Disposable razors]	http://img.tesco.com/Groceries/pi/101/5010189105101/IDShot_90x90.jpg	Wilkinson Sword Extra 2 Razors Sensitive 10'S	3.5	52192441	0.35
49	0.478	ML	400.0				1	100ML	[Baby Softwash, Johnson's® recommends babycentre.co.uk]	http://img.tesco.com/Groceries/pi/015/3574660474015/IDShot_90x90.jpg	Johnsons Baby Pink Softwash 400Ml	2.25	63914637	0.563
50	0.482	G	400.0				1	100G	[Antiseptic Healing Cream]	http://img.tesco.com/Groceries/pi/001/5011025016001/IDShot_90x90.jpg	Sudocrem Antiseptic Healing Cream 400G	5.8	53322650	1.45
51	0.167	ML	50.0				1	100ML	[Clean Comfort Roll-On Anti-Perspirant Deodorant]	http://img.tesco.com/Groceries/pi/404/0000050210404/IDShot_90x90.jpg	Dove Men+Care Clean Comfort Roll-On Antiperspirant Deodorant 50Ml	2.0	65375983	4.0
52	0.075	ML	75.0		True	Save 50p Was £1.50 Now £1.00	1	50ML	[Long lasting anti-perspirant]	http://img.tesco.com/Groceries/pi/380/0000096097380/IDShot_90x90.jpg	Sure Men Black And White Antiperspirant Deodorant Compressed 75Ml	1.0	78640678	0.667
53	0.073	ML	75.0		True	Save 50p Was £1.50 Now £1.00	1	100ML	[Long lasting anti perspirant]	http://img.tesco.com/Groceries/pi/665/0000096080665/IDShot_90x90.jpg	Sure Men Quantum Antiperspirant Deodorant Compressed 75Ml	1.0	75620966	1.34
54	0.137	ML	150.0		True	Save £1.50 Was £3.00 Now £1.50	1	100ML	[Signature Aerosol Anti-Perspirant Deodorant]	http://img.tesco.com/Groceries/pi/748/8710908268748/IDShot_90x90.jpg	Lynx Signature Antiperspirant Deodorant 150Ml	1.5	80423680	1.0
55	0.548	ML	500.0				1	100ML	[Sensitive shower gel]	http://img.tesco.com/Groceries/pi/840/4005808810840/IDShot_90x90.jpg	Nivea For Men Sensitive Shower Gel 500Ml	3.0	71226040	0.6
56	0.342	ML	300.0				1	100ML	[Tesco Revive Shower Gel 2 in 1 Hair & Body 250ml, With Vitamin E & Menthol]	http://img.tesco.com/Groceries/pi/392/5054402464392/IDShot_90x90.jpg	Tesco Mens Revive Shower Gel 300Ml	0.9	78142202	0.3
57	0.185	ML	200.0				1	100ML	[Body Spray Deodorant]	http://img.tesco.com/Groceries/pi/426/8712561194426/IDShot_90x90.jpg	Lynx Peace Body Spray 200Ml	4.0	75138299	2.0
58	0.148	SNGL	60.0				1	EACH	[Soft and hygienics, 100 % pure cotton, Average contents: 60 buds]	http://img.tesco.com/Groceries/pi/909/0000003201909/IDShot_90x90.jpg	Tesco Loves Baby Safety Buds 60 Pack	0.5	65131886	0.008
59	0.2	ML	150.0				1	100ML	[Antibacterial Shave Gel]	http://img.tesco.com/Groceries/pi/290/0688003118290/IDShot_90x90.jpg	King Of Shaves Alphagel Antibacterial Shave Gel 150Ml	3.5	65481747	2.34
60	0.148	ML	150.0		True	Save £1.50 Was £3.00 Now £1.50	1	100ML	[Excite Body Spray Deodorant]	http://img.tesco.com/Groceries/pi/197/8718114650197/IDShot_90x90.jpg	Lynx Excite Body Spray 150Ml	1.5	66887709	1.0
61	0.159	ML	50.0				1	100ML		http://img.tesco.com/Groceries/pi/332/0000042231332/IDShot_90x90.jpg	Nivea For Men Sensitive Protect Roll On 50Ml	1.25	71083887	2.5
62	0.028	SNGL	2.0				1	EACH	[2 x Identi Key Locks]	http://img.tesco.com/Groceries/pi/248/5018404000248/IDShot_90x90.jpg	Travel Blue 2 X Identi Key Lock	4.0	71028009	2.0
63	0.438	SNGL	4.0				1	EACH		http://img.tesco.com/Groceries/pi/387/5000207004387/IDShot_90x90.jpg	Johnsons Baby Soap 4 Bar Pack	1.25	51466091	0.313
64	0.144	ML	150.0		True	Save £1.50 Was £3.00 Now £1.50	1	100ML	[Dry Dark Temptation Aerosol Anti-Perspirant Deodorant]	http://img.tesco.com/Groceries/pi/222/8717644278222/IDShot_90x90.jpg	Lynx Dry Dark Temptation Antiperspirant Deodorant 150Ml	1.5	62028376	1.0
65	0.81	SNGL	1.0				1	EACH	[World Wide Adaptor Set]	http://img.tesco.com/Groceries/pi/757/5018404001757/IDShot_90x90.jpg	World Wide Adapter	6.5	56292351	6.5
66	0.123	ML	100.0				1	100ML	[Pure petroleum jelly.]	http://img.tesco.com/Groceries/pi/634/0000042182634/IDShot_90x90.jpg	Vaseline Original Petroleum Jelly 100Ml	2.0	71204550	2.0
67	0.2	ML	200.0				1	100ML	[Deodorant]	http://img.tesco.com/Groceries/pi/517/5010612808517/IDShot_90x90.jpg	Brut Deodorant 200Ml	2.0	50111910	1.0
68	0.387	SNGL	300.0				1	EACH	[100% pure cotton, soft & absorbent, approximately 300 balls]	http://img.tesco.com/Groceries/pi/207/5000436393207/IDShot_90x90.jpg	Tesco Loves Baby Cotton Wool Balls 300 Pack	2.25	53977197	0.008
69	0.082	SNGL	8.0		True	Any 2 for £6.00	1	EACH	[Disposable Razors. Soft Ultragrip™ handle for great control; Lubrastrip with Aloe and Vitamin E.]	http://img.tesco.com/Groceries/pi/482/7702018980482/IDShot_90x90.jpg	Gillette Blue 2 Plus Disposable Razors 8 Pack	3.5	64212838	0.438
70	2.267	ML	250.0				1	100ML	[For expert advice visit:, www.menexpert.co.uk]	http://img.tesco.com/Groceries/pi/209/3600522373209/IDShot_90x90.jpg	Loreal Deodspray Longlasting Fresh 250Ml	2.6	73326696	1.04
71	0.29	ML	250.0				1	100ML	[Shower Gel]	http://img.tesco.com/Groceries/pi/821/4005900124821/IDShot_90x90.jpg	Nivea Shower Gel Act Cln 250Ml	1.5	78641544	0.6
72	0.043	G	30.0				1	100G	[Nappy Rash Ointment]	http://img.tesco.com/Groceries/pi/113/5011309190113/IDShot_90x90.jpg	Metanium Nappy Rash Ointment 30G	3.0	57090634	10.0
73	0.157	ML	50.0				1	100ML		http://img.tesco.com/Groceries/pi/506/4005900036506/IDShot_90x90.jpg	Nivea Roll On Black And White Power 50Ml	1.25	67447158	2.5
74	0.209	G	180.0				1	100G	[100% pure cotton, soft, gentle and absorbent]	http://img.tesco.com/Groceries/pi/620/5052109749620/IDShot_90x90.jpg	Tesco Baby Everyday Value Cotton Wool Roll 180G	0.8	72319159	0.444
75	0.961	ML	200.0				1	100ML	[NIVEA MEN® Originals Moisturising Shaving Gel]	http://img.tesco.com/Groceries/pi/250/5025970023250/IDShot_90x90.jpg	Nivea For Men Moisturising Shave Gel 200Ml	2.5	56985848	1.25
76	0.142	ML	150.0		True	Save £1.50 Was £3.00 Now £1.50	1	100ML	[Aerosol Anti-Perspirant Deodorant]	http://img.tesco.com/Groceries/pi/819/8712561620819/IDShot_90x90.jpg	Lynx Dry Black Antiperspirant Deodorant 150Ml	1.5	78595380	1.0
77	0.358	ML	300.0				1	100ML	[Bubble Baby Bath & Wash, For more ideas on making bathtime fun visit www.johnsonsbaby.co.uk]	http://img.tesco.com/Groceries/pi/281/3574661218281/IDShot_90x90.jpg	Johnson's Baby 2 In 1 Bubble Bath+Wash 300Ml	2.0	67928298	0.667
78	0.468	ML	400.0		True	Save £1.00 Was £2.50 Now £1.50	1	100ML	[Dark Temptation Body Wash]	http://img.tesco.com/Groceries/pi/388/8717644356388/IDShot_90x90.jpg	Lynx Dark Temptation Shower Gel 400Ml	1.5	67224094	0.375
79	0.275	G	400.0				1	100G	[soothing, bedtime powder, helps relax baby before bedtime, extra absorbent, perfect for newborns, paediatrician approved, hypoallergenic, dermatologically tested]	http://img.tesco.com/Groceries/pi/810/5052319402810/IDShot_90x90.jpg	Tesco Loves Baby And Toddler Bedtime Powder 400G	1.25	66638366	0.313
80	0.441	ML	500.0				1	100ML	[Baby Oil]	http://img.tesco.com/Groceries/pi/090/3574661218090/IDShot_90x90.jpg	Johnsons Baby Oil 500Ml	3.0	52501549	0.6
81	0.603	ML	400.0				1	100ML		http://img.tesco.com/Groceries/pi/991/5025404001991/IDShot_90x90.jpg	Infacare Baby Bath 400Ml	2.5	50839084	0.625
82	0.053	SNGL	4.0	False			1	EACH		http://img.tesco.com/Groceries/pi/475/7702018852475/IDShot_90x90.jpg	Gillette Fusion Power Razor Blades 4 Pack	12.0	59354775	3.0
83	0.205	G	175.0				1	100G	[Antiseptic healing cream]	http://img.tesco.com/Groceries/pi/059/5011025015059/IDShot_90x90.jpg	Sudocrem Antiseptic Healing Cream 175G	4.0	73243200	2.29
84	0.173	ML	150.0				1	100ML		http://img.tesco.com/Groceries/pi/042/5011091102042/IDShot_90x90.jpg	Oilatum Junior Bath Additive 150Ml	3.5	63091273	2.34
85	0.038	ML	250.0		True	Save 50p Was £2.00 Now £1.50	1	100ML		http://img.tesco.com/Groceries/pi/790/3607346733790/IDShot_90x90.jpg	Adidas Pure Game Antiperspirant Deodorant 250Ml	1.5	75845251	0.6
86	0.699	SNGL	8.0	False			1	EACH		http://img.tesco.com/Groceries/pi/783/7702018263783/IDShot_90x90.jpg	Gillette Mach 3 Cartridges 8 Pack	14.0	53647444	1.75
87	0.342	ML	300.0				1	100ML	[Tesco Adventure Shower Gel 2 in 1 Hair & Body 250ml, With Vitamin E & Menthol]	http://img.tesco.com/Groceries/pi/347/5054402464347/IDShot_90x90.jpg	Tesco Mens Adventure Shower Gel 300Ml	0.9	78142144	0.3
88	0.308	ML	250.0				1	100ML		http://img.tesco.com/Groceries/pi/864/7702018980864/IDShot_90x90.jpg	Gillette Series Sensitive Shave Foam 250Ml	2.5	51550526	1.0
89	0.012	ML	50.0				1	100ML	[Men Expert Full Power Deodorant, For expert advice visit:, www.menexpert.co.uk]	http://img.tesco.com/Groceries/pi/265/3600521848265/IDShot_90x90.jpg	Loreal Men Full Power Deo Roll-On 50Ml	2.0	66350607	4.0
90	0.475	ML	400.0		True	Save £1.00 Was £2.50 Now £1.50	1	100ML	[Apollo Body Wash]	http://img.tesco.com/Groceries/pi/774/8711700796774/IDShot_90x90.jpg	Lynx Apollo Shower Gel 400Ml	1.5	72618669	0.375
91	0.45	ML	300.0				1	100ML	[Baby Oil]	http://img.tesco.com/Groceries/pi/083/3574661218083/IDShot_90x90.jpg	Johnsons Baby Oil 300Ml	2.0	50972316	0.667
92	0.185	ML	125.0				1	100ML	[Long lasting anti-perspirant]	http://img.tesco.com/Groceries/pi/672/0000096080672/IDShot_90x90.jpg	Sure Men Quantum Antiperspirant Deodorant Compressed 125Ml	2.5	75621354	2.0
93	0.087	ML	75.0		True	Save 50p Was £1.50 Now £1.00	1	100ML	[Men Antibacterial Odour Protection Aerosol Anti-Perspirant Deodorant Compressed]	http://img.tesco.com/Groceries/pi/823/0000096125823/IDShot_90x90.jpg	Sure For Men Antibacterial Odour Protection Antiperspirant Deodorant 75Ml	1.0	80446290	1.34
94	0.7	ML	500.0				1	100ML	[moisturising, bodywash, helps cleanse & soften baby's skin, no tears, perfect for newborns, paediatrician approved, hypoallergenic, dermatologically tested]	http://img.tesco.com/Groceries/pi/482/5052910455482/IDShot_90x90.jpg	Tesco Baby Bodywash 500Ml	1.0	73022796	0.2
95	0.241	ML	200.0				1	100ML	[Conditioner Spray]	http://img.tesco.com/Groceries/pi/441/3574661218441/IDShot_90x90.jpg	Johnsons Baby No More Tangles Spray 200Ml	2.5	64772896	1.25
96	0.5	SNGL	1.0				1	EACH	[NIVEA® Travel Essentials]	http://img.tesco.com/Groceries/pi/726/5025970003726/IDShot_90x90.jpg	Nivea Female Travel Essentials	7.5	80747521	7.5
97	0.04	SNGL	4.0	False			1	EACH		http://img.tesco.com/Groceries/pi/813/7702018263813/IDShot_90x90.jpg	Gillette Mach 3 Turbo Razor Blades 4 Pack	9.0	62485811	2.25
98	0.087	ML	50.0				1	100ML	[Tesco Adventure 24 Hour Roll On 50ml, Long lasting freshness, Alcohol Free]	http://img.tesco.com/Groceries/pi/695/0000003256695/IDShot_90x90.jpg	Tesco Mens Adventure Roll On 50Ml	0.7	78142104	1.4
99	0.091	SNGL	4.0				1	EACH	[Xtreme 3 Ultimate Plus 4 Razors]	http://img.tesco.com/Groceries/pi/004/4027800474004/IDShot_90x90.jpg	Wilkinson Sword Xtreme 3 Ultimate	3.5	73340413	0.875
0	0.128	ML	125.0				1	100ML	[Men Invisible Black + White Aerosol Anti - Perspirant Deodorant Compressed]	http://img.tesco.com/Groceries/pi/397/0000096097397/IDShot_90x90.jpg	Sure Men Black And White Antiperspirant Deodorant Compressed 125Ml	2.5	78681237	2.0
1	0.08	SNGL	4.0				1	EACH		http://img.tesco.com/Groceries/pi/813/3014260295813/IDShot_90x90.jpg	Gillette Sensor 3 Disposable Razors 4'S	5.0	57969074	1.25
2	0.112	G	100.0				1	100G	[Nappy Care Ointment]	http://img.tesco.com/Groceries/pi/017/5010605142017/IDShot_90x90.jpg	Bepanthen Ointment 100G	7.0	60945075	7.0
3	0.147	SNGL	1.0				1	EACH	[British Adaptor]	http://img.tesco.com/Groceries/pi/733/5018404001733/IDShot_90x90.jpg	Travel Blue British Adaptor	4.0	71028234	4.0
4	0.085	ML	50.0		True	Save 50p Was £1.50 Now £1.00	1	100ML	[Men Antibacterial Odour Protection Roll-on Anti-Perspirant Deodorant]	http://img.tesco.com/Groceries/pi/779/0000096125779/IDShot_90x90.jpg	Sure For Men Odour Protection Roll On 50Ml	1.0	80446382	2.0
5	0.087	ML	50.0				1	100ML	[Men Expert Carbon Protect 48H, For expert advice visit:, www.menexpert.co.uk]	http://img.tesco.com/Groceries/pi/941/3600522107941/IDShot_90x90.jpg	Loreal Men Deo Carbon Protect Intensive Ice 50Ml	2.0	71207184	4.0
6	0.565	ML	500.0				1	100ML	[No More Tangles® Shampoo]	http://img.tesco.com/Groceries/pi/205/3574661218205/IDShot_90x90.jpg	Johnsons Baby No More Tangles Shampoo 500Ml	3.0	64773064	0.6
7	0.142	ML	150.0		True	Save £1.50 Was £3.00 Now £1.50	1	100ML	[Dry Excite Aerosol Anti-Perspirant Deodorant]	http://img.tesco.com/Groceries/pi/832/8718114652832/IDShot_90x90.jpg	Lynx Dry Excite Antiperspirant Deodorant 150Ml	1.5	66886808	1.0
8	0.123	ML	125.0				1	100ML	[Tesco Pro Formula For Men Clear Ice Anti Perspirant Deodorant 125ml, Compressed, Smaller pack, lasts just as long, Encapsulated fragrance 48HR, Less White Marks, Alcohol Free, Scientifically developed for Tesco]	http://img.tesco.com/Groceries/pi/552/5054402464552/IDShot_90x90.jpg	Pro Formula For Men Clear Ice Antiperspirant Deodorant 125Ml	1.0	78142277	0.8
9	0.185	ML	250.0				1	100ML	[Cool Fresh Aerosol Anti-Perspirant Deodorant]	http://img.tesco.com/Groceries/pi/823/8710908325823/IDShot_90x90.jpg	Dove Men+Care Cool Fresh Antiperspirant Deodorant 250Ml	3.0	80423449	1.2
10	0.12	ML	100.0				1	100ML	[NIVEA MEN® Originals Deep Cleaning Face Wash]	http://img.tesco.com/Groceries/pi/778/4005808227778/IDShot_90x90.jpg	Nivea For Men Deep Cleaning Face Wash 100Ml	3.5	63169827	3.5
11	0.207	ML	250.0		True	Save £1.00 Was £2.50 Now £1.50	1	100ML	[Nivea Men Sensitive & Protect 48 Hour Anti-Perspirant]	http://img.tesco.com/Groceries/pi/273/4005808665273/IDShot_90x90.jpg	Nivea Sensitive Protect Male Spray 250Ml	1.5	71082928	0.6
12	0.205	ML	250.0		True	Save £1.00 Was £2.50 Now £1.50	1	100ML	[Nivea Men Stress Protect 48 Hour Anti-Perspirant]	http://img.tesco.com/Groceries/pi/476/4005808277476/IDShot_90x90.jpg	Nivea Deodorant Stress Protect Male 250Ml	1.5	73373512	0.6
13	0.294	ML	200.0				1	100ML		http://img.tesco.com/Groceries/pi/833/7702018980833/IDShot_90x90.jpg	Gillette Series Conditioning Shave Gel 200Ml	2.5	54659169	1.25
14	0.01	SNGL	1.0				1	EACH		http://img.tesco.com/Groceries/pi/noimage.jpg	Travel Blue American Adaptor	4.0	71028194	4.0
15	0.185	ML	125.0				1	100ML	[Men+Care Extra Fresh Compressed Antiperspirant, Dove Men+Care Extra Fresh, Dove Men Extra Fresh, Dove Extra Fresh, Dove antiperspirant, antiperspirant, deodorant]	http://img.tesco.com/Groceries/pi/931/0000096080931/IDShot_90x90.jpg	Dove Men Care Extra Fresh Antiperspirant Deodorant Compressed 125Ml	3.0	75622889	2.4
16	0.185	ML	200.0				1	100ML	[Deodorant]	http://img.tesco.com/Groceries/pi/743/8710908391743/IDShot_90x90.jpg	Lynx Black Night Body Spray 200Ml	4.0	80423328	2.0
17	1.336	ML	100.0				1	100ML		http://img.tesco.com/Groceries/pi/281/5025970023281/IDShot_90x90.jpg	Nivea For Men Extra Soothing Shave Balm 100Ml	3.5	56794918	3.5
18	0.293	ML	200.0				1	100ML		http://img.tesco.com/Groceries/pi/221/7702018073221/IDShot_90x90.jpg	Gillette Fusion Proglide Shave Gel Hydrating 200Ml	3.0	67139496	1.5
19	0.08	G	41.0		True	Save £1.00 Was £3.00 Now £2.00	1	100G	[Advanced Men 48HR Protection Clean Control Anti-Perspirant & Deodorant]	http://img.tesco.com/Groceries/pi/634/0309974755634/IDShot_90x90.jpg	Mitchum Deodorant Clean Control Stick 41G	2.0	60245258	4.88
